0,TEXT_LUCKZF201_03482_SEQ_00,"** Schwierigkeitsanpassung**
Phyna möchte mit den Bewohnern des Umlands in Kontakt treten."
1,TEXT_LUCKZF201_03482_SEQ_01,"**** Die Schwierigkeit des Auftrags wird an die aktuelle Stufe angepasst.

Du versprichst, die Viis-Zwillinge Ciuna und Phyna nach Schlangenzweig zu begleiten und den Bewohnern der Siedlung vorzustellen. Sprich im Wildgarten mit Phyna."
2,TEXT_LUCKZF201_03482_SEQ_02,"Im Wildgarten machen Ciuna und Phyna die Bekanntschaft von Valan und Quinfort. Dieser hatte wieder eine Vision von einer Gefahr für den Wald und schließt aus einer Bemerkung Phynas, dass der Schlüssel dazu in Mjrls Sehnsucht liegen könnte. Dorthin stürmt er davon. Lauf ihm nach, damit ihm nichts passiert."
3,TEXT_LUCKZF201_03482_SEQ_03,"Quinfort war von wilden Tieren bedrängt worden, aber dank Ciunas und deines Einschreitens unverletzt geblieben. Auch die Wasserschlange ist da. Sprich in Mjrls Sehnsucht mit Quinfort."
4,TEXT_LUCKZF201_03482_SEQ_04,Ihr wollt dem Gehalt von Quinforts Prophezeiung an einem sichereren Ort auf den Grund gehen. Sprich in Fanow mit Lanille.
5,TEXT_LUCKZF201_03482_SEQ_05,"Lanille erinnert sich an einen Mythos um die Wasserschlange von Ronka, der auf einer Steintafel in der Großen Pyramide von Ux'ner eingemeißelt sein soll. Wenn du sie birgst, wird Lanille die alte Inschrift für euch entziffern."
6,TEXT_LUCKZF201_03482_SEQ_06,"Du hast die richtige Steintafel gefunden. Berichte Quinfort davon, der bei den Morgensternen wartet."
7,TEXT_LUCKZF201_03482_SEQ_07,"Quinfort ist äußerst aufgeregt. Bring die Steintafel nach Fanow zu Lanille, um zu erfahren, was darauf steht. "
8,TEXT_LUCKZF201_03482_SEQ_08,"Der Mythos auf der Steintafel besagt, dass der Wald ursprünglich zwei Beschützer hatte: die Viis und eine gewisse Priesterfamilie, die die Stimme der Schlange vernehmen konnte. Die Viis bitten Quinfort, in die Fußstapfen dieser vor langem untergegangenen Familie zu treten und gemeinsam mit ihnen den Wald und das Vermächtnis von Ronka zu beschützen."
9,TEXT_LUCKZF201_03482_SEQ_09,
10,TEXT_LUCKZF201_03482_SEQ_10,
11,TEXT_LUCKZF201_03482_SEQ_11,
12,TEXT_LUCKZF201_03482_SEQ_12,
13,TEXT_LUCKZF201_03482_SEQ_13,
14,TEXT_LUCKZF201_03482_SEQ_14,
15,TEXT_LUCKZF201_03482_SEQ_15,
16,TEXT_LUCKZF201_03482_SEQ_16,
17,TEXT_LUCKZF201_03482_SEQ_17,
18,TEXT_LUCKZF201_03482_SEQ_18,
19,TEXT_LUCKZF201_03482_SEQ_19,
20,TEXT_LUCKZF201_03482_SEQ_20,
21,TEXT_LUCKZF201_03482_SEQ_21,
22,TEXT_LUCKZF201_03482_SEQ_22,
23,TEXT_LUCKZF201_03482_SEQ_23,
24,TEXT_LUCKZF201_03482_TODO_00,Mit Phyna im Wildgarten sprechen
25,TEXT_LUCKZF201_03482_TODO_01,Quinfort suchen
26,TEXT_LUCKZF201_03482_TODO_02,Mit Quinfort sprechen
27,TEXT_LUCKZF201_03482_TODO_03,In Fanow mit Lanille sprechen
28,TEXT_LUCKZF201_03482_TODO_04, suchen
29,TEXT_LUCKZF201_03482_TODO_05,Bei den Morgensternen mit Quinfort sprechen
30,TEXT_LUCKZF201_03482_TODO_06,Lanille in Fanow  geben
31,TEXT_LUCKZF201_03482_TODO_07,
32,TEXT_LUCKZF201_03482_TODO_08,
33,TEXT_LUCKZF201_03482_TODO_09,
34,TEXT_LUCKZF201_03482_TODO_10,
35,TEXT_LUCKZF201_03482_TODO_11,
36,TEXT_LUCKZF201_03482_TODO_12,
37,TEXT_LUCKZF201_03482_TODO_13,
38,TEXT_LUCKZF201_03482_TODO_14,
39,TEXT_LUCKZF201_03482_TODO_15,
40,TEXT_LUCKZF201_03482_TODO_16,
41,TEXT_LUCKZF201_03482_TODO_17,
42,TEXT_LUCKZF201_03482_TODO_18,
43,TEXT_LUCKZF201_03482_TODO_19,
44,TEXT_LUCKZF201_03482_TODO_20,
45,TEXT_LUCKZF201_03482_TODO_21,
46,TEXT_LUCKZF201_03482_TODO_22,
47,TEXT_LUCKZF201_03482_TODO_23,
48,TEXT_LUCKZF201_03482_CIUNA_000_001,"Also, ich kann mir nicht vorstellen, wie es außerhalb des Waldes aussieht."
49,TEXT_LUCKZF201_03482_PHYNA_000_002,"Sei gegrüßt, Verbündete! Vielen Dank für die Hilfe bei den Vor­bereitungen zu der Zeremonie. Jetzt wissen wir mit Sicherheit, dass du auf unserer Seite stehst!"
50,TEXT_LUCKZF201_03482_PHYNA_000_003,"Gerade eben habe ich mit Ciuna darüber gesprochen, ob wir uns nicht einmal aus Yx'Maja hinauswagen und die weitere Umgebung erkunden sollten. Also zumindest einmal Schlangenzweig besuchen, das ist ja nicht weit."
51,TEXT_LUCKZF201_03482_CIUNA_000_004,"Ja, bisher dachten wir ja nie auch nur im Entferntesten daran, den Wald zu verlassen, und schon gar nicht, Fremde willkommen zu heißen. Also werden wir es langsam angehen, dachten wir, und erst einmal mit der Nachbarsiedlung in Kontakt treten."
52,TEXT_LUCKZF201_03482_PHYNA_000_005,"Du könntest uns doch bestimmt dabei helfen! Würdest du uns den Bewohnern von Schlangenzweig vorstellen? Wenn wir alleine dort auftauchen, kriegen sie bestimmt einen Schrecken."
53,TEXT_LUCKZF201_03482_CIUNA_000_006,"Vielen Dank! Wenn du dabei bist, empfangen sie uns bestimmt viel freundlicher. Treffen wir uns im Wildgarten, gleich vor Schlangenzweig? Wir warten dort auf dich."
54,TEXT_LUCKZF201_03482_VALAN_000_010,"Das sind doch Viis aus Fanow! Ich kann nicht glauben, dass wir in ihrem Wald stehen und trotzdem noch nicht mit Pfeilen durchsiebt sind."
55,TEXT_LUCKZF201_03482_QUINFORT_000_011,Hohohahaha!
56,TEXT_LUCKZF201_03482_CIUNA_000_012,"Ich dachte, die Leute hier wären geruhsame, in sich gekehrte Verehrer der Dunkelheit ..."
57,TEXT_LUCKZF201_03482_PHYNA_000_013,Kennst du die beiden vielleicht? Dann bitte stell uns ihnen doch vor.
58,TEXT_LUCKZF201_03482_QUINFORT_000_014,"Hohohihi! Euch vorzustellen ist nicht nötig! Wie wunderbar, dass wir uns schon treffen! Gerade vorhin hat mir die Wasserschlange von Ronka in einer Vision eben dies prophezeit."
59,TEXT_LUCKZF201_03482_QUINFORT_000_015,"Ich sah, dass die nächste Gefahr vom Osten an den Wald herandräut. Ich sah einen von blauen Blumen gesäumten Pfad und inmitten heiliger Hallen eine Steintafel, die von einer verlorenen Ver­gangen­heit zeugt. Und ich sah, wer uns dorthin führen wird ... zwei Viis von ein und derselben Gestalt!"
60,TEXT_LUCKZF201_03482_VALAN_000_016,"Er wollte unbedingt in Richtung Osten in den Wald, da bin ich mitgekommen. Seit er mit seiner letzten Vision richtig lag, ist er nicht mehr zu bremsen. Behauptet, dass ihm die Schlange dies und das eingegeben hat ... Tja, nach dem Erfolg letztes Mal kann ich es aber leider nicht mehr als leeres Gerede abtun. "
61,TEXT_LUCKZF201_03482_CIUNA_000_017,"Ich weiß zwar nicht, was er damit meint ... aber sagte dein Freund gerade eben, dass der Wald in Gefahr ist?"
62,TEXT_LUCKZF201_03482_QUINFORT_000_018,"Jawohl! In Gefahr - in großer Gefahr! Sagt mir, habt ihr im Wald vielleicht die ehrenwerte Gestalt der Wasserschlange von Ronka erblickt? Klein in ihrer Körperlichkeit, doch unendlich groß in ihrer Erhabenheit?"
63,TEXT_LUCKZF201_03482_PHYNA_000_019,"Schlange von Ronka? Klein ... aber groß?
Ich glaube nicht ... Aber wenn du Wasserschlangen suchst, die gibt es flussabwärts des Wildgartens in Mjrls Sehnsucht zuhauf."
64,TEXT_LUCKZF201_03482_QUINFORT_000_020,"Hm. Die Große Schlange zeigte sich auch mir zum ersten Mal am Ufer eines Gewässers, nämlich an den Gestaden des Tusi Mek'ta. Dann könnte sie diesmal Mjrls Sehnsucht gewählt haben."
65,TEXT_LUCKZF201_03482_QUINFORT_000_021,"Ich werde mich sofort dorthin begeben. O Wasserschlange von Ronka, harre meiner Ankunft!"
66,TEXT_LUCKZF201_03482_CIUNA_000_022,He! Warte! Alleine dorthin zu laufen ist viel zu gefährlich! Hallo?
67,TEXT_LUCKZF201_03482_VALAN_000_023,"<seufz> Und schon wieder bringt er alle in Schwie­rig­keiten ...
Vielen Dank, werte Viis!"
68,TEXT_LUCKZF201_03482_PHYNA_000_024,"Er sucht also eine kleine Wasserschlange? Die Schlange mag ihm ja wohlgesonnen sein, aber ich würde nicht so losstürmen, ohne genau zu wissen, wohin."
69,TEXT_LUCKZF201_03482_PHYNA_000_025,"Wenn Ciuna dabei ist, wird ihm vermutlich nichts passieren, aber der Wald ist groß. Wer weiß, ob sie ihn so rasch findet. Du solltest lieber auch hinterherlaufen und ihn suchen helfen. Sein Freund kann mit mir in Fanow auf eure Rückkehr warten."
70,TEXT_LUCKZF201_03482_CIUNA_000_060,"Sie wollten nur nicht, dass ihnen ein Fremder den Wald zertrampelt. Aber ich bin trotzdem froh, dass du eingeschritten bist."
71,TEXT_LUCKZF201_03482_TSUCHINOKO_100_060,Quiep?
72,TEXT_LUCKZF201_03482_QUINFORT_000_061,"Welch ein Glück, dass Ihr unversehrt seid, große Behüterin!"
73,TEXT_LUCKZF201_03482_TSUCHINOKO_000_062,Quiep!
74,TEXT_LUCKZF201_03482_CIUNA_000_063,"Nun hast du mir schon wieder geholfen. Vielen Dank. Aber sag mal, dein Freund da ist ja völlig vereinnahmt von diesem wurmartigen Geschöpf. Und das soll die Wasserschlange von Ronka sein?"
75,TEXT_LUCKZF201_03482_QUINFORT_000_064,"Bitte offenbart uns, welche Gefahr dem Wald diesmal droht!"
76,TEXT_LUCKZF201_03482_CIUNA_000_065,"Für ihn besteht offenbar gar kein Zweifel. Aber wir sollten nicht allzulange hier bleiben, sonst fallen uns noch andere wilde Tiere an. Lass uns nach Fanow zurückkehren und alles mit Lanille besprechen."
77,TEXT_LUCKZF201_03482_QUINFORT_000_066,"Wartet doch, große Behüterin! Ihr müsst nicht am Erdboden kriechen! Ich werde Euch tragen! "
78,TEXT_LUCKZF201_03482_LANILLE_000_069,"Besucher aus Schlangenzweig? Und Ciuna und Phyna sind bereits mit ihnen auf dem Rückweg hierher? Dann warten wir am besten, bis alle versammelt sind."
79,TEXT_LUCKZF201_03482_LANILLE_000_070,"Und du bist also die Große Schlange, die Wasserschlange von Ronka ..."
80,TEXT_LUCKZF201_03482_TSUCHINOKO_000_071,Quiep!
81,TEXT_LUCKZF201_03482_LANILLE_000_072,Das finde ich alles sehr erstaunlich.
82,TEXT_LUCKZF201_03482_LANILLE_100_072,"Bei uns in Fanow werden nämlich immer wieder - wenn auch sehr selten - solche geboren, die in ihren Träumen Weissagungen empfangen. Wir nennen sie die Wahrträumer. Du scheinst diese Fähigkeit auch zu besitzen."
83,TEXT_LUCKZF201_03482_LANILLE_000_073,"Ich wusste nicht, dass es so etwas auch bei anderen Völkern gibt, aber das liegt wohl an unserer selbstgewählten Abgeschiedenheit. Jedenfalls dürfen wir nicht ignorieren, dass dir eine Gefahr für den Wald offenbart wurde."
84,TEXT_LUCKZF201_03482_QUINFORT_000_074,Hoho! Wahrträumer! So nennt man also Erwählte wie mich!
85,TEXT_LUCKZF201_03482_CIUNA_000_075,"Ist die Schlange, die er meint, etwa die große geflügelte Schlange, gegen die Lozatl der Legende nach kämpfte? Dann wüssten wir, welche Steintafel er in seiner Vision gesehen hat."
86,TEXT_LUCKZF201_03482_LANILLE_000_076,"In der Großen Pyramide von Ux'ner wird  verwahrt, in die eine alte Überlieferung eingemeißelt ist. Vermutlich meint er die."
87,TEXT_LUCKZF201_03482_LANILLE_000_077,"Vielleicht ist darin eine Botschaft verschlüsselt, die uns vor einer Gefahr für den Wald warnt. Wenn ihr mir die Tafel bringt, kann ich sie für euch entziffern. Ich gehöre nämlich zu denen, die die alten Schriftzeichen lesen können. "
88,TEXT_LUCKZF201_03482_LANILLE_000_078,Aber bei dieser Expedition müsstest du wahrscheinlich helfen. Das Innere des Tempels war nur für den Kaiser und seine Gäste und engsten Vertrauten zugänglich. Du als Verbündete des Herrschers von Ronka könntest die Steintafel vielleicht bergen.
89,TEXT_LUCKZF201_03482_QUINFORT_000_079,Ein Tempel der Ronka-Zivilisation! Ganz wie in meiner Vision! Ich werde mit dir kommen und deine Schritte leiten!
90,TEXT_LUCKZF201_03482_PHYNA_000_080,"Das lässt du lieber sein. Bis vor die Tempelmauern können wir dich aber gerne begleiten. Vorausgesetzt, du läufst uns nicht davon!"
91,TEXT_LUCKZF201_03482_LANILLE_000_081,"Die Steintafel müsste in der Großen Pyramide von Ux'ner zu finden sein.
Ein Wahrträumer aus Schlangenzweig, wer hätte das gedacht ...!"
92,TEXT_LUCKZF201_03482_TSUCHINOKO_000_082,Quiep!
93,TEXT_LUCKZF201_03482_QUINFORT_000_090,Was für ein imposantes Bauwerk! Man spürt die Großartigkeit dieser heiligen Hallen über die Jahrhunderte hinweg!
94,TEXT_LUCKZF201_03482_PHYNA_000_091,"Na, na. Bei so viel Begeisterung für die Wurzeln unserer Kultur fühle ich mich direkt beschämt."
95,TEXT_LUCKZF201_03482_VALAN_000_092,"Ich passe auf, dass er nicht wegläuft und sich in Schwie­rig­keiten bringt, keine Sorge."
96,TEXT_LUCKZF201_03482_CIUNA_000_093,"Ich hätte nicht gedacht, dass sich außer uns Viis jemand so sehr für die Ronka interessiert."
97,TEXT_LUCKZF201_03482_SYSTEM_000_094,In die Tafel sind alte Schriftzeichen und das Bild eines Coeurl eingraviert. Das sieht nicht nach der Legende der Wasserschlange aus.
98,TEXT_LUCKZF201_03482_SYSTEM_000_095,In die Tafel sind alte Schriftzeichen und das Bild eines Welses eingraviert. Das sieht nicht nach der Legende der Wasserschlange aus.
99,TEXT_LUCKZF201_03482_SYSTEM_000_096,In die Tafel sind alte Schriftzeichen und das Bild einer Schlange eingraviert. Es könnte sich um die Legende der Wasserschlange handeln!
100,TEXT_LUCKZF201_03482_PHYNA_000_100,Hast du die Steintafel gefunden?
101,TEXT_LUCKZF201_03482_CIUNA_000_101,"Während du da drin warst, hat uns dein Freund mit Fragen gelöchert. Über die Ronka, über die Berufung der Viis, über ... einfach alles! Seine Wissbegier scheint keine Grenzen zu kennen."
102,TEXT_LUCKZF201_03482_VALAN_000_102,"Siehst du, Quinfort hat sich keinen einzigen Schritt von hier wegbewegt.
Gut, dafür konnte er auch keine Sekunde die Klappe halten ... <seufz>"
103,TEXT_LUCKZF201_03482_QUINFORT_000_103,"In dieser Steintafel liegt also das vergessene Wissen über die Große Schlange verborgen! Lass uns rasch nach Fanow zurückkehren, um die Botschaft zu entschlüsseln!"
104,TEXT_LUCKZF201_03482_TSUCHINOKO_000_105,Quiep!
105,TEXT_LUCKZF201_03482_LANILLE_000_106,Konntest du die Steintafel in der Pyramide finden?
106,TEXT_LUCKZF201_03482_LANILLE_000_107,"Ja, das muss sie sein, kein Zweifel. Hmm, es ist eine Weile her, seit ich diese alten Zeichen zuletzt gesehen habe ...
Warten wir noch auf die anderen, dann sage ich dir, was darauf steht."
107,TEXT_LUCKZF201_03482_LANILLE_000_110,"Nachdem das Ronka-Reich untergegangen war, haben unsere Vorfahren aufgeschrieben, was bis dahin nur mündlich überliefert worden war. Dies hier ist ein Teil dieser Niederschrift."
108,TEXT_LUCKZF201_03482_LANILLE_000_111,"*Die Erhabene Schlange ward besiegt; von des Kaisers Riesen, Lozatl. Man bannte sie sodann in einen Kristall; in ein köstliches Kleinod ward sie versiegelt. Man bannte auch ihren Namen. Doch siehe, so überquellend war ihre Kraft, dass das Volk sich dort um sie scharte in Ehrfurcht. So wacht die Erhabene Schlange über den Wald; wahrlich, sie ist des Waldes Auge, sie ist des Waldes Beschützerin.*"
109,TEXT_LUCKZF201_03482_LANILLE_000_112,"*Man betraute die Viis, über den großen östlichen Tempel zu wachen. Das Heiligtum von Dwatl im Westen aber überantwortete man einer Priesterfamilie, denn sie hörte die Stimme der Schlange. In dieser Weise ward Rak'tika der Obhut zweier Sippen anbefohlen.*"
110,TEXT_LUCKZF201_03482_LANILLE_000_113,"*Doch es versank der westliche Tempel im See; und die Sippe der Priester ging unter. So begab es sich, dass einzig die Viis für das Wohl des Waldes sorgten; sie waren ihm desto inniger verbunden. Die Beschützerin aber wand sich in großer Trauer und beklagte die verlorenen Fürsorger und kroch wie eine Schlange die dicken Zweige entlang.*"
111,TEXT_LUCKZF201_03482_QUINFORT_000_114,"Wie poetisch! Und ihr seid diejenigen, die seit alters für das Wohl des Waldes sorgen! Wie dankenswert und der Bewunderung würdig!"
112,TEXT_LUCKZF201_03482_CIUNA_000_115,Lanille ... „der Obhut zweier Sippen anbefohlen“!
113,TEXT_LUCKZF201_03482_LANILLE_000_116,"Ja. Als ich diese Stelle vor langer Zeit einmal las, habe ich mir nicht viel dabei gedacht. Aber nun ..."
114,TEXT_LUCKZF201_03482_CIUNA_000_117,"Ich dachte immer, dass nur wir Viis für den Wald zuständig seien. Aber wenn es stimmt, was auf dieser Steintafel steht, lag die Hälfte davon früher in den Händen von jemand anderem - dieser Priesterfamilie."
115,TEXT_LUCKZF201_03482_LANILLE_000_118,"Die Blutlinie werden wir wohl nicht zu­rück­ver­fol­gen können, aber dass uns diese Textstelle gerade jetzt wieder in die Hände fällt, wo uns eine Gefahr für den Wald prophezeit wurde, ist vielleicht wirklich eine Botschaft der Behüterin selbst."
116,TEXT_LUCKZF201_03482_LANILLE_000_119,"Wahrträumer aus Schlangenzweig - diejenigen, die den westlichen Tempel vor Jahrtausenden behüteten, müssen die Weisheit Ronkas genauso verehrt haben wie du."
117,TEXT_LUCKZF201_03482_CIUNA_000_120,"Du bist ein aufrichtiger Verehrer der Ronka-Kultur. Dir können wir vertrauen. Bitte führ gemeinsam mit uns die Aufgabe jener alten Priesterfamilie fort, um das Vermächtnis des alten Kaiserreichs weiter zu bewahren."
118,TEXT_LUCKZF201_03482_QUINFORT_000_121,"Oh, äh ... ja, aber selbst­verständ­lich! Es ist mir eine außer­ordent­liche Ehre, den alten Beschützern des Waldes bei ihrer hohen Aufgabe zur Seite zu stehen!"
119,TEXT_LUCKZF201_03482_PHYNA_000_122,"Wir wollten ohnehin gerade aufbrechen, um Gleichgesinnte zu suchen. In dir haben wir jemanden gefunden, der noch dazu bereit ist, den Wald nach seinen besten Kräften zu beschützen. Einen besseren Verbündeten kann man sich nicht wünschen."
120,TEXT_LUCKZF201_03482_QUINFORT_000_123,"Hmm ... Mir scheint, die Gefahr, vor der uns meine Vision warnen wollte, war eine eher schleichende. Der langsame Verlust der beeindruckenden Errungenschaften der Ronka. Um diesen aufzuhalten, wurde ich erwählt! Auf dass das alte Wissen nicht in Vergessenheit und der Wald in Gefahr gerate!"
121,TEXT_LUCKZF201_03482_QUINFORT_000_124,"Die legendäre Priesterfamilie, die die Stimme der Schlange hörte - bin ich womöglich ein Nachkomme dieser Sippe?!"
122,TEXT_LUCKZF201_03482_PHYNA_000_125,"Wo ist denn die kleine, äh, Große Schlange hin?"
123,TEXT_LUCKZF201_03482_QUINFORT_000_126,"Sie hat ihre Gestalt wieder vor unserem Blick verborgen. Diesmal war ihre Präsenz keine Warnbotschaft, sondern ein Mittel, um Freund­schaft zu stiften."
124,TEXT_LUCKZF201_03482_VALAN_000_127,"Psst, mach schnell, bevor er's merkt ... Nimm die Schlange mit! Wenn er sie hier sieht, sagt er uns ein Unglück nach dem anderen voraus."
125,TEXT_LUCKZF201_03482_TSUCHINOKO_000_128,Quiep?!
126,TEXT_LUCKZF201_03482_VALAN_000_129,"Sieh mal an, das gefällt ihr sogar. Keine Sorge, wenn sie Quinfort wirklich Visionen eingeben kann, wird sie es auch aus deiner Tasche heraus tun."
127,TEXT_LUCKZF201_03482_LANILLE_000_130,"Ich kann es kaum glauben, dass wir so treue Freunde des Waldes in nächster Nähe hatten. Ihr seid in Fanow jederzeit herzlich willkommen. Auch wir werden Schlangenzweig bald einen Besuch abstatten und offiziell um gute Nachbarschaft bitten."
128,TEXT_LUCKZF201_03482_QUINFORT_000_131,"Nun werden wir diesem Wald die Gestalt zurückgeben, die der Kaiser von Ronka ihm angedacht hatte! Wir, das Volk des großen Waldes Rak'tika!"
