key,0,1
413,"TEXT_VOICEMAN_04002_003920_ISSE","J'ai toujours pensé que ce que vous faisiez était de la folie... que nous n'avions pas besoin de vous... Heu<SoftHyphen/>reu<SoftHyphen/>se<SoftHyphen/>ment, j'ai réalisé à quel point je me trompais."
414,"TEXT_VOICEMAN_04002_003930_ISSE","J'ai tellement honte d'être resté soumis aussi longtemps... Je n'osais pas m'avouer que je devais garder la tête haute, et protéger ceux que j'aime<Indent/>!"
415,"TEXT_VOICEMAN_04002_003940_ISSE","Grâce à vous, j'ai enfin compris que nous devions reprendre courage<Indent/>! Si nous ne prenons pas notre destin en main, nous serons perdus à tout jamais<Indent/>!"
416,"TEXT_VOICEMAN_04002_003950_ISSE","Voilà pourquoi nous sommes là<Indent/>! Notre cœur appartient à Doma, et nous ne baisserons plus les bras<Indent/>!"
417,"TEXT_VOICEMAN_04002_003960_ZENOS","Une bande de sauvages qui se dirigent droit vers la mort de leur plein gré... Comme c'est charmant<Indent/>!"
418,"TEXT_VOICEMAN_04002_003970_ZENOS","Mal<SoftHyphen/>heu<SoftHyphen/>reu<SoftHyphen/>se<SoftHyphen/>ment, vous avez eu l'impudence de croiser mon chemin, et cela va vous coûter cher, ex<SoftHyphen/>trê<SoftHyphen/>me<SoftHyphen/>ment cher..."
419,"TEXT_VOICEMAN_04002_003980_ALISAIE","(-???-)Désolée de te décevoir, Zenos, mais tes projets sadiques vont devoir attendre<Indent/>!"
420,"TEXT_VOICEMAN_04002_003990_ALISAIE","Fuyez, vite<Indent/>! Gosetsu, occupez-vous de Yugiri<Indent/>!"
421,"TEXT_VOICEMAN_04002_004000_GOSETSU","C'est comme si c'était fait<Indent/>!"
422,"TEXT_VOICEMAN_04002_004010_YOTSUYU","Enfer et damnation, on n'y voit plus rien<Indent/>! Dépêchez-vous de les rattraper<Indent/>!"
423,"TEXT_VOICEMAN_04002_004020_YOTSUYU","Votre Altesse, où allez-vous<Indent/>?"
424,"TEXT_VOICEMAN_04002_004030_E3F2VILLAGERC","Ça va<Indent/>? Vos blessures ne sont pas trop graves, j'espère<Indent/>!"
425,"TEXT_VOICEMAN_04002_004040_YUGIRI","Ça va beaucoup mieux grâce aux soins de mes camarades et à votre hospitalité. Soyez rassurés."
426,"TEXT_VOICEMAN_04002_004050_E3F2VILLAGERC","Voilà une bonne nouvelle<Indent/>! Nous aussi, on est capables de mettre du cœur à l'ouvrage<Indent/>! Si on peut faire quoi que ce soit d'autre pour vous, n'hésitez pas à nous le dire."
427,"TEXT_VOICEMAN_04002_004060_GOSETSU","Allons, arrête de les transpercer du regard comme ça, <If(PlayerParameter(4))>elles<Else/>ils</If> risquent de mal le prendre. Quelques paroles réconfortantes seront amplement suffisantes."
428,"TEXT_VOICEMAN_04002_004070_ISSE","Ça va, j'ai compris... C'est plutôt vous qui devriez avoir des choses à nous dire. D'ici là, je vais m'assurer que les autres villageois vont bien."
429,"TEXT_VOICEMAN_04002_004080_YUGIRI","Dame Alisaie, Gosetsu, je tiens à vous présenter mes excuses pour tout ce qui s'est passé. J'ai non seulement mis ma vie en danger, mais aussi celle de notre ami<If(PlayerParameter(4))>e<Else/></If>."
430,"TEXT_VOICEMAN_04002_004090_YUGIRI","Encore une fois, ma naïveté a failli nous être fatale. Ton avertissement était on ne peut plus fondé, Gosetsu. J'espère simplement qu'un jour, je parviendrai à regagner votre confiance..."
431,"TEXT_VOICEMAN_04002_004100_GOSETSU","Ne dis pas de bêtises, Yugiri. Garde ton calme, et demande-toi plutôt quel sens ont les paroles de notre jeune seigneur."
432,"TEXT_VOICEMAN_04002_004110_GOSETSU","La seule chose qui compte pour lui, c'est de protéger son peuple et ceux qui sont à son service, ce qui t'inclut toi aussi. Tu devrais donc accorder plus d'importance à ta vie."
433,"TEXT_VOICEMAN_04002_004120_ALISAIE","Vous n'avez pas à vous tracasser de la sorte, Yugiri. Au final, votre ferveur et votre abnégation ont redonné espoir à beaucoup de gens."
434,"TEXT_VOICEMAN_04002_004130_ALISAIE","Plutôt que de nous faire des excuses, vous n'avez qu'à remercier <If(PlayerParameter(4))>la Guerrière<Else/>le Guerrier</If> de la Lumière de s'être battu<If(PlayerParameter(4))>e<Else/></If> à vos côtés et d'avoir toujours cru en vous."
435,"TEXT_VOICEMAN_04002_004140_YUGIRI","... Dame Alisaie a entièrement raison. Merci infiniment pour votre aide. Les mots ne pourront jamais exprimer la recon<SoftHyphen/>nais<SoftHyphen/>san<SoftHyphen/>ce que j'éprouve envers vous."
436,"TEXT_VOICEMAN_04002_004150_LYSE","Eeeeh<Indent/>! On est là<Indent/>!"
437,"TEXT_VOICEMAN_04002_004160_ALPHINAUD","Quand j'ai appris que vous alliez tenter d'éliminer Zenos, mon sang n'a fait qu'un tour. Quel soulagement de vous voir tous en un seul morceau<Indent/>!"
438,"TEXT_VOICEMAN_04002_004170_LYSE","Désolée de ne pas avoir été là pour vous épauler... Alisaie m'a ex<SoftHyphen/>pres<SoftHyphen/>sé<SoftHyphen/>ment demandé de rester en retrait."
439,"TEXT_VOICEMAN_04002_004180_LYSE","Oh, je ne doute pas qu'elle ait dit ça pour mon bien. Si j'avais Zenos en face de moi, je ne pourrais pas m'empêcher de le défier, même si mes chances de victoire sont proches de zéro..."
440,"TEXT_VOICEMAN_04002_004190_ALISAIE","... Quoi<Indent/>? Pourquoi vous me regardez comme ça<Indent/>?"
441,"TEXT_VOICEMAN_04002_004200_ALISAIE","Oublions cette histoire et concentrons-nous plutôt sur la situation actuelle, vous voulez bien<Indent/>? Nous ne devrions pas nous attendre à des re<SoftHyphen/>pré<SoftHyphen/>sail<SoftHyphen/>les de la part des Impériaux dans l'immédiat, mais maintenant qu'ils sont au courant de nos intentions, ce n'est qu'une question de temps avant qu'ils passent à l'action."
442,"TEXT_VOICEMAN_04002_004210_ALISAIE","Il est évident que nous n'avons pas les moyens de leur résister en cas d'af<SoftHyphen/>fron<SoftHyphen/>te<SoftHyphen/>ment direct. Nous devons donc mettre au point une stratégie solide. Alphinaud, toi qui as toujours de bonnes idées, c'est l'occasion idéale de te creuser les méninges<Indent/>!"
443,"TEXT_VOICEMAN_04002_004220_ALPHINAUD","Eh bien... Ce que je peux vous dire pour l'instant, c'est que malgré les quelques tentatives que j'ai pu faire à Kugane, nous ne devons malheureusement pas nous attendre à un envoi de renforts de la part de l'Alliance éorzéenne."
444,"TEXT_VOICEMAN_04002_004230_ALPHINAUD","D'une part, cela prendrait beaucoup trop de temps. Et puis, même si les Garlemaldais ne surveillent pas la mer de très près, il ne leur serait pas difficile de repérer des navires remplis de soldats. Nous ne pouvons pas prendre un tel risque."
445,"TEXT_VOICEMAN_04002_004240_ALPHINAUD","En revanche, les Impériaux postés à Doma ne sont guère nombreux ac<SoftHyphen/>tu<SoftHyphen/>el<SoftHyphen/>le<SoftHyphen/>ment. Cela, nous le devons au talent ex<SoftHyphen/>cep<SoftHyphen/>tion<SoftHyphen/>nel de nos agents secrets, j'ai nommé Hancock et Tataru."
446,"TEXT_VOICEMAN_04002_004250_ALPHINAUD","Par conséquent, en rassemblant tous ceux qui sont prêts à se battre, nous pourrions tenter de prendre le Château de Doma. Ce ne sera pas une partie de plaisir, mais nous n'aurons pro<SoftHyphen/>ba<SoftHyphen/>ble<SoftHyphen/>ment jamais de meilleure opportunité."
447,"TEXT_VOICEMAN_04002_004260_GOSETSU","Oh<Indent/>! S'il en est ainsi, nous devrions d'abord aller en toucher deux mots au seigneur Hien. Rien ne pourra galvaniser nos troupes davantage que son soutien<Indent/>!"
448,"TEXT_VOICEMAN_04002_004270_GOSETSU","Les Domiens ont prouvé qu'ils avaient encore la volonté de se battre. Il faut im<SoftHyphen/>mé<SoftHyphen/>dia<SoftHyphen/>te<SoftHyphen/>ment l'en avertir<Indent/>!"
449,"TEXT_VOICEMAN_04002_004280_LYSE","Et pendant ce temps, nous devrons nous entraîner sans relâche. Notre prochaine rencontre avec Zenos sera la dernière, c'est moi qui vous le dis<Indent/>!"
450,"TEXT_VOICEMAN_04002_004289_SYSTEM_NONE_VOICE","Pendant ce temps, au Château de Doma"
451,"TEXT_VOICEMAN_04002_004290_ZENOS","Voilà une situation pour le moins intéressante... Je ne suis pas surpris qu'une telle machine ait réussi à capturer un Primordial aussi redoutable que Bahamut."
452,"TEXT_VOICEMAN_04002_004300_ZENOS","Que mon aéronef soit prêt à décoller le plus vite possible. Je m'en vais rendre visite à cette proie capturée à Ala Mhigo. Quand il apprendra que j'ai fait mon devoir, Sa Majesté ne pourra plus me faire de reproches."
453,"TEXT_VOICEMAN_04002_004310_YOTSUYU","Ugh<Indent/>!"
454,"TEXT_VOICEMAN_04002_004320_ZENOS","Je me demande vraiment pourquoi j'ai placé une vulgaire informatrice comme toi au poste de vice-gouverneure..."
455,"TEXT_VOICEMAN_04002_004330_ZENOS","La tourmente que je t'avais ordonné de provoquer à Doma devait servir d'exemple aux autres provinces. C'était pourtant une mission sur mesure pour quelqu'un de rongé par une haine aussi sordide<Indent/>!"
456,"TEXT_VOICEMAN_04002_004340_YOTSUYU","Argh<Indent/>!"
457,"TEXT_VOICEMAN_04002_004350_ZENOS","Je vais te laisser encore une chance..."
458,"TEXT_VOICEMAN_04002_004360_ZENOS","Mais si jamais Doma tombe aux mains des rebelles, tu n'auras plus jamais l'occasion d'implorer ma grâce."
459,"TEXT_VOICEMAN_04002_004370_ZENOS","Tu as intérêt à te remettre au travail sur-le-champ. Si tu échoues, tu périras dans les mêmes flammes que tous tes barbares de congénères."
460,"TEXT_VOICEMAN_04002_004380_GRYNEWAHT","Maîtresse, est-ce que ça va<Indent/>!? Le gouverneur général est vraiment trop cruel avec vous..."
461,"TEXT_VOICEMAN_04002_004390_GRYNEWAHT","Aïe<Indent/>!"
462,"TEXT_VOICEMAN_04002_004400_YOTSUYU","... Selon toute vraisemblance, ce<If(PlayerParameter(4))>tte<Else/></If> soi-disant héro<If(PlayerParameter(4))>ïne<Else/>s</If> éorzéen<If(PlayerParameter(4))>ne<Else/></If> soutient l'armée de libération dans leur combat."
463,"TEXT_VOICEMAN_04002_004410_YOTSUYU","Vous êtes les meilleurs amis du monde, pas vrai<Indent/>? Alors, tu ne devrais pas avoir trop de mal à lui mettre la main dessus, ainsi que sur ses petits amis. Nous allons leur montrer qu'on ne se moque pas impunément de nous..."
464,"TEXT_VOICEMAN_04002_004420_GRYNEWAHT","Oh<Indent/>!? Vraiment<Indent/>!? Je vais enfin pouvoir lui mettre une raclée<Indent/>?"
465,"TEXT_VOICEMAN_04002_004430_GRYNEWAHT","Ouaiiiiis<Indent/>!! Depuis le temps que j'attends ça<Indent/>! Faites-moi confiance, Maîtresse... Je vais vous débarrasser de tous ces gêneurs<Indent/>!"
466,"TEXT_VOICEMAN_04002_004439_SYSTEM_NONE_VOICE","Pendant ce temps, aux Marges de Gyr Abania"
467,"TEXT_VOICEMAN_04002_004440_ESTINIEN","(-???-)Hmm... Il doit s'agir de cette crevasse..."
468,"TEXT_VOICEMAN_04002_004450_ESTINIEN","(-???-)Je ne ressens plus du tout l'aura des Yeux du dragon... Est-ce parce que la haine de Nidhogg ne les nourrit plus<Indent/>? C'est bien la première fois que je me pose cette question depuis que j'ai retrouvé ma liberté..."
469,"TEXT_VOICEMAN_04002_004460_ESTINIEN","Mais si cette tragédie est le fait des Yeux du dragon, le bon sens exige que j'aide mes amis à y mettre fin. Je suis sûr que tu serais d'accord, mon cher Alphinaud..."
470,"TEXT_VOICEMAN_04002_004470_LYSENARRATION","La Steppe d'Azim... Cette immensité de verdure habitée par des peuples nomades
s'étendait à perte de vue sous nos yeux."
471,"TEXT_VOICEMAN_04002_004480_LYSENARRATION","Sur cette terre pétrie de mythes et de légendes mémorables,
nous sommes partis à la recherche de celui qui devait conduire la libération de Doma."
472,"TEXT_VOICEMAN_04002_004490_LYSENARRATION","Un vent paisible nous portait vers un endroit encore inconnu,
avec l'espoir que de nouvelles rencontres nous donneraient la force de continuer le combat."
