key,0,1
#,,
int32,str,str
0,"TEXT_VOICEMAN_04002_000010_TANSUI","Hé, vous là-bas<Indent/>! Alors comme ça on refuse d'payer l'Droit de Rubis<Indent/>?"
1,"TEXT_VOICEMAN_04002_000020_TANSUI","J'comprends bien qu'vous ayez pas envie d'fricoter avec la Confédération, mais c'est pour vot' bien<Indent/>! Qui sait c'qui pourrait vous arriver, si vous naviguez sans notre protection<Indent/>!?"
2,"TEXT_VOICEMAN_04002_000030_GARLEANLEADERDOMA","Hmpf<Indent/>! Pourquoi tenez-vous absolument à passer pour plus dangereux que vous ne l'êtes<Indent/>? C'est pitoyable..."
3,"TEXT_VOICEMAN_04002_000040_GARLEANLEADERDOMA","Si vous avez pu agir en toute impunité jusqu'à présent, c'est uniquement parce que nous avions l'ordre de ne pas régler leur compte aux vulgaires brigands que vous êtes."
4,"TEXT_VOICEMAN_04002_000050_GARLEANLEADERDOMA","Cette époque est désormais révolue. Notre vice-gouverneure générale a une sainte horreur des pirates et elle nous a autorisés à répliquer à la moindre attaque. Vous comprenez ce que ça veut dire<Indent/>?"
5,"TEXT_VOICEMAN_04002_000060_TESHITAPIRATE","Enfoirés<Indent/>!<Indent/>..."
6,"TEXT_VOICEMAN_04002_000070_TANSUI","Si vous avez les moyens d'vos ambitions, j'vois pas c'qui vous empêche de nous filer quelques sous. C'est qu'on a besoin d'vivre, nous aussi, mon brave Monsieur."
7,"TEXT_VOICEMAN_04002_000080_GARLEANLEADERDOMA","Je n'ai pas davantage de temps à perdre avec des crapules... Allez, en route<Indent/>!"
8,"TEXT_VOICEMAN_04002_000090_LYSE","Où qu'on aille, c'est toujours la même chose avec les Impériaux. Pour eux, il n'y a que des dominants et des dominés..."
9,"TEXT_VOICEMAN_04002_000100_TANSUI","À vrai dire, ils n'ont jamais accepté d'payer, mais c'est bien la première fois qu'ils s'montrent aussi agressifs."
10,"TEXT_VOICEMAN_04002_000110_TANSUI","Moi, j'suis originaire de Hingashi, mais y a beaucoup de Domiens parmi nous. J'ai bien l'impression qu'ça plaît pas trop à la vice-gouverneure générale de Doma."
11,"TEXT_VOICEMAN_04002_000120_TANSUI","Elle a d'ailleurs décrété qu'tous ceux qui interféreraient avec l'ordre impérial seraient traités en ennemis. Clairement, elle donne pas d'autre choix que d'se soumettre. C'qui est sûr, c'est qu'ça n'arrange pas nos affaires..."
12,"TEXT_VOICEMAN_04002_000130_ALISAIE","Depuis quand les Kojin sont-ils à la solde des Garlemaldais<Indent/>? Se pourrait-il qu'ils aient eux aussi été forcés d'obéir<Indent/>?"
13,"TEXT_VOICEMAN_04002_000140_TANSUI","Non. À l'origine, c'est un peuple d'mercenaires. Ils ont juste choisi d'se ranger du côté du plus fort."
14,"TEXT_VOICEMAN_04002_000150_TANSUI","Mais bon, j'suis sûr que Soroban pourra nous en dire plus là-d'ssus... Tiens<Indent/>? Où est-ce qu'il est passé<Indent/>? Ah, il a dû s'carapater en voyant ses potes avec le Garlemaldais."
15,"TEXT_VOICEMAN_04002_000160_LYSE","Dis, si la présence des Impériaux vous gêne tant que ça, pourquoi la Confédération ne les combat pas<Indent/>? Ceux d'entre vous qui sont de Doma ont plus d'une raison de leur en vouloir, non<Indent/>?"
16,"TEXT_VOICEMAN_04002_000170_TANSUI","Aaah<Indent/>! J'comprends mieux qui vous êtes maintenant. Un rescapé de la résistance domienne et des gens venus l'aider."
17,"TEXT_VOICEMAN_04002_000180_TANSUI","Vous vous êtes pris une raclée et vous voudriez qu'on s'joigne à vous<Indent/>? Hmpf<Indent/>! Laissez-moi rire<Indent/>! J'suis pas con au point de pas m'rendre compte du déséquilibre des forces entre vous et l'Empire."
18,"TEXT_VOICEMAN_04002_000190_TANSUI","Et puis, mettez-vous bien dans l'crâne qu'on tire un trait sur son passé et sa patrie quand on d'vient pirate. On est du côté d'personne, et personne n'est d'notre côté. Pigé<Indent/>?"
19,"TEXT_VOICEMAN_04002_000200_TANSUI","Je dois toutefois admettre que ça sent l'roussi pour nous aussi. Soit on meurt le sabre au clair... soit on accepte de servir un souverain. Mais ça, ce sera à not'chef de choisir."
20,"TEXT_VOICEMAN_04002_000210_TANSUI","La purge ordonnée par la vice-gouverneure générale a fini par atteindre les villages côtiers. Ça fait aucun doute qu'on est les prochains sur la liste des gêneurs à éliminer..."
21,"TEXT_VOICEMAN_04002_000220_GOSETSU","Comment<Indent/>!? Cette maudite vipère n'a donc aucune pitié<Indent/>!?"
22,"TEXT_VOICEMAN_04002_000230_GOSETSU","Nous devons agir, et vite<Indent/>! Dépêchons-nous de retrouver Soroban et de rallier le continent pour voir ce qui s'y passe exactement<Indent/>!"
23,"TEXT_VOICEMAN_04002_000240_TANSUI","Ces gens ont payé leur Droit d'Rubis. Laissez-les aller où ils veulent. D'mon côté, il faut que j'm'entretienne avec not'chef..."
24,"TEXT_VOICEMAN_04002_000250_ALISAIE","Vous ne trouvez pas que ça fait beaucoup de gardes pour un simple village de pêcheurs<Indent/>? Même si l'Empire est sur le qui-vive depuis la récente rébellion, il y a quelque chose qui cloche..."
25,"TEXT_VOICEMAN_04002_000260_GOSETSU","Je suis d'accord. Ça fait un moment que je suis parti, mais je doute que le niveau de sécurité soit généralement aussi élevé. Nous sommes pro<SoftHyphen/>ba<SoftHyphen/>ble<SoftHyphen/>ment arrivés trop tard..."
26,"TEXT_VOICEMAN_04002_000270_LYSE","Hé, regardez là-bas<Indent/>!"
27,"TEXT_VOICEMAN_04002_000280_GOSETSU","Grrrmmmh... Même à cette distance, il n'y a pas de doute possible<Indent/>: c'est Yotsuyu, la traîtresse qui a vendu sa patrie pour obtenir les faveurs de l'Empire<Indent/>! Cette prétendue vice-gouverneure générale de Doma est notre principale ennemie<Indent/>!"
28,"TEXT_VOICEMAN_04002_000290_LYSE","C'est donc elle qui a maté la rébellion domienne... Oh, mais celui qui est derrière elle, je le reconnais<Indent/>!"
29,"TEXT_VOICEMAN_04002_000300_YOTSUYU","Voyez cette misère qui suinte de partout... Je ne connais rien de plus écœurant qu'un village domien. Ce spectacle me donne vraiment envie de vomir."
30,"TEXT_VOICEMAN_04002_000310_YOTSUYU","Pourquoi tremblez-vous de la sorte, pauvres gueux<Indent/>? Cela fait maintenant vingt-cinq ans que votre patrie est une province de l'Empire."
31,"TEXT_VOICEMAN_04002_000320_YOTSUYU","Attendez donc sagement que la tempête passe. Tant que vous ne vous rebellez pas, vous serez épargnés et vous pourrez continuer cette vie minable et dégoûtante."
32,"TEXT_VOICEMAN_04002_000330_YOTSUYU","Mais pour cela, il va falloir me prouver votre obéissance inconditionnelle. Même des crève-la-faim comme vous voient où je veux en venir, n'est-ce pas<Indent/>?<Indent/>..."
33,"TEXT_VOICEMAN_04002_000340_YOTSUYU","Pourtant, ce matin, nos mercenaires ont découvert cet homme en train de fuir en bateau. Vous ne pouvez pas nier qu'il est des vôtres<Indent/>!? Qu'espérait-il au juste<Indent/>? Rallier dis<SoftHyphen/>crè<SoftHyphen/>te<SoftHyphen/>ment Kugane dans sa misérable embarcation<Indent/>?"
34,"TEXT_VOICEMAN_04002_000350_YOTSUYU","Hmpf. Ce pauvre imbécile n'a rien à dire pour sa défense... Si vous avez un tant soit peu de jugeote, vous n'essaierez pas de l'imiter. Vous savez ce que j'attends de vous, pas vrai<Indent/>?"
35,"TEXT_VOICEMAN_04002_000360_E3F1VILLAGER","Moi... Je jure fidélité à l'empire de Garlemald<Indent/>!<Indent/>... Je promets d'obéir à tous les ordres<Indent/>!"
36,"TEXT_VOICEMAN_04002_000370_YOTSUYU","Très bien... Tu vas me prouver ta sincérité par les actes."
37,"TEXT_VOICEMAN_04002_000380_YOTSUYU","Tue-le. Il a démontré son mépris de l'Empire en essayant de fuir... Tu as juré fidélité, n'est-ce pas<Indent/>?"
38,"TEXT_VOICEMAN_04002_000390_E3F1VILLAGER","Désolé... mais... je ne veux pas qu'il soit fait de mal à ma famille..."
39,"TEXT_VOICEMAN_04002_000400_YOTSUYU","Oh, oui<Indent/>! Quel pied<Indent/>! J'aime les hommes soumis<Indent/>!"
40,"TEXT_VOICEMAN_04002_000410_YOTSUYU","Au tour de ces vieux débris... Tue-les. Ceux qui sont incapables de travailler ne sont d'aucune utilité à l'Empire."
41,"TEXT_VOICEMAN_04002_000420_E3F1VILLAGER","Mais... ce sont ma mère... et mon père<Indent/>!<Indent/>... Je peux pas faire ça<Indent/>!<Indent/>..."
42,"TEXT_VOICEMAN_04002_000430_E3F1VILLAGER","Ouuuh... (gémit)"
43,"TEXT_VOICEMAN_04002_Q1_000_001_NONE_VOICE","Que dites-vous à Gosetsu<Indent/>?"
44,"TEXT_VOICEMAN_04002_A1_000_001_NONE_VOICE","Nous devons réagir im<SoftHyphen/>mé<SoftHyphen/>dia<SoftHyphen/>te<SoftHyphen/>ment<Indent/>!"
45,"TEXT_VOICEMAN_04002_A1_000_002_NONE_VOICE","Du calme<Indent/>! Il ne faut pas se faire repérer<Indent/>!"
46,"TEXT_VOICEMAN_04002_000440_ALISAIE","Attendez<Indent/>! Même si vous êtes capables de vaincre ces soldats, je crains que certains villageois ne fassent les frais d'une attaque frontale<Indent/>!"
47,"TEXT_VOICEMAN_04002_000450_ALISAIE","C'est juste. Si vous attaquez comme ça de front, je crains que les villageois n'en fassent les frais<Indent/>!"
48,"TEXT_VOICEMAN_04002_000460_ALISAIE","Qui plus est, en cas d'échec, la vigilance de l'armée impériale sera renforcée, et la libération de Doma n'en sera que plus difficile. Je ne parle même pas des répercussions que cela pourrait avoir pour le peuple."
49,"TEXT_VOICEMAN_04002_000470_GOSETSU","N'essayez pas de m'arrêter<Indent/>! Mon code d'honneur m'impose de mettre un terme à cette violence injuste<Indent/>!"
50,"TEXT_VOICEMAN_04002_000480_GOSETSU","Même si j'ai été vaincu, je vous rappelle que je suis un illustre général domien. Je vais les laisser me faire prisonnier pour faire diversion. À vous de mettre au point un plan pendant qu'ils m'interrogeront<Indent/>!"
51,"TEXT_VOICEMAN_04002_000490_LYSE","Mais rien ne garantit qu'ils vous laisseront la vie sauve<Indent/>! Vous ne parviendrez pas à libérer Doma si vous mourez ici<Indent/>!"
52,"TEXT_VOICEMAN_04002_000500_GOSETSU","Ce qui doit arriver arrivera. Mais je peux vous assurer que je n'ai pas l'intention de rendre mon dernier souffle avant d'avoir accompli mon devoir<Indent/>! Et puis, ne vous inquiétez pas, j'ai l'habitude de me faire capturer<Indent/>!"
53,"TEXT_VOICEMAN_04002_000510_LYSE","Vous voulez parler de ce qui s'est passé à Kugane<Indent/>?<Indent/>... Mais ça n'a rien à voir<Indent/>! Il est hors de question que je laisse un autre camarade perdre la vie<Indent/>!"
54,"TEXT_VOICEMAN_04002_000520_ALISAIE","Lyse, je sais que tu as été pro<SoftHyphen/>fon<SoftHyphen/>dé<SoftHyphen/>ment marquée par la débâcle à L'Étendue de Rhalgr, mais c'est justement parce que nous avons goûté à la défaite que nous devons aller de l'avant."
55,"TEXT_VOICEMAN_04002_000530_ALISAIE","Merci de prendre ce risque pour nous faire gagner du temps. Nous allons l'utiliser au mieux... Promettez-moi seulement de ne pas vous faire tuer."
56,"TEXT_VOICEMAN_04002_000540_GOSETSU","Vous avez ma parole de samouraï. Je vous conseille de partir d'ici et de vous diriger vers la tour au nord-est. Ceux qui vivent là-bas sauront pro<SoftHyphen/>ba<SoftHyphen/>ble<SoftHyphen/>ment vous aider."
57,"TEXT_VOICEMAN_04002_000550_GOSETSU","Sur ce, bon vent<Indent/>!"
58,"TEXT_VOICEMAN_04002_000560_YOTSUYU","Tous plus idiots les uns que les autres. J'en ai ma claque de cette mentalité débile qui force les Domiens à s'insurger contre l'autorité. Pourquoi ne comprennent-ils pas qu'il est dans leur intérêt de se soumettre<Indent/>!?"
59,"TEXT_VOICEMAN_04002_000570_GOSETSU","Ça suffit, Yotsuyu<Indent/>!"
60,"TEXT_VOICEMAN_04002_000580_YOTSUYU","Oh<Indent/>! Pour une surprise, en voilà une de taille<Indent/>!"
61,"TEXT_VOICEMAN_04002_000590_GOSETSU","Arrête de martyriser ces pauvres gens<Indent/>! Si toi et tes hommes quittez ce village, j'accepte de me rendre. Tu ne voudrais pas que je fasse une dé<SoftHyphen/>mon<SoftHyphen/>stra<SoftHyphen/>tion de mes talents de bretteur, n'est-ce pas<Indent/>?"
62,"TEXT_VOICEMAN_04002_000600_YOTSUYU","Mettez-le aux arrêts. Nous allons l'interroger dans la taverne du coin."
63,"TEXT_VOICEMAN_04002_000610_TANSUI","Héhé, content d'vous voir. Il paraît qu'vous nous avez rendu service<Indent/>? Vous avez toute ma gratitude pour ça."
64,"TEXT_VOICEMAN_04002_000620_TANSUI","J'imagine qu'vous comprenez mieux not'situation désormais. Mon p'tit doigt me dit pourtant qu'vous allez à nouveau nous demander d'affronter l'Empire."
65,"TEXT_VOICEMAN_04002_000630_ALISAIE","Vous avez vu juste. Je pense que les pirates ne peuvent plus ignorer la menace que re<SoftHyphen/>pré<SoftHyphen/>sen<SoftHyphen/>tent Yotsuyu et les Garlemaldais. Pour cette raison, nous aimerions obtenir votre aide."
66,"TEXT_VOICEMAN_04002_000640_TANSUI","C'est drôle comme ces enlèvements tombent pile au moment qui arrange le plus vos affaires, hein<Indent/>? J'en arrive presqu'à m'demander si vous seriez pas des oiseaux d'malheur..."
67,"TEXT_VOICEMAN_04002_000650_RASHO","Du calme, Tansui. Ils ne sont en aucun cas res<SoftHyphen/>pon<SoftHyphen/>sa<SoftHyphen/>bles de ce qui se passe. Tu le sais aussi bien que nous tous."
68,"TEXT_VOICEMAN_04002_000660_RASHO","Je reconnais bien là l'esprit retors de cette femme sadique. Les villageois ne lui suffisent pas. Elle a l'intention de ramener de force les Domiens qui ont rejoint les rangs de la Confédération pour les massacrer..."
69,"TEXT_VOICEMAN_04002_000670_RASHO","Il est fort probable que nos camarades ont été emmenés à Isari. Si nous partons à leur rescousse, nous serons exterminés. Si nous restons ici, nos ennemis finiront par nous avoir à l'usure..."
70,"TEXT_VOICEMAN_04002_000680_RASHO","Dans les deux cas, nous n'avons pas beaucoup d'espoir. Mais plutôt que de perdre tous mes hommes bêtement, je préfère prendre le temps de trouver une échappatoire..."
71,"TEXT_VOICEMAN_04002_000690_RASHO","Vous avez ma réponse."
72,"TEXT_VOICEMAN_04002_000700_LYSE","Vous n'allez donc rien faire pour sauver vos compagnons d'une mort certaine<Indent/>!?"
73,"TEXT_VOICEMAN_04002_000710_LYSE","Si c'est vraiment votre choix, alors vous perdrez quelque chose d'encore plus précieux que votre liberté... C'est votre dignité<Indent/>! Est-ce vraiment ce que vous voulez<Indent/>!?"
74,"TEXT_VOICEMAN_04002_000720_ALISAIE","Dites, je crois qu'il y a encore une chance de les convaincre. Ce ne sera pas facile, mais je pense que ça peut marcher."
75,"TEXT_VOICEMAN_04002_000730_ALISAIE","Vous permettez que j'essaie<Indent/>?"
76,"TEXT_VOICEMAN_04002_Q2_000_001_NONE_VOICE","Que répondez-vous<Indent/>?"
77,"TEXT_VOICEMAN_04002_A2_000_001_NONE_VOICE","Je vous en prie<Indent/>!"
78,"TEXT_VOICEMAN_04002_A2_000_002_NONE_VOICE","Si c'est tout ce qu'il nous reste..."
79,"TEXT_VOICEMAN_04002_000740_LYSE","Je n'ai pas l'intention d'abandonner ces gens. Peu importe leurs origines, je ne tolérerai pas que l'Empire les fasse souffrir<Indent/>! Je suis prête à tout pour les sauver<Indent/>!"
80,"TEXT_VOICEMAN_04002_000750_ALISAIE","Merci."
81,"TEXT_VOICEMAN_04002_000760_ALISAIE","Nous comprenons votre point de vue, mais comme vous refusez d'agir, nous allons vous montrer comment on prend le dessus dans une telle situation. Vous n'allez pas en croire vos yeux, je vous le garantis."
82,"TEXT_VOICEMAN_04002_000770_ALISAIE","Au fond, votre problème n'est pas de savoir si vous serez à la hauteur pour affronter les troupes postées à Isari. Ce qui vous effraie le plus, c'est de ne pas être capable ensuite de faire face aux re<SoftHyphen/>pré<SoftHyphen/>sail<SoftHyphen/>les de l'Empire."
83,"TEXT_VOICEMAN_04002_000780_ALISAIE","Nous allons vous débarrasser de ces inquiétudes. Lorsque nous aurons sauvé le village et vos camarades, c'est Doma tout entière que nous libérerons<Indent/>!"
84,"TEXT_VOICEMAN_04002_000790_ALISAIE","Mais tout d'abord, laissez-nous vous prouver que nous en avons les moyens. Nous allons neutraliser les Kojin des environs à nous seul<If(PlayerParameter(4))>e<Else/></If>s<Indent/>! Cela affaiblira grandement notre ennemi<Indent/>!"
85,"TEXT_VOICEMAN_04002_000800_TANSUI","Neutraliser les Kojin<Indent/>? À vous seul<If(PlayerParameter(4))>e<Else/></If>s<Indent/>!? Sans blague<Indent/>! J'aimerais bien voir ça<Indent/>! Pfff<Indent/>!"
86,"TEXT_VOICEMAN_04002_000810_ALISAIE","Nous sommes bien plus forts que vous le pensez. Surtout <If(PlayerParameter(4))>elle<Else/>lui</If>. Croyez-moi, <If(PlayerParameter(4))>elle<Else/>il</If> a accompli des exploits bien plus grands par le passé<Indent/>!"
87,"TEXT_VOICEMAN_04002_000820_ALISAIE","J'ose imaginer que les pirates de la Confédération n'ont pas peur des paris. Si nous réussissons, je vous mets donc au défi d'intervenir à Isari."
88,"TEXT_VOICEMAN_04002_000830_TANSUI","Qu'est-ce que t'en dis<Indent/>? On a pas d'leçons d'courage à recevoir d'la part d'une gamine, hein<Indent/>?"
89,"TEXT_VOICEMAN_04002_000840_RASHO","Pari accepté. J'ai hâte de voir ce dont vous êtes capables."
90,"TEXT_VOICEMAN_04002_000850_ALISAIE","D'où vient cette lumière<Indent/>?"
91,"TEXT_VOICEMAN_04002_000860_LYSE","Ouaaahou<Indent/>!"
92,"TEXT_VOICEMAN_04002_000870_ALISAIE","Incroyable<Indent/>! On dirait une immense bulle d'air... Pourtant, nous sommes au fond de la mer<Indent/>!"
93,"TEXT_VOICEMAN_04002_000880_SOROBAN","(-???-)Hmmm<Indent/>? Je connais ces voiiiix... Oh, c'est vouuuus<Indent/>! Quel plaisir de vous revooooir<Indent/>!"
94,"TEXT_VOICEMAN_04002_000890_LYSE","Soroban<Indent/>!? Mais que fais-tu ici<Indent/>?"
95,"TEXT_VOICEMAN_04002_000900_SOROBAN","Eh bien, c'est ici que je viiiis."
96,"TEXT_VOICEMAN_04002_000910_LYSE","Tu veux dire que c'est le village de ta tribu<Indent/>!?<Indent/>..."
97,"TEXT_VOICEMAN_04002_000920_SOROBAN","Oui, exactemeeeent. Soyez les bienvenu<If(PlayerParameter(4))>e<Else/></If>s à Tamamizu, mes amiiii<If(PlayerParameter(4))>e<Else/></If>s."
98,"TEXT_VOICEMAN_04002_000930_BUNCHIN","Hohohoooo... Soyez les bienvenu<If(PlayerParameter(4))>e<Else/></If>s parmi nous, voyageuuu<If(PlayerParameter(4))>ses<Else/>rs</If>. Soroban m'a dit que vous l'aviez aidé à faire de bonnes affaiiiires..."
99,"TEXT_VOICEMAN_04002_000940_ALISAIE","Vous nous faites un grand honneur en nous accueillant dans votre fabuleux village. Je suis désolée de manquer aux règles de la bienséance, mais nous aimerions nous entretenir avec vous d'un sujet de la plus haute importance."
100,"TEXT_VOICEMAN_04002_000950_BUNCHIN","Vous désirez donc que la tribu des Rouges cesse d'offrir ses services à l'Empiiiire..."
101,"TEXT_VOICEMAN_04002_000960_LYSE","Oui. Nous savons que vous n'êtes pas en bons termes avec eux, mais peut-être qu'ils accepteront de vous écouter. Si ça ne vous dérange pas, bien sûr..."
102,"TEXT_VOICEMAN_04002_000970_BUNCHIN","Hmmm... Comme vous vous êtes donné la peine de faire tout ce chemin pour nous parler, je vais vous en dire plus sur notre peuuuuple."
103,"TEXT_VOICEMAN_04002_000980_BUNCHIN","Nous autres Kojin vénérons une myriade de <Emphasis>kami</Emphasis>, des dieux que nous considérons à l'origine de tous les phénomènes de ce moooonde."
104,"TEXT_VOICEMAN_04002_000990_BUNCHIN","Ils se manifestent généralement dans des objets, exprimant une préférence par<SoftHyphen/>ti<SoftHyphen/>cu<SoftHyphen/>liè<SoftHyphen/>re pour les artefacts anciens ou de grande valeuuuur."
105,"TEXT_VOICEMAN_04002_001000_BUNCHIN","Pour cette raison, notre peuple col<SoftHyphen/>lec<SoftHyphen/>tion<SoftHyphen/>ne depuis toujours toutes sortes de trésors dans lesquels pourrait résider un kamiiii. C'est cette coutume qui nous a permis de prospéreeeer..."
106,"TEXT_VOICEMAN_04002_001010_BUNCHIN","Vous devinez facilement qu'entrer en conflit avec un adversaire aussi dangereux que l'empire de Garlemald ne pourrait que nuire à ce mode de viiiie."
107,"TEXT_VOICEMAN_04002_001020_BUNCHIN","C'est pour ça que la tribu des Rouges a im<SoftHyphen/>mé<SoftHyphen/>dia<SoftHyphen/>te<SoftHyphen/>ment choisi de s'allier aux Impériauuuux."
108,"TEXT_VOICEMAN_04002_001030_SOROBAN","Le problème, c'est que les Garlemaldais ne reconnaissent aucune religioooon..."
109,"TEXT_VOICEMAN_04002_001040_SOROBAN","Les Rouges cachent donc leurs réelles motivations derrière leur prétendu appât du gaaaain."
110,"TEXT_VOICEMAN_04002_001050_SOROBAN","C'est là toute la différence avec notre tribuuuu. Nous considérons que leur attitude va à l'encontre de notre coutume et manque de respect envers les dieuuuux."
111,"TEXT_VOICEMAN_04002_001060_BUNCHIN","Exactemeeeent. Ils ont besoin d'être rappelés à l'ordre et remis dans le droit chemiiiin<Indent/>!"
112,"TEXT_VOICEMAN_04002_001070_BUNCHIN","Plutôt que de recourir à la force, notre tribu a depuis toujours favorisé la diplomatie afin de mieux négocier l'obtention de trésoooors."
113,"TEXT_VOICEMAN_04002_001080_BUNCHIN","L'attitude des Rouges a toutefois endommagé nos relations avec les autres peuples et rendu les échanges difficiiiiles. Le temps est venu pour nous d'exprimer notre mécontentemeeeent<Indent/>!"
114,"TEXT_VOICEMAN_04002_001090_ALISAIE","Devons-nous en déduire que vous êtes prêts à nous aider<Indent/>?"
115,"TEXT_VOICEMAN_04002_001100_BUNCHIN","Tout à faaaait. Nous allons vous dire comment faire rentrer la tête dans leur carapace aux Rouuuuges."
116,"TEXT_VOICEMAN_04002_001110_BUNCHIN","Il faut pour cela que nous vous révélions notre plus grand trésoooor. Par conséquent, nous allons d'abord vous proposer un marché afin de créer un véritable lien de confiance entre nouuuus."
117,"TEXT_VOICEMAN_04002_001120_SOROBAN","Votre talent pour les affaires n'a pas d'égal, vénérable ancieeeen<Indent/>! Nous allons faire de gros bénéfices grâce à vouuuus<Indent/>!"
118,"TEXT_VOICEMAN_04002_001130_BUNCHIN","Hohohoooo... Tu en dis trop, Sorobaaaan. Occupe-toi plutôt d'expliquer à nos invité<If(PlayerParameter(4))>e<Else/></If>s ce que nous attendons d'<If(PlayerParameter(4))>eeeelles<Else/>euuuux</If>."
119,"TEXT_VOICEMAN_04002_001140_SOROBAN","Avec plaisiiiir<Indent/>!"
120,"TEXT_VOICEMAN_04002_001150_LYSE","Je ne sais pas trop où cette histoire va nous mener, mais j'imagine que nous n'avons pas d'autre choix..."
121,"TEXT_VOICEMAN_04002_001160_SOROBAN","Voilàààà<Indent/>! J'ai fait des offrandes à la mer pour vouuuus."
122,"TEXT_VOICEMAN_04002_001170_SOROBAN","Maintenant, il ne me reste plus qu'à exécuter le ritueeeel. Si vous voulez bien vous mettre ici, s'il vous plaaaaît."
123,"TEXT_VOICEMAN_04002_001180_SOROBAN","Bien, détendez-vouuus. Répétez dans votre tête l'incantation que je vais prononceeeer."
124,"TEXT_VOICEMAN_04002_001190_SOROBAN","Ô Dieux qui vivez dans l'immensité de l'océaaaan...
Vous qui animez toutes choses sous la surface des floooots..."
125,"TEXT_VOICEMAN_04002_001200_SOROBAN","Acceptez les offrandes faites au nom de ces geeeens...
Libérez-les de l'impureté de la terre et accordez-leur la bénédiction de l'eauuuu..."
126,"TEXT_VOICEMAN_04002_001210_SOROBAN","Avec ça, même les montures que vous utilisez à la surface devraient pouvoir se déplacer librement dans la meeeer."
127,"TEXT_VOICEMAN_04002_001220_ALISAIE","Vraiment<Indent/>? Je ne vois aucun changement..."
128,"TEXT_VOICEMAN_04002_001230_SOROBAN","Euh, oui, je pense que ça a marchéééé. Ceci dit, ce rituel vous permet juste de rester sous l'eau autant que vous vouleeeez. Ça ne fera pas de vous de meilleurs nageuuuurs."
129,"TEXT_VOICEMAN_04002_001240_LYSE","Moi, je sais nager, en tout cas. Et toi, Alisaie<Indent/>?"
130,"TEXT_VOICEMAN_04002_001250_ALISAIE","Je suis contente que tu me poses cette question. Figure-toi que contrairement à Alphinaud, je suis très à l'aise dans l'eau..."
131,"TEXT_VOICEMAN_04002_001251_ALISAIE","Oui, oui, je vous assure<Indent/>! Il ne sait même pas faire la planche<Indent/>!"
132,"TEXT_VOICEMAN_04002_001260_SOROBAN","Il faut dire que le corps des humains n'est pas adapté au milieu aquatiiiique. Mais vous m'avez l'air pressé<If(PlayerParameter(4))>e<Else/></If>s, alors laissez-moi vous mettre en relation avec des créatures qui nous permettent de nous mouvoir plus viiiite."
133,"TEXT_VOICEMAN_04002_001270_SOROBAN","Commençons par entrer dans l'eau, si vous le voulez bieeeen."
134,"TEXT_VOICEMAN_04002_001280_ALISAIE","C'est incroyable<Indent/>! C'est comme si je me tenais sur la terre ferme<Indent/>!"
135,"TEXT_VOICEMAN_04002_001290_SOROBAN","Bien, je vais appeler de précieux alliéééés. Regardez bien ce qui va venir immédiatemeeeent<Indent/>!"
136,"TEXT_VOICEMAN_04002_001300_LYSE","Oh, vous êtes nos “précieux alliés”<Indent/>!? J'ai le sentiment qu'on va pouvoir voyager partout sous l'eau avec vous<Indent/>!"
137,"TEXT_VOICEMAN_04002_001310_ALISAIE","Je doute que nous ayons le temps pour des escapades sous-marines. Je te rappelle que Gosetsu et les pirates nous attendent."
138,"TEXT_VOICEMAN_04002_001311_SOROBAN","Si jamais vous vous retrouvez séparé<If(PlayerParameter(4))>e<Else/></If>s d'eux, venez me vooooir. Je me ferai un plaisir de les rappeleeeer. Bonne rouuuute<Indent/>!"
139,"TEXT_VOICEMAN_04002_001320_LYSE","Allons-y<Indent/>! Ce que nous cherchons est sûrement caché quelque part dans la mer<Indent/>!"
140,"TEXT_VOICEMAN_04002_001329_SYSTEM_NONE_VOICE","Pendant ce temps, à Isari"
141,"TEXT_VOICEMAN_04002_001330_GRYNEWAHT","Prends ça<Indent/>!"
142,"TEXT_VOICEMAN_04002_001340_GOSETSU","Argh<Indent/>!"
143,"TEXT_VOICEMAN_04002_001350_YOTSUYU","Être forcée de me salir les pieds dans cette taverne crasseuse, avec un gros balourd en guise de compagnie... Je n'étais pas tombée aussi bas depuis bien longtemps..."
144,"TEXT_VOICEMAN_04002_001360_GOSETSU","Hmpf... Je connais une vipère qui a la langue bien pendue depuis qu'elle a trahi sa patrie."
145,"TEXT_VOICEMAN_04002_001370_YOTSUYU","Quelle originalité<Indent/>! Le plus mauvais des perdants n'aurait pas dit mieux."
146,"TEXT_VOICEMAN_04002_001380_GOSETSU","“Vipère” est encore bien trop faible... Je pourrais t'appeler “Naeuri la martyre”, ou bien encore “Sashihai la veuve noire”... Ça te procure tant de plaisir que ça de semer le chaos parmi les tiens<Indent/>?"
