key,0,1
#,,
int32,str,str
0,"TEXT_REGOTH3SANANA_00496_SANANA_000_000","アンタのような腕利き冒険者が現れてくれて、正直助かったよ。
難破船から持ち出せた物資で、必要なものがあれば言ってくれ。
……もちろん、相応の対価はいただくがねっ！"
1,"TEXT_REGOTH3SANANA_00496_SANANA_000_010","なーんか、面倒な話になってきたね。
ここまで軌道に乗ってきたからには、ロウェナ商会でも、
交流に、一枚噛ませてもらえないかと考えていたんだが……。"
2,"TEXT_REGOTH3SANANA_00496_SANANA_000_020","まさか、クレナイたちとクガネに行くことになるとは。
まあ、交流の話がなくなっちまうのは、アタシも困る……。
ジッカンの野郎もムカつくし、手伝っちゃるよ。"
3,"TEXT_REGOTH3SANANA_00496_SANANA_000_030","ここまで来たら、アタシも本気で協力する……！
あの、ツリマユ野郎の鼻を明かしてやろうぜ！"
4,"TEXT_REGOTH3SANANA_00496_SANANA_000_040","アタシが、がっぽり……
……もとい、クレナイの夢を実現させるためにも、
<Split(<Highlight>ObjectParameter(1)</Highlight>, ,1)/>には、ジャンジャン納品してもらわないとね！"
