key,0,1
190,"TEXT_VOICEMAN_05300_001770_HYTHLODAEUS","<UIForeground>F20223</UIForeground>A crystal bearing the forgotten name of <If(PlayerParameter(4))>her<Else/>his</If> office, along with a magick of <If(PlayerParameter(4))>her<Else/>his</If> own conceiving─a singular incantation embodying <If(PlayerParameter(4))>her<Else/>his</If> spirit.<UIForeground>01</UIForeground>"
191,"TEXT_VOICEMAN_05300_001780_HYTHLODAEUS","<UIForeground>F20223</UIForeground>Among all the offices, the Fourteenth was most unusual. For while the rest sat in Amaurot, its holder was charged with gaining an intimate knowledge of the wider world.<UIForeground>01</UIForeground>"
192,"TEXT_VOICEMAN_05300_001790_HYTHLODAEUS","<UIForeground>F20223</UIForeground>In the course of his duty, he traveled the length and breadth of every land, and befriended countless folk.<UIForeground>01</UIForeground>"
193,"TEXT_VOICEMAN_05300_001800_HYTHLODAEUS","<UIForeground>F20223</UIForeground>In the course of her duty, she traveled the length and breadth of every land, and befriended countless folk.<UIForeground>01</UIForeground>"
194,"TEXT_VOICEMAN_05300_001810_HYTHLODAEUS","<UIForeground>F20223</UIForeground><If(PlayerParameter(4))>She<Else/>He</If> encountered troubles too, of course. Matters which <If(PlayerParameter(4))>she<Else/>he</If> could simply have referred to the Convocation. But that was not <If(PlayerParameter(4))>her<Else/>his</If> way.<UIForeground>01</UIForeground>"
195,"TEXT_VOICEMAN_05300_001820_HYTHLODAEUS","<UIForeground>F20223</UIForeground>Nay, more often than not, <If(PlayerParameter(4))>she<Else/>he</If> would call upon <If(PlayerParameter(4))>her<Else/>his</If> comrades, and together resolve matters themselves.<UIForeground>01</UIForeground>"
196,"TEXT_VOICEMAN_05300_001830_HYTHLODAEUS","<UIForeground>F20223</UIForeground>Such is the magick sealed within that crystal─the magick to summon the stars to your side.<UIForeground>01</UIForeground>"
197,"TEXT_VOICEMAN_05300_001840_HYTHLODAEUS","<UIForeground>F20223</UIForeground>In time of greatest need, should you wish upon it with all your heart, it will surely answer your call.<UIForeground>01</UIForeground>"
198,"TEXT_VOICEMAN_05300_001850_HYTHLODAEUS","<UIForeground>F20223</UIForeground>And now it is where it belongs.<UIForeground>01</UIForeground>"
199,"TEXT_VOICEMAN_05300_001860_HYTHLODAEUS","<UIForeground>F20223</UIForeground>Oh, there is no need for thanks. But nor will I hear any complaints about it either.<UIForeground>01</UIForeground>"
200,"TEXT_VOICEMAN_05300_001870_HYTHLODAEUS","<UIForeground>F20223</UIForeground>After all, I cannot say whether I act of my own volition or by the will of my recreator!<UIForeground>01</UIForeground>"
201,"TEXT_VOICEMAN_05300_001880_YSHTOLA","I was wondering where you had disappeared to."
202,"TEXT_VOICEMAN_05300_001890_YSHTOLA","Is something troubling you?"
203,"TEXT_VOICEMAN_05300_001900_YSHTOLA","...No? Very well."
204,"TEXT_VOICEMAN_05300_001910_YSHTOLA","I have everything. Let's hurry back to the surface."
205,"TEXT_VOICEMAN_05300_001920_YSHTOLA","Forgive us our lateness."
206,"TEXT_VOICEMAN_05300_001930_YSHTOLA","Master Chai, my congratulations on your appointment. By all accounts, you are a capable mayor."
207,"TEXT_VOICEMAN_05300_001940_CHAINUZZ","Oh, I have capable friends, my lady. I must say, it's good to see you looking hale and whole again."
208,"TEXT_VOICEMAN_05300_001950_YSHTOLA","The credit for that lies with my own capable friend, without whom I might never have escaped my abductor."
209,"TEXT_VOICEMAN_05300_001960_THANCRED","A primal... I suppose that would explain why Elidibus has been fostering faith in the Warrior of Light."
210,"TEXT_VOICEMAN_05300_001970_THANCRED","While you were enjoying your audience with the wandering heart of Zodiark, we were busy dispatching the last of the black-masked Ascians. A task which proved almost insultingly easy."
211,"TEXT_VOICEMAN_05300_001980_THANCRED","Formidable though we undoubtedly are, they were obviously sent to provide encouragement for budding heroes. One cannot help but wonder how many times the ploy has been used before..."
212,"TEXT_VOICEMAN_05300_001990_ALPHINAUD","Master Chai, you mentioned that the people of Kholusia are similarly enamored of the Warrior of Light."
213,"TEXT_VOICEMAN_05300_002000_CHAINUZZ","Indeed. Though it's hardly surprising given the state of the world. Many are still struggling to find a purpose, and it's only natural that they should take comfort in the tales."
214,"TEXT_VOICEMAN_05300_002010_ALPHINAUD","Then the fever has spread to every corner of Norvrandt."
215,"TEXT_VOICEMAN_05300_002020_ALPHINAUD","We may have dealt with his black-masked minions, but it is plain Elidibus has yet to show his hand."
216,"TEXT_VOICEMAN_05300_002030_DULIACHAI","Oh my, what a spectacular sky!"
217,"TEXT_VOICEMAN_05300_002040_ALISAIE","Another starshower..."
218,"TEXT_VOICEMAN_05300_002050_RYNE","Wait, is that..."
219,"TEXT_VOICEMAN_05300_002060_RYNE","...Amaurot?"
220,"TEXT_VOICEMAN_05300_002070_EULMOREMANA","No subtitles. Report if displayed."
221,"TEXT_VOICEMAN_05300_002075_HYDAELYN","Hear... Feel... Think..."
222,"TEXT_VOICEMAN_05300_002080_EULMOREMANA","Did you hear that? That voice, calling out..."
223,"TEXT_VOICEMAN_05300_002090_EULMOREMANB","No, I didn't hear anything. But..."
224,"TEXT_VOICEMAN_05300_002100_EULMOREMANB","Why do I feel so... Like I've lost something dear to me..."
225,"TEXT_VOICEMAN_05300_002110_ALPHINAUD","Does Elidibus seek to awaken more people to the Echo with clearer visions of the Final Days?"
226,"TEXT_VOICEMAN_05300_002120_WARRIOROFLIGHTAVATARS","In the name...of the Light...I shall vanquish...the Darkness..."
227,"TEXT_VOICEMAN_05300_002130_WARRIOROFLIGHTAVATARS","I shall deliver the world from its doom!"
228,"TEXT_VOICEMAN_05300_002140_THANCRED","No subtitles. Report if displayed."
229,"TEXT_VOICEMAN_05300_002150_THANCRED","And who might you be!?"
230,"TEXT_VOICEMAN_05300_002160_ALISAIE","Whoever they are, they've come for our heads!"
231,"TEXT_VOICEMAN_05300_002170_ALISAIE","No you don't!"
232,"TEXT_VOICEMAN_05300_002180_ALISAIE","No subtitles. Report if displayed."
233,"TEXT_VOICEMAN_05300_002190_YSHTOLA","They are not of flesh and blood."
234,"TEXT_VOICEMAN_05300_002200_URIANGER","I know this magick."
235,"TEXT_VOICEMAN_05300_002210_URIANGER","The rings are like unto those that the Exarch did employ in our summoning."
236,"TEXT_VOICEMAN_05300_002220_THANCRED","No subtitles. Report if displayed."
237,"TEXT_VOICEMAN_05300_002230_THANCRED","Are you saying the Exarch is summoning them?"
238,"TEXT_VOICEMAN_05300_002240_URIANGER","Nay. Yet the similarity can be no mere coincidence..."
239,"TEXT_VOICEMAN_05300_002250_RYNE","No subtitles. Report if displayed."
240,"TEXT_VOICEMAN_05300_002260_RYNE","Should we make a stand here? Or retreat to the Crystarium?"
241,"TEXT_VOICEMAN_05300_002270_YSHTOLA","The aether churns around us. More of them will appear ere long."
242,"TEXT_VOICEMAN_05300_002280_YSHTOLA","To stay would only place innocents in harm's way. We must fight this battle elsewhere."
243,"TEXT_VOICEMAN_05300_002290_CHAINUZZ","Wait!"
244,"TEXT_VOICEMAN_05300_002300_CHAINUZZ","Take one of our airships! You can decide what to do on your flight to the Crystarium!"
245,"TEXT_VOICEMAN_05300_002310_YSHTOLA","You are a capable leader in your own right, Master Chai. The citizens of Eulmore chose well."
246,"TEXT_VOICEMAN_05300_002320_ALPHINAUD","It's settled, then. To the airship!"
247,"TEXT_VOICEMAN_05300_002330_RYNE","I think that's the last of them..."
248,"TEXT_VOICEMAN_05300_002340_THANCRED","Apparently, even they have limits. Nevertheless, we should remain vigilant."
249,"TEXT_VOICEMAN_05300_002350_ALISAIE","Urianger, something occurred to me while we were fighting. These enemies..."
250,"TEXT_VOICEMAN_05300_002360_URIANGER","...Are heroes hailing from other shards, summoned hither to deliver this world from its doom."
251,"TEXT_VOICEMAN_05300_002370_URIANGER","Scant moments after the starshower did they appear─as yet more souls were inspired to walk the hero's path, no doubt."
252,"TEXT_VOICEMAN_05300_002380_URIANGER","Thus did hopes for salvation of realms near and far resonate and converge...lending still greater strength unto our adversary."
253,"TEXT_VOICEMAN_05300_002390_ALISAIE","So that's Elidibus's game. But first things first: if the rings are the same as the Exarch's, then we need to ask him how that's possible."
254,"TEXT_VOICEMAN_05300_002400_ALPHINAUD","The Crystarium is close. Let us press on."
255,"TEXT_VOICEMAN_05300_002410_YSHTOLA","They come!"
256,"TEXT_VOICEMAN_05300_002420_THANCRED","So near and yet so far."
257,"TEXT_VOICEMAN_05300_002430_RYNE","“In the chaos of conflict, one can always find an opening to exploit.”"
258,"TEXT_VOICEMAN_05300_002440_THANCRED","No subtitles. Report if displayed."
259,"TEXT_VOICEMAN_05300_002450_THANCRED","Whoever taught you that is a wise man indeed. And good with a gunblade. But yes, I daresay we can create an opening wide enough for at least one of us to slip through."
260,"TEXT_VOICEMAN_05300_002460_THANCRED","That being you, of course─though others are welcome to follow in your wake. Ryne and I will keep our guests occupied."
261,"TEXT_VOICEMAN_05300_002470_YSHTOLA","Brave and selfless as ever. Yet the two of you may struggle to fool our foes, aetherically sensitive as they are."
262,"TEXT_VOICEMAN_05300_002480_YSHTOLA","Had you a comrade who could use destructive magicks to wreak havoc upon the ambient aether, on the other hand..."
263,"TEXT_VOICEMAN_05300_002490_URIANGER","No subtitles. Report if displayed."
264,"TEXT_VOICEMAN_05300_002500_URIANGER","Very well, I too shall assist in the diversionary effort."
265,"TEXT_VOICEMAN_05300_002510_ALISAIE","Oh, not this old dance again... Yes. Obviously, I'll stay and fight."
266,"TEXT_VOICEMAN_05300_002520_ALISAIE","Alphinaud! I'm about to do a great many stupid and reckless things. Watch my back, would you?"
267,"TEXT_VOICEMAN_05300_002530_ALPHINAUD","And there you have it. Take care of yourself, my friend."
268,"TEXT_VOICEMAN_05300_Q5_000_001_NONE_VOICE","What will you say?"
269,"TEXT_VOICEMAN_05300_A5_000_001_NONE_VOICE","Make it a nice big opening, eh!?"
270,"TEXT_VOICEMAN_05300_A5_000_002_NONE_VOICE","You don't have enough lives for this..."
271,"TEXT_VOICEMAN_05300_A5_000_003_NONE_VOICE","Use your magic sparingly, do you hear?"
272,"TEXT_VOICEMAN_05300_002540_RYNE","We'll do our best!"
273,"TEXT_VOICEMAN_05300_002550_YSHTOLA","Rest assured I have no intention of expending any of mine this day."
274,"TEXT_VOICEMAN_05300_002560_ALPHINAUD","I shall not overexert myself without good reason. As for the others..."
275,"TEXT_VOICEMAN_05300_002570_ALISAIE","Finished? Then let's begin!"
276,"TEXT_VOICEMAN_05300_002580_ALISAIE","No subtitles. Report if displayed."
277,"TEXT_VOICEMAN_05300_002590_SYSTEM_NONE_VOICE","A short while earlier, in the Ocular..."
278,"TEXT_VOICEMAN_05300_002600_MYSTERYVOICE","...'Tis done."
279,"TEXT_VOICEMAN_05300_002610_BEQLUGG","Let me see! Let me see!"
280,"TEXT_VOICEMAN_05300_002620_BEQLUGG","Yes! Your memories are preserved safely within! We've done it! We've done it at last!"
281,"TEXT_VOICEMAN_05300_002630_MYSTERYVOICE","No subtitles. Report if displayed."
282,"TEXT_VOICEMAN_05300_002640_MYSTERYVOICE","I have inspected the other vessels. They are all ready to receive of our friends' memories."
283,"TEXT_VOICEMAN_05300_002650_BEQLUGG","Excellent, excellent!"
284,"TEXT_VOICEMAN_05300_002660_BEQLUGG","I shall have my familiars bear word to them at once!"
285,"TEXT_VOICEMAN_05300_002670_MYSTERYVOICE","Elidibus..."
286,"TEXT_VOICEMAN_05300_002680_ELIDIBUS","It was not until I observed the battle between Emet-Selch and the Warrior of Darkness that I realized what I must do."
287,"TEXT_VOICEMAN_05300_002690_ELIDIBUS","I will summon heroes from other worlds unto the First, just as you did."
288,"TEXT_VOICEMAN_05300_002700_ELIDIBUS","Their presence shall serve to empower me─granting me the strength to crush my enemy."
289,"TEXT_VOICEMAN_05300_002710_MYSTERYVOICE","Though it pains me to disappoint you, I feel compelled to explain that the magick in question requires no small amount of preparation."
290,"TEXT_VOICEMAN_05300_002720_ELIDIBUS","Ah, but you assume I require my champions to be summoned in their entirety. I do not. Their souls needn't even be whole."
291,"TEXT_VOICEMAN_05300_002730_ELIDIBUS","My purpose requires no more than their burning desire to vanquish evil."
292,"TEXT_VOICEMAN_05300_002740_ELIDIBUS","This I shall sear upon the aether, raising thereby an army of phantom heroes, to whom I shall whisper, as I have to so many over the ages..."
293,"TEXT_VOICEMAN_05300_002750_ELIDIBUS","“Here lies darkness. It must be destroyed.”"
294,"TEXT_VOICEMAN_05300_002760_MYSTERYVOICE","And you expect me to cooperate?"
295,"TEXT_VOICEMAN_05300_002770_ELIDIBUS","I do not require your cooperation. Your death will suffice. The magick, I shall have from your corpse."
296,"TEXT_VOICEMAN_05300_002780_BEQLUGG","Go, Lugus!"
297,"TEXT_VOICEMAN_05300_002790_BEQLUGG","We must flee!"
298,"TEXT_VOICEMAN_05300_002800_BEQLUGG","No subtitles. Report if displayed."
299,"TEXT_VOICEMAN_05300_002810_ELIDIBUS","...But what is this?"
300,"TEXT_VOICEMAN_05300_002820_MYSTERYVOICE","(-???-)Argh... Unnngh..."
301,"TEXT_VOICEMAN_05300_002830_MYSTERYVOICE","My friend... How did you...?"
302,"TEXT_VOICEMAN_05300_002840_MYSTERYVOICE","No matter... Elidibus... He took us unawares..."
303,"TEXT_VOICEMAN_05300_002850_MYSTERYVOICE","No subtitles. Report if displayed."
304,"TEXT_VOICEMAN_05300_002860_BEQLUGG","It was all we could do...to raise a ward to hinder his steps... And so we fled..."
305,"TEXT_VOICEMAN_05300_002870_BEQLUGG","But he took it... The vessel with the Exarch's memories..."
306,"TEXT_VOICEMAN_05300_002880_BEQLUGG","Forgive me... Forgive me..."
307,"TEXT_VOICEMAN_05300_002890_MYSTERYVOICE","The vessel bears not only my memories, but my blood─the blood of Allagan royalty...granting him the means to control the tower."
308,"TEXT_VOICEMAN_05300_002900_MYSTERYVOICE","With it, he has performed I know not how many summonings, calling forth heroes from across the rift."
309,"TEXT_VOICEMAN_05300_002910_MYSTERYVOICE","And as you can see, the burden upon the tower is beginning to tell..."
310,"TEXT_VOICEMAN_05300_Q6_000_001_NONE_VOICE","What will you say?"
311,"TEXT_VOICEMAN_05300_A6_000_001_NONE_VOICE","Leave him to me."
312,"TEXT_VOICEMAN_05300_A6_000_002_NONE_VOICE","I'm just glad you're alive. Make sure you stay that way."
313,"TEXT_VOICEMAN_05300_002920_MYSTERYVOICE","No. I won't let you go alone. Not this time."
314,"TEXT_VOICEMAN_05300_002930_MYSTERYVOICE","If you mean to face him alone, I will not allow it. Not this time."
315,"TEXT_VOICEMAN_05300_002940_MYSTERYVOICE","No subtitles. Report if displayed."
316,"TEXT_VOICEMAN_05300_002950_MYSTERYVOICE","Elidibus has exploited the people's nobility. Twisted their purest intentions for terrible ends."
317,"TEXT_VOICEMAN_05300_002960_MYSTERYVOICE","And I cannot let it stand. As Exarch, it is my duty to protect them. To defend their hopes and dreams."
318,"TEXT_VOICEMAN_05300_002970_MYSTERYVOICE","So I'm going to the Crystal Tower, with or without your blessing─though I would rather it were with."
319,"TEXT_VOICEMAN_05300_002980_MYSTERYVOICE","Thank you."
320,"TEXT_VOICEMAN_05300_002990_BEQLUGG","I'd join you...but I would only be a burden. Better that I remain here with my gremlins..."
321,"TEXT_VOICEMAN_05300_003000_MYSTERYVOICE","I shall send help. Stay strong, my friend, and take heart."
322,"TEXT_VOICEMAN_05300_003010_MYSTERYVOICE","By binding Elidibus within the tower, we have done more than simply delay him."
323,"TEXT_VOICEMAN_05300_003020_MYSTERYVOICE","Much like our adversary, I am not wont to show my hand prematurely. But the time has come to bring my strongest card to bear."
324,"TEXT_VOICEMAN_05300_003030_MYSTERYVOICE","To the tower!"
325,"TEXT_VOICEMAN_05300_003040_MYSTERYVOICE","Not here either. We must keep climbing."
326,"TEXT_VOICEMAN_05300_003050_MYSTERYVOICE","No subtitles. Report if displayed."
327,"TEXT_VOICEMAN_05300_003060_MYSTERYVOICE","No subtitles. Report if displayed."
328,"TEXT_VOICEMAN_05300_003070_MYSTERYVOICE","'Twas but a matter of time..."
329,"TEXT_VOICEMAN_05300_003080_MYSTERYVOICE","I cannot keep up with you. Nor will it avail us to make a stand here."
330,"TEXT_VOICEMAN_05300_003090_MYSTERYVOICE","You must go on without me. Find Elidibus, and stop him."
331,"TEXT_VOICEMAN_05300_003100_MYSTERYVOICE","Worry not, my friend."
332,"TEXT_VOICEMAN_05300_003110_MYSTERYVOICE","Though I am no warrior, I have learned to hold my own over the years."
333,"TEXT_VOICEMAN_05300_003120_MYSTERYVOICE","When first we explored this tower, you and your fellow adventurers formed the van, while I was left to follow in your wake."
334,"TEXT_VOICEMAN_05300_003130_MYSTERYVOICE","Suffice it to say, I was not best pleased with the arrangement. How I wished that I could join you..."
335,"TEXT_VOICEMAN_05300_003140_MYSTERYVOICE","And now I have, here where it all began."
336,"TEXT_VOICEMAN_05300_003150_MYSTERYVOICE","I was right to trust in you and the power of your legacy─of your name. To let them guide my every deed."
337,"TEXT_VOICEMAN_05300_003160_ELIDIBUS","For Elidibus is my name. And my mission. Guiding my every deed."
338,"TEXT_VOICEMAN_05300_Q7_000_001_NONE_VOICE","What will you say?"
339,"TEXT_VOICEMAN_05300_A7_000_001_NONE_VOICE","Why me?"
340,"TEXT_VOICEMAN_05300_A7_000_002_NONE_VOICE","Did you never consider other paths?"
341,"TEXT_VOICEMAN_05300_003170_MYSTERYVOICE","Why you? Why <Emphasis>not</Emphasis> you? Had I chosen another, we would never have made it this far. Or do I mistake your meaning...?"
342,"TEXT_VOICEMAN_05300_003180_MYSTERYVOICE","I did─but I chose not to walk them, thank the gods. Why ever would you ask me such a thing?"
343,"TEXT_VOICEMAN_05300_003190_MYSTERYVOICE","...Elidibus spoke in similar terms, you say? How curious."
344,"TEXT_VOICEMAN_05300_003200_MYSTERYVOICE","To answer your question, then, I made my choice for reasons which seemed obvious to me, but may not to any other."
345,"TEXT_VOICEMAN_05300_003210_MYSTERYVOICE","There were the expectations I placed upon myself before beginning my slumber. And the expectations of those who roused me."
346,"TEXT_VOICEMAN_05300_003220_MYSTERYVOICE","Of course, I had the choice to turn my back on the lot of it. But in the end, it was no choice at all."
347,"TEXT_VOICEMAN_05300_003230_MYSTERYVOICE","I cherish the time I spent with you and the others. What I wouldn't give to return to those halcyon days..."
348,"TEXT_VOICEMAN_05300_003240_MYSTERYVOICE","Chasing ancient secrets, overcoming trial after trial with the aid of like-minded comrades..."
349,"TEXT_VOICEMAN_05300_003250_MYSTERYVOICE","And what remarkable comrades they were. In such company, I felt as if I were a character in the epic tales that had stirred my heart as a boy. As if my dream had come true..."
350,"TEXT_VOICEMAN_05300_003260_MYSTERYVOICE","It hadn't, of course, for I was no hero. Neither then nor after. Though the world to which I awakened, and the First were beset with myriad problems, I rarely knew how best to play my part."
351,"TEXT_VOICEMAN_05300_003270_MYSTERYVOICE","There was, however, one thing of which I was certain: that I could not bear to let those dear to me meet a tragic end."
352,"TEXT_VOICEMAN_05300_003280_MYSTERYVOICE","I'm afraid our time is up. Go."
353,"TEXT_VOICEMAN_05300_003290_MYSTERYVOICE","Rest assured you haven't seen the last of me. I wouldn't dream of playing my trump card save in your presence."
354,"TEXT_VOICEMAN_05300_003300_MYSTERYVOICE","Break!"
355,"TEXT_VOICEMAN_05300_003310_ELIDIBUS","Memories of a possible future..."
356,"TEXT_VOICEMAN_05300_003320_ELIDIBUS","Worthless, all. Worthless as memories of the only past. Fated to fray and fade into oblivion."
357,"TEXT_VOICEMAN_05300_003330_ELIDIBUS","Leaving naught but a gaping void..."
358,"TEXT_VOICEMAN_05300_003340_ELIDIBUS","The Waking...Sands? ...Yes, that was the place. The place I first made myself known to you and yours."
359,"TEXT_VOICEMAN_05300_003350_ELIDIBUS","The seventh Rejoining had left the realm listing dangerously towards Darkness. And events were unfolding that threatened to push it over the brink."
360,"TEXT_VOICEMAN_05300_003360_ELIDIBUS","Thus did I approach you, in my capacity as Emissary, thinking that you would make a useful pawn..."
361,"TEXT_VOICEMAN_05300_003370_ELIDIBUS","But I was wrong, and for my misstep did Lahabrea and Emet-Selch pay the ultimate price. Leaving me the last of the unsundered."
362,"TEXT_VOICEMAN_05300_003380_ELIDIBUS","My remaining brethren, fragmented as they are, cannot hope to see our mission to its end. It falls to me alone."
363,"TEXT_VOICEMAN_05300_003390_ELIDIBUS","Defeat is not an option. I will strike you down. I will resurrect Lord Zodiark. And I will bring back those who sacrificed themselves to call Him forth."
364,"TEXT_VOICEMAN_05300_003400_ELIDIBUS","Though it take a thousand thousand years, upon my honor as Elidibus, Emissary of the Convocation of Fourteen, I will see this done."
365,"TEXT_VOICEMAN_05300_003410_HYTHLODAEUS","<UIForeground>F20223</UIForeground>But know that his devotion is not without reason. Even if he himself can no longer remember what that reason is.<UIForeground>01</UIForeground>"
366,"TEXT_VOICEMAN_05300_003420_LAHABREA","(-Convocation Speaker-)<UIForeground>F20223</UIForeground>You worry too much, Elidibus. This dedication to your duty verges on obsession.<UIForeground>01</UIForeground>"
367,"TEXT_VOICEMAN_05300_003430_MYSTERYVOICE",""
368,"TEXT_VOICEMAN_05300_Q8_000_001_NONE_VOICE","What will you say?"
369,"TEXT_VOICEMAN_05300_A8_000_001_NONE_VOICE","Those who once relied upon you are no more."
370,"TEXT_VOICEMAN_05300_A8_000_002_NONE_VOICE","However hard you struggle, you will never bring back the Convocation."
371,"TEXT_VOICEMAN_05300_003440_ELIDIBUS","What of it!? I have my mission!"
372,"TEXT_VOICEMAN_05300_003450_ELIDIBUS","I am Elidibus! And it is my duty to steer mankind and the very star upon their true course. This I swore to...to someone."
373,"TEXT_VOICEMAN_05300_003460_ELIDIBUS","We spoke, and I swore...what? What did I...?"
374,"TEXT_VOICEMAN_05300_003470_ELIDIBUS","No subtitles. Report if displayed."
375,"TEXT_VOICEMAN_05300_003480_ELIDIBUS","This pain, this torment...is nothing! No more than must be suffered to deliver the world from its doom! No more than any of you malformed creatures have known!"
376,"TEXT_VOICEMAN_05300_003490_ELIDIBUS","Even should you lose all that is dear to you. Even should it cost you your life..."
377,"TEXT_VOICEMAN_05300_003500_DUMMYARDBERT","Even should you lose all that is dear to you. Even should it cost you your life..."
378,"TEXT_VOICEMAN_05300_003510_ELIDIBUS","You bear the burden and fight on, kicking and screaming until your last breath is spent!"
379,"TEXT_VOICEMAN_05300_003520_DUMMYARDBERT","You bear the burden and fight on, kicking and screaming until your last breath is spent!"
380,"TEXT_VOICEMAN_05300_003530_WARRIOROFDARKNESS","(-Voice from Within-)Aye, it's true. We've lost much and more. Known unimaginable suffering."
381,"TEXT_VOICEMAN_05300_003540_WARRIOROFDARKNESS","(-Voice from Within-)But through it all, we never, ever forgot what was dear to us. And that's what gave us the strength to carry on."
382,"TEXT_VOICEMAN_05300_Q9_000_001_NONE_VOICE","Elidibus..."
383,"TEXT_VOICEMAN_05300_A9_000_001_NONE_VOICE","You've no fight left to fight."
384,"TEXT_VOICEMAN_05300_A9_000_002_NONE_VOICE","I will put an end to this."
385,"TEXT_VOICEMAN_05300_003550_ELIDIBUS","No! NO! It will not end here!"
386,"TEXT_VOICEMAN_05300_003560_ELIDIBUS","Champions from beyond the rift, heed my call! The time is come to deliver your brethren from darkness!"
387,"TEXT_VOICEMAN_05300_003570_ELIDIBUS","My heart's sole desire is a world free of sorrow. Join with me now in hope and prayer...for the salvation of all!"
388,"TEXT_VOICEMAN_05300_003580_ELIDIBUS","(-Elidibus-)If you would usher in the end, then with my all shall I oppose you..."
389,"TEXT_VOICEMAN_05300_003590_ELIDIBUS","(-Elidibus-)...As the avatar of those mortal heroes who fought unfalteringly, in all their imperfection! As the Warrior of Light incarnate!"
390,"TEXT_VOICEMAN_05300_003600_ELIDIBUS","Come, Warrior of Darkness! Let us finish this!"
391,"TEXT_VOICEMAN_05300_003610_ELIDIBUS","No subtitles. Report if displayed."
392,"TEXT_VOICEMAN_05300_003620_EMETSELCH","<UIForeground>F20223</UIForeground>Herein I commit the chronicle of the traveler. Shepherd to the stars in the dark.<UIForeground>01</UIForeground>"
393,"TEXT_VOICEMAN_05300_003630_EMETSELCH","<UIForeground>F20223</UIForeground>Though the world be sundered and our souls set adrift, where you walk, my dearest friend, fate shall surely follow.<UIForeground>01</UIForeground>"
394,"TEXT_VOICEMAN_05300_003640_EMETSELCH","<UIForeground>F20223</UIForeground>For yours is the Fourteenth seat─the seat of Azem.<UIForeground>01</UIForeground>"
395,"TEXT_VOICEMAN_05300_003650_ELIDIBUS","An invocation of eld...though not of Hydaelyn's making... What are you?"
396,"TEXT_VOICEMAN_05300_003660_ELIDIBUS","No─it matters not! You are the enemy, and you will fall! Even should it cost me everything, I will not forsake my duty!"
397,"TEXT_VOICEMAN_05300_003670_ELIDIBUS","Fool! You have achieved nothing! I am immortal, and I will never surrender!"
398,"TEXT_VOICEMAN_05300_003680_ELIDIBUS","No subtitles. Report if displayed."
399,"TEXT_VOICEMAN_05300_003690_MYSTERYVOICE","Elidibus. So fixated were you on my memories of the future, you failed to heed the lessons of the past."
400,"TEXT_VOICEMAN_05300_003700_MYSTERYVOICE","Your obsession blinded you to the true nature of this tower─this beacon of hope for mankind."
