key,0,1
401,"TEXT_VOICEMAN_05300_003710_MYSTERYVOICE","Created to serve as a reservoir for the limitless energy of the heavens! To harness and bind the boundless─not unlike white auracite!"
402,"TEXT_VOICEMAN_05300_003720_MYSTERYVOICE","Your ill-begotten power, obtained by exploiting that which is best in us... I shall have it, your soul and all!"
403,"TEXT_VOICEMAN_05300_003730_ELIDIBUS","No subtitles. Report if displayed."
404,"TEXT_VOICEMAN_05300_003740_ELIDIBUS","This..."
405,"TEXT_VOICEMAN_05300_003750_ELIDIBUS","Yes... I would become Him. I would save everyone. This I believed. Yet still they cried out, in rage and despair..."
406,"TEXT_VOICEMAN_05300_003760_ELIDIBUS","Divided─over the fate of the star. A rare occurrence, always fleeting. But not this time. Not this time..."
407,"TEXT_VOICEMAN_05300_003770_ELIDIBUS","Reconciliation. Elidibus. I was needed. I withdrew myself from Zodiark. For them..."
408,"TEXT_VOICEMAN_05300_003780_ELIDIBUS","My people. My brothers. ...My friends."
409,"TEXT_VOICEMAN_05300_003790_ELIDIBUS","Stay strong. Keep the faith. At duty's end, we will meet again. We will. We will."
410,"TEXT_VOICEMAN_05300_003800_ELIDIBUS","The rains have ceased, and we have been graced with another beautiful day. But you are not here to see it."
411,"TEXT_VOICEMAN_05300_003810_MYSTERYVOICE","I concede, I may have overexerted myself."
412,"TEXT_VOICEMAN_05300_003820_MYSTERYVOICE","Steady now, and listen. I told you before that I had a plan, and that when all was said and done, I would ask a favor of you."
413,"TEXT_VOICEMAN_05300_003830_MYSTERYVOICE","We have averted the Eighth Umbral Calamity. Found a way for everyone to return to the Source, and...last but not least, we have secured the future of all the people of Norvrandt. We have won, my friend."
414,"TEXT_VOICEMAN_05300_003840_MYSTERYVOICE","So I hope you'll forgive me this moment of selfishness. And...while I wouldn't want you to feel obliged..."
415,"TEXT_VOICEMAN_05300_003850_MYSTERYVOICE","Promise me you'll take me on your next adventure. A journey. Together. That's all I ask."
416,"TEXT_VOICEMAN_05300_Q10_000_001_NONE_VOICE","What will you say?"
417,"TEXT_VOICEMAN_05300_A10_000_001_NONE_VOICE","I promise."
418,"TEXT_VOICEMAN_05300_A10_000_002_NONE_VOICE","You could've asked me earlier!"
419,"TEXT_VOICEMAN_05300_003860_MYSTERYVOICE","No subtitles. Report if displayed."
420,"TEXT_VOICEMAN_05300_003870_MYSTERYVOICE","If I were to tell you that this isn't the end─that we will meet again─would you believe me?"
421,"TEXT_VOICEMAN_05300_003880_MYSTERYVOICE","Thank you."
422,"TEXT_VOICEMAN_05300_003890_MYSTERYVOICE","My friend. With you, my mind and memories shall travel to the ends of the world and beyond. But in this place shall my body stand immovable."
423,"TEXT_VOICEMAN_05300_003900_MYSTERYVOICE","May it serve as an undying promise, not only to those who looked to me for leadership, but to any soul who has known despair, that hope is everlasting."
424,"TEXT_VOICEMAN_05300_003910_RYNE","There the Exarch would remain, keeping his silent vigil."
425,"TEXT_VOICEMAN_05300_003920_RYNE","When the Scions were not released from his summoning spell, we proceeded with the plan to return them to the Source."
426,"TEXT_VOICEMAN_05300_003930_RYNE","The Warrior of Darkness, however, retained <If(PlayerParameter(4))>her<Else/>his</If> ability to traverse the two worlds at will."
427,"TEXT_VOICEMAN_05300_003940_RYNE","And in time the Crystal Tower became a symbol of his link to the First─and of hope."
428,"TEXT_VOICEMAN_05300_003950_RYNE","And in time the Crystal Tower became a symbol of her link to the First─and of hope."
429,"TEXT_VOICEMAN_05300_003960_DULIACHAI","Oh... Oh, Alphinaud..."
430,"TEXT_VOICEMAN_05300_003970_ALPHINAUD","Please, Lady Chai, dry your eyes!"
431,"TEXT_VOICEMAN_05300_003980_DULIACHAI","The thought of never seeing you again... It's more than my poor heart can bear!"
432,"TEXT_VOICEMAN_05300_003990_DULIACHAI","No subtitles. Report if displayed."
433,"TEXT_VOICEMAN_05300_004000_CHAINUZZ","Oh, it's you. As you can see, Alphinaud has broken the news."
434,"TEXT_VOICEMAN_05300_004010_CHAINUZZ","I don't know how to console her. She thinks we'll be lost without him."
435,"TEXT_VOICEMAN_05300_Q11_000_001_NONE_VOICE","What will you say?"
436,"TEXT_VOICEMAN_05300_A11_000_001_NONE_VOICE","You're certainly well loved."
437,"TEXT_VOICEMAN_05300_A11_000_002_NONE_VOICE","Make sure you leave nothing unsaid."
438,"TEXT_VOICEMAN_05300_A11_000_003_NONE_VOICE","A picture paints a thousand words!"
439,"TEXT_VOICEMAN_05300_004020_ALPHINAUD","'Tis more than I deserve. Yet I am truly grateful, and will see that she knows as much."
440,"TEXT_VOICEMAN_05300_004030_ALPHINAUD","Indeed, my friend. Nothing unsaid."
441,"TEXT_VOICEMAN_05300_004040_ALPHINAUD","You'll never let me forget it, will you. I'll have you know I completed the promised painting in the end. Be that as it may, there are times only words will suffice."
442,"TEXT_VOICEMAN_05300_004050_ALPHINAUD","Lady Chai, I have a confession to make."
443,"TEXT_VOICEMAN_05300_004060_ALPHINAUD","On the day we ousted Lord Vauthry, when I revealed the truth of his tyranny and your complicity in his crimes, I did so with great trepidation. Not out of fear that you wouldn't listen, but that you might never recover."
444,"TEXT_VOICEMAN_05300_004070_ALPHINAUD","There was a time when I too, in my hubris, believed myself worthy to lord it over others. And when the lie was laid bare─when I was forced to confront the cost, the lives lost─it all but destroyed me."
445,"TEXT_VOICEMAN_05300_004080_ALPHINAUD","To awaken from a naive dream to so harsh a reality... I would have understood had you all surrendered to despair."
446,"TEXT_VOICEMAN_05300_004090_ALPHINAUD","But you didn't surrender. Far from it. You picked yourselves up and rose to the challenge."
447,"TEXT_VOICEMAN_05300_004100_ALPHINAUD","You found a path forward and the strength to walk it─and to keep walking it─day after day."
448,"TEXT_VOICEMAN_05300_004110_ALPHINAUD","But what struck me is how much faster you found it than I did."
449,"TEXT_VOICEMAN_05300_004120_CHAINUZZ","...Really? It felt pretty slow to me! But rest assured, we'll make Eulmore into a nation anyone would be proud to call home...eventually."
450,"TEXT_VOICEMAN_05300_004130_CHAINUZZ","You can still come and go as you please, I believe? When we have good tidings to report, I may trouble you to be their bearer."
451,"TEXT_VOICEMAN_05300_004140_CHAINUZZ","There may also be less-than-good tidings...in which event, I hope I can trouble you for your counsel."
452,"TEXT_VOICEMAN_05300_004150_ALPHINAUD","I should be honored to provide it, Master Chai."
453,"TEXT_VOICEMAN_05300_004160_DULIACHAI","Oh, Alphinaud... I know you aren't one to sit still, but do remember to take your ease from time to time."
454,"TEXT_VOICEMAN_05300_004170_DULIACHAI","And no matter where you are, remember that there are people here who are praying for your health and happiness."
455,"TEXT_VOICEMAN_05300_004180_DULIACHAI","Our brave and gentle artist. You have our love, now and always."
456,"TEXT_VOICEMAN_05300_004190_ALPHINAUD","And you mine. Please take care."
457,"TEXT_VOICEMAN_05300_004200_SETO","Is that...Ardbert's crystal?"
458,"TEXT_VOICEMAN_05300_004210_SETO","So it is. It has changed...but I would know it anywhere. However did you come by it?"
459,"TEXT_VOICEMAN_05300_004220_SETO","...Then even in death, his enemies found a way to profit from his sacrifice. It grieves me to think of his body being used for evil ends..."
460,"TEXT_VOICEMAN_05300_004230_SETO","But thanks to you, his honor is restored, and he may finally find peace."
461,"TEXT_VOICEMAN_05300_004240_SETO","No words can express my gratitude. I will keep this crystal safe to the end of my days."
462,"TEXT_VOICEMAN_05300_004250_SETO","Rest easy, my friend. You have earned it."
463,"TEXT_VOICEMAN_05300_Q12_000_001_NONE_VOICE","What will you say?"
464,"TEXT_VOICEMAN_05300_A12_000_001_NONE_VOICE","Tell me, does anything strike you as different about my soul?"
465,"TEXT_VOICEMAN_05300_A12_000_002_NONE_VOICE","Close your eyes."
466,"TEXT_VOICEMAN_05300_004260_SETO","Your soul? Hm..."
467,"TEXT_VOICEMAN_05300_004270_SETO","Pardon? ...Hm! Very well."
468,"TEXT_VOICEMAN_05300_004280_SETO","How can this be?"
469,"TEXT_VOICEMAN_05300_004290_WARRIOROFDARKNESS","Seto, my old friend. You've grown!"
470,"TEXT_VOICEMAN_05300_004300_SETO","Oh! Oh, Ardbert! How I've missed you!"
471,"TEXT_VOICEMAN_05300_004310_SETO","I'm sorry I couldn't keep you safe... Or even console you."
472,"TEXT_VOICEMAN_05300_004320_SETO","Had I only learned to speak sooner, I would have told you how much you meant to me. How much I cared."
473,"TEXT_VOICEMAN_05300_004330_WARRIOROFDARKNESS","I knew. I always knew."
474,"TEXT_VOICEMAN_05300_004340_WARRIOROFDARKNESS","But I'm happy to hear it nonetheless. Thank you, Seto. My partner in crime."
475,"TEXT_VOICEMAN_05300_004350_SETO","I see... His journey continues."
476,"TEXT_VOICEMAN_05300_004360_SETO","Then I will not yet bid him rest. With you, he may look forward to many more adventures."
477,"TEXT_VOICEMAN_05300_004370_SETO","It has been a while since last I flew. Perhaps I too will go on a little adventure. Ride the winds, seek the horizon... Yes. I think perhaps I will."
478,"TEXT_VOICEMAN_05300_004380_RUNAR","Master Matoya!"
479,"TEXT_VOICEMAN_05300_004390_RUNAR","For too long, I have remained silent. But no longer. I could not bear it if you were to leave. Please stay! I beg of you!"
480,"TEXT_VOICEMAN_05300_004400_YSHTOLA","Runar... Please..."
481,"TEXT_VOICEMAN_05300_004410_RUNAR","...I jest. At least in part. Ahem. What I came to say is this..."
482,"TEXT_VOICEMAN_05300_004420_RUNAR","Thank you. Without your wisdom, your strength, and your kindness to guide us, our people would still be lost."
483,"TEXT_VOICEMAN_05300_004430_RUNAR","We will never forget you, Master Matoya. Wherever your journeys may take you, you will always be in our hearts."
484,"TEXT_VOICEMAN_05300_004435_YSHTOLA","No subtitles. Report if displayed."
485,"TEXT_VOICEMAN_05300_004440_YSHTOLA","And you in mine."
486,"TEXT_VOICEMAN_05300_004450_YSHTOLA","Remember that your people's journey─that <Emphasis>our</Emphasis> people's journey is yet ongoing. Your lives will change, and so too will your dreams. Yet come what may, you need not forsake your time-honored traditions, nor less your beliefs."
487,"TEXT_VOICEMAN_05300_004460_YSHTOLA","But neither should you be beholden to them. For it was with curiosity and courage that the Night's Blessed first triumphed over adversity. New knowledge and new wisdom are ever worthy of pursuit."
488,"TEXT_VOICEMAN_05300_004470_RUNAR","Indeed they are. And so, until we return to the sunless sea, we shall endeavor to live our lives to the fullest."
489,"TEXT_VOICEMAN_05300_004480_YSHTOLA","That is well. But however great your strides, there may yet come a day when the challenges you face cannot be surmounted alone."
490,"TEXT_VOICEMAN_05300_004490_YSHTOLA","On such a day..."
491,"TEXT_VOICEMAN_05300_004500_RUNAR","On such a day?"
492,"TEXT_VOICEMAN_05300_004505_YSHTOLA","No subtitles. Report if displayed."
493,"TEXT_VOICEMAN_05300_004510_YSHTOLA","You may call on me."
494,"TEXT_VOICEMAN_05300_004520_YSHTOLA","Since a means to travel between worlds exists, you can be sure I will find a way to employ it."
495,"TEXT_VOICEMAN_05300_004530_YSHTOLA","And there remain so many mysteries here that want for solving."
496,"TEXT_VOICEMAN_05300_004540_RUNAR","Master Matoya!"
497,"TEXT_VOICEMAN_05300_004550_YSHTOLA","No subtitles. Report if displayed."
498,"TEXT_VOICEMAN_05300_004560_ALISAIE","That's everyone, then. We've all said what we needed to."
499,"TEXT_VOICEMAN_05300_004570_URIANGER","Even as we speak, Beq Lugg undertaketh their final inspection of our spirit vessels."
500,"TEXT_VOICEMAN_05300_004580_URIANGER","When thine own preparations for the journey are complete, thou art to present thyself in the Ocular."
501,"TEXT_VOICEMAN_05300_004590_RYNE","Um...everyone?"
502,"TEXT_VOICEMAN_05300_004600_RYNE","I want to thank you all. On behalf of the First."
503,"TEXT_VOICEMAN_05300_004610_RYNE","You, and Minfilia, and the Exarch."
504,"TEXT_VOICEMAN_05300_004620_RYNE","Without each and every one of you guiding us, fighting for us...we wouldn't be standing here now. There wouldn't even <Emphasis>be</Emphasis> a here. And no words can express our gratitude."
505,"TEXT_VOICEMAN_05300_004630_RYNE","We still have a lot to do, countless trials to overcome─but if it ever seems too much, I'll think of our time together."
506,"TEXT_VOICEMAN_05300_004640_RYNE","The happy moments...and the sad─I will remember it all. And it will give me the strength to carry on without you."
507,"TEXT_VOICEMAN_05300_004650_RYNE","Because you made me who I am. Minfilia. Ryne."
508,"TEXT_VOICEMAN_05300_004660_RYNE","To honor these names and these memories, I will stand with all the people of this land, and strive for a better tomorrow."
509,"TEXT_VOICEMAN_05300_004670_URIANGER","Thancred. I believe the honor of responding should rightfully be thine."
510,"TEXT_VOICEMAN_05300_004680_THANCRED","No subtitles. Report if displayed."
511,"TEXT_VOICEMAN_05300_004690_THANCRED","I know better than most how much you've grown, and I have every confidence you'll make your people proud."
512,"TEXT_VOICEMAN_05300_004700_THANCRED","Gods know, I'm proud of you. I always will be. You deserve all the happiness in the world and more."
513,"TEXT_VOICEMAN_05300_004710_RYNE","No subtitles. Report if displayed."
514,"TEXT_VOICEMAN_05300_004720_LYNA","(-???-)Might we also say a few words?"
515,"TEXT_VOICEMAN_05300_004730_ALPHINAUD","Why, this is...just about all of you!"
516,"TEXT_VOICEMAN_05300_004740_LYNA","To see you off seemed the least we could do."
517,"TEXT_VOICEMAN_05300_004750_LYNA","You risked your all for us─fought for a realm not your own. Before you came, we had never known the beauty of the night sky."
518,"TEXT_VOICEMAN_05300_004760_LYNA","Or the joy of your company."
519,"TEXT_VOICEMAN_05300_004770_LYNA","Though it saddens us deeply to bid you farewell, it has ever been our way to send off friends with a smile."
520,"TEXT_VOICEMAN_05300_004780_LYNA","Wherever your road should lead, we shall pray for your safety. And following your brave example, we shall continue to fight for the Crystarium."
521,"TEXT_VOICEMAN_05300_004790_ALISAIE","With or without us, you've always taken good care of this city. I don't doubt for a moment you'll continue to do so."
522,"TEXT_VOICEMAN_05300_004800_ALPHINAUD","Aye, a more resilient people we have never known."
523,"TEXT_VOICEMAN_05300_004810_ALPHINAUD","As resilient and enduring as the tower that watches over you."
524,"TEXT_VOICEMAN_05300_004820_LYNA","To the last, we did not question the Exarch about his past. It is only now, when he can no longer tell us, that we believe we know the answer."
525,"TEXT_VOICEMAN_05300_004830_LYNA","We have heard what became of him, and what is about to be attempted."
526,"TEXT_VOICEMAN_05300_004840_LYNA","All will be well, of this we are certain."
527,"TEXT_VOICEMAN_05300_004850_LYNA","How could it be otherwise, when every soul in the Crystarium is praying for it with all their heart?"
528,"TEXT_VOICEMAN_05300_004860_LYNA","And so, when our lord awakens, I bid you give him a message."
529,"TEXT_VOICEMAN_05300_004870_LYNA","Tell him he needn't worry about us."
530,"TEXT_VOICEMAN_05300_004880_LYNA","That he need no longer hide who he truly is. That he should live his own life to the fullest."
531,"TEXT_VOICEMAN_05300_004890_LYNA","And that if he should ever find himself reminiscing on the past with a smile, we shall be smiling with him."
532,"TEXT_VOICEMAN_05300_004900_LYNA","Will you tell him this?"
533,"TEXT_VOICEMAN_05300_Q13_000_001_NONE_VOICE","What will you say?"
534,"TEXT_VOICEMAN_05300_A13_000_001_NONE_VOICE","Word for word."
535,"TEXT_VOICEMAN_05300_A13_000_002_NONE_VOICE","I'll do my best."
536,"TEXT_VOICEMAN_05300_004910_LYNA","Thank you. Please look after him for us."
537,"TEXT_VOICEMAN_05300_004920_LYNA","I am sure you will."
538,"TEXT_VOICEMAN_05300_004930_YSHTOLA","I daresay we have all the good wishes we can carry. Let us be on our way."
539,"TEXT_VOICEMAN_05300_004940_BEQLUGG","All right, then. Pray proceed as instructed, beginning with your memories."
540,"TEXT_VOICEMAN_05300_004950_URIANGER","The first step is complete. And all appeareth to be in order."
541,"TEXT_VOICEMAN_05300_004960_ALISAIE","Well, that just leaves our souls, then."
542,"TEXT_VOICEMAN_05300_004970_ALISAIE","We're in your hands, Angelo."
543,"TEXT_VOICEMAN_05300_004980_BEQLUGG","It is done! The vessels have received of both their memories and their souls!"
544,"TEXT_VOICEMAN_05300_004990_BEQLUGG","I hereby entrust them to your care. They belong to you now. Just be sure to guard them well, yes?"
545,"TEXT_VOICEMAN_05300_005000_RYNE","This <Emphasis>will</Emphasis> work, won't it?"
546,"TEXT_VOICEMAN_05300_005010_BEQLUGG","Our theories have held thus far."
547,"TEXT_VOICEMAN_05300_005020_BEQLUGG","But I make no promises about what is to come. Even the greatest mages in history knew better than to transport a soul across the rift. We, my dear, are in unknown territory."
548,"TEXT_VOICEMAN_05300_005030_BEQLUGG","Prepare as we might, we cannot account for all possibilities, and it is in such circumstances that accidents are wont to occur..."
549,"TEXT_VOICEMAN_05300_005040_BEQLUGG","Yet miracles do happen. So let us pray, and will our friends home."
550,"TEXT_VOICEMAN_05300_005050_RYNE","I won't stop praying until I know they're safe."
551,"TEXT_VOICEMAN_05300_005060_BEQLUGG","All safely stowed away? I do hope so."
552,"TEXT_VOICEMAN_05300_005070_BEQLUGG","All that remains, then, is to step into the mirror. Go now...and safe travels."
553,"TEXT_VOICEMAN_05300_005080_ALISAIE","Did it...? Are we...?"
554,"TEXT_VOICEMAN_05300_005090_THANCRED","...We're home."
555,"TEXT_VOICEMAN_05300_005100_TATARU","Oh! Oh, you're back! You're back! You're all back!"
556,"TEXT_VOICEMAN_05300_005110_YSHTOLA","No subtitles. Report if displayed."
557,"TEXT_VOICEMAN_05300_005120_YSHTOLA","Thank you. My body feels like a sack of popotoes, but otherwise I have never felt better."
558,"TEXT_VOICEMAN_05300_005130_YSHTOLA","That said, I doubt any of us will be fit to travel for some while. May we leave the rest to you?"
559,"TEXT_VOICEMAN_05300_005140_URIANGER","The vessel beareth our comrade's blood. With it in thy possession, the way will surely open before thee."
560,"TEXT_VOICEMAN_05300_005150_TATARU","What!? But you've only just got here!"
561,"TEXT_VOICEMAN_05300_005160_ALPHINAUD","No subtitles. Report if displayed."
562,"TEXT_VOICEMAN_05300_005170_ALPHINAUD","Tataru, might I trouble you to brew us all a pot of your special tea?"
563,"TEXT_VOICEMAN_05300_005180_ALPHINAUD","Ah! And we may require an extra cup."
564,"TEXT_VOICEMAN_05300_005190_MYSTERYVOICE","Yours is a long road, my friend, and it stretches on to places beyond imagining."
565,"TEXT_VOICEMAN_05300_005200_MYSTERYVOICE","With your every step, these grand adventures shall grow more distant and faint."
566,"TEXT_VOICEMAN_05300_005210_MYSTERYVOICE","And there may come a day when you forget the faces and voices of those you have met along the way."
567,"TEXT_VOICEMAN_05300_005220_MYSTERYVOICE","On that day, I bid you remember this..."
568,"TEXT_VOICEMAN_05300_005230_MYSTERYVOICE","That no matter how far your journey may take you, you stand where you stand by virtue of the road you walked to get there."
569,"TEXT_VOICEMAN_05300_005240_MYSTERYVOICE","For in times of hardship, when you fear you cannot go on..."
570,"TEXT_VOICEMAN_05300_005250_MYSTERYVOICE","The joy you have known, the pain you have felt, the prayers you have whispered and answered─they shall ever be your strength and your comfort."
571,"TEXT_VOICEMAN_05300_005260_MYSTERYVOICE","This I hope─I believe, here at memory's end."
572,"TEXT_VOICEMAN_05300_005270_SYSTEM_NONE_VOICE","Some days later..."
573,"TEXT_VOICEMAN_05300_005280_ALISAIE","[LOW, ANNOYED SIGH]"
574,"TEXT_VOICEMAN_05300_005290_ALPHINAUD","What is it, Alisaie? Are you all right? Do you still feel under the weather?"
575,"TEXT_VOICEMAN_05300_005300_ALISAIE","Physically, I couldn't be better. Thanks to Krile's ministrations, I'm already looking forward to our next fight."
576,"TEXT_VOICEMAN_05300_005310_ALISAIE","But seriously─don't you have anything to say about <Emphasis>that</Emphasis>?"
577,"TEXT_VOICEMAN_05300_005320_YSHTOLA","No less impressive than our garments. You've outdone yourself, Tataru."
578,"TEXT_VOICEMAN_05300_005330_TATARU","To give credit where it's due, I had help from a certain fiery pixie who visited me in my dreams. They gave me all the information I needed to get the details just right."
579,"TEXT_VOICEMAN_05300_005340_TATARU","For your weapons, though, I needed a <Emphasis>lot</Emphasis> more help... Thankfully, our favorite heads of state were happy to place their finest craftsmen at my exclusive disposal."
580,"TEXT_VOICEMAN_05300_005350_TATARU","Oh, and speaking of the Alliance leaders, they all express their “unreserved elation at your safe return,” and promise to come and see you in person as soon as they can."
581,"TEXT_VOICEMAN_05300_005360_THANCRED","They really needn't have gone to such trouble─but we'll be keeping these gifts all the same. Do pass on our gratitude."
582,"TEXT_VOICEMAN_05300_005370_ALISAIE","I realize we haven't taken up new martial arts, nor have I ever been one to set much store by appearances..."
583,"TEXT_VOICEMAN_05300_005380_ALISAIE","But I can't help feeling a certain lack of...I don't know, personal development."
584,"TEXT_VOICEMAN_05300_005390_ALPHINAUD","No subtitles. Report if displayed."
585,"TEXT_VOICEMAN_05300_005400_ALPHINAUD","I quite understand. But as you observed, the others had the more pressing need. Rest assured, our turn will come."
586,"TEXT_VOICEMAN_05300_005410_KRILE","If I expend any more aether, I swear I will blink out of existence. I need a bite to eat."
587,"TEXT_VOICEMAN_05300_005420_KRILE","Tataru, a cup of tea, if you would be so kind. And something sweet."
588,"TEXT_VOICEMAN_05300_005430_URIANGER","By Mistress Krile's exhausted state, may I assume that the ward hath been restored?"
589,"TEXT_VOICEMAN_05300_005440_GRAHATIA","(-???-)Indeed. We succeeded in weaving it anew, albeit at a slightly diminished potency than when I had Beq Lugg's assistance."
590,"TEXT_VOICEMAN_05300_005450_GRAHATIA","(-???-)It is no cause for concern, though. The tower is not easily reached, never mind breached. And even should some few succeed, their presence won't escape my notice."
591,"TEXT_VOICEMAN_05300_005460_URIANGER","Excellent. Said duty thus discharged, thou art free to go wheresoever thy fancy taketh thee."
592,"TEXT_VOICEMAN_05300_005470_URIANGER","Upon which note─hast thou perchance come to a decision? The offer remaineth open."
593,"TEXT_VOICEMAN_05300_005480_GRAHATIA","(-???-)Well...if you're certain that's what you... I-I mean, if you think I..."
594,"TEXT_VOICEMAN_05300_Q14_000_001_NONE_VOICE","What will you say?"
595,"TEXT_VOICEMAN_05300_A14_000_001_NONE_VOICE","..."
596,"TEXT_VOICEMAN_05300_A14_000_002_NONE_VOICE","G'raha, really."
597,"TEXT_VOICEMAN_05300_005490_GRAHATIA","No subtitles. Report if displayed."
598,"TEXT_VOICEMAN_05300_005500_GRAHATIA","No subtitles. Report if displayed."
599,"TEXT_VOICEMAN_05300_005510_GRAHATIA","No subtitles. Report if displayed."
600,"TEXT_VOICEMAN_05300_005520_GRAHATIA","I accept. Henceforth, I shall count myself a Scion of the Seventh Dawn."
601,"TEXT_VOICEMAN_05300_005530_GRAHATIA","G'raha Tia, at your service."
602,"TEXT_VOICEMAN_05300_005540_GRAHATIA","When I was a boy, many long years ago, I yearned to stand tall as the heroes of eld."
603,"TEXT_VOICEMAN_05300_005550_UNSETTLEDRESEARCHER","Help! Somebody help!"
604,"TEXT_VOICEMAN_05300_005560_UNSETTLEDRESEARCHER","Hippogryphs! Hippogryphs on the rampage! A giant flock of 'em! Please, we need help!"
605,"TEXT_VOICEMAN_05300_005570_ALISAIE","I could do with a little rampage myself."
606,"TEXT_VOICEMAN_05300_005580_ALPHINAUD","What!? Now wait just a─"
607,"TEXT_VOICEMAN_05300_005590_ALPHINAUD","No subtitles. Report if displayed."
608,"TEXT_VOICEMAN_05300_005600_GRAHATIA","But like a fool seeking to pluck the stars from the heavens, my every attempt to reprise their deeds fell short... "
609,"TEXT_VOICEMAN_05300_005610_YSHTOLA","I will join the fray when I've finished my tea."
610,"TEXT_VOICEMAN_05300_005620_URIANGER","Thus did the avatar of destruction descend, and in her wake leave naught but tears and ash..."
611,"TEXT_VOICEMAN_05300_005630_GRAHATIA","And then, one day, an all but forgotten dream from my youth stood before me, in the flesh."
612,"TEXT_VOICEMAN_05300_005640_GRAHATIA","So it was that a new adventure began..."
613,"TEXT_VOICEMAN_05300_005650_ZENOS","No subtitles. Report if displayed."
614,"TEXT_VOICEMAN_05300_005660_ZENOS","The memory of a dying world's end, night after night... And I thought it but a tired old dream."
615,"TEXT_VOICEMAN_05300_005670_FANDANIEL","I say... I knew that securing the palace would provide Your Radiance with depressingly little sport─but that you should fall asleep out of boredom!?"
616,"TEXT_VOICEMAN_05300_005680_FANDANIEL","Splendid! Truly splendid! And my own preparations, you will be pleased to hear, proceed apace."
617,"TEXT_VOICEMAN_05300_005690_FANDANIEL","Oh yes, they proceed very well indeed. Frighteningly so. And we owe it not least of all to this singularly useful body I chanced to find."
618,"TEXT_VOICEMAN_05300_005700_FANDANIEL","With the Populares now all but destroyed, it will be the simplest of tasks to discredit their groundless assertions that I met with a grisly end."
619,"TEXT_VOICEMAN_05300_005710_FANDANIEL","And as the very-much-alive lord of House Brutus, I have a vast fortune at my disposal."
