key,0,1
620,"TEXT_VOICEMAN_05300_005720_FANDANIEL","Ahhh, money, money, money! The great motivator! There is simply no better way to move men─and expedite plans─than with its alluring glint, would you not agree?"
621,"TEXT_VOICEMAN_05300_005730_FANDANIEL","But wait...! Were we not acquainted, you and...“I”?"
622,"TEXT_VOICEMAN_05300_005740_FANDANIEL","(-White-robed Figure-)Should our familiarity cause you distress, I beg your forgiveness."
623,"TEXT_VOICEMAN_05300_005750_ZENOS","...What did you say your name was?"
624,"TEXT_VOICEMAN_05300_005760_FANDANIEL","(-White-robed Figure-)Ahhh, a dagger through my heart! That my deepest desire should forever remain unfulfilled! To live unrecognized! To die forgotten!"
625,"TEXT_VOICEMAN_05300_005770_FANDANIEL","(-White-robed Figure-)So it goes. Whatever this flesh may have been before, it serves only as a vessel now."
626,"TEXT_VOICEMAN_05300_005780_FANDANIEL","And I, faithful Fandaniel, labor only to advance my lord's ambitions."
627,"TEXT_VOICEMAN_05300_005790_FANDANIEL","Speaking of which, with the palace in our hands, we may now proceed with the next phase of the plan."
628,"TEXT_VOICEMAN_05300_005800_FANDANIEL","But how very odd... Despite all our havoc wreaking, old Elidibus did not deign to appear. Dare I hope...?"
629,"TEXT_VOICEMAN_05300_005810_FANDANIEL","That the last of the unsundered...is gone?"
630,"TEXT_VOICEMAN_05300_005820_FANDANIEL","No subtitles. Report if displayed."
631,"TEXT_VOICEMAN_05300_005830_FANDANIEL","Imagine it! Bound no more by the shackles of moldering memories─of damnable duty! Free at last to live for the moment!"
632,"TEXT_VOICEMAN_05300_005840_FANDANIEL","Your Radiance. But give the word, and I shall go forth and prepare for you your hunting ground."
633,"TEXT_VOICEMAN_05300_005850_GRAHATIA","That which awaited was a fell beast."
634,"TEXT_VOICEMAN_05300_005860_GRAHATIA","Ferocious. Ravenous. Remorseless."
635,"TEXT_VOICEMAN_05300_005870_ZENOS","...Do as you will."
636,"TEXT_VOICEMAN_05300_005880_ZENOS","It has been too, too long, my friend...and insufferably dull in your absence."
637,"TEXT_VOICEMAN_05300_005890_ZENOS","When you return to me, you will share everything. Every blow will be a story unto itself. Every triumph. Every kill."
638,"TEXT_VOICEMAN_05300_005900_ZENOS","Rest assured we shall have a fitting stage for our reunion."
639,"TEXT_VOICEMAN_05300_005910_ZENOS","Oh, yes. To reprise that transcendent moment, I will set this world ablaze. And we shall dance before the pyre."
640,"TEXT_VOICEMAN_05300_005920_GRAHATIA","The beast shall kindle the flames of the apocalypse."
641,"TEXT_VOICEMAN_05300_005930_GRAHATIA","Into its domain shall the hero set forth, for the final chapter in the tale of this star."
