key,0,1
#,,
int32,str,str
0,"TEXT_VOICEMAN_05300_000010_ELIDIBUS","No subtitles. Report if displayed."
1,"TEXT_VOICEMAN_05300_000020_ELIDIBUS","Why am I...? Was it you who called me here?"
2,"TEXT_VOICEMAN_05300_000030_LAHABREA","(-Convocation Speaker-)<UIForeground>F20223</UIForeground>On behalf of the Convocation, I bid you welcome to our order.<UIForeground>01</UIForeground>"
3,"TEXT_VOICEMAN_05300_000040_LAHABREA","(-Convocation Speaker-)<UIForeground>F20223</UIForeground>At times you will stand with us. At times you will stand against us. All that you might steer mankind and the very star upon their true course.<UIForeground>01</UIForeground>"
4,"TEXT_VOICEMAN_05300_000050_LAHABREA","(-Convocation Speaker-)<UIForeground>F20223</UIForeground>For yours is the seat of Elidibus, the Emissary, and by this name shall your every action be guided.<UIForeground>01</UIForeground>"
5,"TEXT_VOICEMAN_05300_000060_ELIDIBUS","So you peered into my memories... No matter. You will have found little of import."
6,"TEXT_VOICEMAN_05300_000070_ELIDIBUS","But I see you intended to summon me here no more than I intended to come. The fault is mine."
7,"TEXT_VOICEMAN_05300_000080_ELIDIBUS","Such is the burden of hope..."
8,"TEXT_VOICEMAN_05300_Q1_000_001_NONE_VOICE","What will you say?"
9,"TEXT_VOICEMAN_05300_A1_000_001_NONE_VOICE","Give back Ardbert's body."
10,"TEXT_VOICEMAN_05300_A1_000_002_NONE_VOICE","Why must you embroil the people in your plans?"
11,"TEXT_VOICEMAN_05300_A1_000_003_NONE_VOICE","What are you plotting?"
12,"TEXT_VOICEMAN_05300_000090_ELIDIBUS","What fool would relinquish his weapon on the eve of battle?"
13,"TEXT_VOICEMAN_05300_000100_ELIDIBUS","I merely avail myself of such tools as I require for the conflict to come."
14,"TEXT_VOICEMAN_05300_000110_ELIDIBUS","Come now, my plans are no mystery."
15,"TEXT_VOICEMAN_05300_000120_ELIDIBUS","That which I do is no different from that which you have done so many times, Warrior of Darkness."
16,"TEXT_VOICEMAN_05300_000130_ELIDIBUS","I arm myself. I hone my skills. I make ready to vanquish my enemy─you."
17,"TEXT_VOICEMAN_05300_000140_ELIDIBUS","You who have murdered my brothers─who have taken their selfless labors in service to the one true world and turned them to ash."
18,"TEXT_VOICEMAN_05300_000150_ELIDIBUS","I see you for what you are. You are death, and only in death shall you serve any purpose."
19,"TEXT_VOICEMAN_05300_000160_ELIDIBUS","The Convocation charged me to steer mankind and the very star upon their true course. As Elidibus, it is my duty. And I shall see it done."
20,"TEXT_VOICEMAN_05300_000170_ELIDIBUS","I will strike you down..."
21,"TEXT_VOICEMAN_05300_000180_ELIDIBUS","Destroy you body and soul. All else must wait."
22,"TEXT_VOICEMAN_05300_000190_DUMMYARDBERT","Destroy you body and soul. All else must wait."
23,"TEXT_VOICEMAN_05300_000200_ELIDIBUS","Ere long I will come for you, Warrior of Darkness. And I will save the world."
24,"TEXT_VOICEMAN_05300_000210_ELIDIBUS","One last matter."
25,"TEXT_VOICEMAN_05300_000220_ELIDIBUS","I bore witness to your final struggle with Emet-Selch. It seemed as if he saw something familiar in you."
26,"TEXT_VOICEMAN_05300_000230_ELIDIBUS","As if he mistook you for another."
27,"TEXT_VOICEMAN_05300_Q2_000_001_NONE_VOICE","What will you say?"
28,"TEXT_VOICEMAN_05300_A2_000_001_NONE_VOICE","Hythlodaeus called me his “new old friend.”"
29,"TEXT_VOICEMAN_05300_A2_000_002_NONE_VOICE","..."
30,"TEXT_VOICEMAN_05300_000240_ELIDIBUS","...No. I recall not of whom he spoke."
31,"TEXT_VOICEMAN_05300_000250_ELIDIBUS","Keep your counsel, then. You spare me further frustration. As often as we have met, you have never once awakened any memory within me."
32,"TEXT_VOICEMAN_05300_000260_ELIDIBUS","Mayhap I never knew you. Or mayhap it is another fragment lost."
33,"TEXT_VOICEMAN_05300_000270_MYSTERYVOICE","(-???-)Ah, I wasn't aware you already had a guest. If the conversation is constructive, I shall not intrude."
34,"TEXT_VOICEMAN_05300_000280_MYSTERYVOICE","But if you seek to stir up trouble, Elidibus, then I must insist you leave at once."
35,"TEXT_VOICEMAN_05300_000290_MYSTERYVOICE","No subtitles. Report if displayed."
36,"TEXT_VOICEMAN_05300_000300_ELIDIBUS","Though you lack Her blessing, your soul is surprisingly dense... Hmph."
37,"TEXT_VOICEMAN_05300_000310_MYSTERYVOICE","Worry not, I seem to be unharmed."
38,"TEXT_VOICEMAN_05300_000320_MYSTERYVOICE","Oh, this... This is my own doing─the consequence of my recent exertions."
39,"TEXT_VOICEMAN_05300_000330_MYSTERYVOICE","It is the tower's way of compensating me for the demands I have placed on it."
40,"TEXT_VOICEMAN_05300_000340_MYSTERYVOICE","Rest assured, it is no great inconvenience at present. Indeed, I told Beq Lugg as much...but they would not be persuaded, and sent me away to rest."
41,"TEXT_VOICEMAN_05300_000350_MYSTERYVOICE","No need to make a fuss. Strange as it may sound, I consider it something of a badge of honor."
42,"TEXT_VOICEMAN_05300_000360_MYSTERYVOICE","One of the brave souls who saw me delivered unto the First once said..."
43,"TEXT_VOICEMAN_05300_000370_MYSTERYVOICE","That the world shall ever have a place for tales of heroism, so long as we have need of inspiration in our lives."
44,"TEXT_VOICEMAN_05300_000380_MYSTERYVOICE","Though he and his fellows had no way of knowing whether their mad scheme would amount to anything, they knew that the attempt alone would inspire hope. Or so they hoped."
45,"TEXT_VOICEMAN_05300_000390_MYSTERYVOICE","A more optimistic lot, one would be hard-pressed to find."
46,"TEXT_VOICEMAN_05300_000400_MYSTERYVOICE","They said they would find a means to save our godsforsaken world─just as soon as they had sent me on my way. Said it with such confidence that, for a fleeting moment, I half-believed them."
47,"TEXT_VOICEMAN_05300_000410_MYSTERYVOICE","Such faith, such courage in the face of unrelenting despair. For a long time, it was more than I could bear to remember them."
48,"TEXT_VOICEMAN_05300_000420_MYSTERYVOICE","But having come this far─having sent full many on their way myself─I see things more clearly."
49,"TEXT_VOICEMAN_05300_000430_MYSTERYVOICE","To take action is to hope. To believe─to <Emphasis>choose</Emphasis> to believe is to take the first step towards a brighter future."
50,"TEXT_VOICEMAN_05300_000440_MYSTERYVOICE","And why do I tell you this? Because I want you to indulge me in a little recklessness."
51,"TEXT_VOICEMAN_05300_000450_MYSTERYVOICE","Needless to say, I have a plan. And...when all is said and done, I will ask yet another favor of you."
52,"TEXT_VOICEMAN_05300_000460_RYNE","You're both here! Thank goodness!"
53,"TEXT_VOICEMAN_05300_000470_MYSTERYVOICE","What's wrong?"
54,"TEXT_VOICEMAN_05300_000480_RYNE","It's Thancred! He's collapsed!"
55,"TEXT_VOICEMAN_05300_000490_TATARU","Excuse us..."
56,"TEXT_VOICEMAN_05300_000500_TATARU","This way."
57,"TEXT_VOICEMAN_05300_000510_KRILE","No subtitles. Report if displayed."
58,"TEXT_VOICEMAN_05300_000520_KRILE","No subtitles. Report if displayed."
59,"TEXT_VOICEMAN_05300_000530_KRILE","I would rather you hadn't seen this."
60,"TEXT_VOICEMAN_05300_000540_TATARU","I'm sorry. We have urgent tidings..."
61,"TEXT_VOICEMAN_05300_000550_KRILE","No, no, I'm not angry with you. On the contrary."
62,"TEXT_VOICEMAN_05300_000560_KRILE","I know full well how hard everyone has been searching for a way to return home. And I had hoped to afford you the time you needed. "
63,"TEXT_VOICEMAN_05300_000570_KRILE","But given our friends' present state, perhaps it was for the best that you came."
64,"TEXT_VOICEMAN_05300_000580_KRILE","Stiff and cold, all of them. As if they were made of wax."
65,"TEXT_VOICEMAN_05300_000590_KRILE","Barely alive at all."
66,"TEXT_VOICEMAN_05300_000600_KRILE","And they had been doing so well. Save for occasional signs of aetheric instability, they appeared to be in passable health."
67,"TEXT_VOICEMAN_05300_000610_KRILE","Then, quite without warning, things took a turn for the worse. A change for which even Master Matoya could offer no explanation."
68,"TEXT_VOICEMAN_05300_000620_KRILE","She could only remind me that the soul is yet an unknown frontier, and that much and more lies beyond our ken."
69,"TEXT_VOICEMAN_05300_000630_KRILE","But let's not lose heart just yet. At times like these, it is all the more important that we remain positive."
70,"TEXT_VOICEMAN_05300_000640_KRILE","Why, I but this moment succeeded in quelling a fluctuation in Thancred's aether."
71,"TEXT_VOICEMAN_05300_000650_KRILE","And while the others have weakened, they have remained relatively stable. I believe I may leave my post for a moment."
72,"TEXT_VOICEMAN_05300_000660_KRILE","So come, let me hear your tale outside."
73,"TEXT_VOICEMAN_05300_000670_ALPHINAUD","Forgive the delay."
74,"TEXT_VOICEMAN_05300_000680_THANCRED","We have visited every region and confirmed the presence of Ascians throughout the realm."
75,"TEXT_VOICEMAN_05300_000690_URIANGER","Lest a grave predicament be made to seem hopeless, it should be noted that they are of inferior rank. The black-masked minions who answer to the red."
76,"TEXT_VOICEMAN_05300_000700_THANCRED","Yes. A gaggle of schemers attempting to exploit recent events to sow the seeds of petty conflict."
77,"TEXT_VOICEMAN_05300_000710_THANCRED","Fortunately, nothing of any great concern has come of their meddling just yet."
78,"TEXT_VOICEMAN_05300_000720_ALISAIE","We also encountered a number of the Crystarium's former defenders, busily solving this problem and that in a bid to become Warriors of Light."
79,"TEXT_VOICEMAN_05300_000730_MYSTERYVOICE","Their zeal is to be applauded. 'Tis but a pity I cannot encourage them on their course..."
80,"TEXT_VOICEMAN_05300_000740_THANCRED","Not knowing Elidibus set them upon it, no. Both the troubles to be solved and the villains to be vanquished are his doing too, like as not."
81,"TEXT_VOICEMAN_05300_000750_THANCRED","And so, with apologies to the aspiring Warriors of Light, I believe it best that we deal with the Ascians quickly and quietly."
82,"TEXT_VOICEMAN_05300_000760_MYSTERYVOICE","I quite agree."
83,"TEXT_VOICEMAN_05300_000770_ALPHINAUD","But tell us, what news from the Source? How fare our bodies?"
84,"TEXT_VOICEMAN_05300_Q3_000_001_NONE_VOICE","What will you say?"
85,"TEXT_VOICEMAN_05300_A3_000_001_NONE_VOICE","Uh...well enough─though time is not on our side."
86,"TEXT_VOICEMAN_05300_A3_000_002_NONE_VOICE","I'm sorry, but...things have taken a turn for the worse."
87,"TEXT_VOICEMAN_05300_000780_ALPHINAUD","Indeed. Heartening though it is to know we can stay awhile longer, returning home must remain our priority."
88,"TEXT_VOICEMAN_05300_000781_ALISAIE","This seems an appropriate moment to ask about the spirit vessel. Have you made any progress?"
89,"TEXT_VOICEMAN_05300_000790_ALPHINAUD","...Oh dear. Then we must redouble our efforts! Not that we have ever stinted in that regard..."
90,"TEXT_VOICEMAN_05300_000800_ALISAIE","This would seem an appropriate moment to ask about the spirit vessel. Tell me you've made some progress."
91,"TEXT_VOICEMAN_05300_000810_BEQLUGG","We have, as it happens. One moment."
92,"TEXT_VOICEMAN_05300_000820_URIANGER","The red stones... Then this doth mean..."
93,"TEXT_VOICEMAN_05300_000830_BEQLUGG","For the benefit of all, permit us to explain."
94,"TEXT_VOICEMAN_05300_000840_BEQLUGG","As you will recall, using white auracite as our starting point, we fashioned a vessel for mind and memory both."
95,"TEXT_VOICEMAN_05300_000850_BEQLUGG","Yet though it served this purpose admirably, the process of imbuing it with one's complete essence proved a somewhat thornier proposition."
96,"TEXT_VOICEMAN_05300_000860_BEQLUGG","Simply put, the memory would not accompany the mind. And so we looked to the Allagans' mastery of memory transference for a solution."
97,"TEXT_VOICEMAN_05300_000870_MYSTERYVOICE","This approach was not without its own complications, however, relying as it does upon blood─which inanimate objects notably do not possess."
98,"TEXT_VOICEMAN_05300_000880_MYSTERYVOICE","We duly explored methods of suffusing the vessel with drops of the aforementioned. Alas, our painstaking experimentation succeeding only in making me feel faint, and singularly failed to imbue the crystal with the necessary properties."
99,"TEXT_VOICEMAN_05300_000890_MYSTERYVOICE","It was then that an idea occurred to me: namely, that we might fuse the vessel not with normal blood, but with my crystallized essence."
100,"TEXT_VOICEMAN_05300_000900_ALISAIE","You're doing this for our sakes, so far be it from us to complain..."
101,"TEXT_VOICEMAN_05300_000910_ALISAIE","But don't think we haven't noticed what's happening to your arm."
102,"TEXT_VOICEMAN_05300_000920_MYSTERYVOICE","It falls well short of offering up my life in exchange for yours─which was your only stipulated prohibition, as I recall. And it is but a small price to pay for delivering you home."
103,"TEXT_VOICEMAN_05300_000930_BEQLUGG","Assuming it works."
104,"TEXT_VOICEMAN_05300_000940_BEQLUGG","We shall soon know if this grisly addition will serve as a suitable conduit for the subject's memory. Though...not soon enough to warrant your waiting. The test is like to take a while."
105,"TEXT_VOICEMAN_05300_000950_THANCRED","Let us be off, then. We have Ascians to attend to, among other things."
106,"TEXT_VOICEMAN_05300_000960_ALISAIE","Forgive me, but I count <Emphasis>six</Emphasis> vessels. And there are only five of us."
107,"TEXT_VOICEMAN_05300_000970_MYSTERYVOICE","One is for testing purposes. I will personally use it to see whether the crystal functions as it should."
108,"TEXT_VOICEMAN_05300_000980_ALISAIE","And...if it does, wouldn't that mean that your soul could also return to the Source?"
109,"TEXT_VOICEMAN_05300_000990_MYSTERYVOICE","Yes. In theory, at least."
110,"TEXT_VOICEMAN_05300_001000_MYSTERYVOICE","But there is a distinct difference between your circumstances and mine. While your corporeal forms want for souls, my past self does not."
111,"TEXT_VOICEMAN_05300_001010_MYSTERYVOICE","Mayhap our essences would blend. Or mayhap they would curdle. There is no telling what might occur."
112,"TEXT_VOICEMAN_05300_001020_ALISAIE","And you'd be willing to take that risk?"
113,"TEXT_VOICEMAN_05300_001030_MYSTERYVOICE","I would."
114,"TEXT_VOICEMAN_05300_001040_ALISAIE","I see."
115,"TEXT_VOICEMAN_05300_001050_ELIDIBUS","Excellent. I had intended to speak with you alone."
116,"TEXT_VOICEMAN_05300_001060_ELIDIBUS","None of my doing, lest you misunderstand. The link between her body and soul wavers."
117,"TEXT_VOICEMAN_05300_001070_ELIDIBUS","I know not what you hoped to find here, but it will avail you naught to learn of our past."
118,"TEXT_VOICEMAN_05300_001080_LAHABREA","(-Convocation Speaker-)<UIForeground>F20223</UIForeground>Reviewing the records yet again? Really? You worry too much, Elidibus.<UIForeground>01</UIForeground>"
119,"TEXT_VOICEMAN_05300_001090_LAHABREA","(-Convocation Speaker-)<UIForeground>F20223</UIForeground>This dedication to your duty verges on obsession.<UIForeground>01</UIForeground>"
120,"TEXT_VOICEMAN_05300_001100_IGEYORHM","(-Convocation Member-)<UIForeground>F20223</UIForeground>To think some thought you ill-suited for the role. How wrong they were.<UIForeground>01</UIForeground>"
121,"TEXT_VOICEMAN_05300_001110_IGEYORHM","(-Convocation Member-)<UIForeground>F20223</UIForeground>But come, turn your gaze outside the window, my friend. The rains have ceased, and we have been graced with another beautiful day.<UIForeground>01</UIForeground>"
122,"TEXT_VOICEMAN_05300_001120_ELIDIBUS","It fades. Fades away into oblivion. Does the world no longer have need of me?"
123,"TEXT_VOICEMAN_05300_001130_ELIDIBUS","No. I am Elidibus. And I must─I <Emphasis>will</Emphasis> fulfill my duty."
124,"TEXT_VOICEMAN_05300_001140_ELIDIBUS","Sundered though you may be, you fought for the world's salvation. For hope."
125,"TEXT_VOICEMAN_05300_001150_ELIDIBUS","Hope..."
126,"TEXT_VOICEMAN_05300_001160_ELIDIBUS","Ahhh, it swells within me. Empowers me. Now─<Emphasis>now</Emphasis> I may carry out my mission."
127,"TEXT_VOICEMAN_05300_001170_ELIDIBUS","And yet..."
128,"TEXT_VOICEMAN_05300_001180_ELIDIBUS","Why do I yearn for this? Why do I struggle so?"
129,"TEXT_VOICEMAN_05300_001190_ELIDIBUS","I shall take her into my safekeeping. If you want her back, you will do as I ask."
130,"TEXT_VOICEMAN_05300_001200_ELIDIBUS","Show me your strength. I would take your measure."
131,"TEXT_VOICEMAN_05300_001210_ELIDIBUS","I have prepared a suitable arena. You need but ride the flow of aether."
132,"TEXT_VOICEMAN_05300_001220_ELIDIBUS","You have grown stronger since last we fought."
133,"TEXT_VOICEMAN_05300_001230_ELIDIBUS","The result of your trials in the First, no doubt."
134,"TEXT_VOICEMAN_05300_001240_YSHTOLA","(-???-)Have you finished?"
135,"TEXT_VOICEMAN_05300_001250_YSHTOLA","My apologies. I freed myself as soon as I awoke, but rather too late, I see."
136,"TEXT_VOICEMAN_05300_001260_YSHTOLA","Now, Elidibus, if you have ceased trading blows, I would trade words with you."
137,"TEXT_VOICEMAN_05300_001270_YSHTOLA","I have a theory, you see─one concerning that which you seek to accomplish."
138,"TEXT_VOICEMAN_05300_001280_YSHTOLA","It stems from who─or rather <Emphasis>what</Emphasis>─you truly are: a primal."
139,"TEXT_VOICEMAN_05300_001290_YSHTOLA","The ancients created Zodiark to deliver the star from destruction."
140,"TEXT_VOICEMAN_05300_001300_YSHTOLA","If the magick that brought Him forth is the precursor of what we know as summoning, then Zodiark would have been instilled with a presiding desire..."
141,"TEXT_VOICEMAN_05300_001310_YSHTOLA","I found it among the records at Anyder. And it came as no surprise. Were I faced with the world's destruction, I too would wish for the same..."
142,"TEXT_VOICEMAN_05300_001320_YSHTOLA","Salvation."
143,"TEXT_VOICEMAN_05300_001330_YSHTOLA","I know that you sacrificed yourself to become Zodiark's heart."
144,"TEXT_VOICEMAN_05300_001340_YSHTOLA","How you came to be separated from Him is less clear..."
145,"TEXT_VOICEMAN_05300_001350_YSHTOLA","But if you are a fragment of His being, it stands to reason a desire for the world's salvation would drive you."
146,"TEXT_VOICEMAN_05300_001360_YSHTOLA","And thus did you seek to inspire the masses to rise up as Warriors of Light, going so far as to use Ardbert as a symbol of hope."
147,"TEXT_VOICEMAN_05300_001370_ELIDIBUS","Correct on all counts. Such is my nature, and such are my methods."
148,"TEXT_VOICEMAN_05300_001380_ELIDIBUS","I have aided heroes. I have made them. I have even become them."
149,"TEXT_VOICEMAN_05300_001390_ELIDIBUS","This served not only to strengthen me, but also to facilitate the work of my brothers, such as Emet-Selch, with his penchant for nation building."
150,"TEXT_VOICEMAN_05300_001400_YSHTOLA","Then you will be all too familiar with the fickleness of mankind."
151,"TEXT_VOICEMAN_05300_001410_YSHTOLA","We change. We forget. And what little we do remember becomes twisted and fragmented over time. For which reason, you deem us unfit to carry on your legacy."
152,"TEXT_VOICEMAN_05300_001420_YSHTOLA","But are you yourself free of these foibles? As the last witness of the Final Days, do you remember <Emphasis>everything</Emphasis> that was lost? Or even the things you cared about?"
153,"TEXT_VOICEMAN_05300_001430_ELIDIBUS","Get to the point."
154,"TEXT_VOICEMAN_05300_001440_YSHTOLA","A primal is shaped by the hope that fuels it. Even should this hope be something as simple as the world's salvation, it is the collective desire of innumerable disparate souls crying out for deliverance."
155,"TEXT_VOICEMAN_05300_001450_YSHTOLA","Having drawn your strength from such a cacophony of voices, can you truly be sure you still speak with your own?"
156,"TEXT_VOICEMAN_05300_001460_ELIDIBUS","No subtitles. Report if displayed."
157,"TEXT_VOICEMAN_05300_001470_ELIDIBUS","Your question is irrelevant."
158,"TEXT_VOICEMAN_05300_001480_ELIDIBUS","No matter how much I should change, no matter how much I should forget, I shall ever remember my duty."
159,"TEXT_VOICEMAN_05300_001490_ELIDIBUS","At times I stand with my brethren. At times I stand against them. All that I might steer mankind and the very star upon their true course."
160,"TEXT_VOICEMAN_05300_001500_ELIDIBUS","For Elidibus is my name. And my mission. Guiding my every deed."
161,"TEXT_VOICEMAN_05300_001510_ELIDIBUS","But enough talk. You have shown me sufficient proof of your might."
162,"TEXT_VOICEMAN_05300_001520_ELIDIBUS","As I am now, I would struggle to defeat you. Yet I have still to play all of my cards."
163,"TEXT_VOICEMAN_05300_001530_ELIDIBUS","If I could offer you some semblance of sport, your lessers would pose no threat to me. Would you not agree, Warrior of Darkness?"
164,"TEXT_VOICEMAN_05300_001540_EMETSELCH","Gone is the brilliant radiance of life, replaced by the sickly glow of malformed creatures."
165,"TEXT_VOICEMAN_05300_001550_EMETSELCH","Is this to be how it ends? For we who loved the star with all our being?"
166,"TEXT_VOICEMAN_05300_001560_EMETSELCH","No. I will not suffer it to be so."
167,"TEXT_VOICEMAN_05300_001570_HYTHLODAEUS","(-???-)<UIForeground>F20223</UIForeground>Well, well. We meet again, my new old friend.<UIForeground>01</UIForeground>"
168,"TEXT_VOICEMAN_05300_Q4_000_001_NONE_VOICE","What will you say?"
169,"TEXT_VOICEMAN_05300_A4_000_001_NONE_VOICE","Hythlodaeus."
170,"TEXT_VOICEMAN_05300_A4_000_002_NONE_VOICE","The, uh...receptionist at the Bureau of the Secretariat?"
171,"TEXT_VOICEMAN_05300_001580_HYTHLODAEUS","<UIForeground>F20223</UIForeground>How good of you to remember.<UIForeground>01</UIForeground>"
172,"TEXT_VOICEMAN_05300_001590_HYTHLODAEUS","<UIForeground>F20223</UIForeground>Chief of the Bureau of the Architect, in fact. Where I also answered to the name of “Hythlodaeus.”<UIForeground>01</UIForeground>"
173,"TEXT_VOICEMAN_05300_001600_HYTHLODAEUS","<UIForeground>F20223</UIForeground>Heh heh... I see you have been collecting stars.<UIForeground>01</UIForeground>"
174,"TEXT_VOICEMAN_05300_001610_HYTHLODAEUS","<UIForeground>F20223</UIForeground>I speak of those crystals. They have constellations etched upon them, yes?<UIForeground>01</UIForeground>"
175,"TEXT_VOICEMAN_05300_001620_HYTHLODAEUS","<UIForeground>F20223</UIForeground>High in the heavens, those stars shine their guiding light down upon the lives below. Fitting symbols for the Convocation of Fourteen, would you not agree?<UIForeground>01</UIForeground>"
176,"TEXT_VOICEMAN_05300_001630_HYTHLODAEUS","<UIForeground>F20223</UIForeground>As you will have gathered, each crystal bears an account of the life of a member of the Convocation as remembered by the unsundered.<UIForeground>01</UIForeground>"
177,"TEXT_VOICEMAN_05300_001640_HYTHLODAEUS","<UIForeground>F20223</UIForeground>Lest you worry, they aren't concepts; they are far too incomplete to be so. But they suffice for imbuing memories within sundered souls, that they might be restored to their office.<UIForeground>01</UIForeground>"
178,"TEXT_VOICEMAN_05300_001650_HYTHLODAEUS","<UIForeground>F20223</UIForeground>Keep them. I am sure Emet-Selch wouldn't mind.<UIForeground>01</UIForeground>"
179,"TEXT_VOICEMAN_05300_001660_HYTHLODAEUS","<UIForeground>F20223</UIForeground>So, how fare you of late? You are feuding with Elidibus this time, I believe?<UIForeground>01</UIForeground>"
180,"TEXT_VOICEMAN_05300_001670_HYTHLODAEUS","<UIForeground>F20223</UIForeground>Hm... I shall refrain from passing comment on your struggle. It is not my place to do so, long-departed as I am.<UIForeground>01</UIForeground>"
181,"TEXT_VOICEMAN_05300_001680_HYTHLODAEUS","<UIForeground>F20223</UIForeground>But if I may give voice to a personal desire...I would rather you lived.<UIForeground>01</UIForeground>"
182,"TEXT_VOICEMAN_05300_001690_HYTHLODAEUS","<UIForeground>F20223</UIForeground>If you do not, how will you keep your promise to Emet-Selch? The promise to remember?<UIForeground>01</UIForeground>"
183,"TEXT_VOICEMAN_05300_001700_HYTHLODAEUS","<UIForeground>F20223</UIForeground>It must weigh heavy, the burden of all those memories.<UIForeground>01</UIForeground>"
184,"TEXT_VOICEMAN_05300_001710_HYTHLODAEUS","<UIForeground>F20223</UIForeground>To one who has lived a life such as yours, I can well imagine how Elidibus's existence might seem hollow─how empty his single-minded pursuit of a half-forgotten cause must appear...<UIForeground>01</UIForeground>"
185,"TEXT_VOICEMAN_05300_001720_HYTHLODAEUS","<UIForeground>F20223</UIForeground>But know that his devotion is not without reason. Even if he himself can no longer remember what that reason is.<UIForeground>01</UIForeground>"
186,"TEXT_VOICEMAN_05300_001730_HYTHLODAEUS","<UIForeground>F20223</UIForeground>Well, that is quite enough talk about Elidibus. I would see if you can reunite the wayward stars.<UIForeground>01</UIForeground>"
187,"TEXT_VOICEMAN_05300_001740_HYTHLODAEUS","<UIForeground>F20223</UIForeground>I mentioned before that there was a member of the Convocation who opposed Zodiark's summoning and defected. One whose office was left vacant...<UIForeground>01</UIForeground>"
188,"TEXT_VOICEMAN_05300_001750_HYTHLODAEUS","<UIForeground>F20223</UIForeground>Defectors having been deemed unworthy of commemoration, no crystal exists for the individual in question.<UIForeground>01</UIForeground>"
189,"TEXT_VOICEMAN_05300_001760_HYTHLODAEUS","<UIForeground>F20223</UIForeground>...Or shouldn't exist, at any rate─and wouldn't, had a friend not created one in secret.<UIForeground>01</UIForeground>"
