0,"TEXT_CLSTHM250_00352_SEQ_00","Cocobygo w\xc3\xbcrde gerne etwas mit dir bereden."
1,"TEXT_CLSTHM250_00352_SEQ_01","Cocobuki verh\xc3\xa4lt sich seltsam still in letzter Zeit. Frage ihn, was er auf dem Herzen hat."
2,"TEXT_CLSTHM250_00352_SEQ_02","Die Geisterforscher, die um die Zerst\xc3\xb6rung der Urne gebeten hatten, sollen sich in Camp Knochenbleich aufhalten. Statte ihnen einen Besuch ab und hole Informationen \xc3\xbcber Mormo ein."
3,"TEXT_CLSTHM250_00352_SEQ_03","Du hast von den Forschern drei Abhandlungen \xc3\xbcber Mormo erhalten. Lege sie Cocobuki in der Thaumaturgengilde zur Ansicht vor."
4,"TEXT_CLSTHM250_00352_SEQ_04","Cocobuki w\xc3\xbcnscht sich, dass sein Bruder Cocobygo ebenfalls erf\xc3\xa4hrt, was die Forscher \xc3\xbcber Mormo herausgefunden haben. Zeige Cocobygo die Aufs\xc3\xa4tze."
5,"TEXT_CLSTHM250_00352_SEQ_05","Cocobuki m\xc3\xb6chte, dass du dich der geheimen Lektion des \x02\x1a\x02\x02\x03G\xc3\xa4hnenden Abgrunds\x02\x1a\x02\x01\x03 stellst und seinen Br\xc3\xbcdern Mut einfl\xc3\xb6\xc3\x9ft. Suche ihn in Thals Rast auf, wenn du dich der Aufgabe gewachsen f\xc3\xbchlst. Du wirst daf\xc3\xbcr all dein K\xc3\xb6nnen als Thaumaturg\x02\x08\t\xe9\x05\xff\x03in\xff\x01\x03 aufbringen m\xc3\xbcssen."
6,"TEXT_CLSTHM250_00352_SEQ_06","Du hast die Pr\xc3\xbcfung der geheimen Lektion bestanden. Beratschlage das weitere Vorgehen mit Cocobuki in der Thaumaturgengilde."
7,"TEXT_CLSTHM250_00352_SEQ_07","Dein glanzvolles Abschneiden bei der geheimen Pr\xc3\xbcfung hat Cocobuki restlos \xc3\xbcberzeugt. Trotzdem solltest du die Zeit nutzen, die dir bis zum Kampf mit Mormo bleibt, und zu \x02\x08A\xe9\x05\xff\x1feiner noch st\xc3\xa4rkeren Magierin\xff\x1deinem noch st\xc3\xa4rkeren Magier\x03 werden.\x02\x10\x01\x03\x02\x10\x01\x03\xe2\x80\xbbSobald du als Thaumaturg\x02\x08\t\xe9\x05\xff\x03in\xff\x01\x03 Stufe 30 erreicht hast, kannst du bei Cocobuki einen neuen Auftrag erhalten."
8,"TEXT_CLSTHM250_00352_SEQ_08",
9,"TEXT_CLSTHM250_00352_SEQ_09",
10,"TEXT_CLSTHM250_00352_SEQ_10",
11,"TEXT_CLSTHM250_00352_SEQ_11",
12,"TEXT_CLSTHM250_00352_SEQ_12",
13,"TEXT_CLSTHM250_00352_SEQ_13",
14,"TEXT_CLSTHM250_00352_SEQ_14",
15,"TEXT_CLSTHM250_00352_SEQ_15",
16,"TEXT_CLSTHM250_00352_SEQ_16",
17,"TEXT_CLSTHM250_00352_SEQ_17",
18,"TEXT_CLSTHM250_00352_SEQ_18",
19,"TEXT_CLSTHM250_00352_SEQ_19",
20,"TEXT_CLSTHM250_00352_SEQ_20",
21,"TEXT_CLSTHM250_00352_SEQ_21",
22,"TEXT_CLSTHM250_00352_SEQ_22",
23,"TEXT_CLSTHM250_00352_SEQ_23",
24,"TEXT_CLSTHM250_00352_TODO_00","Mit Cocobuki sprechen"
25,"TEXT_CLSTHM250_00352_TODO_01","Abhandlungen \xc3\xbcber Mormo besorgen"
26,"TEXT_CLSTHM250_00352_TODO_02","Cocobuki die Abhandlungen der Forscher zeigen"
27,"TEXT_CLSTHM250_00352_TODO_03","Cocobygo die Abhandlungen \xc3\xbcber Mormo geben"
28,"TEXT_CLSTHM250_00352_TODO_04","Cocobuki an Thals Rast treffen"
29,"TEXT_CLSTHM250_00352_TODO_05","Cocobuki in der Thaumaturgengilde aufsuchen"
30,"TEXT_CLSTHM250_00352_TODO_06",
31,"TEXT_CLSTHM250_00352_TODO_07",
32,"TEXT_CLSTHM250_00352_TODO_08",
33,"TEXT_CLSTHM250_00352_TODO_09",
34,"TEXT_CLSTHM250_00352_TODO_10",
35,"TEXT_CLSTHM250_00352_TODO_11",
36,"TEXT_CLSTHM250_00352_TODO_12",
37,"TEXT_CLSTHM250_00352_TODO_13",
38,"TEXT_CLSTHM250_00352_TODO_14",
39,"TEXT_CLSTHM250_00352_TODO_15",
40,"TEXT_CLSTHM250_00352_TODO_16",
41,"TEXT_CLSTHM250_00352_TODO_17",
42,"TEXT_CLSTHM250_00352_TODO_18",
43,"TEXT_CLSTHM250_00352_TODO_19",
44,"TEXT_CLSTHM250_00352_TODO_20",
45,"TEXT_CLSTHM250_00352_TODO_21",
46,"TEXT_CLSTHM250_00352_TODO_22",
47,"TEXT_CLSTHM250_00352_TODO_23",
48,"TEXT_CLSTHM250_00352_SCENE00020_INSTANCE_BATTLE_YESNO_TITLE","Willst du den Kampf f\xc3\xbcr \xe2\x80\x9eDas Licht am Boden des Abgrunds\xe2\x80\x9c beginnen?"
49,"TEXT_CLSTHM250_00352_SCENE00020_INSTANCE_BATTLE_YESNO_YES","Ja"
50,"TEXT_CLSTHM250_00352_SCENE00020_INSTANCE_BATTLE_YESNO_NO","Nein"
51,"TEXT_CLSTHM250_00352_COCOBYGO_000_1","Du wei\xc3\x9ft von dem Vorfall mit Cocobusi, nicht wahr? Buki hat uns mittlerweile ebenfalls eingeweiht. Eine schlimme Sache ist das. Wir m\xc3\xbcssen unseren Bruder umgehend finden und ... die n\xc3\xb6tigen Ma\xc3\x9fnahmen ergreifen."
52,"TEXT_CLSTHM250_00352_COCOBYGO_000_3","Nur Buki druckst schon eine ganze Weile rum. Dabei ist er sonst immer so besonnen und zielstrebig, das passt irgendwie gar nicht zu ihm. Vor uns will er leider nicht so recht mit der Sprache rausr\xc3\xbccken. K\xc3\xb6nntest du ihm vielleicht mal auf den Zahn f\xc3\xbchlen, \x02,\r\xff\x07\x02)\x03\xeb\x02\x03\xff\x02 \x02\x03?"
53,"TEXT_CLSTHM250_00352_COCOBUKI_000_10","Ah, \x02,\r\xff\x07\x02)\x03\xeb\x02\x03\xff\x02 \x02\x03! Da bist du ja wieder! Hm hm, ja! Wie ich sehe, hast du abermals einen gewaltigen Sprung auf der arkanen Karriereleiter gemacht! Sehr sch\xc3\xb6n, dann darf sich wenigstens einer von uns \xc3\xbcber Fortschritte freuen. Ich bin in der Sache mit der Nichtsgesandten n\xc3\xa4mlich immer noch keinen Schritt weiter."
54,"TEXT_CLSTHM250_00352_COCOBUKI_000_11","Wenn ich wenigstens Rat von au\xc3\x9fen einholen k\xc3\xb6nnte! Aber das d\xc3\xbcrfen wir leider nicht riskieren. Es w\xc3\xa4re wohl nur eine Frage der Zeit, bis die ersten Forderungen laut w\xc3\xbcrden, Cocobusi zu vernichten, um die Nichtsgesandte loszuwerden. Denn genauso w\xc3\xbcrde jeder Thaumaturg vorgehen, der die Lehren des \x02\x1a\x02\x02\x03G\xc3\xa4hnenden Abgrunds\x02\x1a\x02\x01\x03 verinnerlicht hat."
55,"TEXT_CLSTHM250_00352_COCOBUKI_000_15","Einen schwachen Hoffnungsschimmer sehe ich allerdings noch am Boden des Abgrunds glimmen ... Die Geisterforscher, die uns mit der Zerst\xc3\xb6rung der Urne beauftragt hatten, sind von ihrer Forschungsreise zur\xc3\xbcckgekehrt. "
56,"TEXT_CLSTHM250_00352_COCOBUKI_000_16","Angeblich haben sie ihre Erkenntnisse in Abhandlungen \xc3\xbcber Mormo zusammengefasst. Und da w\xc3\xbcrde ich liebend gerne mal einen Blick drauf werfen! Hast du eventuell Zeit, den Forschern einen Besuch abzustatten? Sie sollen sich momentan in Camp Knochenbleich aufhalten."
57,"TEXT_CLSTHM250_00352_AKUMAA_000_20","Du bist an unserer Abhandlung \xc3\xbcber die Nichtsgesandte Mormo interessiert? Du pflegst recht au\xc3\x9fergew\xc3\xb6hnliche Hobbys, wenn mir diese Bemerkung erlaubt ist. Hohoho!"
58,"TEXT_CLSTHM250_00352_AKUMAA_000_21","Von mir stammt das erste Kapitel. Darin habe ich alles niedergeschrieben, was wir unternommen haben, um Mormos wahres Wesen zu ergr\xc3\xbcnden. Ich kann dir sagen, diese Urne ist ein wahrlich diabolisches Werkzeug. Selbst mir zittern bei dem Gedanken an sie die Knie."
59,"TEXT_CLSTHM250_00352_AKUMAA_000_200","Es freut mich, dass unsere Arbeit bei dir auf Interesse st\xc3\xb6\xc3\x9ft. Hoffentlich ist ihre Lekt\xc3\xbcre aufschlussreich f\xc3\xbcr dich."
60,"TEXT_CLSTHM250_00352_AKUMAB_000_32","Du forschst auch \xc3\xbcber Mormo?! Wie sch\xc3\xb6n, \x02\x08/\xe9\x05\xff\x14eine Gleichgesinnte\xff\x16einen Gleichgesinnten\x03 zu treffen! Wusstest du, dass Nichtsgesandte unsere Welt nur \xc3\xbcber eine Art Dimensionsloch erreichen k\xc3\xb6nnen?"
61,"TEXT_CLSTHM250_00352_AKUMAB_000_34","Eine m\xc3\xa4chtige Nichtsgesandte wie Mormo br\xc3\xa4uchte allerdings ein ziemlich gro\xc3\x9fes Dimensionsloch, um sich zu uns zu zw\xc3\xa4ngen. Deswegen hat sie lediglich ihre Seele geschickt, die einen Wirtsk\xc3\xb6rper ben\xc3\xb6tigt, um ihr finsteres Werk zu vollbringen. All das habe ich im zweiten Kapitel unserer Abhandlung festgehalten. Glaub mir, du wirst sie nicht eher aus der Hand legen, bis du alle gruseligen Details erfahren hast."
62,"TEXT_CLSTHM250_00352_AKUMAB_000_205","Es geht doch nichts \xc3\xbcber ein paar Tage M\xc3\xbc\xc3\x9figgang am Ende einer anstrengenden Forschungsreise. Ich w\xc3\xbcnschte, wir k\xc3\xb6nnten sie an der Sonnenk\xc3\xbcste verbringen und m\xc3\xbcssten nicht in diesem staubigen Camp ausharren."
63,"TEXT_CLSTHM250_00352_AKUMAC_000_36","Informationen \xc3\xbcber Mormo? Ja, damit kann ich dienen. Im dritten Kapitel der Abhandlung unseres Geisterforscher-Konsortiums habe ich alles zusammengetragen, was Gelehrte vergangener Zeitalter \xc3\xbcber Methoden zur Vernichtung der Seele der Nichtsgesandten herausgefunden haben."
64,"TEXT_CLSTHM250_00352_AKUMAC_000_38","Dabei geht es um Bannsiegel und m\xc3\xa4chtige Zauber, aber wenn ich jetzt anfange, dir die komplexen Zusammenh\xc3\xa4nge zu erkl\xc3\xa4ren, stehen wir \xc3\xbcbermorgen noch hier. Lies dir die magischen Theorien am besten in Ruhe zu Hause durch."
65,"TEXT_CLSTHM250_00352_AKUMAC_000_210","Wenn du Mormo in ihre Schranken weisen m\xc3\xb6chtest, kann ich dir die Lekt\xc3\xbcre des dritten Kapitels nur w\xc3\xa4rmstens empfehlen."
66,"TEXT_CLSTHM250_00352_COCOBUKI_000_50","Es waren drei Forscher an der Zahl. Erkundige dich bitte bei ihnen, was sie \xc3\xbcber Mormo herausgefunden haben."
67,"TEXT_CLSTHM250_00352_COCOBUKI_000_52","Hm hm hm ... Diese Stelle hier ist interessant. Alte Dokumente, die man in den Sil'dih-Ruinen gefunden hat, enthielten anscheinend schon Passagen \xc3\xbcber eine besonders m\xc3\xa4chtige Nichtsgesandte namens Mormo."
68,"TEXT_CLSTHM250_00352_COCOBUKI_000_54","Nachdem diese sich Zugang zu unserer Welt verschafft hatte und in den K\xc3\xb6rper eines unfreiwilligen Wirts gefahren war, schufen die Magier Sil'dihs eine Urne, die dem Wirt seinen \xc3\x84ther entzog und mit ihm Mormos Seele aus dem K\xc3\xb6rper saugte."
69,"TEXT_CLSTHM250_00352_COCOBUKI_000_56","In der Urne sollte die Seele solange eingesperrt bleiben, bis sie sich zusammen mit dem \xc3\x84ther auf nat\xc3\xbcrliche Weise verfl\xc3\xbcchtigen w\xc3\xbcrde. Dieser Prozess w\xc3\xbcrde hunderte von Jahre in Anspruch nehmen und keinesfalls d\xc3\xbcrfte die Urne vorher ge\xc3\xb6ffnet werden."
70,"TEXT_CLSTHM250_00352_COCOBUKI_000_57","Sollte dies dennoch geschehen, w\xc3\xbcrde die Seele in den n\xc3\xa4chstbesten K\xc3\xb6rper fahren und Mormo unsere Welt erneut in dunkle Schatten tauchen. Dann bliebe als letzte Rettung nur noch, die Nichtsgesandte zusammen mit ihrem Wirtsk\xc3\xb6rper ... zu vernichten."
71,"TEXT_CLSTHM250_00352_COCOBUKI_000_59","Hm hm hm ... So war das also. Die Seele von Mormo, ihrer Magie beraubt, hat sich des K\xc3\xb6rpers von Cocobusi bem\xc3\xa4chtigt. Da dessen Reserven an arkaner Energie jedoch verschwindend gering waren, begann Mormo bald, andere Thaumaturgen als \xc3\x84therquelle anzuzapfen."
72,"TEXT_CLSTHM250_00352_COCOBUKI_000_62","Hm hm ... Glauben wir dieser Schrift, dann ist Cocobusis Schicksal bereits besiegelt. Cocobygo sollte diese Neuigkeiten ebenfalls erfahren. Zeige ihm die Schriften bitte, \x02\x08$\xe9\x05\xff\x11meine Sch\xc3\xbclerin\xff\x0emein Sch\xc3\xbcler\x03. Ich werde umgehend zu euch sto\xc3\x9fen."
73,"TEXT_CLSTHM250_00352_COCOBUKI_000_200","Cocobygo hat ein Recht, die Schriften der Geisterforscher zu studieren. Zeige sie ihm bitte. Ich werde umgehend zu euch sto\xc3\x9fen."
74,"TEXT_CLSTHM250_00352_COCOBYGO_000_70","D-Du konntest wissenschaftliche Abhandlungen \xc3\xbcber Mormo auftreiben? Steht da vielleicht etwas drin, das uns weiterhilft?"
75,"TEXT_CLSTHM250_00352_COCOBYGO_000_71","B-Buki ...! Die Abhandlungen \xc3\xbcber Mormo lassen keine Zweifel mehr offen! Die Lage ist aussichtslos. Uns bleibt ... keine Wahl."
76,"TEXT_CLSTHM250_00352_COCOBUKI_000_72","Nicht so schnell, mein Lieber. Es ist zwar ein schwieriges Unterfangen, aber wenn wir alle unsere Kr\xc3\xa4fte einen, haben wir vielleicht Aussicht auf Erfolg. Hm hm hm, wenn der Schuss nach hinten losgeht, wird es allerdings weit mehr als nur \x02\x1a\x02\x02\x03ein\x02\x1a\x02\x01\x03 Opfer zu beklagen geben."
77,"TEXT_CLSTHM250_00352_COCOBANI_000_73","Welcher Eufel ist denn in dich gefahren, Buki? Sonst hast du uns doch immer nur was von Risikominimierung vorgepredigt."
78,"TEXT_CLSTHM250_00352_COCOBEZI_000_74","Je l\xc3\xa4nger wir warten, desto st\xc3\xa4rker wird Mormo. Wir sollten zuschlagen, solange die Nichtsgesandte noch nicht bei vollen Kr\xc3\xa4ften ist, oder etwa nicht, Buki?"
79,"TEXT_CLSTHM250_00352_COCOBOHA_000_75","Das sehe ich auch so, Bruderherz. Es tut mir zwar leid um Busi, aber besser er bei\xc3\x9ft alleine ins Gizar-Kraut als wir alle zusammen. Das h\xc3\xa4tte Busi auch nicht anders gewollt."
80,"TEXT_CLSTHM250_00352_COCOBUKI_000_76","Weil er nicht auf meinen genialen Plan gekommen w\xc3\xa4re. Ich werde meine arkane Energie auf Mormo \xc3\xbcbertragen, damit sie sich in ihrer eigentlichen Gestalt manifestieren kann und unseren Bruder freil\xc3\xa4sst."
81,"TEXT_CLSTHM250_00352_COCOBYGO_000_78","Bist du wahnsinnig? Wenn kein \xc3\x84ther mehr durch deine Adern str\xc3\xb6mt, war's das mit dir, Buki! Au\xc3\x9ferdem w\xc3\xbcrde Mormo so zu ihrer urspr\xc3\xbcnglichen St\xc3\xa4rke zur\xc3\xbcckfinden!"
82,"TEXT_CLSTHM250_00352_COCOBUKI_000_80","Macht euch um mich mal keine Sorgen. In mir steckt genug Magie f\xc3\xbcr 'ne ganze Gesandtschaft von Nichtsgesandten! Und selbst wenn ich geschw\xc3\xa4cht sein sollte - um Mormo k\xc3\xb6nnt \x02\x1a\x02\x02\x03ihr\x02\x1a\x02\x01\x03 euch auch k\xc3\xbcmmern. Zusammen mit \x02,\r\xff\x07\x02)\x03\xeb\x02\x03\xff\x02 \x02\x03 schafft ihr das schon, daran hege ich keine Zweifel."
83,"TEXT_CLSTHM250_00352_COCOBOHA_000_81","Machst du Witze, Buki? Das Ding ist 'ne lebende, \xc3\xa4h, oder auch nicht, Legende! Seit wann kn\xc3\xb6pfen wir Thaumaturgen uns Gegner vor, die uns haushoch \xc3\xbcberlegen sind?"
84,"TEXT_CLSTHM250_00352_COCOBUKI_000_82","Ich gebe zu, das ist mein Vers\xc3\xa4umnis. Ich habe euch stets gelehrt, rational zu k\xc3\xa4mpfen und Risiken aus dem Weg zu gehen. Ich habe euch nicht gelehrt, was es hei\xc3\x9ft, Mut zu fassen und f\xc3\xbcr eine gerechte Sache einzustehen."
85,"TEXT_CLSTHM250_00352_COCOBUKI_000_83","Darum m\xc3\xb6chte ich dich bitten, \x02,\r\xff\x07\x02)\x03\xeb\x02\x03\xff\x02 \x02\x03. Stelle dich der geheimen Lektion des \x02\x1a\x02\x02\x03G\xc3\xa4hnenden Abgrunds\x02\x1a\x02\x01\x03 und zeige meinen Br\xc3\xbcdern, was wahrer Mut ist."
86,"TEXT_CLSTHM250_00352_COCOBYGO_000_84","A-Aber du verlangst das Unm\xc3\xb6gliche von \x02,\r\xff\x07\x02)\x03\xeb\x02\x03\xff\x02 \x02\x03, Buki! Nicht einmal wir haben diese Pr\xc3\xbcfung abgelegt."
87,"TEXT_CLSTHM250_00352_COCOBUKI_000_85","Obwohl ihr alle es k\xc3\xb6nntet. Genauso wie \x02,\r\xff\x07\x02)\x03\xeb\x02\x03\xff\x02 \x02\x03 ... \x02,\r\xff\x07\x02)\x03\xeb\x02\x03\xff\x02 \x02\x03, wenn auch du an dich glaubst, so, wie ich an dich glaube, dann suche mich auf. Du findest mich in Thals Rast. Dort werde ich dir alles Weitere erz\xc3\xa4hlen."
88,"TEXT_CLSTHM250_00352_COCOBUKI_000_90","Es tut mir leid, dass wir dich in diese Sache mit reingezogen haben, \x02,\r\xff\x07\x02)\x03\xeb\x02\x03\xff\x02 \x02\x03, aber wenn jemand dieser Herausforderung gewachsen ist, dann du, \x02\x08\r\xe9\x05\xff\x04die\xff\x04der\x03 du all unsere bisherigen Pr\xc3\xbcfungen so bravour\xc3\xb6s gemeistert hast."
89,"TEXT_CLSTHM250_00352_COCOBUKI_000_91","Die geheime Lektion des \x02\x1a\x02\x02\x03G\xc3\xa4hnenden Abgrunds\x02\x1a\x02\x01\x03 stellt das gesamte K\xc3\xb6nnen eines Thaumaturgen auf die Probe. Fokussiere deine arkanen Kr\xc3\xa4fte und finde den Weg, der dich zum Sieg f\xc3\xbchrt."
90,"TEXT_CLSTHM250_00352_COCOBUKI_000_93","Also dann, lass uns die Pr\xc3\xbcfung beginnen."
91,"TEXT_CLSTHM250_00352_SCENE00015_INSTANCE_BATTLE_YESNO_TITLE","Willst du den Kampf f\xc3\xbcr \xe2\x80\x9eDas Licht am Boden des Abgrunds\xe2\x80\x9c beginnen?"
92,"TEXT_CLSTHM250_00352_SCENE00015_INSTANCE_BATTLE_YESNO_YES","Ja"
93,"TEXT_CLSTHM250_00352_SCENE00015_INSTANCE_BATTLE_YESNO_NO","Nein"
94,"TEXT_CLSTHM250_00352_COCOBYGO_000_110","\x02,\r\xff\x07\x02)\x03\xeb\x02\x03\xff\x02 \x02\x03! Mute dir nicht zu viel zu!"
95,"TEXT_CLSTHM250_00352_COCOBANI_000_111","Fliehe, wenn es brenzlig wird, \x02,\r\xff\x07\x02)\x03\xeb\x02\x03\xff\x02 \x02\x03!\x02\x10\x01\x03Du bist uns n\xc3\xa4mlich ziemlich ans Herz gewachsen, wei\xc3\x9ft du?"
96,"TEXT_CLSTHM250_00352_COCOBEZI_000_112","Selbst wir haben diese Pr\xc3\xbcfung nicht abgelegt.\x02\x10\x01\x03Die Aussicht auf Erfolg ... ist gering."
97,"TEXT_CLSTHM250_00352_COCOBOHA_000_113","Willst du die geheime Pr\xc3\xbcfung wirklich antreten?\x02\x10\x01\x03Hast du \xc3\xbcberhaupt keine Angst?"
98,"TEXT_CLSTHM250_00352_COCOBYGO_000_120","Du ... Du hast es wirklich geschafft?"
99,"TEXT_CLSTHM250_00352_COCOBUKI_000_121","Seht ihr es jetzt, meine Br\xc3\xbcder? Ein Thaumaturg ist jeder Gefahr gewachsen! Nichts h\xc3\xa4lt seiner Zerst\xc3\xb6rungskraft stand!"
100,"TEXT_CLSTHM250_00352_COCOBANI_000_123","Das k\xc3\xb6nnen wir auch! Wir werden dieser Nichtsgesandten eine Lektion erteilen, die sie niemals vergisst. Wir werden Cocobusi von seinem Fluch befreien!"
101,"TEXT_CLSTHM250_00352_COCOBEZI_000_124","Wir waren anscheinend nicht nur feige, sondern auch unreif. Dass erst du kommen musstest, um uns zu zeigen, was Mut bedeutet ..."
102,"TEXT_CLSTHM250_00352_COCOBOHA_000_125","Gl\xc3\xbcckwunsch zum Bestehen der geheimen Lektion! Das k\xc3\xb6nnen wir nicht auf uns sitzen lassen! Jetzt m\xc3\xbcssen wir nachziehen!"
103,"TEXT_CLSTHM250_00352_COCOBUKI_000_126","Meine Br\xc3\xbcder! So kenne ich euch, und so gefallt ihr mir! Hm hm hm, wenn ihr eure Kr\xc3\xa4fte eint, werdet ihr mit allem fertig."
104,"TEXT_CLSTHM250_00352_COCOBUKI_000_127","Dank dir haben meine Br\xc3\xbcder neues Selbstvertrauen gefasst, \x02,\r\xff\x07\x02)\x03\xeb\x02\x03\xff\x02 \x02\x03. Lass uns zur Gilde zur\xc3\xbcckkehren und unser weiteres Vorgehen in Ruhe besprechen."
105,"TEXT_CLSTHM250_00352_COCOBUKI_000_130","Cocobygo, Cocobani, Cocobezi, Cocoboha ... und du, \x02,\r\xff\x07\x02)\x03\xeb\x02\x03\xff\x02 \x02\x03. Gemeinsam k\xc3\xb6nnt ihr alles \xc3\xbcberwinden! Auch Mormo!"
106,"TEXT_CLSTHM250_00352_COCOBUKI_000_133","Doch noch ist die Stunde der Wahrheit nicht gekommen. Nutze die verbleibende Zeit, um weiter an dir zu arbeiten und den Sieg zu einer sicheren Sache zu machen."
107,"TEXT_CLSTHM250_00352_COCOBUKI_000_134","Du bist unsere einzige Hoffnung, \x02,\r\xff\x07\x02)\x03\xeb\x02\x03\xff\x02 \x02\x03. Wir z\xc3\xa4hlen auf dich!"
108,"TEXT_CLSTHM250_00352_QIB_TODO_001","Besiege alle Gegner der geheimen Lektion!"
109,"TEXT_CLSTHM250_00352_COCOBUKI_BATTLETALK_01","Hm hm hm, jetzt gibt es kein Zur\xc3\xbcck mehr!"
110,"TEXT_CLSTHM250_00352_COCOBUKI_BATTLETALK_02","Finst're Schwingen tragen leere Worte in unsere Welt.\x02\x10\x01\x03Steigt empor in die L\xc3\xbcfte, Herolde des Nichts!"
111,"TEXT_CLSTHM250_00352_COCOBYGO_BATTLETALK_03","D-Das also ist die geheime Pr\xc3\xbcfung!"
112,"TEXT_CLSTHM250_00352_COCOBANI_BATTLETALK_04","\xc3\x9cbernimm dich nicht, \x02,\r\xff\x07\x02)\x03\xeb\x02\x03\xff\x02 \x02\x03!"
113,"TEXT_CLSTHM250_00352_COCOBUKI_BATTLETALK_05","Das war nur der Anfang.\x02\x10\x01\x03Die n\xc3\xa4chste Gefahr wird weitaus gr\xc3\xb6\xc3\x9fer sein ..."
114,"TEXT_CLSTHM250_00352_COCOBUKI_BATTLETALK_06","In den Schatten des Abgrunds siecht F\xc3\xa4ulnis.\x02\x10\x01\x03Bringt Verderbnis \xc3\xbcber die Welt, Schlacken des Nichts!"
115,"TEXT_CLSTHM250_00352_COCOBEZI_BATTLETALK_07","Achtung, das Sekret der Glitscherartigen l\xc3\xa4sst dich verstummen!\x02\x10\x01\x03Unternimmst du dagegen nichts, bist du dem Untergang geweiht!"
116,"TEXT_CLSTHM250_00352_COCOBUKI_BATTLETALK_08","Hm hm hm, du hast dich fabelhaft geschlagen.\x02\x10\x01\x03Doch bist du auch dieser letzten Probe gewachsen?"
117,"TEXT_CLSTHM250_00352_COCOBUKI_BATTLETALK_09","Das schrille Surren seiner Fl\xc3\xbcgel l\xc3\xa4sst seine Opfer sich winden.\x02\x10\x01\x03Zerrei\xc3\x9fe, was aufzuhalten dich droht, Springer des Nichts!"
118,"TEXT_CLSTHM250_00352_COCOBOHA_BATTLETALK_10","Lass dich nicht unterkriegen, \x02,\r\xff\x07\x02)\x03\xeb\x02\x03\xff\x02 \x02\x03!\x02\x10\x01\x03Achte auf seine Bewegung, dann kannst du den Blitzen ausweichen!"