key,0,1,2,3,4,5,6,7,8,9
#,,,,,,,,,,Text
int32,uint32,byte,bit&01,bit&02,bit&04,byte,single,bit&08,single,str
0,0,2,False,False,False,1,1,False,1,"0"
1,0,2,False,False,False,3,1,False,1,"0"
2,0,2,False,False,False,3,5,False,1,"0"
3,0,2,False,False,False,3,5,False,1,"Hush! The anoles draw near!"
4,0,2,False,False,False,3,5,False,1,"Allow not a single imp to escape!"
5,0,2,False,False,False,3,5,False,1,"There are too many of them!"
6,0,2,False,False,False,3,5,False,1,"The gnats! They're everywhere!"
7,0,2,False,False,False,3,5,False,1,"Hostile sylphs approach! Draw your weapons!"
8,0,2,False,False,False,3,5,False,1,"Whence did these stags come!?"
9,0,2,False,False,False,3,5,False,1,"We must keep the roads safe!"
10,0,2,False,False,False,3,5,False,1,"These knaves must be taught a lesson!"
11,0,2,False,False,False,3,5,False,1,"It is the beans they are after!"
12,0,2,False,False,False,3,5,False,1,"The Ixal! Someone save us!"
13,0,2,False,False,False,3,5,False,1,"What are ziz doing this far east!?"
14,0,2,False,False,False,3,5,False,1,"The bud! We must protect the bud!"
15,0,2,False,False,False,3,5,False,1,"Take care. Something has the opo-opos in a frenzy."
16,0,2,False,False,False,3,5,False,1,"Seven hells! It's time for a change in plans."
17,0,2,False,False,False,3,5,False,1,"Kill them all, my pet!"
18,0,2,False,False,False,3,5,False,1,"Would someone be so kind as to assist us?"
19,0,2,False,False,False,3,5,False,1,"My wares! Those damned goblins have made off with my wares!"
20,0,2,False,False,False,3,5,False,1,"Would ye look at all them golems!"
21,0,2,False,False,False,3,5,False,1,"Not <Emphasis>more</Emphasis> imps! They'll have all our honey!"
22,0,2,False,False,False,3,5,False,1,"At this rate, there'll be no flowers left at all!"
23,0,2,False,False,False,3,5,False,1,"Intercept the Ixali raiders!"
24,0,2,False,False,False,3,5,False,1,"Get this man away from me!"
25,0,2,False,False,False,3,5,False,1,"Excelsior!"
26,0,2,False,False,False,2,5,False,1,"Ngaaah!"
27,0,2,False,False,False,2,5,False,1,"Hyah!"
28,0,2,False,False,False,2,5,False,1,"Begone!"
29,0,2,False,False,False,2,5,False,1,"Down with you!"
30,0,2,False,False,False,2,5,False,1,"Try that again!"
31,0,2,False,False,False,2,5,False,1,"You're mine!"
32,0,2,False,False,False,2,5,False,1,"Had enough!?"
33,0,2,False,False,False,2,5,False,1,"Take that!"
34,0,2,False,False,False,2,5,False,1,"Yaaaaaah!"
35,0,2,False,False,False,2,5,False,1,"I'll kill all ye bastards!"
36,0,2,False,False,False,2,5,False,1,"Out of me way!"
37,0,2,False,False,False,2,5,False,1,"Yer head's mine!"
38,0,2,False,False,False,2,5,False,1,"Let us dance!"
39,0,2,False,False,False,2,5,False,1,"Seek you audience with the king?"
40,0,2,False,False,False,2,3,False,1,"Kneel before your king!"
41,0,2,False,False,False,2,3,False,1,"I want to hear you sing!"
42,0,2,False,False,False,2,3,False,1,"Come a little closer."
43,0,2,False,False,False,2,5,False,1,"Why do you defy me?"
44,0,2,False,False,False,2,5,False,1,"I am not amused!"
45,0,2,False,False,False,2,3,False,1,"Dance, you fools!"
46,0,2,False,False,False,2,3,False,1,"Is this what you seek?"
47,0,2,False,False,False,2,3,False,1,"Hissssss!"
48,0,2,False,False,False,2,5,False,1,"Whaddaya treeslugs talkinbout!?"
49,0,2,False,False,False,2,5,False,1,"Yehavn't seentha lassa Spessser! Hic!"
50,0,2,False,False,False,2,5,False,1,"Gah hah hah! Who's next!?"
51,0,2,False,False,False,2,5,False,1,"Ulp! I just wanted to drink my mead in peace!"
52,0,2,False,False,False,2,3,False,1,"You's a probbluh...prob...prollem wif that!?"
53,0,2,False,False,False,2,3,False,1,"Thal's balls!"
54,0,2,False,False,False,2,5,False,1,"This one has made ready!"
55,0,2,False,False,False,2,5,False,1,"Listen! The forest speaks!"
56,0,2,False,False,False,2,5,False,1,"These ones must suffer!"
57,0,2,False,False,False,2,5,False,1,"This one will not perish!"
58,0,2,False,False,False,3,5,False,1,"Come! The Wood Wailers seek volunteers!"
59,0,2,False,False,False,3,5,False,1,"Ye may've made it this far, but ye ain't gettin' out alive."
60,0,2,False,False,False,3,5,False,1,"Hit me with all you have!"
61,0,2,False,False,False,3,5,False,1,"Enough! You've done well today."
62,0,2,False,False,False,3,5,False,1,"There are too many of them!"
63,0,2,False,False,False,3,5,False,1,"Tonight we shall poach the poachers!"
64,0,2,False,False,False,3,5,False,1,"Are the resources of the city–state so thinly stretched that they must send adventurers to do their dirty work?"
65,0,2,False,False,False,3,5,False,1,"Damn you all! The forest is not yours to claim!"
66,0,2,False,False,False,3,5,False,1,"Lustyeye uplanders seek goodgobbies' gobbiepack goodies?"
67,0,2,False,False,False,3,3,False,1,"Gobbiepack! Gobbiepack!"
68,0,2,False,False,False,3,3,False,1,"Gobbiepack! Gobbiepack! Little room!"
69,0,2,False,False,False,3,3,False,1,"Gobbiepack! Gobbiepack! Filled with boom!"
70,0,2,False,False,False,3,5,False,1,"No! Gobbiekeep rumbles and overtumbles!"
71,0,2,False,False,False,3,5,False,1,"Backwalk with fastness, uplander! Or else...ba-boom!"
72,0,2,False,False,False,3,3,False,1,"Fireboom! Fireboom!"
73,0,2,False,False,False,3,3,False,1,"Fireboom! Fireboom! Uplander's doom!"
74,0,2,False,False,False,3,3,False,1,"Fireboom! Fireboom! Uplander's tomb!"
75,0,2,False,False,False,3,5,False,1,"Gobbiekeep crumbles and overtumbles!"
76,0,2,False,False,False,3,5,False,1,"Goobiekeep tumbles and undercrumbles!"
77,0,2,False,False,False,3,5,False,1,"Narrowheart uplander seeks overtossing of good Gobbiekeep! Stikflix backpays with much fireboom!"
78,0,2,False,False,False,3,5,False,1,"Gobbiekin! More fireboom! More fireboom!"
79,0,2,False,False,False,3,5,False,1,"Oh! Such soreness of gut! Might we be making busydeal? No?"
80,0,2,False,False,False,3,3,False,1,"Stikflix! Stikflix!"
81,0,2,False,False,False,3,3,False,1,"Stikflix! Stikflix! Quickflicks gloom!"
82,0,2,False,False,False,3,3,False,1,"Stikflix! Stikflix! Fireboom resumes!"
83,0,2,False,False,False,3,5,False,1,"Fellow creatures! Come, follow this one!"
84,0,2,False,False,False,3,5,False,1,"This one angers..."
85,0,2,False,False,False,3,5,False,1,"This one grows weary..."
86,0,2,False,False,False,3,5,False,1,"This one will suffer at the hands of the grounded ones no more!"
87,0,2,False,False,False,3,3,False,1,"Your Highness!"
88,0,2,False,False,False,2,3,False,1,"Sit yer poxy arse down!"
89,0,2,False,False,False,2,3,False,1,"Gah hah hah!"
90,0,2,False,False,False,2,3,False,1,"I could have taken him... Honest!"
91,0,2,False,False,False,3,5,False,1,"You have my thanks!"
92,0,2,False,False,False,3,5,False,1,"Mercy!"
93,0,2,False,False,False,3,5,False,1,"The Order has no need for milksops!"
94,0,2,False,False,False,3,3,False,1,"Oh dear! Here he comes!"
95,0,2,False,False,False,3,5,False,1,"High time I should check the crops..."
96,0,2,False,False,False,3,5,False,1,"The ladybugs! They're attacking the bees!"
97,0,2,False,False,False,2,5,False,1,"Someone help! The poor honeybees don't stand a chance!"
98,0,2,False,False,False,3,5,False,1,"The harvest will be a good one this season. I can feel it! You have my thanks!"
99,0,2,False,False,False,3,5,False,1,"Another harvest lost..."
100,0,2,False,False,False,3,5,False,1,"0"
101,0,2,False,False,False,3,5,False,1,"0"
102,0,2,False,False,False,3,5,False,1,"0"
103,0,2,False,False,False,2,3,False,1,"0"
104,0,2,False,False,False,2,3,False,1,"0"
105,0,2,False,False,False,2,3,False,1,"0"
106,0,2,False,False,False,2,3,False,1,"0"
107,0,2,False,False,False,3,5,False,1,"This one requires aid!"
108,0,2,False,False,False,3,5,False,1,"Many thanks!"
109,0,2,False,False,False,3,5,False,1,"Hm? Do you hear something?"
110,0,2,False,False,False,3,5,False,1,"Why, you sneaky flying rat! I'll see you never eat another Lalafell!"
111,0,2,False,False,False,3,5,False,1,"Sod off, ye sack o' squirrel shite!"
112,0,2,False,False,False,3,5,False,1,"Who invited this bastard!?"
113,0,2,False,False,False,3,5,False,1,"How's about I escort ye off the premises?"
114,0,2,False,False,False,3,5,False,1,"I spy a throat needs slittin'!"
115,0,2,False,False,False,2,3,False,1,"Lookin' fer us?"
116,0,2,False,False,False,2,3,False,1,"Sneaky bastards."
117,0,2,False,False,False,2,3,False,1,"Body feels...so heavy..."
118,0,2,False,False,False,2,3,False,1,"Curses! Not now!"
119,0,2,False,False,False,3,5,False,1,"They are too quick for me... I am done for..."
120,0,2,False,False,False,3,5,False,1,"I don't believe they will follow any further."
121,0,2,False,False,False,3,5,False,1,"You have done a great service for Ul'dah."
122,0,2,False,False,False,2,3,False,1,"<rumble> <rumble>"
123,0,2,False,False,False,2,3,False,1,"<rumble>"
124,0,2,False,False,False,3,5,False,1,"Sheep! Scores of them!"
125,0,2,False,False,False,3,5,False,1,"Slay the rabid beasts before they can force their way to the Zephyr Gate!"
126,0,2,False,False,False,3,5,False,1,"I fear my pursuers may have circled around, and await us ahead."
127,0,2,False,False,False,3,5,False,1,"If the Amalj'aa have already made it this far, they will use this place to trap us."
128,0,2,False,False,False,3,5,False,1,"Little Ala Mhigo is close, but not close enough. Look alive, friend!"
129,0,2,False,False,False,3,10,False,1,"We're discovered!"
130,0,2,False,False,False,2,5,False,1,"How did ye find this place!?"
131,0,2,False,False,False,2,4,False,1,"Me loyal pups!"
132,0,2,False,False,False,2,4,False,1,"Come closer. I'll slit yer throat and toss yer corpse to the mad serpent."
133,0,2,False,False,False,2,4,False,1,"Wh-Where are me men!? Wh-Where are me maidens!?"
134,0,2,False,False,False,2,6,False,1,"Try an' catch me, ye two-legged lubber!"
135,0,2,False,False,False,2,4,False,1,"Back fer more, eh? I sharpened me blade, just fer this very occasion."
136,0,2,False,False,False,2,2,False,1,"Eat 'em alive!"
137,0,2,False,False,False,2,4,False,1,"M-M-Might ye consider a parley?"
138,0,2,False,False,False,2,6,False,1,"The boss ain't goin' to like this one bit..."
139,0,2,False,False,False,2,4,False,1,"0"
140,0,2,False,False,False,2,4,False,1,"Die!"
141,0,2,False,False,False,2,4,False,1,"Take the women alive!"
142,0,2,False,False,False,2,4,False,1,"To the abyss with ye!"
143,0,2,False,False,False,2,5,False,1,"Kindly uplander! Gobbieflock needs quick hand-lending!"
144,0,2,False,False,False,2,4,False,1,"Pshkohhh... Overmany deepsores... Blood and bile! Blood and bile!"
145,0,2,False,False,False,2,4,False,1,"Hand-lending! Hand-lending!"
146,0,2,False,False,False,2,4,False,1,"Pshkohhh... Much soreness..."
147,0,2,False,False,False,2,6,False,1,"Uplander saves gobbieflock! Huzzah! Zah hah!"
148,0,2,False,False,False,2,6,False,1,"Many thanks! Many thanks!"
149,0,2,False,False,False,2,6,False,1,"Kindly uplander now taking gobbie jinglyshine!"
150,0,2,False,False,False,3,6,False,1,"Shkoh! Shkoh! More fastness! More fastness!"
151,0,2,False,False,False,3,3,False,1,"Shkoh! Brayflox shall see to thunderfoot!"
152,0,2,False,False,False,3,4,False,1,"Shkoh! Shkoh! More backstrike! More forestrike!"
153,0,2,False,False,False,2,4,False,1,"Psheew... Brayflox backwalks from foregate of deathpit!"
154,0,2,False,False,False,2,6,False,1,"Shkoh! Shkoh! Gobfists of Brayflox are having no match!"
155,0,2,False,False,False,2,3,False,1,"Shkoh! Shkoh! Fireboom! Overboom!"
156,0,2,False,False,False,3,2,False,1,"Gobbie...boom?"
157,0,2,False,False,False,2,5,False,1,"Shkoh! Shkoh! Present for kindly uplander!"
158,0,2,False,False,False,2,8,False,1,"Shkoh! Shkoh! Victory for Brayflox! Longstop is not overturning!"
159,0,2,False,False,False,2,6,False,1,"Brayflox is come to give goodly uplander gobbie hand-lending!"
160,0,2,False,False,False,2,6,False,1,"There! Thunderclaw is blood and bile!"
161,0,2,False,False,False,2,6,False,1,"Othermore deednotch added to gobbiebelt!"
162,0,2,False,False,False,2,10,False,1,"Oh, goodly Brayflox!"
163,0,2,False,False,False,2,10,False,1,"Oh, mighty Brayflox!"
164,0,2,False,False,False,2,30,False,1,"Yes, yes! More tongueflaps! More tongueflaps!"
165,0,2,False,False,False,3,5,False,1,"Help! Someone! I'm being chased by jackals!"
166,0,2,False,False,False,3,5,False,1,"Get away!"
167,0,2,False,False,False,3,5,False,1,"I was only joking!"
168,0,2,False,False,False,3,5,False,1,"Please! I didn't mean any harm!"
169,0,2,False,False,False,3,5,False,1,"I'm...still alive...? Thank the Twelve!"
170,0,2,False,False,False,2,3,False,1,"What in the seven hells is that thing!?"
171,0,2,False,False,False,2,3,False,1,"No man in his right mind would fish here!"
172,0,2,False,False,False,3,5,False,1,"You hear that?"
173,0,2,False,False,False,3,5,False,1,"I need a drink..."
174,0,2,False,False,False,2,5,False,1,"For the Admiral!"
175,0,2,False,False,False,3,5,False,1,"Look alive, privates!"
176,0,2,False,False,False,3,5,False,1,"They're only bloody jackals!"
177,0,2,False,False,False,2,5,False,1,"Must I do everything!?"
178,0,2,False,False,False,2,5,False,1,"You haven't had enough, have you!?"
179,0,2,False,False,False,2,5,False,1,"Suck it up, lad! You're a storm soldier now!"
180,0,2,False,False,False,3,5,False,1,"Something's wrong... I can feel it..."
181,0,2,False,False,False,3,5,False,1,"Another victory for the Admiral!"
182,0,2,False,False,False,3,5,False,1,"A disgrace! Each and every one of you!"
183,0,2,False,False,False,3,5,False,1,"I suppose it's time I be makin' the rounds."
184,0,2,False,False,False,3,5,False,1,"I have a bad feelin' 'bout this."
185,0,2,False,False,False,3,5,False,1,"Bloody hells! Not again!"
186,0,2,False,False,False,3,5,False,1,"If I never see another cave bat, it'll be too soon."
187,0,2,False,False,False,3,5,False,1,"You stay the hells away from my stock, you filthy flyin' rat!"
188,0,2,False,False,False,3,5,False,1,"Me dodos! Someone save me poor dodos!"
189,0,2,False,False,False,2,5,False,1,"We cannot let these bats out to feed. Their bite'll drive both man and beast to madness!"
190,0,2,False,False,False,3,3,False,1,"Today is the day! The miller's daughter will finally be mine!"
191,0,2,False,False,False,3,3,False,1,"Oh, wherever could he be?"
192,0,2,False,False,False,3,3,False,1,"Many have visited the maiden's garden, yet her flower remains unplucked."
193,0,2,False,False,False,3,3,False,1,"Today, that changes!"
194,0,2,False,False,False,3,3,False,1,"Ah, milady. Will you forgive me for my tardiness?"
195,0,2,False,False,False,3,1,False,1,"Out here, all alone... I was so frightened! "
196,0,2,False,False,False,3,2,False,1,"Why did you wish to see me so far from town?"
197,0,2,False,False,False,3,2,False,1,"Ah yes, let me explain, my love..."
198,0,2,False,False,False,3,1,False,1,"Your love?"
199,0,2,False,False,False,3,2,False,1,"Your eyes are like sapphires, your lips, rubies. And your breasts... Those br─"
200,0,2,False,False,False,3,1,False,1,"What was that!?"
201,0,2,False,False,False,3,3,False,1,"A-A-A monster! Save me!"
202,0,2,False,False,False,3,3,False,1,"Save you!? Who's going to save me!?"
203,0,2,False,False,False,2,5,False,1,"Do something! Anything!"
204,0,2,False,False,False,2,5,False,1,"It's your fault we're out here in the first place!"
205,0,2,False,False,False,3,2,False,1,"I'm going home."
206,0,2,False,False,False,3,2,False,1,"W-Wait!"
207,0,2,False,False,False,3,2,False,1,"Don't ever call on me again, coward!"
208,0,2,False,False,False,3,2,False,1,"B-But I never got the chance to tell you about your br─"
209,0,2,False,False,False,3,3,False,1,"Hmph!"
210,0,2,False,False,False,3,3,False,1,"<sigh> I wonder if she has a sister..."
211,0,2,False,False,False,3,3,False,1,"Did you hear that?"
212,0,2,False,False,False,3,3,False,1,"Hah hah! Right into me hands!"
213,0,2,False,False,False,3,3,False,1,"Freebooters! Keep them away!"
214,0,2,False,False,False,3,3,False,1,"What does it look like I'm doing?"
215,0,2,False,False,False,3,3,False,1,"Have at 'em lads! Ye keep what ye kill!"
216,0,2,False,False,False,3,5,False,1,"The damned gobdaw's at it again!"
217,0,2,False,False,False,2,5,False,1,"Quiet down before I shut you up myself!"
218,0,2,False,False,False,2,5,False,1,"I told you to stop!"
219,0,2,False,False,False,2,5,False,1,"I'll show you what we here at the Quay think of stowaways."
220,0,2,False,False,False,2,5,False,1,"Step aside, honeybee. I's no quarrel wiv yer ilk."
221,0,2,False,False,False,2,5,False,1,"I paid fer me passage, proper. The damn captain's fillin' yer ears with gobshite."
222,0,2,False,False,False,2,5,False,1,"I ain't no stowaway!"
223,0,2,False,False,False,3,5,False,1,"You're askin' for it!"
224,0,2,False,False,False,3,5,False,1,"I could use a little help over here, sir!"
225,0,2,False,False,False,3,5,False,1,"So it's a fight ye all want, eh?"
226,0,2,False,False,False,3,5,False,1,"That quiet you down, did it?"
227,0,2,False,False,False,3,5,False,1,"May the mighty serpent drag yer arses all the way down to the abyss!"
228,0,2,False,False,False,3,5,False,1,"So, are you finally ready to talk?"
229,0,2,False,False,False,3,5,False,1,"I's less 'an naught to say to you and yers."
230,0,2,False,False,False,3,5,False,1,"Then to the brig it is. Grab the shackles, men."
231,0,2,False,False,False,3,5,False,1,"No... Not there again. Anywhere but there! Please! I'll tell you all you want to know! Honest!"
232,0,2,False,False,False,3,5,False,1,"Godsdammit to the seventh hell and back!"
233,0,2,False,False,False,3,5,False,1,"Sod off, honeybees!"
234,0,2,False,False,False,3,5,False,1,"We'll find you, bastard!"
235,0,2,False,False,False,3,5,False,1,"No man can rule Ahctstymm Shadowlurker!"
236,0,2,False,False,False,2,3,False,1,"Get them gropers off me grog!"
237,0,2,False,False,False,2,3,False,1,"Sod off! I drink what I want."
238,0,2,False,False,False,2,3,False,1,"<Emphasis>I'll</Emphasis> cut ye a new gob so's that ye can drink all grog ye like!"
239,0,2,False,False,False,2,3,False,1,"Not afore I cut ye a new piss'ole!"
240,0,2,False,False,False,2,5,False,1,"Get yer hands off me, honeybees!"
241,0,2,False,False,False,3,3,False,1,"Kill every last one of them!"
242,0,2,False,False,False,3,3,False,1,"Cursed orobon!"
243,0,2,False,False,False,3,3,False,1,"Coblyns sighted ahead!"
244,0,2,False,False,False,3,3,False,1,"Don't let those ants take another child!"
245,0,2,False,False,False,3,3,False,1,"The ore must get through!"
246,0,2,False,False,False,3,3,False,1,"Those accursed goats will see this desert reduced to a...well, a desert!"
247,0,2,False,False,False,3,3,False,1,"The lizards march west! We must intercept them!"
248,0,2,False,False,False,3,3,False,1,"Amalj'aa raiders! Men! To your positions!"
249,0,2,False,False,False,3,3,False,1,"Those bothersome imps are up to no good!"
250,0,2,False,False,False,3,3,False,1,"The Amalj'aa approach! Meet them in field!"
251,0,2,False,False,False,3,3,False,1,"What are landtraps doing in the desert!?"
252,0,2,False,False,False,3,3,False,1,"I told those damn Ala Mhigans to cover their piss!"
253,0,2,False,False,False,3,3,False,1,"They say the dead rise from the abyss each night to claim the souls of the living."
254,0,2,False,False,False,3,3,False,1,"S-S-Souls of the l-l-l-living?"
255,0,2,False,False,False,3,3,False,1,"You sound as if you believe that bilge!"
256,0,2,False,False,False,3,3,False,1,"Believe it? No... It's just..."
257,0,2,False,False,False,3,3,False,1,"Hah! You're worse than my skin and blister!"
258,0,2,False,False,False,3,3,False,1,"Didn't your ma ever tell you!? There's no such thing as ghosts!"
259,0,2,False,False,False,3,3,False,1,"Th-Th-Then what is that!?"
260,0,2,False,False,False,3,3,False,1,"P-Probably just a firefly."
261,0,2,False,False,False,3,3,False,1,"It l-l-l-looks awfully big to be a f-f-firefly..."
262,0,2,False,False,False,3,3,False,1,"Then it's a ship...or a lighthouse...or a...uh..."
263,0,2,False,False,False,3,3,False,1,"A GHOST!!!"
264,0,2,False,False,False,3,5,False,1,"Mummy! Save me!"
265,0,2,False,False,False,3,5,False,1,"Wait! D-D-Don't leave me here!"
266,0,2,False,False,False,2,5,False,1,"P-P-Please don't claim m-m-my soul!"
267,0,2,False,False,False,2,5,False,1,"B-B-B-B-Begone?"
268,0,2,False,False,False,3,5,False,1,"It w-w-worked!"
269,0,2,False,False,False,3,5,False,1,"Or not! Aaaaaahhh!"
270,0,2,False,False,False,3,3,False,1,"It's the rats... I can hear their squeaking!"
271,0,2,False,False,False,3,3,False,1,"The exercise is open to all who wish to join!"
272,0,2,False,False,False,3,3,False,1,"Why flour? Why not millioncorn or ogre pumpkins or grapes?"
273,0,2,False,False,False,3,3,False,1,"This place is simply crawling with yarzons!"
274,0,2,False,False,False,3,3,False,1,"The goblins'll be here any moment, and then, not a single cog'll be safe!"
275,0,2,False,False,False,3,3,False,1,"Need...cores..."
276,0,2,False,False,False,3,3,False,1,"I wants 'em dead... All dead..."
277,0,2,False,False,False,3,3,False,1,"My appointment! Whatever shall I tell them!?"
278,0,2,False,False,False,3,3,False,1,"But how am I to get from <Emphasis>here</Emphasis> to <Emphasis>there</Emphasis>?"
279,0,2,False,False,False,3,3,False,1,"A good beating─that's what these recruits need."
280,0,2,False,False,False,3,3,False,1,"One day, that wench'll be mine."
281,0,2,False,False,False,3,3,False,1,"One day, that wench'll be mine."
282,0,2,False,False,False,3,3,False,1,"What did you say!?"
283,0,2,False,False,False,3,3,False,1,"The wench is mine!"
284,0,2,False,False,False,3,3,False,1,"And I say she's mine!"
285,0,2,False,False,False,3,3,False,1,"And I say yer full of crab shite!"
286,0,2,False,False,False,3,3,False,1,"And I say yer full of...of...more crab shite!"
287,0,2,False,False,False,3,3,False,1,"Alright, you two. Clap the traps. She ain't neither of yours."
288,0,2,False,False,False,3,3,False,1,"This ain't none of your business."
289,0,2,False,False,False,3,3,False,1,"Aye, this is between me and this here sod."
290,0,2,False,False,False,2,5,False,1,"<pant> <pant>"
291,0,2,False,False,False,3,3,False,1,"Excellent work, men. The checkpoint is secure!"
292,0,2,False,False,False,3,3,False,1,"Thal's balls! You think it will be any easier when the imperials come!?"
293,0,2,False,False,False,2,3,False,1,"We did it! The day is ours!"
294,0,2,False,False,False,2,3,False,1,"This bodes ill for the checkpoint..."
295,0,2,False,False,False,3,3,False,1,"Heh heh. That should teach the lads."
296,0,2,False,False,False,3,3,False,1,"It seems my recruits aren't the only ones who are soft..."
297,0,2,False,False,False,2,3,False,1,"I should've become a culinarian!"
298,0,2,False,False,False,3,3,False,1,"I see the caravans now. The oranges will be safe!"
299,0,2,False,False,False,2,3,False,1,"My harvest... It's gone..."
300,0,2,False,False,False,2,3,False,1,"These oranges are off to the pleasure boats, you say? Might be I should see the crates there myself."
301,0,2,False,False,False,2,3,False,1,"The bridge is ours once again!"
302,0,2,False,False,False,2,3,False,1,"Bleedin' honeybees... You'd best sleep with one eye open!"
303,0,2,False,False,False,2,3,False,1,"The galagos! They're gone! I can finally deliver my flour to market!"
304,0,2,False,False,False,2,3,False,1,"Pickman! Pickman! Worthy, we are not!"
305,0,2,False,False,False,3,3,False,1,"In the name of Titan, Lord of Crags, crushed shall you be!"
306,0,2,False,False,False,2,3,False,1,"Well, now that's settled, I can get back to work."
307,0,2,False,False,False,2,3,False,1,"Doesn't look like the goblins did too much damage."
308,0,2,False,False,False,2,3,False,1,"Another shipment lost...and the new one will come out of my pay..."
309,0,2,False,False,False,2,3,False,1,"Backrun! Backrun!"
310,0,2,False,False,False,2,3,False,1,"Thank...you..."
311,0,2,False,False,False,2,3,False,1,"Allow a single peiste to cross and I'll see to it you're docked a full moon's salary!"
312,0,2,False,False,False,2,3,False,1,"Next season's catch is safe...for now."
313,0,2,False,False,False,2,3,False,1,"The coblyns have withdrawn. Return to barracks!"
314,0,2,False,False,False,3,3,False,1,"Send those pirates plummeting!"
315,0,2,False,False,False,2,3,False,1,"Ye dinnae get et. <If(PlayerParameter(4))>Thank ye.<Else/>Will ye be me new da?</If>"
316,0,2,False,False,False,2,3,False,1,"The children are safe! Now let us fill that hole!"
317,0,2,False,False,False,2,3,False,1,"I really should be off. I mustn't keep the noble ladies waiting!"
318,0,2,False,False,False,2,3,False,1,"The area is clear."
319,0,2,False,False,False,2,3,False,1,"Ah, let us marvel in the beauty of the desert! (Just disregard those goat corpses.)"
320,0,2,False,False,False,2,3,False,1,"Crawl back under your rocks, foul lizards!"
321,0,2,False,False,False,2,3,False,1,"To Zahar'ak! Retreat!"
322,0,2,False,False,False,2,3,False,1,"Wine and glory to the victors!"
323,0,2,False,False,False,2,3,False,1,"One day this land will be ours again!"
324,0,2,False,False,False,2,3,False,1,"<Emphasis>You</Emphasis> aren't an imp, are you? Hah hah! I jest!"
325,0,2,False,False,False,2,3,False,1,"From dust, to dust!"
326,0,2,False,False,False,2,3,False,1,"The desert is no place for rose...ling."
327,0,2,False,False,False,2,3,False,1,"You haven't seen the last of us!"
328,0,2,False,False,False,2,3,False,1,"Mayhap this will teach those degenerates to piss elsewhere."
329,0,2,False,False,False,2,3,False,1,"I couldn't have made it on my own. You have our gratitude."
330,0,2,False,False,False,2,3,False,1,"Foolish are the sons of man. The past is to be left to slumber."
331,0,2,False,False,False,3,5,False,1,"Damned vixen!"
332,0,2,False,False,False,3,5,False,1,"Is that all? Might be you left your member at home with your blade."
333,0,2,False,False,False,3,5,False,1,"She's all yours, friend!"
334,0,2,False,False,False,3,5,False,1,"If you think you can do any better, I invite you to try."
335,0,2,False,False,False,3,5,False,1,"This way."
336,0,2,False,False,False,3,5,False,1,"Now, let us begin."
337,0,2,False,False,False,2,5,False,1,"Hah! I've felt bigger stings from a flea bite."
338,0,2,False,False,False,2,5,False,1,"Ah, this is living!"
339,0,2,False,False,False,2,5,False,1,"Who's next!?"
