key,0,1
188,"TEXT_FESGSC501_04054_ROLAND_000_134","Lass die Scherze. Also, wer ist nun der Täter?"
189,"TEXT_FESGSC501_04054_OLLIER_000_135","W-Was?!"
190,"TEXT_FESGSC501_04054_DALUCE_000_136","Dann bist du also zum gleichen Schluss wie wir gekommen: Hugue hat das Horn gestohlen."
191,"TEXT_FESGSC501_04054_DALUCE_000_137","Bleibt nur noch die Frage zu klären, wo er es versteckt hat. "
192,"TEXT_FESGSC501_04054_DALUCE_000_138","Hast du komplett den Verstand verloren?"
193,"TEXT_FESGSC501_04054_DALUCE_000_139","Ich werde mir diesen Unsinn keine Sekunde länger anhören. Führt Hugue ab."
194,"TEXT_FESGSC501_04054_SASAPANO_000_140","(-Pipimaya-)D-Das beweist noch längst nicht, dass ich der Täter bin! Ich bin schließlich nicht der einzige Lalafell im Gold Saucer!"
195,"TEXT_FESGSC501_04054_Q10_000_000","Was sagst du?"
196,"TEXT_FESGSC501_04054_A10_000_001","Dein Bruder soll ja ziemlich MGP-versessen sein<Indent/>..."
197,"TEXT_FESGSC501_04054_A10_000_002","Das ist auch wieder wahr<Indent/>..."
198,"TEXT_FESGSC501_04054_A10_000_003","Hmpf!"
199,"TEXT_FESGSC501_04054_SASAPANO_000_141","(-Pipimaya-)Ich bin mir auch sicher, dass Hugue unschuldig ist. Genauso wie ich. Weder ich noch Hugue haben die Tat begangen!"
200,"TEXT_FESGSC501_04054_SASAPANO_000_142","(-Pipimaya-)Woher hast du diese Information?"
201,"TEXT_FESGSC501_04054_SASAPANO_000_143","(-Pipimaya-)U-Und überhaupt, ich habe ein Alibi! Ich habe während der Tatzeit bei einem Chocobo-Rennen mitgemacht! "
202,"TEXT_FESGSC501_04054_SASAPANO_000_144","(-Pipimaya-)Das für die Chocobo-Rennen verantwortliche Personal wird bestätigen, dass ich dort war."
203,"TEXT_FESGSC501_04054_Q11_000_000","Was sagst du?"
204,"TEXT_FESGSC501_04054_A11_000_001","Da habe ich mich wohl gründlich vertan. Ich bitte um Entschuldigung, Mayapipi."
205,"TEXT_FESGSC501_04054_A11_000_002","Gib die Tat endlich zu!"
206,"TEXT_FESGSC501_04054_SASAPANO_000_145","(-Pipimaya-)Was sollen diese Beschuldigungen? Bestimmt ist auch Hugue unschuldig. Weder er noch ich haben die Tat begangen!"
207,"TEXT_FESGSC501_04054_PIPIMAYA_000_150","(-???-)Es scheint alles nach Plan zu verlaufen<Indent/>..."
208,"TEXT_FESGSC501_04054_OLLIER_000_151","Zusammenfassend lässt sich also sagen, dass die Beweislage für einen Schuldspruch Hugues nicht ausreicht. Richtig? "
209,"TEXT_FESGSC501_04054_DALUCE_000_152","Den ultimativen Beweis für seine Täterschaft gibt es nicht, das stimmt."
210,"TEXT_FESGSC501_04054_DALUCE_000_153","Mag sein, dass wir uns getäuscht haben. In dem Fall entschuldige ich mich."
211,"TEXT_FESGSC501_04054_DALUCE_000_154","Fragt sich nur, wer denn nun der wirkliche Täter ist."
212,"TEXT_FESGSC501_04054_PIPIMAYA_000_155","(-???-)Es scheint alles nach Plan zu verlaufen<Indent/>..."
213,"TEXT_FESGSC501_04054_SASAPANO_000_160","(-Pipimaya-)Mayapipi? Frechheit! Es ist doch wohl nicht zu viel verlangt, dass man bei seinem richtigen Namen genannt wird, oder was? "
214,"TEXT_FESGSC501_04054_BRASSBLADESMANC04054_000_161","W-Wie bitte? Mayapipi<Indent/>..."
215,"TEXT_FESGSC501_04054_PIPIMAYA_000_162","(-???-)Es ist genug, Sasapano."
216,"TEXT_FESGSC501_04054_PIPIMAYA_000_163","(-Lalafell, der Pipimaya gleicht-)Das nenne ich Scharfsinn. Ihr habt Recht, Hugue ist nicht der Täter."
217,"TEXT_FESGSC501_04054_PIPIMAYA_000_164","(-Lalafell, der Pipimaya gleicht-)Wir haben das Horn gestohlen."
218,"TEXT_FESGSC501_04054_BRASSBLADESMANC04054_000_165","Ihr ... b-beide?"
219,"TEXT_FESGSC501_04054_DALUCE_000_166","Was zum<Indent/>...?"
220,"TEXT_FESGSC501_04054_ROLAND_000_167","Was geht hier vor? Würdet ihr uns bitte aufklären?"
221,"TEXT_FESGSC501_04054_PIPIMAYA_000_168","Ich bin der wahre Pipimaya. Und der, den ihr alle für Pipimaya gehalten habt, ist in Wahrheit ... mein jüngerer Bruder Sasapano."
222,"TEXT_FESGSC501_04054_PIPIMAYA_000_169","Es gibt noch einen dritten Bruder, der jüngste von uns dreien. Er ist nicht nur äußerst intelligent, sondern auch ausgesprochen sportlich. Wir sind sehr stolz auf ihn."
223,"TEXT_FESGSC501_04054_PIPIMAYA_000_170","Eines Tages erkrankte unser kluger Bruder an einer unheilbaren Krankheit. Die Ärzte teilten uns mit, dass er nicht mehr lange zu leben habe."
224,"TEXT_FESGSC501_04054_PIPIMAYA_000_171","Wir versprachen ihm, dass wir ihm jede Bitte in der ihm verbleibenden Zeit erfüllen würden."
225,"TEXT_FESGSC501_04054_PIPIMAYA_000_172","Er hatte nur einen Wunsch: Er wollte auf einem Imperator-Kaktor reiten. Da ich im Gold Saucer hin und wieder Wache schiebe, wusste ich, dass man das Imperator-Kaktor-Horn benötigt, um den Imperator-Kaktor herbeizurufen. Doch das Horn ist nicht gerade billig."
226,"TEXT_FESGSC501_04054_PIPIMAYA_000_173","Mein Bruder und ich beschlossen, so viele MGP wie möglich zusammenzukriegen, um den Traum unseres kranken Bruders zu erfüllen. Vor allem Sasapano verbrachte von da an fast jede freie Minute im Gold Saucer."
227,"TEXT_FESGSC501_04054_PIPIMAYA_000_174","Doch obwohl wir eine beachtliche Summe an MGP angehäuft hatten, reichte sie noch lange nicht aus, um das Horn zu erwerben. Der Zustand unseres Bruders verschlechterte sich zusehends und wir wussten, dass uns allmählich die Zeit davonlief."
228,"TEXT_FESGSC501_04054_PIPIMAYA_000_175","Ich war es, der die Idee zum Diebstahl hatte. Ich wusste von meinen Wachdiensten, dass während des Gold Saucer-Festivals das Personal alle Hände voll zu tun hat, den großen Besucherandrang zu bewältigen, und dass daher der Schalter zuweilen unbewacht war."
229,"TEXT_FESGSC501_04054_PIPIMAYA_000_176","Der Rest spielte sich so ab, wie <Split(<Highlight>ObjectParameter(1)</Highlight>, ,1)/> es geschildert hat. Es war ein guter Plan, aber wir hatten nicht damit gerechnet, dass es so schwierig sein würde, das Horn aus dem Gold Saucer zu schmuggeln<Indent/>- und auch nicht, dass uns jemand so schnell auf die Schliche kommt<Indent/>..."
230,"TEXT_FESGSC501_04054_ROLAND_000_177","So war das also<Indent/>..."
231,"TEXT_FESGSC501_04054_DALUCE_000_178","Wir haben dich zu Unrecht beschuldigt. Das ist ein unverzeihlicher Fehler. Bitte vergib uns."
232,"TEXT_FESGSC501_04054_DALUCE_000_179","Du hast dein Wissen als Wachdienst leistende Messingklinge missbraucht, um das Horn zu stehlen. Ist dir die Schwere deines Vergehens bewusst?"
233,"TEXT_FESGSC501_04054_HUGUE_000_180","... <räusper>"
234,"TEXT_FESGSC501_04054_HUGUE_000_181","Ich würde gerne etwas sagen<Indent/>..."
235,"TEXT_FESGSC501_04054_HUGUE_000_182","Wie ihr wisst, gehöre ich zum Personal des Gold Saucers. Doch bevor ich hier zu arbeiten anfing, besaß ich weder ein Dach über dem Kopf noch eine anständige Arbeit."
236,"TEXT_FESGSC501_04054_HUGUE_000_183","Ich lebte von der Hand in den Mund und erfüllte meine Mutter kaum mit Stolz."
237,"TEXT_FESGSC501_04054_HUGUE_000_184","Selbstverständlich verfügte ich nicht über die finanziellen Mittel, um meiner Mutter etwas zum Geburtstag zu kaufen. Doch eines Tages beschloss ich aus einem Impuls heraus, einen Ring zu stehlen, um ihn ihr zu schenken."
238,"TEXT_FESGSC501_04054_HUGUE_000_185","Ich wurde geschnappt und schämte mich zutiefst, doch für Reue war es nun zu spät. Ich verlor meine Tagesarbeit und fand auch keine neue mehr. Niemand wollte einen Dieb anstellen. Statt meiner Mutter eine Freude zu bereiten, hatte ich ihr nur noch mehr Kummer beschert."
239,"TEXT_FESGSC501_04054_HUGUE_000_186","Ich war am Tiefpunkt meines Lebens angelangt, als etwas geschah, womit ich nicht gerechnet hatte: Jemand fragte mich, ob ich nicht für ihn arbeiten wolle."
240,"TEXT_FESGSC501_04054_HUGUE_000_187","Der Mann, dessen Ring ich gestohlen hatte, bot mir eine Arbeit an: Genau, niemand Geringerer als Godbert Manderville, der Eigentümer des Gold Saucers."
241,"TEXT_FESGSC501_04054_HUGUE_000_188","Und so kam ich zu meiner aktuellen Anstellung. Heute kann ich mit meinem Lohn sogar für den Unterhalt meiner Mutter aufkommen."
242,"TEXT_FESGSC501_04054_HUGUE_000_189","Als nun der Verdacht wegen meiner Vorgeschichte auf mich fiel, war ich deswegen nicht wirklich überrascht. Zum Glück konnte der Irrtum nun aber aufgeklärt werden. Dennoch empfinde ich nichts als Mitleid für Pipimaya und seinen Bruder. Wie ich haben auch sie aus einem ehrbaren Motiv heraus eine riesige Dummheit begangen."
243,"TEXT_FESGSC501_04054_HUGUE_000_190","Und deswegen bitte ich euch: Urteilt nicht zu hart über sie!"
244,"TEXT_FESGSC501_04054_GODBERT_000_191","(-???-)Ohoho ... Ich habe alles mitgehört."
245,"TEXT_FESGSC501_04054_GODBERT_000_192","Daluce, auf die Bestrafung komme ich später zu sprechen. Zuerst möchte ich jedoch eine Ankündigung machen."
246,"TEXT_FESGSC501_04054_GODBERT_000_193","Pipimaya, Sasapano - ich schenke eurem Bruder das Imperator-Kaktor-Horn!"
247,"TEXT_FESGSC501_04054_GODBERT_100_193","Von einer offiziellen Anzeige sehe ich ab, daher braucht ihr auch nicht zu befürchten, als Diebe verhaftet und eingekerkert zu werden."
248,"TEXT_FESGSC501_04054_Q12_000_000","Was sagst du?"
249,"TEXT_FESGSC501_04054_A12_000_001","Was für eine großzügige Geste!"
250,"TEXT_FESGSC501_04054_A12_000_002","Ich will auch eins!"
251,"TEXT_FESGSC501_04054_GODBERT_000_194","Hohoho! Dann musst du eben wie alle anderen fleißig MGP scheffeln."
252,"TEXT_FESGSC501_04054_GODBERT_000_195","Doch nun zur Bestrafung der beiden Täter. Ich verstehe zwar die Umstände, die zur Tat geführt haben, aber Diebstahl bleibt nun einmal Diebstahl."
253,"TEXT_FESGSC501_04054_GODBERT_000_196","Hugues Worte haben mich dennoch nicht unberührt gelassen. Ich möchte daher einen Vorschlag unterbreiten."
254,"TEXT_FESGSC501_04054_GODBERT_000_197","Wie wäre es, wenn Pipimaya und Sasapano ihre Strafe in Form von gemeinnütziger Arbeit hier im Gold Saucer verbüßen?"
255,"TEXT_FESGSC501_04054_GODBERT_000_198","Pipimaya, du sollst ein Señor Kaktor-Kostüm tragen und die Kinder in Frondales Physiatrischer Akademie aufmuntern, die wie dein Bruder krank sind."
256,"TEXT_FESGSC501_04054_GODBERT_000_199","Lass dir gesagt sein: Es ist nicht einfach, in die stachelige Haut eines Kaktors zu schlüpfen<Indent/>... Willst du dich dieser Heraus<SoftHyphen/>forde<SoftHyphen/>rung stellen?"
257,"TEXT_FESGSC501_04054_PIPIMAYA_000_200","Es ist mir eine Ehre!"
258,"TEXT_FESGSC501_04054_GODBERT_000_201","Nun zu dir, Sasapano. Du kennst dich im Gold Saucer hervorragend aus."
259,"TEXT_FESGSC501_04054_GODBERT_000_202","Ich möchte daher, dass du die weniger schwer erkrankten Kinder der Akademie zu uns einlädst und sie herumführst. Kannst du das?"
260,"TEXT_FESGSC501_04054_GODBERT_000_203","Irgendwelche Einwände, Daluce?"
261,"TEXT_FESGSC501_04054_DALUCE_000_204","Wenn ein Mitglied des Scor<SoftHyphen/>pio-Krei<SoftHyphen/>ses und der Eigentümer des Gold Saucers mit dieser Lösung zufrieden ist, sind wir Messingklingen es ebenfalls."
262,"TEXT_FESGSC501_04054_GODBERT_000_205","Fantastisch! Dann wäre die Angelegenheit ja geklärt!"
263,"TEXT_FESGSC501_04054_OLLIER_000_220","Ich fasse es nicht, dass Hugue wirklich der Täter sein soll."
264,"TEXT_FESGSC501_04054_OLLIER_000_221","Trotzdem danke, dass du geholfen hast, die Wahrheit ans Licht zu bringen, selbst wenn sie mir nicht gefällt<Indent/>... Für deine Mühen möchten wir uns gerne mit einem kleinen Geschenk erkenntlich zeigen. Sprich meinen Kollegen neben mir an, er weiß mehr darüber."
265,"TEXT_FESGSC501_04054_OLLIER_000_222","Danke, dass du Hugue davor bewahrt hast, Opfer eines großen Irrtums zu werden! Wir wissen zwar noch nicht, wer der wahre Täter ist, doch die Hauptsache ist, dass keiner mehr Hugues Unschuld anzweifelt. "
266,"TEXT_FESGSC501_04054_OLLIER_000_223","Nochmals vielen, vielen Dank! Für deine Mühen möchten wir uns gerne mit einem kleinen Geschenk erkenntlich zeigen. Sprich meinen Kollegen neben mir an, er weiß mehr darüber."
267,"TEXT_FESGSC501_04054_OLLIER_000_224","Ich lag goldrichtig damit, dich um Hilfe zu bitten. Du hast nicht nur Hugues Unschuld bewiesen, sondern auch herausgefunden, wer den Diebstahl tatsächlich begangen hat. Einwandfreie Arbeit!"
268,"TEXT_FESGSC501_04054_OLLIER_000_225","Pipimaya und Sasapano sind übrigens nach Hause gegangen, um ihrem Bruder das Imperator-Kaktor-Horn zu überreichen. Der wird Augen gemacht haben!"
269,"TEXT_FESGSC501_04054_OLLIER_000_226","Vielen Dank, <Split(<Highlight>ObjectParameter(1)</Highlight>, ,1)/>. Für deine Mühen möchten wir uns gerne mit einem kleinen Geschenk erkenntlich zeigen. Sprich meinen Kollegen neben mir an, er weiß mehr darüber."
270,"TEXT_FESGSC501_04054_GSSTAFF04054_000_227","Ollier hat mir alles erzählt. Vielen Dank für deine Hilfe."
271,"TEXT_FESGSC501_04054_Q1_200_000","Was willst du dir ansehen?"
272,"TEXT_FESGSC501_04054_A1_200_001","Den Eintrag zum Zustand des Schalters am Tag des Diebstahls"
273,"TEXT_FESGSC501_04054_A1_200_002","Die Zeugenaussage des Besuchers über den Zustand des Schalters"
274,"TEXT_FESGSC501_04054_A1_200_003","Die Unterhaltung mit der unzufriedenen Messingklinge"
275,"TEXT_FESGSC501_04054_A1_200_004","Den Eintrag zum anderen Blickwinkel auf den Schalterbereich"
276,"TEXT_FESGSC501_04054_A1_200_005","Die Unterhaltung mit dem gestressten Mitarbeiter"
277,"TEXT_FESGSC501_04054_A1_200_006","Die Unterhaltung mit der Gerüchte liebenden Messingklinge"
278,"TEXT_FESGSC501_04054_A1_200_007","Die Unterhaltung mit der steifen Mitarbeiterin"
279,"TEXT_FESGSC501_04054_A1_200_008","Die Unterhaltung mit der neuen Messingklinge"
280,"TEXT_FESGSC501_04054_A1_200_009","Die Unterhaltung mit dem geschwätzigen Mitarbeiter"
281,"TEXT_FESGSC501_04054_A1_200_010","Nichts"
282,"TEXT_FESGSC501_04054_SYSTEM_300_001","Du hast noch nichts eingetragen<Indent/>..."
283,"TEXT_FESGSC501_04054_SYSTEM_200_001","(-Zustand des Schalters am Tag des Diebstahls-)<Emphasis>Laut Aussage des Mitarbeiters, der an dem betreffenden Tag am Hauptschalter Lose für den Mini-Glückskaktor verkaufte, war der Besucherandrang im Gold Saucer wegen des Festivals größer als üblich. Ansonsten habe aber alles seinen gewohnten Lauf genommen.</Emphasis>"
284,"TEXT_FESGSC501_04054_SYSTEM_200_002","(-Zustand des Schalters am Tag des Diebstahls-)<Emphasis>Wenn jemand in den Schalterbereich eingedrungen wäre, der nicht zum Personal gehört, wäre ihm dies bestimmt aufgefallen.</Emphasis>"
285,"TEXT_FESGSC501_04054_SYSTEM_200_010","(-Zeugenaussage des Besuchers über den Zustand des Schalters-)<Emphasis>Der Zeuge berichtet, Hugue habe sich einmal vom Schalter entfernt, um eine Besucherführung zu machen. Niemand habe während seiner Abwesenheit seine Position eingenommen.</Emphasis>"
286,"TEXT_FESGSC501_04054_SYSTEM_200_020","(-Unterhaltung mit der unzufriedenen Messingklinge-)<Emphasis>Die Messingklinge äußerte ihren Unmut darüber, dass sie mit der Suche nach dem Diebesgut betraut wurde. Das gestohlene Horn im riesigen Gold Saucer zu finden, käme der Suche nach der Stecknadel im Heuhaufen gleich.</Emphasis>"
287,"TEXT_FESGSC501_04054_SYSTEM_200_030","(-Eintrag zum anderen Blickwinkel auf den Schalterbereich-)<Emphasis>Bei der Unter<SoftHyphen/>such<SoftHyphen/>ung des Schalterbereichs ist auffällig, dass etwas, was zuvor sichtbar gewesen war, von einem gewissen Standpunkt nicht mehr gesehen werden kann. Er sollte erneut untersucht werden, wenn mehr Hinweise zum potenziellen Täter vorliegen.</Emphasis>"
288,"TEXT_FESGSC501_04054_SYSTEM_200_040","(-Unterhaltung mit dem gestressten Mitarbeiter-)<Emphasis>Laut Aussage des Mitarbeiters ist die verlorene Uniform noch immer nicht wieder aufgetaucht.</Emphasis>"
289,"TEXT_FESGSC501_04054_SYSTEM_200_041","(-Unterhaltung mit dem gestressten Mitarbeiter-)<Emphasis>Er habe sogar das Reinigungspersonal um Hilfe gebeten, aber sie hätten nichts gefunden, nicht einmal einen einzigen verlorenen Gegenstand.</Emphasis>"
290,"TEXT_FESGSC501_04054_SYSTEM_200_050","(-Unterhaltung mit der Gerüchte liebenden Messingklinge-)<Emphasis>Laut der Gerüchte liebenden Messingklinge soll Pipimaya offenherzig und beliebt sein und von einigen Kollegen liebevoll „Mayapipi“ genannt werden. Es sehe ihm nicht ähnlich, eine Einladung einfach so zu ignorieren.</Emphasis>"
291,"TEXT_FESGSC501_04054_SYSTEM_200_060","(-Unterhaltung mit der steifen Mitarbeiterin-)<Emphasis>Die Mitarbeiterin verrät, dass ihr Kollege, der den Glückskaktor-Schalter bedient, seine Uniform verloren haben soll. So etwas habe sie in ihrer langen Karriere im Gold Saucer noch nie erlebt.</Emphasis>"
292,"TEXT_FESGSC501_04054_SYSTEM_200_070","(-Unterhaltung mit der neuen Messingklinge-)<Emphasis>Die Aussage der neuen Messingklinge besagt, er habe während seiner Dienstpause Pipimaya zum Essen eingeladen, aber dieser habe ihn einfach ignoriert und sei alleine zum Chocobo-Rennen losgezogen.</Emphasis>"
293,"TEXT_FESGSC501_04054_SYSTEM_200_071","(-Unterhaltung mit der neuen Messingklinge-)<Emphasis>Die Messingklinge erwähnte außerdem, dass Pipimayas jüngerer Bruder ein gern gesehener Gast im Gold Saucer sei.</Emphasis>"
294,"TEXT_FESGSC501_04054_SYSTEM_200_080","(-Unterhaltung mit dem geschwätzigen Mitarbeiter-)<Emphasis>Laut der Aussage soll Pipimayas jüngerer Bruder Stammgast im Gold Saucer sein und keine Attraktion auslassen, bei der es MGP zu holen gebe. Den Gerüchten nach habe er es auf einen besonders teuren Preis abgesehen.</Emphasis>"
295,"TEXT_FESGSC501_04054_SYSTEM_200_081","(-Unterhaltung mit dem geschwätzigen Mitarbeiter-)<Emphasis>Einer der Mitarbeiter hat den Bruder mit Pipimaya verwechselt. Dies könnte darauf hindeuten, dass sich die beiden ähnlich sehen.</Emphasis>"
