key,0,1
#,,
int32,str,str
0,"TEXT_FESGSC501_04054_SEQ_00","※ Dieser Auftrag ist nur für die Dauer des saisonalen Ereignisses verfügbar.

Ollier sucht Hilfe in einer delikaten Angelegenheit."
1,"TEXT_FESGSC501_04054_SEQ_01","※ Dieser Auftrag kann nur für die Dauer des saisonalen Ereignisses angenommen und gespielt werden. Nach Ende des saisonalen Ereignisses kann er nicht mehr abgeschlossen werden. Weitere Informationen findest du auf dem Lodestone.

Ollier erzählt dir, dass ein befreundeter Mitarbeiter des Gold Saucers des Diebstahls bezichtigt wird. Überzeugt von der Unschuld seines Freundes bittet er dich, den wahren Täter zu finden. Sprich erneut mit Ollier in der Manderville-Lounge am Platz der Wunder."
2,"TEXT_FESGSC501_04054_SEQ_02","Du erfährst von Ollier, dass es sich beim Diebesgut um ein Imperator-Kaktor-Horn handelt, das in einer Schublade hinter dem Hauptschalter verwahrt wurde. Da Unbefugte keinen Zutritt zum Schalterbereich haben und Olliers Freund Hugue kurz vor der Entdeckung des Diebstahls am besagten Schalter Dienst versah, fiel der Verdacht auf ihn. Doch auch Roland, der Manager für das Tagesgeschäft im Gold Saucer, hält Hugue für unschuldig und sichert dir seine Unterstützung zu. Bevor du mit deinen Ermittlungen anfängst, sprich erneut mit Ollier in der Manderville-Lounge."
3,"TEXT_FESGSC501_04054_SEQ_03","Ollier überreicht dir ein Notizbuch, in das du alles eintragen sollst, was dir zur Lösung des Falls relevant erscheint. Sprich als Erstes mit dem ängstlichen Mitarbeiter in der Nähe und vermerke in deinem Ermittlungsbuch die gewonnenen Erkenntnisse."
4,"TEXT_FESGSC501_04054_SEQ_04","Du hast mit dem ängstlichen Mitarbeiter gesprochen und seine Aussagen im Ermittlungsbuch notiert. Sprich erneut mit Ollier."
5,"TEXT_FESGSC501_04054_SEQ_05","Ollier ist überzeugt davon, der Wahrheit auf die Spur zu kommen, wenn ihr nur eure Ohren und Augen offen haltet. Suche im Gold Saucer nach Zeugen und Beweisen und kehre zu Ollier zurück, wenn du genug Hinweise gesammelt hast, um den Fall zu lösen, oder wenn du die bisher gesammelten Hinweise noch einmal durchgehen möchtest."
6,"TEXT_FESGSC501_04054_SEQ_06","Vor der versammelten Ge<SoftHyphen/>sell<SoftHyphen/>schaft legst du die Ergebnisse deiner Unter<SoftHyphen/>such<SoftHyphen/>ung dar. Der Fall ist gelöst. Sprich erneut mit Ollier. "
7,"TEXT_FESGSC501_04054_SEQ_07","Ollier dankt dir für deine Bemühungen und schickt dich zu seinem Kollegen, der dir eine Belohnung überreichen wird."
8,"TEXT_FESGSC501_04054_SEQ_08",""
9,"TEXT_FESGSC501_04054_SEQ_09",""
10,"TEXT_FESGSC501_04054_SEQ_10",""
11,"TEXT_FESGSC501_04054_SEQ_11",""
12,"TEXT_FESGSC501_04054_SEQ_12",""
13,"TEXT_FESGSC501_04054_SEQ_13",""
14,"TEXT_FESGSC501_04054_SEQ_14",""
15,"TEXT_FESGSC501_04054_SEQ_15",""
16,"TEXT_FESGSC501_04054_SEQ_16",""
17,"TEXT_FESGSC501_04054_SEQ_17",""
18,"TEXT_FESGSC501_04054_SEQ_18",""
19,"TEXT_FESGSC501_04054_SEQ_19",""
20,"TEXT_FESGSC501_04054_SEQ_20",""
21,"TEXT_FESGSC501_04054_SEQ_21",""
22,"TEXT_FESGSC501_04054_SEQ_22",""
23,"TEXT_FESGSC501_04054_SEQ_23",""
24,"TEXT_FESGSC501_04054_TODO_00","Mit Ollier im Gold Saucer sprechen"
25,"TEXT_FESGSC501_04054_TODO_01","Erneut mit Ollier sprechen"
26,"TEXT_FESGSC501_04054_TODO_02","Mit dem ängstlichen Mitarbeiter sprechen"
27,"TEXT_FESGSC501_04054_TODO_03","Mit Ollier sprechen"
28,"TEXT_FESGSC501_04054_TODO_04","Beweise und Zeugenaussagen sammeln und mit Ollier sprechen"
29,"TEXT_FESGSC501_04054_TODO_05","Erneut mit Ollier sprechen"
30,"TEXT_FESGSC501_04054_TODO_06",""
31,"TEXT_FESGSC501_04054_TODO_07",""
32,"TEXT_FESGSC501_04054_TODO_08",""
33,"TEXT_FESGSC501_04054_TODO_09",""
34,"TEXT_FESGSC501_04054_TODO_10",""
35,"TEXT_FESGSC501_04054_TODO_11",""
36,"TEXT_FESGSC501_04054_TODO_12",""
37,"TEXT_FESGSC501_04054_TODO_13",""
38,"TEXT_FESGSC501_04054_TODO_14",""
39,"TEXT_FESGSC501_04054_TODO_15",""
40,"TEXT_FESGSC501_04054_TODO_16",""
41,"TEXT_FESGSC501_04054_TODO_17",""
42,"TEXT_FESGSC501_04054_TODO_18",""
43,"TEXT_FESGSC501_04054_TODO_19",""
44,"TEXT_FESGSC501_04054_TODO_20",""
45,"TEXT_FESGSC501_04054_TODO_21",""
46,"TEXT_FESGSC501_04054_TODO_22",""
47,"TEXT_FESGSC501_04054_TODO_23",""
48,"TEXT_FESGSC501_04054_OLLIER_000_000","Entschuldigung, hättest du vielleicht einen Moment Zeit für mich?"
49,"TEXT_FESGSC501_04054_OLLIER_000_001","Ach, du bist es! Ich habe dich damals um Mithilfe bei dem „Mordfall“ gebeten. Erinnerst du dich? Ich bin Ollier."
50,"TEXT_FESGSC501_04054_OLLIER_000_002","Es geht wieder um eine Straftat. Nur dieses Mal ist sie nicht vorgetäuscht. So unglaublich es klingt: Im Gold Saucer treibt sich ein Dieb um! Die Messingklingen ermitteln in diesem Fall zurzeit noch, daher bitte ich dich, das Gehörte vertraulich zu behandeln."
51,"TEXT_FESGSC501_04054_OLLIER_000_003","Mein Name ist Ollier und ich bin Angestellter im Gold Saucer."
52,"TEXT_FESGSC501_04054_OLLIER_000_004","Ich würde dich gerne um Hilfe bei einer etwas ... nun ja, delikaten Angelegenheit bitten. So unglaublich es klingt: Im Gold Saucer treibt sich ein Dieb um! Die Messingklingen ermitteln in diesem Fall zurzeit noch, daher bitte ich dich, das Gehörte vertraulich zu behandeln."
53,"TEXT_FESGSC501_04054_OLLIER_000_005","Diebstahl an sich ist schon schlimm genug, aber stell dir bloß vor, jemand vom Personal, der zufällig auch noch ein guter Freund von mir ist, gilt als Hauptverdächtiger!  "
54,"TEXT_FESGSC501_04054_OLLIER_000_006","Es steht für mich außer Frage, dass er es nicht war. Mein Freund wäre zu einer solchen Tat gar nicht fähig. Ich muss seine Unschuld beweisen, aber alleine schaffe ich das nicht."
55,"TEXT_FESGSC501_04054_OLLIER_000_007","Würdest du mir helfen, den wahren Dieb zu überführen?"
56,"TEXT_FESGSC501_04054_OLLIER_000_008","Vielen Dank! Dann treffen wir uns in der Manderville-Lounge am Platz der Wunder. Bis bald!"
57,"TEXT_FESGSC501_04054_OLLIER_000_009","Wenn du noch nie im Gold Saucer warst, dann sprich doch mal mit dem betuchten Jüngling da drüben. Ich habe gehört, dass er Flugscheine zu verschenken hat."
58,"TEXT_FESGSC501_04054_SYSTEM_000_010","Um diesen Auftrag spielen zu können, muss zuvor der Nebenauftrag „Auf ins Vergnügen“ abgeschlossen worden sein, der ab Stufe 15 im Nald-Kreuzgang angenommen werden kann."
59,"TEXT_FESGSC501_04054_OLLIER_000_020","Danke, dass du so schnell gekommen bist."
60,"TEXT_FESGSC501_04054_OLLIER_000_021","Siehst du den Mann dort drüben, der von den Messingklingen bedrängt wird? Das ist mein Freund Hugue, der des Diebstahls bezichtigt wird."
61,"TEXT_FESGSC501_04054_BRASSBLADESMANA04054_000_022","He, du da! Was lungerst du hier herum? Wir ermitteln in einem Kriminalfall. Du hast hier nichts zu suchen."
62,"TEXT_FESGSC501_04054_ROLAND_000_023","(-???-)Immer mit der Ruhe. <If(PlayerParameter(4))>Sie<Else/>Er</If> stört euch doch nicht bei euren Ermittlungen."
63,"TEXT_FESGSC501_04054_ROLAND_000_024","<Split(<Highlight>ObjectParameter(1)</Highlight>, ,1)/>, das nenne ich eine freudige Überraschung!"
64,"TEXT_FESGSC501_04054_ROLAND_000_025","Willkommen im Gold Saucer. Gestatten, Roland mein Name. Ich bin der Manager für das Tagesgeschäft."
65,"TEXT_FESGSC501_04054_ROLAND_000_026","Darf ich fragen, was dich zu uns führt?"
66,"TEXT_FESGSC501_04054_ROLAND_000_027","Verstehe ... Dann nehme ich an, Ollier hat dich über die Einzelheiten des Diebstahls aufgeklärt?"
67,"TEXT_FESGSC501_04054_OLLIER_000_028","Verzeihung, wie unaufmerksam von mir! Ich werde das sofort nachholen."
68,"TEXT_FESGSC501_04054_OLLIER_000_029","Vor nicht allzu langer Zeit entdeckten wir, dass ein Imperator-Kaktor-Horn aus der Schublade hinter dem Hauptschalter, in der die Preise aufbewahrt werden, entwendet worden war."
69,"TEXT_FESGSC501_04054_OLLIER_000_030","Unbefugte dürfen den Bereich hinter dem Schalter nicht betreten. Es ist höchst unwahrscheinlich, dass sich ein Gast unbemerkt Zutritt verschafft und das Horn gestohlen hat."
70,"TEXT_FESGSC501_04054_OLLIER_000_031","Deswegen fiel der Verdacht auf meinen Freund Hugue. Er hatte sich kurz vor dem Verschwinden der Statue in der Nähe aufgehalten und sich um die Ausgabe der Preise gekümmert."
71,"TEXT_FESGSC501_04054_OLLIER_000_032","Hugue beteuerte von Anfang an seine Unschuld, doch die Beweislage spricht leider gegen ihn. Die Messingklingen scheinen es bereits als nachgewiesen zu erachten, dass er der Täter ist."
72,"TEXT_FESGSC501_04054_OLLIER_100_032","Jeder kennt Hugue als zuverlässigen Mitarbeiter, aber du musst wissen, dass er eine kriminelle Ver<SoftHyphen/>gangen<SoftHyphen/>heit hat. Und es ging auch damals um Diebstahl<Indent/>... Das rechtfertigt aber nicht, ihn von vornherein zu verurteilen!"
73,"TEXT_FESGSC501_04054_OLLIER_000_033","Die Messingklingen setzen ihn gewaltig unter Druck. Wenn wir nichts unternehmen, gesteht er am Ende noch etwas, was er gar nicht getan hat. Das müssen wir auf jeden Fall verhindern."
74,"TEXT_FESGSC501_04054_ROLAND_000_034","Dem kann ich mich nur anschließen."
75,"TEXT_FESGSC501_04054_ROLAND_000_035","Auch ich halte Hugue nicht für den Täter. Bitte finde heraus, wer das Horn tatsächlich gestohlen hat."
76,"TEXT_FESGSC501_04054_ROLAND_000_036","Danke. Ich werde Daluce von den Messingklingen, der die Ermittlungen leitet, darüber informieren, dass auch wir von unserer Seite Nach<SoftHyphen/>for<SoftHyphen/>schungen anstellen werden, um die Täterschaft zu klären."
77,"TEXT_FESGSC501_04054_ROLAND_000_037","Ollier, ich verlasse mich darauf, dass du gemeinsam mit <Split(<Highlight>ObjectParameter(1)</Highlight>, ,1)/> die Wahrheit herausfindest. "
78,"TEXT_FESGSC501_04054_DALUCE_000_038","Bist du etwa <If(PlayerParameter(4))>die Abenteurerin<Else/>der Abenteurer</If>, von <If(PlayerParameter(4))>der<Else/>dem</If> Herr Roland gesprochen hat? Du kannst herumschnüffeln, so viel du willst, aber lass dir gesagt sein, du verschwendest bloß deine Zeit. Der Täter steht bereits fest<Indent/>..."
79,"TEXT_FESGSC501_04054_HUGUE_000_039","Ich sage doch, ich war es nicht! Bitte, glaube mir!"
80,"TEXT_FESGSC501_04054_STAFFA04054_100_039","Ich fass es nicht, dass bei uns im Gold Saucer so etwas passiert<Indent/>..."
81,"TEXT_FESGSC501_04054_OLLIER_000_040","Bevor du mit den Ermittlungen anfängst, würde ich dir gerne etwas überreichen."
82,"TEXT_FESGSC501_04054_OLLIER_000_041","In dieses Notizbuch kannst du alles eintragen, was dir im Zusammenhang mit dem Diebstahl wichtig erscheint. Ich hoffe, es wird dir helfen, deine Gedanken zu ordnen und den Fall zu lösen."
83,"TEXT_FESGSC501_04054_OLLIER_000_042","Wie wäre es, wenn du es gleich einmal ausprobierst und zum Anfang mit meinem Kollegen bei den Spieltischen dort drüben sprichst? Er sieht irgendwie ängstlich aus, findest du nicht? Vielleicht kann er dir etwas zum Diebstahl sagen."
84,"TEXT_FESGSC501_04054_OLLIER_000_043","Sprich doch zunächst einmal mit meinem Kollegen bei den Spieltischen dort drüben, der etwas ängstlich wirkt. Vielleicht kann er dir etwas zum Diebstahl sagen."
85,"TEXT_FESGSC501_04054_SYSTEM_000_050","Du befragst die Person zum Diebstahl."
86,"TEXT_FESGSC501_04054_SYSTEM_000_051","Du siehst dich nach Hinweisen um<Indent/>..."
87,"TEXT_FESGSC501_04054_SYSTEM_000_052","Trage deine Erkenntnisse in dein Ermittlungsbuch ein!"
88,"TEXT_FESGSC501_04054_SYSTEM_100_052","Du hast nichts Neues erfahren<Indent/>..."
89,"TEXT_FESGSC501_04054_SYSTEM_000_053","Du hast alle Hinweise gefunden, um den Fall zu lösen."
90,"TEXT_FESGSC501_04054_STAFFA04054_000_054","Ich habe an dem Tag am Hauptschalter Lose für den Mini-Glückskaktor verkauft. Diebstahl! Von so etwas liest man doch immer nur in der Zeitung!"
91,"TEXT_FESGSC501_04054_STAFFA04054_100_054","Wie ich auch schon dem Ermittlungsleiter der Messingklingen gesagt habe, ist mir nichts Ungewöhnliches aufgefallen."
92,"TEXT_FESGSC501_04054_STAFFA04054_000_055","Allerdings fand gerade das Gold Saucer-Festival statt und der Besucherandrang war größer als üblich. Ich war also ziemlich mit der Arbeit beschäftigt."
93,"TEXT_FESGSC501_04054_STAFFA04054_000_056","Dennoch hätte ich bestimmt bemerkt, wenn jemand in den Schalterbereich eingedrungen wäre, der nicht zum Personal gehört.  "
94,"TEXT_FESGSC501_04054_OLLIER_000_060","Hast du etwas in Erfahrung bringen können? Dann hast du es hoffentlich ins Ermittlungsbuch eingetragen."
95,"TEXT_FESGSC501_04054_OLLIER_000_061","Wenn wir nur unsere Augen und Ohren offen halten, wird die Wahrheit schon ans Licht kommen. Wir müssen Hugues Unschuld beweisen!"
96,"TEXT_FESGSC501_04054_SYSTEM_000_062","Dieser Auftrag enthält Rätsel, die du selbstständig lösen musst. Die Aufgabenliste, das Archiv und die Karte geben stellenweise keine konkreten Anweisungen."
97,"TEXT_FESGSC501_04054_SYSTEM_000_063","Suche im Gold Saucer nach Hinweisen, um den Fall zu lösen. Sowohl Zeugenaussagen als auch Beweisstücke können nützlich sein."
98,"TEXT_FESGSC501_04054_SYSTEM_000_064","Die gesammelten Informationen kannst du in deinem Ermittlungsbuch jederzeit einsehen."
99,"TEXT_FESGSC501_04054_SYSTEM_000_065","Sprich Ollier an, wenn du glaubst, genügend zu wissen, um den Fall aufzuklären. Sei wachsam, kombiniere scharf und finde heraus, wer der Täter ist!"
100,"TEXT_FESGSC501_04054_SASAPANO_000_064","Er sollte lieber gestehen, dann kriegt er vielleicht eine Straferleichterung."
101,"TEXT_FESGSC501_04054_GUESTA04054_000_070","Der Hyuran hinter dem Schalter? Jetzt, wo du es sagst<Indent/>... Einmal verließ er seinen Platz, um einige Besucher herumzuführen."
102,"TEXT_FESGSC501_04054_GUESTA04054_000_071","Während dieser Zeit war der Schalter unbesetzt. Wenn jemand gekommen wäre, um seine Position einzunehmen, wäre mir dies bestimmt aufgefallen. "
103,"TEXT_FESGSC501_04054_BRASSBLADESMANB04054_000_072","Dass der Täter das Horn vermutlich irgendwo im Gold Saucer versteckt hat, leuchtet mir auch ein, die Frage ist bloß, wo? Bei einer so großen Einrichtung sucht man sich dumm und dämlich! Warum fällt mir aber auch immer die unangenehmste Arbeit zu? <seufz>"
104,"TEXT_FESGSC501_04054_SYSTEM_000_073","Auf einmal stutzt du: Von hier aus sieht der Schalter irgendwie anders aus. Etwas - oder jemand - fehlt<Indent/>..."
105,"TEXT_FESGSC501_04054_STAFFB04054_100_074","Ach, was soll ich bloß machen?"
106,"TEXT_FESGSC501_04054_SYSTEM_200_074","Er sieht gestresst aus und scheint nicht in der Verfassung zu sein, mit dir zu sprechen<Indent/>... Sprich ihn erneut an, wenn du herausgefunden hast, was ihn beschäftigt."
107,"TEXT_FESGSC501_04054_SYSTEM_000_074","Du fragst nach dem vermissten Mitarbeiteranzug."
108,"TEXT_FESGSC501_04054_STAFFB04054_000_075","Psst! Kannst du nicht leiser sprechen?!"
109,"TEXT_FESGSC501_04054_STAFFB04054_000_076","Wenn meine Vorgesetzten erfahren, dass ich meine Uniform verloren habe, kriege ich gewaltigen Ärger. Dieser Anzug ist äußerst wertvoll!"
110,"TEXT_FESGSC501_04054_STAFFB04054_000_077","Natürlich habe ich unser Reinigungspersonal gebeten, Ausschau zu halten, nachdem ich den Verlust bemerkt hatte, aber keiner hat irgendetwas gefunden."
111,"TEXT_FESGSC501_04054_STAFFB04054_000_078","Es wurden auch keine Fundstücke abgegeben. Wo mag mein Anzug bloß sein?"
112,"TEXT_FESGSC501_04054_BRASSBLADESMANC04054_100_079","Gibt es irgendwelche aufregenden Neuigkeiten? Ich spreche nicht vom Diebstahl, da steht der Täter ja bereits fest. Gerüchte, Klatsch<Indent/>... du weißt schon, irgendetwas Unterhaltsames."
113,"TEXT_FESGSC501_04054_SYSTEM_200_079","Du hast nichts erfahren, das dir wichtig genug erscheint, um es zu notieren<Indent/>...
Sprich ihn erneut an, wenn du einen Gesprächsstoff gefunden hast, der ihn interessieren könnte."
114,"TEXT_FESGSC501_04054_BRASSBLADESMANC04054_000_079","Gibt es irgendwelche aufregenden Neuigkeiten? Ich spreche nicht vom Diebstahl, da steht der Täter ja bereits fest. Gerüchte, Klatsch<Indent/>... du weißt schon, irgendetwas Unterhaltsames."
115,"TEXT_FESGSC501_04054_BRASSBLADESMANC04054_000_080","Ach, unser neuester Zuwachs bei den Messingklingen hat Pipimaya zum Essen eingeladen, aber eine Abfuhr erteilt bekommen? Pipimaya ist einfach wortlos zu einem Chocobo-Rennen abgezogen? Ha, das ist wirklich ungewöhnlich! Es sieht ihm nicht ähnlich, jemanden auf diese Weise abblitzen zu lassen."
116,"TEXT_FESGSC501_04054_BRASSBLADESMANC04054_000_081","Ich kenne wenige, die so offen und freundlich sind wie er. Selbst als ein Neuling einmal seinen Namen falsch aussprach und ihn „Mayapipi“ nannte, wurde er nicht wütend, sondern meinte nur, er habe nichts dagegen, wenn dies zu seinem neuen Spitznamen werden würde."
117,"TEXT_FESGSC501_04054_BRASSBLADESMANC04054_000_082","Ich hätte an seiner Stelle nicht so gelassen reagiert. Nein, Pipimaya ist keiner, der eine Einladung einfach so ignoriert. Da steckt mehr dahinter<Indent/>..."
118,"TEXT_FESGSC501_04054_STAFFC04054_000_083","Ich weiß zwar nicht, ob es mit dem Diebstahl zu tun hat, aber es gibt da eine Sache, die mich beschäftigt."
119,"TEXT_FESGSC501_04054_STAFFC04054_000_084","Also, mein Kollege, der den Glückskaktor-Schalter bedient, hat seine Uniform verloren. So etwas habe ich in meiner langen Karriere im Gold Saucer noch nie erlebt."
120,"TEXT_FESGSC501_04054_STAFFC04054_000_085","Das wird ein Donnerwetter geben, wenn der Anzug nicht bald wieder auftaucht, sag ich dir. Wie kann man nur so schusselig sein und seine Uniform verlieren?"
121,"TEXT_FESGSC501_04054_BRASSBLADESMANE04054_000_086","Als sich der Vorfall ereignete, hatte ich gerade Pause, also habe ich meinen Kollegen gefragt, ob er nicht Lust hätte, gemeinsam eine Kleinigkeit essen zu gehen. Aber er hat mich eiskalt ignoriert und ist einfach alleine zum Chocobo-Rennen losgezogen."
122,"TEXT_FESGSC501_04054_BRASSBLADESMANF04054_000_087","Sprichst du von Pipimaya? Sein jüngerer Bruder soll ein großer Fan des Gold Saucers sein. Ich wusste nicht, dass Pipimaya ebenso spielversessen ist."
123,"TEXT_FESGSC501_04054_BRASSBLADESMANF04054_000_088","Das passt eigentlich gar nicht zu ihm. Und erst recht nicht, dass er jemanden so sitzen lässt. Pipimaya ist die Freundlichkeit in Person. Selbst mit diesem Hugue, der mit großer Wahr<SoftHyphen/>schein<SoftHyphen/>lich<SoftHyphen/>keit ein Dieb ist, gibt er sich noch ab<Indent/>..."
124,"TEXT_FESGSC501_04054_STAFFD04054_000_089","Sag mal, diese Messingklinge, die sich an den Unter<SoftHyphen/>such<SoftHyphen/>ungen beteiligt - Pipimaya war sein Name -, der kommt doch ziemlich oft hierher, oder nicht? Ich habe ihn jedenfalls einige Male im Gold Saucer gesehen."
125,"TEXT_FESGSC501_04054_STAFFE04054_000_090","Du meinst nicht etwa seinen jüngeren Bruder? Der ist nämlich Stammgast hier. Er soll keine Attraktion auslassen, bei der es MGP zu holen gibt."
126,"TEXT_FESGSC501_04054_STAFFD04054_000_091","Was?! Pipimaya hat einen Bruder? Das wusste ich gar nicht!"
127,"TEXT_FESGSC501_04054_STAFFE04054_000_092","Du lebst aber auch hinter dem Mond<Indent/>... Alle Welt spricht davon, dass er es vermutlich auf einen fetten Preis abgesehen hat, so häufig, wie er hier aufkreuzt."
128,"TEXT_FESGSC501_04054_OLLIER_000_100","Wie sieht es aus? Weißt du jetzt, was sich tatsächlich abgespielt hat?"
129,"TEXT_FESGSC501_04054_OLLIER_000_101","Du scheinst einiges in Erfahrung gebracht zu haben. Weißt du jetzt, was sich tatsächlich abgespielt hat?"
130,"TEXT_FESGSC501_04054_Q1_000_000","Konntest du die Wahrheit herausfinden?"
131,"TEXT_FESGSC501_04054_A1_000_001","Aber sicher!"
132,"TEXT_FESGSC501_04054_A1_000_002","Ich brauche noch ein wenig Zeit."
133,"TEXT_FESGSC501_04054_SYSTEM_000_102","Der Auftrag kann abhängig von deinen Entscheidungen auf unter<SoftHyphen/>schied<SoftHyphen/>liche Weise enden. Die Vergütung für deine Teilnahme bleibt aber in jedem Fall gleich."
134,"TEXT_FESGSC501_04054_Q2_000_000","Möchtest du fortfahren und den Fall lösen?"
135,"TEXT_FESGSC501_04054_OLLIER_000_103","Dann spann uns alle nicht länger auf die Folter! Wer hat das Horn gestohlen?"
136,"TEXT_FESGSC501_04054_OLLIER_000_104","Natürlich. Lass mich wissen, wenn du die Wahrheit herausgefunden hast."
137,"TEXT_FESGSC501_04054_ROLAND_000_110","Danke, dass ihr meiner Einladung Folge geleistet habt, damit ich mir nach Anhörung aller Parteien ein eigenes Urteil bilden kann. "
138,"TEXT_FESGSC501_04054_DALUCE_000_111","Keine Ursache. Auch wir sind daran interessiert, dass die Wahrheit ans Licht kommt."
139,"TEXT_FESGSC501_04054_ROLAND_000_112","<Split(<Highlight>ObjectParameter(1)</Highlight>, ,1)/>, bist du bereit?"
140,"TEXT_FESGSC501_04054_ROLAND_000_113","Dann wollen wir anfangen. Daluce, darf ich dich bitten, uns einen Überblick über die Ereignisse zu geben?"
141,"TEXT_FESGSC501_04054_DALUCE_000_114","Ein Imperator-Kaktor-Horn wurde aus der Schublade beim Hauptschalter entwendet. Der Diebstahl wurde von dem Mitarbeiter entdeckt, der Hugue ablösen sollte."
142,"TEXT_FESGSC501_04054_DALUCE_000_115","Keiner der Zeugen, die wir befragt haben, hat gesehen, dass eine weitere Person in den Schalterbereich eingedrungen wäre."
143,"TEXT_FESGSC501_04054_DALUCE_000_116","Da uns außerdem bekannt ist, dass sich Hugue schon früher einmal an fremdem Eigentum vergriffen hat, liegt es auf der Hand, von ihm als Täter auszugehen. Von meiner Seite aus wäre das alles."
144,"TEXT_FESGSC501_04054_ROLAND_000_117","Vielen Dank."
145,"TEXT_FESGSC501_04054_ROLAND_000_118","<Split(<Highlight>ObjectParameter(1)</Highlight>, ,1)/>, hast du dem irgendetwas hinzuzufügen?"
146,"TEXT_FESGSC501_04054_Q3_000_000","Möchtest du etwas hinzufügen?"
147,"TEXT_FESGSC501_04054_A3_000_001","Hugue ist unschuldig!"
148,"TEXT_FESGSC501_04054_A3_000_002","Wo bleibt der Beweis, dass er der Täter ist?"
149,"TEXT_FESGSC501_04054_DALUCE_000_120","E-Er soll unschuldig sein? Wie kommst du dazu, so etwas zu behaupten?"
150,"TEXT_FESGSC501_04054_Q4_000_000","Warum glaubst du, dass Hugue nicht der Täter ist?"
151,"TEXT_FESGSC501_04054_A4_000_001","Ist es nicht immer so, dass der wahre Täter ein anderer ist?"
152,"TEXT_FESGSC501_04054_A4_000_002","D-Das sagt mir mein Bauchgefühl<Indent/>..."
153,"TEXT_FESGSC501_04054_A4_000_003","Die Uniform eines Angestellten wurde gestohlen<Indent/>..."
154,"TEXT_FESGSC501_04054_DALUCE_000_121","Laut Zeugenaussagen gibt es keine Anzeichen dafür, dass irgendjemand vom Personal Hugues Position hinter dem Schalter einnahm, als dieser sich entfernte, um Besucher herumzuführen. Folglich kann niemand anders das Horn gestohlen haben."
155,"TEXT_FESGSC501_04054_DALUCE_000_122","Was soll der Unsinn? Ich habe keine Zeit für Scherze."
156,"TEXT_FESGSC501_04054_DALUCE_000_123","Was sagst du da?!"
157,"TEXT_FESGSC501_04054_ROLAND_000_124","<räusper> Also, ich fasse zusammen: Die Messingklingen gehen davon aus, dass Hugue der Täter ist, während du, <Split(<Highlight>ObjectParameter(1)</Highlight>, ,1)/>, das infragestellst. Gibt es irgendwelche konkreten Gründe für deine Zweifel?"
158,"TEXT_FESGSC501_04054_Q5_000_000","Warum glaubst du, dass Hugue unschuldig ist?"
159,"TEXT_FESGSC501_04054_A5_000_001","Er ist viel zu nett, um solch eine Tat zu begehen!"
160,"TEXT_FESGSC501_04054_A5_000_002","Weil er das selbst behauptet."
161,"TEXT_FESGSC501_04054_A5_000_003","Das gestohlene Horn konnte nirgends im Gold Saucer entdeckt werden."
162,"TEXT_FESGSC501_04054_DALUCE_000_125","Das stimmt zwar, doch es ist nur eine Frage der Zeit, bis es gefunden wird. Aber sag mir doch, wer außer Hugue soll es denn sonst gestohlen haben?"
163,"TEXT_FESGSC501_04054_Q6_000_000","Wer hat das Horn gestohlen?"
164,"TEXT_FESGSC501_04054_A6_000_001","Dann war es eben doch Hugue<Indent/>..."
165,"TEXT_FESGSC501_04054_A6_000_002","Vielleicht ein Geist<Indent/>..."
166,"TEXT_FESGSC501_04054_A6_000_003","Jemand, der sich hinter den Schalter schlich, als Hugue die Besucherführung machte."
167,"TEXT_FESGSC501_04054_ROLAND_000_126","Dürfte ich um ein bisschen mehr Ernst bei der Sache bitten? Hugues Existenz steht auf dem Spiel."
168,"TEXT_FESGSC501_04054_DALUCE_000_127","Willst du mich auf den Arm nehmen? Ich sehe, ich verschwende nur meine Zeit mit dir<Indent/>..."
169,"TEXT_FESGSC501_04054_ROLAND_000_128","Du scheinst dir ja ziemlich sicher zu sein, dass Hugue nichts mit dem Diebstahl zu tun hat. Ich nehme an, du bist auf irgendwelche Beweise gestoßen, die seine Unschuld belegen?"
170,"TEXT_FESGSC501_04054_ROLAND_000_129","Kommen wir zum Wesentlichen. Wer ist denn deiner Meinung nach der wahre Täter?"
171,"TEXT_FESGSC501_04054_Q7_000_000","Wer ist der wahre Täter?"
172,"TEXT_FESGSC501_04054_A7_000_001","Pipimaya, du bist der Dieb!"
173,"TEXT_FESGSC501_04054_A7_000_002","Jemand anders als Hugue."
174,"TEXT_FESGSC501_04054_A7_000_003","Auch wenn es mir leidtut, dies zu sagen ... Hugue muss der Täter sein<Indent/>..."
175,"TEXT_FESGSC501_04054_A7_000_004","Daluce ist der Dieb!"
176,"TEXT_FESGSC501_04054_SASAPANO_000_130","(-Pipimaya-)I-Ich soll der Täter sein?"
177,"TEXT_FESGSC501_04054_SASAPANO_000_131","(-Pipimaya-)Das soll wohl ein Scherz sein! Ein ziemlich schlechter ... Welche Beweise hast du für eine solche ungeheuerliche Behauptung? "
178,"TEXT_FESGSC501_04054_Q8_000_000","Warum denkst du, dass Pipimaya der Täter ist?"
179,"TEXT_FESGSC501_04054_A8_000_001","Das sagt mir mein Instinkt."
180,"TEXT_FESGSC501_04054_A8_000_002","Er sieht verschlagen aus wie ein Dieb."
181,"TEXT_FESGSC501_04054_A8_000_003","Die gestohlene Uniform passt einzig einem Lalafell."
182,"TEXT_FESGSC501_04054_ROLAND_000_132","Dies ist nun wahrlich nicht der Ort und die Zeit für Scherze. Teile uns bitte mit, wer der Täter ist."
183,"TEXT_FESGSC501_04054_DALUCE_000_133","Ach, und wieso bist du dir da so sicher?"
184,"TEXT_FESGSC501_04054_Q9_000_000","Warum bist du dir so sicher, dass Hugue nicht der Täter ist?"
185,"TEXT_FESGSC501_04054_A9_000_001","Es gibt nicht genügend Beweise für seine Täterschaft."
186,"TEXT_FESGSC501_04054_A9_000_002","Eigentlich bin ich mir gar nicht sicher<Indent/>..."
187,"TEXT_FESGSC501_04054_A9_000_003","W-Weil ... äh, nur so<Indent/>..."
