2767,0,2,false,false,3,3.0,false,1.0,"So viele Münzen, kupo! Herzlichen Dank!"
2768,0,2,false,false,2,3.0,false,1.0,"Bring mir mehr, meeehr, kupo!"
2769,0,2,false,false,1,1.0,false,1.0,"0"
2770,0,2,false,false,2,3.0,false,1.0,"Nimm die Kraft der Dunkelheit in dich auf!"
2771,0,2,false,false,2,3.0,false,1.0,"Aber nur so viel, wie du kontrollieren kannst."
2772,0,2,false,false,2,3.0,false,1.0,"Rückzug!"
2773,0,2,false,false,3,5.0,false,1.0,"So was Dummes, quaaak."
2774,0,2,false,false,3,5.0,false,1.0,"Danke, quaaak!"
2775,0,2,false,false,3,5.0,false,1.0,"Wir werden beobachtet, quaaak!"
2776,0,2,false,false,3,5.0,false,1.0,"Wäre doch nur Matoya\nbei uns, quaaak ..."
2777,0,2,false,false,3,5.0,false,1.0,"Man hat's nicht leicht\nals Helferlein, quaaak ..."
2778,0,2,false,false,3,3.0,false,1.0,"Psssh ... Khoo ... Schnell Warnenwort an andere geben!"
2779,0,2,false,false,2,3.0,false,1.0,"Wirzzu hier nicht durchkommen, Großwachsene!"
2780,0,2,false,false,2,3.0,false,1.0,"Kehrzzu lieber gleich um!"
2781,0,2,false,false,2,3.0,false,1.0,"Vom Wind getragen ..."
2782,0,2,false,false,2,3.0,false,1.0,"Zu Licht geformt!"
2783,0,2,false,false,2,3.0,false,1.0,"Noch mehr von dieser Bande...! Wehrt sie ab!"
2784,0,2,false,false,2,3.0,false,1.0,"Nicht so schnell!"
2785,0,2,false,false,2,3.0,false,1.0,"Psssh! Hier gibt nichtzzu holen!"
2786,0,2,false,false,2,3.0,false,1.0,"Was willzu hier? Hauzzu schnell wieder ab!"
2787,0,2,false,false,2,3.0,false,1.0,"Psssh ... Khoo ... "
2788,0,2,false,false,2,3.0,false,1.0,"Ist schon vorbei ...? Khoo ..."
2789,0,2,false,false,2,3.0,false,1.0,"Hazzu gesehen?! Starkewaffe! Kho kho!"
2790,0,2,false,false,2,3.0,false,1.0,"K-Kriegzzu bald zurück mit Doppelteschmerz ...!"
2791,0,2,false,false,2,3.0,false,1.0,"Freuzzu lieber nicht zu früh!"
2792,0,2,false,false,2,3.0,false,1.0,"Kriegzzu jetzt Dresche!"
2793,0,2,false,false,2,3.0,false,1.0,"Hazzu schon genug? Kho?"
2794,0,2,false,false,2,3.0,false,1.0,"Psh, bald ist vorbei mit lustig!"
2795,0,2,false,false,2,3.0,false,1.0,"Kho kho kho! Großwachsene hat Schnauzevoll!"
2796,0,2,false,false,2,3.0,false,1.0,"Kannzu Füße in Hand nehmen, kho kho kho!"
2797,0,2,false,false,2,3.0,false,1.0,"Große Fahr! Jetzt heißt rennen."
2798,0,2,false,false,2,3.0,false,1.0,"Großeschmerz ... "
2799,0,2,false,false,3,3.0,false,1.0,"Jetzt geht los!"
2800,0,2,false,false,3,3.0,false,1.0,"Kho! Indigohand ist kommen!"
2801,0,2,false,false,3,3.0,false,1.0,"Ich werde von Wölfen verfolgt!"
2802,0,2,false,false,2,5.0,false,1.0,"Wir müssen das Pack zurückschlagen!"
2803,0,2,false,false,2,3.0,false,1.0,"Auf geht's!"
2804,0,2,false,false,2,3.0,false,1.0,"Das reicht!"
2805,0,2,false,false,2,3.0,false,1.0,"Ich steh dir zur Seite!"
2806,0,2,false,false,3,3.0,false,1.0,"Der Sieg ist unser! Vielen Dank!"
2807,0,2,false,false,2,3.0,false,1.0,"Drängen wir das Pack zurück!"
2808,0,2,false,false,2,3.0,false,1.0,"Bei der Ehre der Durendaire!"
2809,0,2,false,false,2,3.0,false,1.0,"Wie schmeckt dir das, dreckige Töle?"
2810,0,2,false,false,2,3.0,false,1.0,"Du kämpfst ausgezeichnet!"
2811,0,2,false,false,2,3.0,false,1.0,"Danke für deinen Beistand!"
2812,0,2,false,false,2,3.0,false,1.0,"Das wird ein Kinderspiel!"
2813,0,2,false,false,2,3.0,false,1.0,"Kehrt zurück, wo ihr herkommt!"
2814,0,2,false,false,2,3.0,false,1.0,"Lebe wohl!"
2815,0,2,false,false,3,3.0,false,1.0,"Das Glück war uns nicht hold ..."
2816,0,2,false,false,2,3.0,false,1.0,"Lassen wir's gut sein für heute ..."
2817,0,2,false,false,2,3.0,false,1.0,"Ich verstehe die Welt nicht mehr ..."
2818,0,2,false,false,2,3.0,false,1.0,"Verdammt ... Rückzug!"
2819,0,2,false,false,2,3.0,false,1.0,"Psh, kannzu dich schon auf was fasst machen!"
2820,0,2,false,false,2,3.0,false,1.0,"Kriegzzu Dresche auf hohle Denkschale."
2821,0,2,false,false,2,3.0,false,1.0,"Psssshh! Auf sie mit Brüll!"
2822,0,2,false,false,2,3.0,false,1.0,"Indigohand muss verschwinden!"
2823,0,2,false,false,2,3.0,false,1.0,"Am besten ist Vollekraft von vorne!"
2824,0,2,false,false,2,3.0,false,1.0,"Lazzu ja Maschine nicht zerstören, kho!"
2825,0,2,false,false,2,3.0,false,1.0,"Kho kho kho! Großwachsene hat Volleschnauze kriegen."
2826,0,2,false,false,2,3.0,false,1.0,"Jetzt gibt keine Gnade!"
2827,0,2,false,false,2,3.0,false,1.0,"Stürmenangriff!"
2828,0,2,false,false,2,3.0,false,1.0,"Maschine kriegzzu nie, Indigohand!"
2829,0,2,false,false,2,3.0,false,1.0,"Fiesegoblin muss verschwinden!"
2830,0,2,false,false,2,3.0,false,1.0,"Hüpfenherz ♪ Frohezeit ♪"
2831,0,2,false,false,2,3.0,false,1.0,"Pssshhh ... Muzzu wissen, wannzu hat verloren ..."
2832,0,2,false,false,2,3.0,false,1.0,"Jetzt geht gleich richtigrund!"
2833,0,2,false,false,2,3.0,false,1.0,"Willzu nicht hören, muzzu schmerzenfühlen!"
2834,0,2,false,false,2,3.0,false,1.0,"Wirzzu Schmerz bekommen in Hinterteil!"
2835,0,2,false,false,2,3.0,false,1.0,"Sieg gehören schon Indigohand!"
2836,0,2,false,false,2,3.0,false,1.0,"Kannzu nicht mehr? Kho?"
2837,0,2,false,false,2,3.0,false,1.0,"Ist anders kommen als Plan ..."
2838,0,2,false,false,2,3.0,false,1.0,"Psh, Zwickenmühle! Besser rennen mit Schnelleschritt ..."
2839,0,2,false,false,3,5.0,false,1.0,"Hm, was hat da geleuchtet?"
2840,0,2,false,false,2,5.0,false,1.0,"Glotzaugen?!"
2841,0,2,false,false,2,5.0,false,1.0,"Auf die Biester!"
2842,0,2,false,false,2,3.0,false,1.0,"Bei der Ehre der Durendaire!"
2843,0,2,false,false,2,3.0,false,1.0,"Lästige, kleine Biester!"
2844,0,2,false,false,2,3.0,false,1.0,"Flucht steht nicht zur Debatte!"
2845,0,2,false,false,2,3.0,false,1.0,"Zurückdrängen!"
2846,0,2,false,false,3,5.0,false,1.0,"Danke! Das war sehr mutig von dir!"
2847,0,2,false,false,3,3.0,false,1.0,"Ich habe mein Haus entehrt ..."
2848,0,2,false,false,2,3.0,false,1.0,"Falls ich sterbe ... liegt es in deiner Hand ..."
2849,0,2,false,false,3,5.0,false,1.0,"Hier sieht's ja wirklich aus wie im Schweinestall!"
2850,0,2,false,false,3,3.0,false,1.0,"Respektlose Böcke! Das Monument ist keine Latrine!"
2851,0,2,false,false,3,3.0,false,1.0,"Ich ... Ich muss mal kurz Bericht erstatten!"
2852,0,2,false,false,3,3.0,false,1.0,"Damit wäre unsere Haut gerettet ... fürs Erste ..."
2853,0,2,false,false,3,3.0,false,1.0,"Wohlverdienter Ruhestand, da gehst du dahin!"
2854,0,2,false,false,2,3.0,false,1.0,"Nimm dies, garstiges Biest!"
2855,0,2,false,false,2,3.0,false,1.0,"Eure Tretminen könnt ihr woanders legen!"
2856,0,2,false,false,2,3.0,false,1.0,"Haldrath hätte diese Sauerei nicht gutgeheißen!"
2857,0,2,false,false,3,5.0,false,1.0,"Da war was! Ein Geräusch, quaaak!"
2858,0,2,false,false,3,5.0,false,1.0,"Irgendetwas beobachtet uns, quaaak!"
2859,0,2,false,false,3,5.0,false,1.0,"Dieses Kreischen  ... Das wird doch nicht etwa ...?"
2860,0,2,false,false,3,5.0,false,1.0,"Ich hasse Vögel, quaaak!"
2861,0,2,false,false,3,5.0,false,1.0,"Ich werd's euch allen zeigen!"
2862,0,2,false,false,3,5.0,false,1.0,"<keuch> ... Die waren nicht angemeldet! "
2863,0,2,false,false,3,5.0,false,1.0,"Siehst du nun, wozu ein à la Wertesta fähig ist?"
2864,0,2,false,false,2,3.0,false,1.0,"Ich zeig dir, was ein à la Wertesta draufhat!"
2865,0,2,false,false,2,3.0,false,1.0,"Haha, ein à la Wertesta ist hart im Nehmen!"
2866,0,2,false,false,2,3.0,false,1.0,"Ein à la Wertesta hat dickes Fell!"
2867,0,2,false,false,3,5.0,false,1.0,"Bislang hab ich dich geschont!"
2868,0,2,false,false,3,5.0,false,1.0,"Ab hier schaff ich's alleine, quaaak."
2869,0,2,false,false,3,5.0,false,1.0,"Vielen quaaak, äh, Dank!"
2870,0,2,false,false,3,5.0,false,1.0,"Endlich <if:eine Gegnerin, die/ein Gegner, der> meiner würdig ist!"
2871,0,2,false,false,3,5.0,false,1.0,"Ich stecke voller Überraschungen!"
2872,0,2,false,false,2,3.0,false,1.0,"Zeig mir, was in dir steckt!"
2873,0,2,false,false,2,3.0,false,1.0,"Ist das schon alles?"
2874,0,2,false,false,2,3.0,false,1.0,"Zeig mir mehr davon!"
2875,0,2,false,false,2,3.0,false,1.0,"Die Leidenschaft des Kampfes ist es, die ich suche!"
2876,0,2,false,false,2,3.0,false,1.0,"Komm mit allem, was du hast!"
2877,0,2,false,false,2,3.0,false,1.0,"Ein à la Wertesta geht nie auf Grundeis!"
2878,0,2,false,false,3,3.0,false,1.0,"Khooo! Lazzu das! Was soll werden, wenn fertig ist?!"
2879,0,2,false,false,3,3.0,false,1.0,"Braufix braucht ganzschnell Helfenhand! Hilfzzu! Irgendwer!"
2880,0,2,false,false,3,3.0,false,1.0,"Jetzt ist ehrlich fundene Buch verloren für Immerzeit ..."
2881,0,2,false,false,3,3.0,false,1.0,"Hüpfenherz! Großedank! Jetzt kann Braufix Wissensammeln aus Buch!"
2882,0,2,false,false,3,5.0,false,1.0,"Da bin ich wieder! Wer will der Erste sein?"
2883,0,2,false,false,3,5.0,false,1.0,"Es war mir eine Ehre! Mögen wir schon bald wieder Seite an Seite kämpfen!"
2884,0,2,false,false,3,5.0,false,1.0,"Ein à la Wertesta geschlagen von zotteligem Getier?"
2885,0,2,false,false,3,5.0,false,1.0,"Räche ... mich ...!"
2886,0,2,false,false,2,3.0,false,1.0,"Ich spüre eine seltsame Kraft in dir ..."
2887,0,2,false,false,2,3.0,false,1.0,"Du kannst noch viel mehr, nicht wahr?"
2888,0,2,false,false,2,3.0,false,1.0,"Es werden keine Gefangenen gemacht!"
2889,0,2,false,false,2,3.0,false,1.0,"Zeigen wir's diesen Biestern!"
2890,0,2,false,false,2,3.0,false,1.0,"Lass uns kurzen Prozess mit ihnen machen!"
2891,0,0,false,false,0,0.0,false,0.0,""
2892,0,0,false,false,0,0.0,false,0.0,""
2893,0,2,false,false,2,3.0,false,1.0,"Schon wieder, quaaak?!"
2894,0,2,false,false,2,3.0,false,1.0,"Nimm dies, quaaak!"
2895,0,2,false,false,2,3.0,false,1.0,"Mach dich vom Acker, quaaak!"
2896,0,2,false,false,3,5.0,false,1.0,"Die Mydolons greifen an!"
2897,0,2,false,false,3,3.0,false,1.0,"Verteidigt die Brücke!"
2898,0,2,false,false,3,3.0,false,1.0,"Sie ergreifen die Flucht!"
2899,0,2,false,false,3,3.0,false,1.0,"<ächz> ... Das sind zu viele!"
2900,0,2,false,false,2,3.0,false,1.0,"Ihr habt hier nichts zu suchen!"
2901,0,2,false,false,2,3.0,false,1.0,"Räumt die Brücke, ihr garstigen Biester!"
2902,0,2,false,false,2,3.0,false,1.0,"Etwas Rittersport vorm Frühstück!"
2903,0,2,false,false,3,5.0,false,1.0,"Verdammt ... Sie haben Verstärkung gerufen!"
2904,0,2,false,false,3,3.0,false,1.0,"Die Brücke ist gesichert!"
2905,0,2,false,false,3,3.0,false,1.0,"Vergebens! Wir ziehen uns zurück!"
2906,0,2,false,false,2,3.0,false,1.0,"Hilfe naht!"
2907,0,2,false,false,5,1.0,false,3.0,"Hier hast du also gesteckt, Dunkelschuppe!"
2908,0,2,false,false,5,1.0,false,3.0,"Seht her, der Verräter!"
2909,0,2,false,false,5,1.0,false,3.0,"Du hast genug Unheil über die Welt gebracht!"
2910,0,2,false,false,5,1.0,false,3.0,"Und als Nächstes folgst du!"
2911,0,2,false,false,2,3.0,false,1.0,"Ihr habt die längste Zeit gestört!"
2912,0,2,false,false,2,3.0,false,1.0,"Hast du gesehen, wie ich der Bestie den Garaus gemacht habe?"
2913,0,2,false,false,2,3.0,false,1.0,"Du?! Das war ja wohl ich!"
2914,0,2,false,false,2,3.0,false,1.0,"Da steckt eindeutig mein Pfeil in dem Drachen!"
2915,0,2,false,false,2,3.0,false,1.0,"Klar, tot war er ja auch nicht schwer zu treffen."
2916,0,2,false,false,2,3.0,false,1.0,"Du bist eine Schande für Finneas Vollstrecker."
2917,0,2,false,false,2,3.0,false,1.0,"Quatsch, der hat noch gezuckt!"
2918,0,2,false,false,2,3.0,false,1.0,"Deine elende Überheblichkeit bin ich satt!"
2919,0,2,false,false,2,3.0,false,1.0,"Und ich deine faulen Ausreden!"
2920,0,2,false,false,2,3.0,false,1.0,"Also gut, tragen wir's aus!"
2921,0,2,false,false,3,5.0,false,1.0,"Wag das nicht noch mal!"
2922,0,2,false,false,2,3.0,false,1.0,"Ist ja schon gut ..."
2923,0,2,false,false,3,5.0,false,1.0,"Verflucht, die Lüge hat gesiegt!"
2924,0,2,false,false,2,3.0,false,1.0,"Jetzt guckst du dumm, was?"
2925,0,2,false,false,2,3.0,false,1.0,"Deine Lügen werd\nich dir austreiben!"
2926,0,2,false,false,2,3.0,false,1.0,"Speer der Gerechtigkeit!"
2927,0,2,false,false,2,3.0,false,1.0,"Meine Pfeile finden\nimmer ins Ziel!"
2928,0,2,false,false,2,3.0,false,1.0,"Ist das alles?"
2929,0,2,false,false,2,3.0,false,1.0,"Har!"
2930,0,2,false,false,2,3.0,false,1.0,"Hgh!"
2931,0,2,false,false,2,3.0,false,1.0,"Wie kann Abschaum wie ihr über mich triumphieren?"
2932,0,2,false,false,2,3.0,false,1.0,"Das geht nicht mit rechten Dingen zu!"
2933,0,2,false,false,2,3.0,false,1.0,"Das also ... ist die Kraft des Lichts?"
2934,0,2,false,false,2,3.0,false,1.0,"Morgenstern im Osten, erfüll mich mit Stärke!"
2935,0,2,false,false,2,3.0,false,1.0,"Gespanntes Gestirn, sinke nach Westen und gewähre mir Einsicht!"
2936,0,2,false,false,2,3.0,false,1.0,"Harmonie im Südhimmel, erfülle mich mit Leben!"
2937,0,2,false,false,2,3.0,false,1.0,"Nordstern am Pol, gewähre mir Macht!"
2938,0,2,false,false,3,5.0,false,1.0,"Der Kerl ist 'ne Klasse für sich ..."
2939,0,2,false,false,3,5.0,false,1.0,"Du wirst es brauchen!"
2940,0,2,false,false,2,3.0,false,1.0,"Viel Glück, <if:meine Liebe/mein Lieber>!"
2941,0,2,false,false,2,3.0,false,1.0,"Das war's für mich ..."
2942,0,2,false,false,5,1.0,false,3.0,"Nicht schlecht für einen Verräter ..."
2943,0,2,false,false,5,1.0,false,3.0,"Doch wer sich mit Sterblichen einlässt ..."
2944,0,2,false,false,5,1.0,false,3.0,"... wird niemals siegen!"
2945,0,2,false,false,5,1.0,false,3.0,"Alter Narr ..."
2946,0,2,false,false,5,1.0,false,3.0,"Gar nicht übel ..."
2947,0,2,false,false,5,1.0,false,3.0,"Hast du immer noch nicht genug?"
2948,0,2,false,false,5,1.0,false,3.0,"Bloß nicht übermütig werden!"
2949,0,2,false,false,5,1.0,false,3.0,"Ich bin längst nicht am Ende!"
2950,0,2,false,false,5,1.0,false,3.0,"Na wartet, ich komme wieder!"
2951,0,2,false,false,3,5.0,false,1.0,"Was wird jetzt aus meiner Kette, kupo?"
2952,0,2,false,false,3,3.0,false,1.0,"Oje, die bösen Saurier, kupo!"
2953,0,2,false,false,2,3.0,false,1.0,"Kupo ... Kupo ..."
2954,0,2,false,false,2,3.0,false,1.0,"Ku... Po..."
2955,0,2,false,false,2,3.0,false,1.0,"Kupokupo ..."
2956,0,2,false,false,3,5.0,false,1.0,"Freundschaft ... währt selbst im Tod ..."
2957,0,2,false,false,2,3.0,false,1.0,"Jetzt liegt es an dir, kupo ..."
2958,0,2,false,false,2,3.0,false,1.0,"Zeig's diesem Mogosh, kupo ..."
2959,0,2,false,false,2,3.0,false,1.0,"Oje, kupo ..."
2960,0,2,false,false,2,3.0,false,1.0,"Die Ehre der Drachen steht auf dem Spiel ..."
2961,0,2,false,false,5,1.0,false,3.0,"Ich werde mich nach Tharl Oom Khash zurückziehen ..."
2962,0,2,false,false,5,1.0,false,3.0,"Haltet mir den Rücken frei! Wenn's sein muss mit eurem Leben!"
2963,0,2,false,false,5,1.0,false,3.0,"Er darf uns nicht entwischen!"
2964,0,2,false,false,5,1.0,false,3.0,"Ihr habt Dunkelschuppe gehört!"
2965,0,2,false,false,5,1.0,false,3.0,"Mit diesen Würmern werden wir auch alleine fertig."
2966,0,2,false,false,5,1.0,false,3.0,"Ihre Köpfe für unseren Herren!"
2967,0,2,false,false,5,1.0,false,3.0,"Nichts für ungut!"
2968,0,2,false,false,5,1.0,false,3.0,"Ihr wagt es, uns aufzuhalten?"
2969,0,2,false,false,5,1.0,false,3.0,"Elender! Hast du den Verrat der Sterblichen etwa vergessen?"
2970,0,2,false,false,5,1.0,false,3.0,"Die Sünde des einen ist nicht die seines ganzes Volkes!"
2971,0,2,false,false,5,1.0,false,3.0,"Sie gewinnen die Oberhand!"
2972,0,2,false,false,5,1.0,false,3.0,"Reißt euch zusammen! Zum Angriff!"
2973,0,2,false,false,5,1.0,false,3.0,"Verzeiht Eurem kläglichen Diener, o Dunkelschuppe!"
2974,0,2,false,false,5,1.0,false,3.0,"Ich habe versagt ..."
2975,0,2,false,false,2,3.0,false,1.0,"Wäre ich bloß stärker gewesen ..."
2976,0,2,false,false,2,3.0,false,1.0,"Ich bin eine Schande für die Horde ..."
2977,0,2,false,false,2,3.0,false,1.0,"Heute ist ein guter Tag!"
2978,0,2,false,false,2,3.0,false,1.0,"Boah, ist mir langweilig, kupo."
2979,0,2,false,false,2,3.0,false,1.0,"Hm, warum bleibst du stehen?"
2980,0,2,false,false,2,3.0,false,1.0,"Na, dann los, kupo!"
2981,0,2,false,false,2,3.0,false,1.0,"Oh, wie hübsch, kupo!"
2982,0,2,false,false,2,3.0,false,1.0,"Was für ein schönes Blümchen, kupo!"
2983,0,2,false,false,2,3.0,false,1.0,"Ich brauch mal kurz ein Päuschen, kupo!"
2984,0,2,false,false,2,3.0,false,1.0,"Toller Ausblick, kupo!"
2985,0,2,false,false,2,3.0,false,1.0,"Nur noch ein bisschen, nicht schlappmachen, kupo!"
2986,0,2,false,false,2,3.0,false,1.0,"Ein M-M-Monster, kupo!"
2987,0,2,false,false,2,3.0,false,1.0,"Da, noch mehr Monster! Haut ab, kupo!"
2988,0,2,false,false,2,3.0,false,1.0,"M-Mir macht ihr keine Angst, kupo!"
2989,0,2,false,false,2,3.0,false,1.0,"Wo mein Kupo erklingt, jeder Drache um Atem ringt!"
2990,0,2,false,false,2,3.0,false,1.0,"Hilfe ... Mein Onkel braucht Hilfe!"
2991,0,2,false,false,2,3.0,false,1.0,"Hier entlang! Schnell!"
2992,0,2,false,false,2,3.0,false,1.0,"Ein Glück, es ist noch nicht zu spät!"
2993,0,2,false,false,2,3.0,false,1.0,"Du musst meinen Onkel retten!"
2994,0,2,false,false,2,3.0,false,1.0,"Nein ... Onkeeel ...!"
2995,0,2,false,false,2,3.0,false,1.0,"Grrrrrr!"
2996,0,2,false,false,2,3.0,false,1.0,"Ihr kommt hier nicht durch!"
2997,0,2,false,false,2,3.0,false,1.0,"Wer will als Nächstes sterben?"
2998,0,2,false,false,2,3.0,false,1.0,"Onkel, ein Glück ist dir nichts passiert!"
2999,0,2,false,false,2,3.0,false,1.0,"Hast du die Verstärkung gerufen? Danke, mein Kind."
3000,0,2,false,false,2,3.0,false,1.0,"Auch dir gilt mein Dank, Abenteurer<if:in/none>. Mögen sich unsere Wege wieder kreuzen."
3001,0,2,false,false,3,5.0,false,1.0,"Ich mach mich mal kurz frisch! Bis gleich!"
3002,0,2,false,false,2,3.0,false,1.0,"Aus dem Weg!"
3003,0,2,false,false,2,3.0,false,1.0,"Das reicht!"
3004,0,2,false,false,2,3.0,false,1.0,"Verschwindet!"
3005,0,2,false,false,2,3.0,false,1.0,"Danke, kupo! Ab hier schaff ich's alleine!"
3006,0,2,false,false,2,3.0,false,1.0,"Bitte, du musst meinem Onkel helfen!"
3007,0,2,false,false,2,3.0,false,1.0,"Dies ist unsere\nwahre Kraft!"
3008,0,2,false,false,2,3.0,false,1.0,"Die Welt erzittert\nvor der Horde!"
3009,0,2,false,false,5,1.0,false,3.0,"<keuch> ... Das sollte weit genug sein ..."
3010,0,2,false,false,2,3.0,false,1.0,"Kweeeh!"
3011,0,2,false,false,2,3.0,false,1.0,"Kweh, kweh ..."
3012,0,2,false,false,2,3.0,false,1.0,"Kweh!"
3013,0,2,false,false,5,1.0,false,3.0,"Pech, mein Kleiner! Deine Reise endet hier!"
3014,0,2,false,false,5,1.0,false,3.0,"Verräter gehören bestraft!"
3015,0,2,false,false,5,1.0,false,3.0,"Du wirst dein Urteil erfahren! Es gibt kein Entrinnen!"
3016,0,2,false,false,5,1.0,false,3.0,"Eine Falle!"
3017,0,2,false,false,5,1.0,false,3.0,"So kurz vor dem Ziel!"
3018,0,2,false,false,5,1.0,false,3.0,"Widerstand ist zwecklos!"
3019,0,2,false,false,5,1.0,false,3.0,"Ich werde meine Fänge in dein zartes Fleisch bohren!"
3020,0,2,false,false,5,1.0,false,3.0,"Lange halte ich das nicht mehr durch!"
3021,0,2,false,false,5,1.0,false,3.0,"Ich habe die hässlichen Schreie also richtig interpretiert. Ein Angriff der Horde!"
3022,0,2,false,false,5,1.0,false,3.0,"Geht es dir gut?"
3023,0,2,false,false,5,1.0,false,3.0,"Ja, Vedrfölnir! Danke!"
3024,0,2,false,false,5,1.0,false,3.0,"Der hat gerade noch gefehlt! Andererseits ..."
3025,0,2,false,false,5,1.0,false,3.0,"Ein Sieg brächte mir grenzenlosen Ruhm!"
3026,0,2,false,false,5,1.0,false,3.0,"Heute ist nicht unser Tag!"
3027,0,2,false,false,5,1.0,false,3.0,"Rückzug!"
3028,0,2,false,false,5,1.0,false,3.0,"Gut gekämpft, mein junger Drache."
3029,0,2,false,false,5,1.0,false,3.0,"Ich danke dir, Vedrfölnir."
3030,0,2,false,false,5,1.0,false,3.0,"Die Horde kann jederzeit zurückschlagen."
3031,0,2,false,false,5,1.0,false,3.0,"Begleite mich zum Tempel."
3032,0,2,false,false,5,1.0,false,3.0,"Jawohl, Vedrfölnir!"
3033,0,2,false,false,5,1.0,false,3.0,"Ein klägliches Ende steht Verrätern gut."
3034,0,2,false,false,5,1.0,false,3.0,"Mission erfüllt! Zurück zu den Unseren!"
3035,0,2,false,false,5,1.0,false,3.0,"Ihr zieht euch zurück?"
3036,0,2,false,false,5,1.0,false,3.0,"Dies war lediglich eine Warnung!"
3037,0,2,false,false,5,1.0,false,3.0,"Es ist mir egal, ob du lebst, solange du leidest!"
3038,0,2,false,false,5,1.0,false,3.0,"Und das hast du gut getan. Muwahahahaha!"
3039,0,2,false,false,5,1.0,false,3.0,"Die Horde hat es auf den Tempel abgesehen! Ich muss die anderen warnen!"
3040,0,2,false,false,2,3.0,false,1.0,"Danke, Abenteurer<if:in/none>."
3041,0,2,false,false,2,3.0,false,1.0,"Hoffentlich bemerken sie mich nicht."
3042,0,2,false,false,2,3.0,false,1.0,"Hoffentlich bemerken sie mich nicht."
3043,0,2,false,false,2,3.0,false,1.0,"Achtung, sie kommen!"
3044,0,2,false,false,2,3.0,false,1.0,"Was?! So viele?!"
3045,0,2,false,false,2,3.0,false,1.0,"Denen bin ich nicht gewachsen ..."
3046,0,2,false,false,2,3.0,false,1.0,"Jetzt liegt es an dir, Abenteurer<if:in/none>!"
3047,0,2,false,false,2,3.0,false,1.0,"Wer niemals ruht, nicht kämpfen kann!"
3048,0,2,false,false,2,3.0,false,1.0,"Du hast tapfer gekämpft, Abenteurer<if:in/none>."
3049,0,2,false,false,2,3.0,false,1.0,"Auf dass wir uns eines Tages wiedertreffen."
3050,0,2,false,false,5,1.0,false,3.0,"Es steht nicht gut um uns ..."
3051,0,2,false,false,5,1.0,false,3.0,"Rückzug, sofort!"
3052,0,2,false,false,5,1.0,false,3.0,"Jawohl!"
3053,0,2,false,false,5,1.0,false,3.0,"Pah ... Feige Verräter ..."
3054,0,2,false,false,5,1.0,false,3.0,"Ein Glück, du bist unversehrt."
3055,0,2,false,false,5,1.0,false,3.0,"Schnell, zum Kreidetempel!"
3056,0,2,false,false,5,1.0,false,3.0,"Verstanden!"
3057,0,2,false,false,5,1.0,false,3.0,"Hilfe, kupo!"
3058,0,2,false,false,5,1.0,false,3.0,"Jetzt oder nie, ich bin weg, kupo!"
3059,0,2,false,false,2,3.0,false,1.0,"Es wird Zeit, das Ganze zu Ende zu führen."
3060,0,2,false,false,2,3.0,false,1.0,"Auf geht's!"
3061,0,2,false,false,5,1.0,false,3.0,"Ein Sieg ist in weiter Ferne."
3062,0,2,false,false,5,1.0,false,3.0,"Ich töte gerne, fürs Sterben gilt das nicht."
3063,0,2,false,false,5,1.0,false,3.0,"Trotzdem, ein unterhaltsamer Kampf!"
3064,0,2,false,false,5,1.0,false,3.0,"Möge das Schlachten schon bald weitergehen!"
3065,0,2,false,false,2,3.0,false,1.0,"Gerettet!"
3066,0,2,false,false,5,1.0,false,3.0,"Vielen Dank, kupo!"
3067,0,2,false,false,5,1.0,false,3.0,"Wo willst du hin, Kleiner?"
3068,0,2,false,false,5,1.0,false,3.0,"Dein Weg führt direkt ins Grab!"
3069,0,2,false,false,5,1.0,false,3.0,"Ich will noch nicht sterben, kupooo!"
3070,0,2,false,false,5,1.0,false,3.0,"Hm, was hat <if:die/der> hier zu suchen?"
3071,0,2,false,false,5,1.0,false,3.0,"Ich werde <if:sie/ihn> einfach mit töten."
3072,0,2,false,false,5,1.0,false,3.0,"Doppeltes Leid, doppelte Freud! Harhar!"
3073,0,2,false,false,5,1.0,false,3.0,"Sprich dein letztes Gebet!"
3074,0,2,false,false,5,1.0,false,3.0,"Du kämpfst ... nicht schlecht ..."
3075,0,2,false,false,5,1.0,false,3.0,"Normal geht mein Spielzeug schnell kaputt ..."
3076,0,2,false,false,5,1.0,false,3.0,"So viel Spaß hatte ich schon lange nicht mehr."
3077,0,2,false,false,5,1.0,false,3.0,"Lass uns weiterspielen!"
3078,0,2,false,false,5,1.0,false,3.0,"Ein gefährliches Spielzeug bist du ..."
3079,0,2,false,false,5,1.0,false,3.0,"Doch ohne Risiko keinen Ruhm!"
3080,0,2,false,false,5,1.0,false,3.0,"Na los, weiter im blutigen Text!"
3081,0,2,false,false,5,1.0,false,3.0,"Oder war das etwa schon alles?"
3082,0,2,false,false,5,1.0,false,3.0,"Töten ist ein Spiel für ihn, kupo?"
3083,0,2,false,false,5,1.0,false,3.0,"Spielzeug? Ich bin doch kein Stofftier, kupo!"
3084,0,2,false,false,5,1.0,false,3.0,"Der ist total durchgedreht, kupo!"
3085,0,2,false,false,5,1.0,false,3.0,"Wo willst du hin, Kleiner?"
3086,0,2,false,false,5,1.0,false,3.0,"Endlich, der Kreidetempel!"
3087,0,2,false,false,5,1.0,false,3.0,"Stürmt ihn, meine Drachen!"
3088,0,2,false,false,2,3.0,false,1.0,"Läuft ja blendend ..."
3089,0,2,false,false,2,3.0,false,1.0,"Zauber, vernichte!"
3090,0,2,false,false,2,3.0,false,1.0,"Aus dem Weg!"
3091,0,2,false,false,2,3.0,false,1.0,"Meine leichteste Übung!"
3092,0,2,false,false,2,3.0,false,1.0,"Bei der Ehre der Leveilleurs!"
3093,0,2,false,false,2,3.0,false,1.0,"Thaliak, steh mir bei!"
3094,0,2,false,false,2,3.0,false,1.0,"Zeit für meinen Trumpf!"
3095,0,2,false,false,2,3.0,false,1.0,"Das ist nicht witzig!"
3096,0,2,false,false,2,3.0,false,1.0,"Nimm dies, Bastard!"
3097,0,2,false,false,2,3.0,false,1.0,"Wie schmeckt dir das?"
3098,0,2,false,false,2,3.0,false,1.0,"Tod den Häretikern!"
3099,0,2,false,false,2,3.0,false,1.0,"Halone, sei mit mir!"
3100,0,2,false,false,2,3.0,false,1.0,"Jetzt bist du dran!"
3101,0,2,false,false,2,3.0,false,1.0,"Krepier!"
3102,0,2,false,false,2,3.0,false,1.0,"Ich geb nicht auf!"
3103,0,2,false,false,2,3.0,false,1.0,"Ich schneid dich in Stücke!"
3104,0,2,false,false,2,3.0,false,1.0,"Genug!"
3105,0,2,false,false,2,3.0,false,1.0,"Hahaha!"
3106,0,2,false,false,2,3.0,false,1.0,"Dieser Kampf endet jetzt!"
3107,0,2,false,false,2,3.0,false,1.0,"Nieder mit dir!"
3108,0,2,false,false,2,3.0,false,1.0,"Ich bin erfüllt von Macht!"
3109,0,2,false,false,5,1.0,false,3.0,"Wer wagt es, sich einzumischen?"
3110,0,2,false,false,5,1.0,false,3.0,"Die feigen Verräter schicken Sterbliche vor?"
3111,0,2,false,false,5,1.0,false,3.0,"Eine bessere Aufwärmübung ..."
3112,0,2,false,false,5,1.0,false,3.0,"Also gut, wie sieht's hiermit aus?"
3113,0,2,false,false,5,1.0,false,3.0,"Seid ihr zu gar nichts zu gebrauchen?"
3114,0,2,false,false,5,1.0,false,3.0,"Na schön, dann eben die hier!"
3115,0,2,false,false,5,1.0,false,3.0,"Halte durch!"
3116,0,2,false,false,5,1.0,false,3.0,"Vedrfölnir? Pah ..."
3117,0,2,false,false,5,1.0,false,3.0,"Dein Ende ist nah!"
3118,0,2,false,false,5,1.0,false,3.0,"Kümmert euch um das Ungeziefer, meine Knechte!"
3119,0,2,false,false,5,1.0,false,3.0,"Ich bin von Dilettanten umgeben!"
3120,0,2,false,false,5,1.0,false,3.0,"Ist denn hier jeder unfähig?"
3121,0,2,false,false,5,1.0,false,3.0,"Also gut, noch einen Versuch!"
3122,0,2,false,false,5,1.0,false,3.0,"Wann habt ihr endlich genug?!"
3123,0,2,false,false,5,1.0,false,3.0,"Erbärmliches Pack!"
3124,0,2,false,false,5,1.0,false,3.0,"Ihr habt es ja nicht anders gewollt!"
3125,0,2,false,false,5,1.0,false,3.0,"Euer Auftritt, meine hörigen Mörder!"
3126,0,2,false,false,2,3.0,false,1.0,"Bloß ein Kratzer ..."
3127,0,2,false,false,2,3.0,false,1.0,"Eine Lücke!"
3128,0,2,false,false,2,3.0,false,1.0,"Erbärmliche Verteidigung!"
