709,0,2,false,false,2,5.0,false,1.0,"Kämpft, meine treuen Diener!"
710,0,2,false,false,2,5.0,false,1.0,"Warum haltet ihr inne, meine feurigen Freunde?"
711,0,2,false,false,2,5.0,false,1.0,"War meine Peitsche zu sanft zu euch?"
712,0,2,false,false,2,5.0,false,1.0,"Sie wollen einfach nicht folgen!"
713,0,2,false,false,2,5.0,false,1.0,"Bringt Verderben über den Feind!"
714,0,2,false,false,2,5.0,false,1.0,"Wagt es nicht, meine Befehle zu verweigern!"
715,0,2,false,false,2,5.0,false,1.0,"Dein Revier kannst du später markieren!"
716,0,2,false,false,3,5.0,false,1.0,"Wie kannst du es wagen?!"
717,0,2,false,false,2,5.0,false,1.0,"Spuckt Feuer, meine Drakons!"
718,0,2,false,false,2,5.0,false,1.0,"Kämpft voller Hass!"
719,0,2,false,false,2,5.0,false,1.0,"Ihr sollt eurem Herrn folgen, närrische Bestien!"
720,0,2,false,false,2,5.0,false,1.0,"Stellt euch nicht so dumm an!"
721,0,2,false,false,2,5.0,false,1.0,"Ihr wisst um die Bedeutung des Wortes Feind, oder?"
722,0,2,false,false,2,5.0,false,1.0,"Sind diese dummen Dinger denn zu gar nichts zu gebrauchen?"
723,0,2,false,false,2,5.0,false,1.0,"Ich werde euch die Futterrationen kürzen, wenn ihr so weitermacht!"
724,0,2,false,false,3,5.0,false,1.0,"Wir sind geschlagen! Rückzug!"
725,0,2,false,false,3,5.0,false,1.0,"Die störrischen Biester wollen nicht folgen! Wir ziehen uns für heute zurück!"
726,0,2,false,false,3,3.0,false,1.0,"In letzter Zeit ist es hier nicht mehr sicher."
727,0,2,false,false,3,3.0,false,1.0,"Gerüchte erzählen von Piratenüberfallen."
728,0,2,false,false,3,3.0,false,1.0,"Ganz genau. Alleine solltet Ihr hier nicht reisen."
729,0,2,false,false,3,3.0,false,1.0,"Eure Fürsorge ehrt Euch, doch was sollte ein einfacher Händler wie ich zu befürchten haben?"
730,0,2,false,false,3,3.0,false,1.0,"Unterschätzt die Grausamkeit derer nicht, die die Hoffnung verloren haben."
731,0,2,false,false,2,5.0,false,1.0,"Für Garlemald!"
732,0,2,false,false,2,5.0,false,1.0,"Ehre dem Kaiserreich!"
733,0,2,false,false,2,5.0,false,1.0,"Verschwinde vom Antlitz dieser Welt!"
734,0,2,false,false,2,5.0,false,1.0,"Du ...!"
735,0,2,false,false,2,3.0,false,1.0,"Verdammt, ich habe dringende Termine!"
736,0,2,false,false,2,3.0,false,1.0,"So komme ich nicht zum Bierhafen ..."
737,0,2,false,false,2,3.0,false,1.0,"Hab Dank, Abenteurer<if:in/none>."
738,0,2,false,false,2,3.0,false,1.0,"Verflucht, an Durchkommen ist nicht zu denken!"
739,0,2,false,false,2,3.0,false,1.0,"Du störst den unbeschränkten Warenverkehr, du ...!"
740,0,2,false,false,2,3.0,false,1.0,"Du warst mir eine große Hilfe! Danke!"
741,0,2,false,false,3,5.0,false,1.0,"Bsss! Verfolger?"
742,0,2,false,false,3,5.0,false,1.0,"Bsssim, bsssum, komm, Freund von Goblins!"
743,0,2,false,false,3,5.0,false,1.0,"Bsssim, bsssam, komm, Freund von Goblins!"
744,0,2,false,false,3,5.0,false,1.0,"Bsssim, bsssom, komm, Freund von Goblins!"
745,0,2,false,false,3,5.0,false,1.0,"Pssskoh ... pssskoh ... Goblin am Ende ist."
746,0,2,false,false,3,5.0,false,1.0,"Bastard des Lichts! Knie nieder vor dem einzig wahren Gott! Knie nieder vor Dalamud!"
747,0,2,false,false,3,5.0,false,1.0,"Die Seelen der Jünger Dalamuds schlafen nie!"
748,0,2,false,false,3,5.0,false,1.0,"Die Seelen der Jünger Dalamuds vergeben nie!"
749,0,2,false,false,3,5.0,false,1.0,"Die Seelen der Jünger Dalamuds vergessen nie!"
750,0,2,false,false,3,5.0,false,1.0,"Brüder, Schwestern! Nehmt euch meiner an! Lasst mich hier nicht zurück!"
751,0,2,false,false,3,5.0,false,1.0,"Ich diene dem Herrn des Infernos allein!"
752,0,2,false,false,3,5.0,false,1.0,"Das Feuer reinigt alles!"
753,0,2,false,false,3,5.0,false,1.0,"Verdorbene Seelen, wohin man schaut! Mögen die Flammen sie läutern!"
754,0,2,false,false,3,5.0,false,1.0,"Brenne! Brenne! Lichterloh!"
755,0,2,false,false,3,5.0,false,1.0,"Das Inferno erwartet mich!"
756,0,2,false,false,3,5.0,false,1.0,"Euren Seelen ist erst dann Rettung gewiss, wenn sie in der Siebten Hölle geschmort haben!"
757,0,2,false,false,3,5.0,false,1.0,"Erhebe dich, mein Bruder, und schreite abermals an meiner Seite!"
758,0,2,false,false,3,5.0,false,1.0,"Erhebe dich, meine Schwester, und fordere ein, was uns aus den Händen gerissen ward!"
759,0,2,false,false,3,5.0,false,1.0,"Erhebe dich, mein Vater, und stürze dich im Zorn auf unsere Feinde!"
760,0,2,false,false,3,5.0,false,1.0,"Meine Brüder ... Bald ... werden wir wieder ... vereint sein."
761,0,2,false,false,3,5.0,false,1.0,"Die Schwingen des Diesigen sollen den Mondigen verhüllen und ewige Nacht bringen!"
762,0,2,false,false,3,5.0,false,1.0,"Kommt zur Meinigen, oh Blättrige!"
763,0,2,false,false,3,5.0,false,1.0,"Der Diesige wird des Spielens müde!"
764,0,2,false,false,3,5.0,false,1.0,"Tod den Sprechenden! Tod den Alligen!"
765,0,2,false,false,3,5.0,false,1.0,"Die Flügel der Meinigen ... sind erschlafft ... "
766,0,2,false,false,3,5.0,false,1.0,"Es war töricht von dir, alleine hier zu erscheinen."
767,0,2,false,false,3,5.0,false,1.0,"Ich werde siegreich sein!"
768,0,2,false,false,3,5.0,false,1.0,"Glaube nicht, dass du schon gewonnen hast!"
769,0,2,false,false,3,5.0,false,1.0,"Vielleicht habe ich dich unterschätzt ..."
770,0,2,false,false,3,5.0,false,1.0,"Wir werden uns wiedersehen!"
771,0,2,false,false,3,5.0,false,1.0,"Sehr stark ich bin! Rache ich üben werde!"
772,0,2,false,false,3,5.0,false,1.0,"Meine Alchemie, sehr mächtig sie ist."
773,0,2,false,false,3,5.0,false,1.0,"Die Geheimnisse der Erde, kennen tu ich sie."
774,0,2,false,false,3,5.0,false,1.0,"Gehauen wir sind aus Stein! Zerfallen zu Staub wir werden. So spricht Titan!"
775,0,2,false,false,3,5.0,false,1.0,"Oh Herr der Felsen! Dieser Schmerz! Dieser Schmerz!"
776,0,2,false,false,3,5.0,false,1.0,"Komm! Der einzig wahre Gott erwartet dein Opfer!"
777,0,2,false,false,3,5.0,false,1.0,"Oh Dalamud! Läutere diese verlorenen Seelen in purpurnem Schein!"
778,0,2,false,false,3,5.0,false,1.0,"Lass die blutroten Flammen deine Sünden tilgen!"
779,0,2,false,false,3,5.0,false,1.0,"Heute Nacht soll der Tribut beglichen werden. In Blut und nichts als Blut!"
780,0,2,false,false,3,5.0,false,1.0,"Mein Herr ... Warum hast du mich ... verlassen?"
781,0,2,false,false,3,5.0,false,1.0,"Niemand widersteht der sengenden Hitze meiner Flammen!"
782,0,2,false,false,3,5.0,false,1.0,"Versuch ruhig, mit meiner Schnelligkeit mitzuhalten, erbärmlicher Wurm!"
783,0,2,false,false,3,5.0,false,1.0,"Du hast meine wahren Kräfte längst nicht gesehen!"
784,0,2,false,false,3,5.0,false,1.0,"Die Erde wird schmelzen und die See wird brodeln!"
785,0,2,false,false,3,5.0,false,1.0,"Die Flammen! Die flackern auf ... und erlöschen!"
786,0,2,false,false,3,5.0,false,1.0,"Zezerix' Herz ist voller Traurigkeit. Essen ist dort, aber Zezerix hier!"
787,0,2,false,false,3,5.0,false,1.0,"Zezerix' Bauch ist voller Grummeln und Brummeln!"
788,0,2,false,false,3,5.0,false,1.0,"Zezerix' Nase riecht lecker Fleisch und lecker Leckerli!"
789,0,2,false,false,3,5.0,false,1.0,"Zezerix' Ohren hören köstliches Knuspern und Knäusern!"
790,0,2,false,false,3,5.0,false,1.0,"Zezerix' Herz ist voller Freude! Danke, Abenteurer<if:in/none>!"
791,0,2,false,false,3,5.0,false,1.0,"Die Meinige ist so einsam und allein ..."
792,0,2,false,false,3,5.0,false,1.0,"Wo nur ist die Zuflucht der Unsrigen?"
793,0,2,false,false,3,5.0,false,1.0,"Ist es noch weit?"
794,0,2,false,false,3,5.0,false,1.0,"Die Meinige hätte niemals fortgehen dürfen."
795,0,2,false,false,3,5.0,false,1.0,"Die Meinige wird die Gütigkeit <if:der Laufenden/des Laufenden> niemals vergessen!"
796,0,2,false,false,3,5.0,false,1.0,"Als berühmter Mogry hat man's wahrlich nicht leicht, kupo!"
797,0,2,false,false,3,5.0,false,1.0,"Ich sagte doch: Keine Autogramme, kupo!"
798,0,2,false,false,3,5.0,false,1.0,"Ich sollte einfach wieder unsichtbar werden, kupo! Aber was ist ein Star, den keiner sieht?"
799,0,2,false,false,3,5.0,false,1.0,"Gucken darfst du, aber anfassen nicht, ist das klar, kupo?"
800,0,2,false,false,3,5.0,false,1.0,"Gut gemacht, sie haben mich nicht in Fetzen gerissen! Nur, wo sind denn jetzt meine ganzen Fans, kupo?"
801,0,2,false,false,3,5.0,false,1.0,"Bizzu freundlich<if:e Großgewachsene/r Großwachsener> und beschüzzu Guttrix bei seinem Gehen?"
802,0,2,false,false,3,5.0,false,1.0,"Wie hält Baumvolk blosss all die Kringelranken und Krümmelranken aus? "
803,0,2,false,false,3,5.0,false,1.0,"Gehzzu schneller, <if:Großgewachsene/Großwachsener>, gehzzu schneller!"
804,0,2,false,false,3,5.0,false,1.0,"Guttrix isss gutester Goblintauscher von alle Goblins!"
805,0,2,false,false,3,5.0,false,1.0,"Hazzu viiieeele Dank, <if:Großgewachsene/Großwachsener>! Vergizzz nicht deinen guuuten Goblinfreund Guttrix!"
806,0,2,false,false,3,5.0,false,1.0,"0"
807,0,2,false,false,3,5.0,false,1.0,"0"
808,0,2,false,false,3,5.0,false,1.0,"0"
809,0,2,false,false,3,5.0,false,1.0,"0"
810,0,2,false,false,3,5.0,false,1.0,"0"
811,0,2,false,false,3,5.0,false,1.0,"Du bist vermutlich von der Abenteurergilde, nicht wahr? Also dann, worauf warten wir?"
812,0,2,false,false,3,5.0,false,1.0,"Los, die Zeit drängt. Ich will mir das Getreide nicht von einem anderen Käufer wegschnappen lassen."
813,0,2,false,false,3,5.0,false,1.0,"Diese Gegend ist ein wenig ... unwirtlicher, als ich erwartet hatte."
814,0,2,false,false,3,5.0,false,1.0,"Wie kann jemand mit all diesen schrecklichen Kreaturen hier bloß durch den Tag kommen, geschweige denn Landwirtschaft betreiben?"
815,0,2,false,false,3,5.0,false,1.0,"Das war ... aufregend, um es mal vorsichtig auszudrücken. Ich hoffe, die Lieferung war es wert."
816,0,2,false,false,3,5.0,false,1.0,"Freundliche<if:none/r> Abenteurer<if:in/none> will Memeroon helfen? Das sehr nett sein! Komm, komm, folge Memeroon!"
817,0,2,false,false,3,5.0,false,1.0,"Böse Räuber machen armem Memeroon Angst!"
818,0,2,false,false,3,5.0,false,1.0,"Bitte, bitte, du musst Memeroons Glitzer beschützen!"
819,0,2,false,false,3,5.0,false,1.0,"Memeroon kann nicht kämpfen! Memeroon muss Glitzer beschützen, ja?"
820,0,2,false,false,3,5.0,false,1.0,"Memeroon ist in Sicherheit! Glitzer ist in Sicherheit! Muss Memeroon Glitzer teilen?"
821,0,2,false,false,3,5.0,false,1.0,"Psssht! Guttrix sucht freundliche<if: Großgewachsene/n Großgewachsenen> zu Begleitschützen bei große Schäft. Na, leuchtet in Denkschale?"
822,0,2,false,false,3,5.0,false,1.0,"Guttrix hat Gutgeschäft mit Regenleuten gemacht! Viel Klimmbimm! Da guckzzzu nua!"
823,0,2,false,false,3,5.0,false,1.0,"Gehzzu mit Schnellschritt! Gutgeschäft wartet da, wo viele Kerzzzen sind!"
824,0,2,false,false,3,5.0,false,1.0,"Guttrix ist gute Schäftmacher!"
825,0,2,false,false,3,5.0,false,1.0,"Guttrix hat warme Dankenherz für <if: Großgewachsene/Großgewachsener>! Nie weglöschen aus Dauermerken, pshh!"
826,0,2,false,false,3,5.0,false,1.0,"Sorge dafür, dass ich unbeschadet ins obere La Noscea komme, und ich sorge dafür, dass du mit Gil überschüttet wirst."
827,0,2,false,false,3,5.0,false,1.0,"Viele Verwundete im Warmwein-Sanatorium dürsten nach etwas Trost. Den wird mein Tropfen ihnen verschaffen."
828,0,2,false,false,3,5.0,false,1.0,"Einst sollen selbst alte Mütterchen von Rotgischt zum Bronzesee gereist sein, ohne mehr Schaden als Blasen an den Füßen davonzutragen."
829,0,2,false,false,3,5.0,false,1.0,"Ich spüre eine allgegenwärtige Gefahr! "
830,0,2,false,false,3,5.0,false,1.0,"Ab hier sollte ich es auch alleine schaffen. Hab dank,  <if:meine Gute/mein Freund>."
831,0,2,false,false,3,5.0,false,1.0,"Verzeiht, Abenteurer<if:in/none>. Ihr kennt nicht zufällig den Weg nach Ul'dah? Ich ... verlaufe mich ständig. "
832,0,2,false,false,3,5.0,false,1.0,"Ein reisender Händler sollte eigentlich einen besseren Orientierungssinn haben, was?"
833,0,2,false,false,3,5.0,false,1.0,"Ich hoffe, diese Geschichte wirkt sich nicht nachteilig auf unser Lieferabkommen aus."
834,0,2,false,false,3,5.0,false,1.0,"Ihr habt nicht zufällig auch böse Blicke aus den Schatten dieses Kaktus da gespürt, oder?"
835,0,2,false,false,3,5.0,false,1.0,"Tausend Dank, <if:werte Abenteurerin/werter Abenteurer>. Ich werde den Karawanen nur Gutes von Euch berichten."
836,0,2,false,false,3,5.0,false,1.0,"Guttrix nicht Bösetaten tun! Guttrix herzgute Goblin!"
837,0,2,false,false,3,5.0,false,1.0,"Guttrix wollen gute Schäft mit Flossigemann machen. "
838,0,2,false,false,3,5.0,false,1.0,"Lauernböse mit Hungernaugen suchen Mampfhampf!"
839,0,2,false,false,3,5.0,false,1.0,"Guttrix hat Guteherz! Keine Schleichlist in Hinterrücken!"
840,0,2,false,false,3,5.0,false,1.0,"Großgewachsene<if:r/m> sei Großedank! Nun kann Guttrix noch mehr gute Schäft machen!"
841,0,2,false,false,3,5.0,false,1.0,"Hat mein Onkel dich geschickt? Mein Onkel macht sich ständig Sorgen."
842,0,2,false,false,3,5.0,false,1.0,"Dabei bin ich nur hier, um meinen Vater zu sehen."
843,0,2,false,false,3,5.0,false,1.0,"I-Ich hab ü-überhaupt keine Angst ..."
844,0,2,false,false,3,5.0,false,1.0,"Vater, eines Tages bin ich auch stark!"
845,0,2,false,false,3,5.0,false,1.0,"Endlich zurück! Vielen Dank!"
846,0,2,false,false,3,3.0,false,1.0,"Das merk ich mir!"
847,0,2,false,false,3,3.0,false,1.0,"Wir sollten umkehren, solange wir noch können!"
848,0,2,false,false,3,3.0,false,1.0,"Ihr habt mich überzeugt, guter Mann, hier ist es zu gefährlich."
849,0,2,false,false,3,3.0,false,1.0,"Euer Geld ist nur die Anzahlung, verstanden? Wir kommen wieder!"
850,0,2,false,false,3,3.0,false,1.0,"N-Nichts wie weg hier!"
851,0,2,false,false,3,3.0,false,1.0,"R-Rennt um Euer Leben!"
852,0,2,false,false,3,3.0,false,1.0,"Die Operation war ein voller Erfolg!"
853,0,2,false,false,3,3.0,false,1.0,"Hier verbrennen wir uns die Finger ... Rückzug!"
854,0,2,false,false,3,3.0,false,1.0,"Welcher Eufel diese Schafe wohl geritten hatte?"
855,0,2,false,false,3,3.0,false,1.0,"Denen sind wir nicht gewachsen! Rückzug, alle Mann!"
856,0,2,false,false,2,5.0,false,1.0,"Bzzz! Großwachsene<if:none/r> falschgeben bei Schäft!"
857,0,2,false,false,2,5.0,false,1.0,"Großwachsene<if:none/r> falsche Schäft machen!"
858,0,2,false,false,2,5.0,false,1.0,"Goblin rachebekommen für Lügenzunge!"
859,0,2,false,false,2,5.0,false,1.0,"Falschsager verdient Starkeschmerz!"
860,0,2,false,false,2,5.0,false,1.0,"Großwachsene<if:none/r> wird Regenaugen bekommen von Festeschlag!"
861,0,2,false,false,2,5.0,false,1.0,"Goblins voll Rasenwut!"
862,0,2,false,false,2,5.0,false,1.0,"Großer Mann leiden muss!"
863,0,2,false,false,2,5.0,false,1.0,"Das für dich sein!"
864,0,2,false,false,2,5.0,false,1.0,"Heute nicht unser Tag!"
865,0,2,false,false,2,5.0,false,1.0,"Goblins wiederkommen zu Rachezeit!"
866,0,2,false,false,2,5.0,false,1.0,"Verflixzzt!"
867,0,2,false,false,2,5.0,false,1.0,"Verschwendung von Zeit! Muss Gil gegen Ware tauschen!"
868,0,2,false,false,2,5.0,false,1.0,"Zurück arbeiten!"
869,0,2,false,false,2,5.0,false,1.0,"Jetzt mit Goblin Tausch machen?"
870,0,2,false,false,3,3.0,false,1.0,"Zurück an die Arbeit mit euch!"
871,0,2,false,false,3,3.0,false,1.0,"Und Lalafell sind doch die Schönsten!"
872,0,2,false,false,3,3.0,false,1.0,"Und Miqo'te sind doch die Schönsten!"
873,0,2,false,false,3,3.0,false,1.0,"H-Habt ihr ... jetzt endlich genug?"
874,0,2,false,false,3,3.0,false,1.0,"Hm, vielleicht sind Miqo'te ja doch nicht so schlecht."
875,0,2,false,false,3,3.0,false,1.0,"Hm, vielleicht sind Lalafell ja doch nicht so schlecht."
876,0,2,false,false,3,3.0,false,1.0,"Ha, willst du's ausdiskutieren?"
877,0,2,false,false,3,3.0,false,1.0,"Worauf du dich verlassen kannst!"
878,0,2,false,false,3,3.0,false,1.0,"B-Bitte nicht schon wieder!!!"
879,0,2,false,false,3,5.0,false,1.0,"Pssskoh ... Bzzzzz ..."
880,0,2,false,false,3,5.0,false,1.0,"Tryptix hauselaufen mit Schnelleschritt."
881,0,2,false,false,2,5.0,false,1.0,"Pshh! Tryptix schwerthelfen gegen Ärgerbringer!"
882,0,2,false,false,2,5.0,false,1.0,"Fremdleute nicht willkommen mit Offenarm! Zertöten Tryptix Letztenerv."
883,0,2,false,false,2,5.0,false,1.0,"Tryptix wird dir Denkschachtel klopfen mit Schnellefaust!"
884,0,2,false,false,2,5.0,false,1.0,"Tryptix haut mit Ganzekraft!"
885,0,2,false,false,3,5.0,false,1.0,"Qiqirn sind hier nicht erwünscht."
886,0,2,false,false,3,5.0,false,1.0,"Dieser Gestank ... verkündet nichts Gutes!"
887,0,2,false,false,3,5.0,false,1.0,"Wenn wir hier fertig sind, kannst du einen aufs Haus trinken!"
888,0,2,false,false,2,5.0,false,1.0,"Stinkende Biester!"
889,0,2,false,false,2,5.0,false,1.0,"Hau ab!"
890,0,2,false,false,2,5.0,false,1.0,"Seid ihr schwer von Begriff?"
891,0,2,false,false,2,5.0,false,1.0,"Ihr vertreibt uns die Gäste!"
892,0,2,false,false,2,5.0,false,1.0,"Ihr wollt's ja nicht anders!"
893,0,2,false,false,2,5.0,false,1.0,"Guguroon auch Bitterwasser trinken will!"
894,0,2,false,false,2,5.0,false,1.0,"Mit Glitzer zahlen!"
895,0,2,false,false,2,5.0,false,1.0,"Qiqirn können kämpfen!"
896,0,2,false,false,2,5.0,false,1.0,"Ihr Qiqirn reinlassen!"
897,0,2,false,false,2,5.0,false,1.0,"Qiqirn auch Gäste!"
898,0,2,false,false,3,5.0,false,1.0,"So, den wären wir los!"
899,0,2,false,false,3,5.0,false,1.0,"Trink einen drauf, du hast es dir verdient."
900,0,2,false,false,3,5.0,false,1.0,"Ich werd mir auch mal 'ne Auszeit gönnen."
901,0,2,false,false,3,5.0,false,1.0,"Der ... hat wohl erst mal genug, was?"
902,0,2,false,false,3,5.0,false,1.0,"Verdammt, der hat mich ganz schön auseinandergenommen."
903,0,2,false,false,3,5.0,false,1.0,"Jetzt brauch ich erst mal 'n kühles Bier."
904,0,2,false,false,2,5.0,false,1.0,"Unsterbliche kommen, schnell weg!"
905,0,2,false,false,2,5.0,false,1.0,"Arbeit wartet!"
906,0,2,false,false,2,5.0,false,1.0,"Qiqirn wiederkommen!"
907,0,2,false,false,2,5.0,false,1.0,"Nächstes Mal ganzes Fass trinken!"
908,0,2,false,false,3,5.0,false,1.0,"Dieser ekelerregende Gestank kann nur eines bedeuten ..."
909,0,2,false,false,3,5.0,false,1.0,"Guguroon viel Bittersaft will!"
910,0,2,false,false,2,3.0,false,1.0,"M-Meister Weggfarr?!"
911,0,2,false,false,2,3.0,false,1.0,"A-Aber wir kämpfen doch für Euch!"
912,0,2,false,false,2,3.0,false,1.0,"Ist das der Dank?!"
913,0,2,false,false,2,3.0,false,1.0,"Ihr Waschlappen!"
914,0,2,false,false,2,3.0,false,1.0,"Gebt euch mehr Mühe!"
915,0,2,false,false,3,5.0,false,1.0,"Kämpft! Kämpft um euer Leben!"
916,0,2,false,false,3,5.0,false,1.0,"Ahrg! Heute ist nicht unser Tag ..."
917,0,2,false,false,3,5.0,false,1.0,"Verflucht, schnell! Irgendwer soll mir helfen!"
918,0,2,false,false,2,3.0,false,1.0,"Kraaar!"
919,0,2,false,false,2,5.0,false,1.0,"Käpt'n ist stark, Käpt'n ist stark! Kraaar!"
920,0,2,false,false,2,5.0,false,1.0,"Räudiger Hund, räudiger Hund! Kraaar!"
921,0,2,false,false,2,5.0,false,1.0,"Macht die Schotten dicht! Kraaar!"
922,0,2,false,false,2,5.0,false,1.0,"Rette sich, wer kann, rette sich, wer kann! Kraaar!"
923,0,2,false,false,2,5.0,false,1.0,"Land unter, Land unter! Kraaar!"
924,0,2,false,false,3,3.0,false,1.0,"Weit und breit keines der Biester mehr zu sehen. Ausgezeichnet!"
925,0,2,false,false,3,3.0,false,1.0,"Das hat mir den Tag gerettet!"
926,0,2,false,false,3,3.0,false,1.0,"Endlich kann ich mein Feld bestellen."
927,0,2,false,false,3,3.0,false,1.0,"Solch tatkräftige Hilfe kann ich bestimmt wieder mal gebrauchen!"
928,0,2,false,false,3,3.0,false,1.0,"Die Biester sind so leicht nicht auszurotten, was?"
929,0,2,false,false,3,3.0,false,1.0,"Beim nächsten Mal müssen sie hoffentlich dran glauben."
930,0,2,false,false,3,3.0,false,1.0,"Mein Feld!"
931,0,2,false,false,3,3.0,false,1.0,"Ich muss unbedingt mein Feld verteidigen!"
932,0,2,false,false,3,3.0,false,1.0,"Wir haben keine Zeit zu verlieren!"
933,0,2,false,false,3,3.0,false,1.0,"Auf geht's!"
934,0,2,false,false,3,3.0,false,1.0,"Danke dir!"
935,0,2,false,false,3,3.0,false,1.0,"Macht euch auf was gefasst!"
936,0,2,false,false,3,3.0,false,1.0,"Wer wagt es, zu stören?!"
937,0,2,false,false,3,3.0,false,1.0,"U-Unsere Geldquelle!"
938,0,2,false,false,3,3.0,false,1.0,"Das muss mit dem Tode bestraft werden!"
939,0,2,false,false,3,3.0,false,1.0,"Wir sind im Hintertreffen?"
940,0,2,false,false,3,3.0,false,1.0,"Das kann ... nicht wahr sein!"
941,0,2,false,false,3,3.0,false,1.0,"Bei den Sieben Höllen!"
942,0,2,false,false,2,3.0,false,1.0,"Stirbst du jetzt, Flügelloser, kha!"
943,0,2,false,false,2,3.0,false,1.0,"Khaaa! Was bist du?!"
944,0,2,false,false,4,1.0,false,3.0,"Urth ... Wohin bist du entschwunden ...?"
945,0,2,false,false,4,1.0,false,3.0,"Urth ... Eines Tages werde ich dich finden."
946,0,2,false,false,4,1.0,false,3.0,"Bald, Urth ... schon bald."
947,0,2,false,false,4,1.0,false,3.0,"Wer erdreistet sich ...?\nDu wagst es, mir den Weg zu versperren?!"
948,0,2,false,false,4,1.0,false,3.0,"Närrische Sterbliche!"
949,0,2,false,false,4,1.0,false,3.0,"Höret das Wehklagen meiner Klinge ..."
950,0,2,false,false,4,1.0,false,3.0,"Seht mich an! Ein Gott vor den Sterblichen ... doch ein Sterblicher vor den Göttern."
951,0,2,false,false,4,1.0,false,3.0,"Meine Klinge aus Obsidian soll deine Existenz zerschneiden ..."
952,0,2,false,false,4,1.0,false,3.0,"Den zarten Faden, der in deinem Sein das Kommende mit schon Vergangenem verbindet."
953,0,2,false,false,4,1.0,false,3.0,"Du weißt nicht ... was du tust. Verloren ist deine arme Seele ..."
954,0,2,false,false,2,5.0,false,1.0,"Werd ich das Meer je wiederseh'n?"
955,0,2,false,false,2,5.0,false,1.0,"Packen wir's an!"
956,0,2,false,false,2,5.0,false,1.0,"Das ist unsere letzte Chance."
957,0,2,false,false,2,5.0,false,1.0,"Ich liebe das Meer ..."
958,0,2,false,false,2,5.0,false,1.0,"Wir dürfen nicht aufgeben."
959,0,2,false,false,2,5.0,false,1.0,"Hier ist unser zu Hause!"
960,0,2,false,false,2,5.0,false,1.0,"Hm, an Land is' es auch gar nicht so schlecht."
961,0,2,false,false,2,5.0,false,1.0,"Wer ist als nächstes an der Reihe?"
962,0,2,false,false,2,5.0,false,1.0,"Hier an Land gefällt's mir nicht schlecht."
963,0,2,false,false,2,5.0,false,1.0,"Was das war?"
964,0,2,false,false,2,5.0,false,1.0,"Geschäft is' Geschäft!"
965,0,2,false,false,2,5.0,false,1.0,"Heute auch groß Geschäft, ja?"
966,0,2,false,false,2,3.0,false,1.0,"<if:Druidin/Druide>, bitte heilt mich!"
967,0,2,false,false,2,3.0,false,1.0,"Schlagt den Feind zurück,  <if:Druidin/Druide>!"
968,0,2,false,false,3,3.0,false,1.0,"Zieht den Wölfen das Fell über die Ohren!"
969,0,2,false,false,2,3.0,false,1.0,"Nur ein toter Wolf, ist ein guter Wolf!"
970,0,2,false,false,3,3.0,false,1.0,"Ixal! Haltet sie auf!"
971,0,2,false,false,2,3.0,false,1.0,"Für die Ehre des Hauses Durendaire!"
972,0,2,false,false,2,3.0,false,1.0,"Flieht nur, ihr feigen Vögel!"
973,0,2,false,false,2,3.0,false,1.0,"Khaaa, khaaa! Gehst du aus dem Weg!"
974,0,2,false,false,2,3.0,false,1.0,"Kannst du sofort verschwinden, verstehst du!"
975,0,2,false,false,2,3.0,false,1.0,"Picke ich deine Augen aus, kha!"
976,0,2,false,false,3,3.0,false,1.0,"Verdammte Drachenbrut!"
977,0,2,false,false,2,3.0,false,1.0,"Jaaa! Der Sieg ist unser!"
978,0,2,false,false,2,3.0,false,1.0,"Für die Ehre der Familie Fortemps!"
979,0,2,false,false,2,3.0,false,1.0,"Halone, steh uns bei!"
980,0,2,false,false,2,3.0,false,1.0,"Ehre oder Tod!"
981,0,2,false,false,3,3.0,false,1.0,"Wir fürchten euch nicht, Drachenbrut!"
982,0,2,false,false,2,3.0,false,1.0,"Für Ishgard!"
983,0,2,false,false,2,3.0,false,1.0,"Diesen Boden tränken wir mit eurem Blut!"
984,0,2,false,false,2,3.0,false,1.0,"Spürt den Zorn der Durendaire!"
985,0,2,false,false,2,5.0,false,1.0,"Ah, es ist angerichtet! An euren Hirnen will ich mich laben!"
986,0,2,false,false,2,5.0,false,1.0,"Wer mir dient ... dient für immer!"
987,0,2,false,false,2,5.0,false,1.0,"Tod dem Feind, mein treuer Diener!"
988,0,2,false,false,2,5.0,false,1.0,"Gepriesen sei Dalamud!"
989,0,2,false,false,2,5.0,false,1.0,"Ich habe noch ein Ass im Ärmel!"
990,0,2,false,false,2,5.0,false,1.0,"Beherrscher der immer währenden Dunkelheit, erhöre mich!"
991,0,2,false,false,2,5.0,false,1.0,"Erhebe dich aus dem Nichts!"
992,0,2,false,false,2,5.0,false,1.0,"Höre meine Stimme, Dämon!"
993,0,2,false,false,2,5.0,false,1.0,"Niemand hält uns auf!"
994,0,2,false,false,2,5.0,false,1.0,"Gridanische Hunde!"
995,0,2,false,false,2,5.0,false,1.0,"Tod den Ungläubigen!"
996,0,2,false,false,2,3.0,false,1.0,"Hier ist weit mehr Schlamm als erwartet ..."
997,0,2,false,false,2,3.0,false,1.0,"Ich kenn mich mit so etwas aus, aber Arbeit ist es trotzdem ..."
998,0,2,false,false,2,3.0,false,1.0,"Wenn man den Schlamm wegspülen könnte ..."
999,0,2,false,false,3,3.0,false,1.0,"Die Gigas! Macht euch bereit!"
1000,0,2,false,false,2,3.0,false,1.0,"Wir weichen kein Stück zurück!"
1001,0,2,false,false,3,3.0,false,1.0,"Ahrrr, Hippogryyyphen!"
1002,0,2,false,false,2,3.0,false,1.0,"Harharhar, so nicht, Freundchen!"
1003,0,2,false,false,2,3.0,false,1.0,"Mithilfe der Kraft der Natur kann ich es schaffen."
1004,0,2,false,false,2,3.0,false,1.0,"Ich spüre die Kraft der Natur in mir!"
1005,0,2,false,false,3,5.0,false,1.0,"Hurra! Gerettet!"
1006,0,2,false,false,3,5.0,false,1.0,"Ich war so in meine Forschung vertieft ..."
1007,0,2,false,false,3,5.0,false,1.0,"Sind die Gigas weg?"
1008,0,2,false,false,3,5.0,false,1.0,"W-War da nicht was?"
1009,0,2,false,false,3,5.0,false,1.0,"Da sind wir endlich! Danke für die Hilfe."
1010,0,2,false,false,3,5.0,false,1.0,"Spürst du fürchterliche Kraft von verbotene Magie!"
1011,0,2,false,false,3,5.0,false,1.0,"Weht der Wind der Unterwelt jetzt! Spürst du eisigen Klauen?"
1012,0,2,false,false,3,5.0,false,1.0,"Der Frost von Unterwelt! Zitterst und stirbst du!"
1013,0,2,false,false,3,5.0,false,1.0,"Von Unterwelt Dämon! Verstehst du, euer Ende nah?!"
1014,0,2,false,false,3,5.0,false,1.0,"Wollte ich doch ... aufsteigen ... Das kann jetzt letzter Flug ... sein."
1015,0,2,false,false,3,5.0,false,1.0,"Ich bin Mimaaas!"
1016,0,2,false,false,3,5.0,false,1.0,"Kommt heeer!"
1017,0,2,false,false,3,5.0,false,1.0,"Mimas ist wütend!"
1018,0,2,false,false,3,5.0,false,1.0,"Neeeein!"
1019,0,2,false,false,3,5.0,false,1.0,"Mimas ... am Ende ..."
1020,0,2,false,false,3,5.0,false,1.0,"Das sind sie ja, die Schoßhündchen des Papstes."
