Index,0 [0x7][0xc],1 [0x3][0x10],2 [0x19][0x12],3 [0x1a][0x12],4 [0x3][0x11],5 [0x9][0x4],6 [0x1b][0x12],7 [0x9][0x8],8 [0x0][0x0]
0,0,2,false,false,1,1.0,false,1.0,"0"
1,0,2,false,false,3,1.0,false,1.0,"0"
2,0,2,false,false,3,5.0,false,1.0,"0"
3,0,2,false,false,3,5.0,false,1.0,"Psst! Die Anolis kommen immer näher ...!"
4,0,2,false,false,3,5.0,false,1.0,"Kein einziger Imp darf entkommen!"
5,0,2,false,false,3,5.0,false,1.0,"Verdammt, es sind zu viele!"
6,0,2,false,false,3,5.0,false,1.0,"Die Schnaken! Sie sind überall!"
7,0,2,false,false,3,5.0,false,1.0,"Die Sylphen kommen, haltet euch bereit!"
8,0,2,false,false,3,5.0,false,1.0,"Oh nein, es werden immer mehr!"
9,0,2,false,false,3,5.0,false,1.0,"Wir werden für Sicherheit auf den Straßen sorgen!"
10,0,2,false,false,3,5.0,false,1.0,"Denen werden wir's zeigen ... "
11,0,2,false,false,3,5.0,false,1.0,"Sie sind hinter den Bohnen her!"
12,0,2,false,false,3,5.0,false,1.0,"Die Ixal! Zu Hilfe!"
13,0,2,false,false,3,5.0,false,1.0,"Seit wann kommen die Ziz in diese Gegend?!"
14,0,2,false,false,3,5.0,false,1.0,"Da kommen sie schon wieder!"
15,0,2,false,false,3,5.0,false,1.0,"Sieh dich vor, die Opo-Opos drehen durch!"
16,0,2,false,false,3,5.0,false,1.0,"Bei den Höllen ... Zeit, die Taktik zu ändern!"
17,0,2,false,false,3,5.0,false,1.0,"Bringt sie um! "
18,0,2,false,false,3,5.0,false,1.0,"Kann uns vielleicht jemand helfen?!"
19,0,2,false,false,3,5.0,false,1.0,"Meine Waren! Die Goblins haben meine Waren!"
20,0,2,false,false,3,5.0,false,1.0,"Sieh dir all diese Golems an!"
21,0,2,false,false,3,5.0,false,1.0,"Noch mehr Imps. Das gibt's doch nicht!"
22,0,2,false,false,3,5.0,false,1.0,"Wenn das so weitergeht, sind bald gar keine Blüten mehr übrig!"
23,0,2,false,false,3,5.0,false,1.0,"Haltet sie auf!"
24,0,2,false,false,3,5.0,false,1.0,"Schaff mir einer diesen Typen vom Hals!"
25,0,2,false,false,3,5.0,false,1.0,"Aus dem Weeeg!"
26,0,2,false,false,2,5.0,false,1.0,"Ngaaah!"
27,0,2,false,false,2,5.0,false,1.0,"Haah!"
28,0,2,false,false,2,5.0,false,1.0,"Stirb schon!"
29,0,2,false,false,2,5.0,false,1.0,"Hngg ..."
30,0,2,false,false,2,5.0,false,1.0,"Versuch das nicht\nnoch mal, du ...!"
31,0,2,false,false,2,5.0,false,1.0,"Du gehörst mir!"
32,0,2,false,false,2,5.0,false,1.0,"Na los, wer will es mit mir aufnehmen?!"
33,0,2,false,false,2,5.0,false,1.0,"Was ist, willst du mehr?"
34,0,2,false,false,2,5.0,false,1.0,"Raaaaaaaah!"
35,0,2,false,false,2,5.0,false,1.0,"Das war's, mieses Gesindel!"
36,0,2,false,false,2,5.0,false,1.0,"Aus dem Weg!"
37,0,2,false,false,2,5.0,false,1.0,"Ich mach dich fertig!"
38,0,2,false,false,2,5.0,false,1.0,"Lass uns ein wenig Spaß haben!"
39,0,2,false,false,2,5.0,false,1.0,"Du wünschst eine Audienz beim König der Könige?"
40,0,2,false,false,2,3.0,false,1.0,"Knie nieder vor deinem König!"
41,0,2,false,false,2,3.0,false,1.0,"Ich will dich singen hören!"
42,0,2,false,false,2,3.0,false,1.0,"Komm doch näher!"
43,0,2,false,false,2,5.0,false,1.0,"Du wagst es ...!"
44,0,2,false,false,2,5.0,false,1.0,"Das ist höchst impertinent."
45,0,2,false,false,2,3.0,false,1.0,"Tanzt für euren König!"
46,0,2,false,false,2,3.0,false,1.0,"Ist es das, was du willst?"
47,0,2,false,false,2,3.0,false,1.0,"Sieh her ..."
48,0,2,false,false,2,5.0,false,1.0,"Was gibbssa ssu tuscheln, ihr Baum...sschnecken!"
49,0,2,false,false,2,5.0,false,1.0,"Ssswerden wir schonnichs ... letzte Mal, kapiert?! Hick!"
50,0,2,false,false,2,5.0,false,1.0,"Gahahah! Hick! Wer will als Nächssses?"
51,0,2,false,false,2,5.0,false,1.0,"Kann man hier nicht mal in Frieden seinen Met trinken?"
52,0,2,false,false,2,3.0,false,1.0,"Hassu ... 'n Prolll...Bl...Prollem?! Was?"
53,0,2,false,false,2,3.0,false,1.0,"Heilllle Scheiße! Hick!"
54,0,2,false,false,2,5.0,false,1.0,"Die Meinige ist bereit!"
55,0,2,false,false,2,5.0,false,1.0,"Es geht los!"
56,0,2,false,false,2,5.0,false,1.0,"Die Andrigen müssen leiden!"
57,0,2,false,false,2,5.0,false,1.0,"Die Meinige wird nicht untergehen!"
58,0,2,false,false,3,5.0,false,1.0,"Das Klageregiment braucht Unterstützung!"
59,0,2,false,false,3,5.0,false,1.0,"Bis hierher habt ihr euch also geschleppt ... nur um hier zugrunde zu gehen!"
60,0,2,false,false,3,5.0,false,1.0,"Macht schon! Zeigt mir, was ihr drauf habt!"
61,0,2,false,false,3,5.0,false,1.0,"Genug! Die Übung ist beendet."
62,0,2,false,false,3,5.0,false,1.0,"Verdammt, es sind zu viele!"
63,0,2,false,false,3,5.0,false,1.0,"Denen werden wir das Wildern schon austreiben!"
64,0,2,false,false,3,5.0,false,1.0,"Ist der Stadtstaat schon so arm, dass Abenteurer die Drecksarbeit erledigen müssen?"
65,0,2,false,false,3,5.0,false,1.0,"Ihr sollt verdammt sein! Der Wald gehört nicht euch!"
66,0,2,false,false,3,5.0,false,1.0,"Großwachsene werfen Gierauge auf Habensachen?"
67,0,2,false,false,3,3.0,false,1.0,"Goblinhorde! Goblinhorde!"
68,0,2,false,false,3,3.0,false,1.0,"Goblinhorde! Goblinhorde! Bumm bumm!"
69,0,2,false,false,3,3.0,false,1.0,"Goblinhorde! Goblinhorde! Krawumm!"
70,0,2,false,false,3,5.0,false,1.0,"Nein! Goblinfezzte wird Trümmerstaub!"
71,0,2,false,false,3,5.0,false,1.0,"Fort, Großwachsene! Sonst kommt Zerfetzenkugel!"
72,0,2,false,false,3,3.0,false,1.0,"Feuerbummzzz! Feuerbummzzz!"
73,0,2,false,false,3,3.0,false,1.0,"Feuerbummzzz! Feuerbummzzz! Bumm bumm!"
74,0,2,false,false,3,3.0,false,1.0,"Feuerbummzzz! Feuerbummzzz! Krawumm!"
75,0,2,false,false,3,5.0,false,1.0,"Nein! Goblinfezzte alles Kaputtebrett!"
76,0,2,false,false,3,5.0,false,1.0,"Oh! Schöne Goblinfezzte nur mehr Kleinesholz!"
77,0,2,false,false,3,5.0,false,1.0,"Enghirnige wollen Fezzte zu Flacherde machen! Flickblix zzahlt mit Feuerbummzzz heim!"
78,0,2,false,false,3,5.0,false,1.0,"Goblinbande! Mehr Feuerbummzzz! Mehr Feuerbummzz!"
79,0,2,false,false,3,5.0,false,1.0,"Oh! Großerschmerz in Denkschale ... "
80,0,2,false,false,3,3.0,false,1.0,"Stickflix! Stickflix!"
81,0,2,false,false,3,3.0,false,1.0,"Stickflix! Stickflix! Bumm bumm!"
82,0,2,false,false,3,3.0,false,1.0,"Stickflix! Stickflix! Kawumm!"
83,0,2,false,false,3,5.0,false,1.0,"Meine geliebten Kreaturen! Kommt, folgt der Meinigen!"
84,0,2,false,false,3,5.0,false,1.0,"Die Meinige wird wütend ..."
85,0,2,false,false,3,5.0,false,1.0,"Der Meinigen reicht es so langsam ..."
86,0,2,false,false,3,5.0,false,1.0,"Die Meinige wird nicht länger leiden!"
87,0,2,false,false,3,3.0,false,1.0,"Eure Hoheit!"
88,0,2,false,false,2,3.0,false,1.0,"Bl...Blleibssu gefälligss hier!"
89,0,2,false,false,2,3.0,false,1.0,"Gahahah!"
90,0,2,false,false,2,3.0,false,1.0,"Ich hätte ihn sonst auch selbst ruhiggestellt ... Trotzdem danke!"
91,0,2,false,false,3,5.0,false,1.0,"Vielen Dank."
92,0,2,false,false,3,5.0,false,1.0,"..."
93,0,2,false,false,3,5.0,false,1.0,"Für Weicheier hat die Bruderschaft keinen Platz!"
94,0,2,false,false,3,3.0,false,1.0,"Oh nein! Hier kommt er schon!"
95,0,2,false,false,3,5.0,false,1.0,"Bald ist es Zeit für meinen Rundgang ..."
96,0,2,false,false,3,5.0,false,1.0,"Marienkäfer! Ein ganzer Schwarm!"
97,0,2,false,false,2,5.0,false,1.0,"Jemand muss diese Biester verjagen!"
98,0,2,false,false,3,5.0,false,1.0,"Puh, hoffentlich haben wir jetzt erst mal etwas Ruhe."
99,0,2,false,false,3,5.0,false,1.0,"Sie haben uns alles kaputtgefressen! Wie schrecklich ..."
100,0,2,false,false,3,5.0,false,1.0,"0"
101,0,2,false,false,3,5.0,false,1.0,"0"
102,0,2,false,false,3,5.0,false,1.0,"0"
103,0,2,false,false,2,3.0,false,1.0,"0"
104,0,2,false,false,2,3.0,false,1.0,"0"
105,0,2,false,false,2,3.0,false,1.0,"0"
106,0,2,false,false,2,3.0,false,1.0,"0"
107,0,2,false,false,3,5.0,false,1.0,"Die Meinige braucht Hilfe!"
108,0,2,false,false,3,5.0,false,1.0,"Vielen Dank!"
109,0,2,false,false,3,5.0,false,1.0,"Hm? War da nicht gerade ein Geräusch?"
110,0,2,false,false,3,5.0,false,1.0,"Ich werde euch lehren, anderer Leute Überreste zu zerfleddern!"
111,0,2,false,false,3,5.0,false,1.0,"Verpiss dich, du kleiner Haufen Hörnchenscheiße!"
112,0,2,false,false,3,5.0,false,1.0,"Wer hat dich eingeladen, Wanze?"
113,0,2,false,false,3,5.0,false,1.0,"Mach dich vom Acker, bevor ich ungemütlich werden muss!"
114,0,2,false,false,3,5.0,false,1.0,"Da scheint ein Schnüffler eine Abreibung zu brauchen!"
115,0,2,false,false,2,3.0,false,1.0,"Willst du zu uns?"
116,0,2,false,false,2,3.0,false,1.0,"Verschlagener Bastard ..."
117,0,2,false,false,2,3.0,false,1.0,"Mein Körper ... fühlt sich so schwer an."
118,0,2,false,false,2,3.0,false,1.0,"Verdammt! Nicht jetzt!"
119,0,2,false,false,3,5.0,false,1.0,"Ich sollte wohl besser\neinen Abenteurer um\nHilfe bitten ..."
120,0,2,false,false,3,5.0,false,1.0,"Die Amalj'aa scheinen uns nicht zu verfolgen. Sehr gut."
121,0,2,false,false,3,5.0,false,1.0,"Vielen Dank für deine Hilfe!"
122,0,2,false,false,2,3.0,false,1.0,"Gugooooahr!"
123,0,2,false,false,2,3.0,false,1.0,"Gugraaahr!"
124,0,2,false,false,3,5.0,false,1.0,"Sch-Schafe! Eine ganze Herde! Sie rennen direkt auf uns zu!"
125,0,2,false,false,3,5.0,false,1.0,"Eine Stampede! Wir müssen die Tiere stoppen!"
126,0,2,false,false,3,5.0,false,1.0,"Hier ist alles ruhig ..."
127,0,2,false,false,3,5.0,false,1.0,"Eine Engstelle. Seht Euch vor!"
128,0,2,false,false,3,5.0,false,1.0,"Kann sich nur noch um Sekunden handeln! Seid auf der Hut!"
129,0,2,false,false,3,10.0,false,1.0,"Da sind sie!"
130,0,2,false,false,2,5.0,false,1.0,"Eindringlinge? Was habt ihr hier zu suchen?"
131,0,2,false,false,2,4.0,false,1.0,"Meine Männer! Das werdet ihr büßen!"
132,0,2,false,false,2,4.0,false,1.0,"Wehe euch! Jetzt habt ihr mich wütend gemacht."
133,0,2,false,false,2,4.0,false,1.0,"I-Ich halte mich lediglich etwas zurück, nett wie ich bin."
134,0,2,false,false,2,6.0,false,1.0,"Da fällt mir ein! Ich hatte ja einen Termin!"
135,0,2,false,false,2,4.0,false,1.0,"Lästig wie Kletten ..."
136,0,2,false,false,2,2.0,false,1.0,"Fütterungszeit, meine Hündchen!"
137,0,2,false,false,2,4.0,false,1.0,"A-Aua! Langsam ist das nicht mehr lustig!"
138,0,2,false,false,2,6.0,false,1.0,"Wie soll ich das bloß erklären? Ich bin geliefert!"
139,0,2,false,false,2,4.0,false,1.0,"Nimm dies!"
140,0,2,false,false,2,4.0,false,1.0,"Aus dir mach ich Fischfutter!"
141,0,2,false,false,2,4.0,false,1.0,"Sprich dein letztes Gebet!"
142,0,2,false,false,2,4.0,false,1.0,"Nicht mit mir, Freundchen!"
143,0,2,false,false,2,5.0,false,1.0,"Psssh, pssskoh ... Netter Goblin helfen!"
144,0,2,false,false,2,4.0,false,1.0,"Bzzz ... Goblinleben vielzzu kurz."
145,0,2,false,false,2,4.0,false,1.0,"Hilfeee, Goblin in Not!"
146,0,2,false,false,2,4.0,false,1.0,"Endenah, Endenah ..."
147,0,2,false,false,2,6.0,false,1.0,"Psss, Vielendank für Gutetat!"
148,0,2,false,false,2,6.0,false,1.0,"Shkohhh, Goblin dir Immerdank schuldet!"
149,0,2,false,false,2,6.0,false,1.0,"Großwachsene<if:none/r> nehmen das Zeichen von Dank!"
150,0,2,false,false,3,6.0,false,1.0,"Psssh! Ihr Echsen Blauwunder erleben!"
151,0,2,false,false,3,3.0,false,1.0,"Shkoh, Großwachsene Vertrauen haben in Goblin."
152,0,2,false,false,3,4.0,false,1.0,"Bzzzz ... Goblin ist Starkkrieger, jaja."
153,0,2,false,false,2,4.0,false,1.0,"Bzzz, das was knapp."
154,0,2,false,false,2,6.0,false,1.0,"Goblins haben gewonnen, bzzz!"
155,0,2,false,false,2,3.0,false,1.0,"Nimm dieses Kawummbumm, du ...!"
156,0,2,false,false,3,2.0,false,1.0,"Gob?!"
157,0,2,false,false,2,5.0,false,1.0,"Der ist für Großwachsene<if:none/n>!"
158,0,2,false,false,2,8.0,false,1.0,"Psss, bzzz ... Ein Leichtspiel für Goblins!"
159,0,2,false,false,2,6.0,false,1.0,"Pssshhh! Verstärkung kommt!"
160,0,2,false,false,2,6.0,false,1.0,"Goblin dich erschreckt hat?"
161,0,2,false,false,2,6.0,false,1.0,"Psss! Neue Legende entstehen!"
162,0,2,false,false,2,10.0,false,1.0,"Brüllvolx ist Großgoblin!"
163,0,2,false,false,2,10.0,false,1.0,"Brüllvolx ist Starkgoblin!"
164,0,2,false,false,2,30.0,false,1.0,"Nettworte freuen Brüllvolx, aber nichts Besonderes getan."
165,0,2,false,false,3,5.0,false,1.0,"Die Schakale sind los!\nRette sich, wer kann!"
166,0,2,false,false,3,5.0,false,1.0,"Bleibt mir vom Leib!"
167,0,2,false,false,3,5.0,false,1.0,"Ich bin total zäh, ehrlich!"
168,0,2,false,false,3,5.0,false,1.0,"Hilfe!"
169,0,2,false,false,3,5.0,false,1.0,"Puh, das war knapp ..."
170,0,2,false,false,2,3.0,false,1.0,"Hm? Was geht hier vor?"
171,0,2,false,false,2,3.0,false,1.0,"P-Pugil!\nEin ganzer Schwarm!"
172,0,2,false,false,3,5.0,false,1.0,"Da ruft jemand um Hilfe!"
173,0,2,false,false,3,5.0,false,1.0,"In Ordnung!\nWir ziehen uns zurück!"
174,0,2,false,false,2,5.0,false,1.0,"Für den Mahlstrom!"
175,0,2,false,false,3,5.0,false,1.0,"Damit solltet ihr auch alleine fertig werden!"
176,0,2,false,false,3,5.0,false,1.0,"Ist das zu fassen?!"
177,0,2,false,false,2,5.0,false,1.0,"Wir können jede Hilfe gebrauchen!"
178,0,2,false,false,2,5.0,false,1.0,"Lasst euch nicht übermannen, ihr Waschlappen!"
179,0,2,false,false,2,5.0,false,1.0,"Du bist eine Schande für den Mahlstrom! Streng dich gefälligst an!"
180,0,2,false,false,3,5.0,false,1.0,"Ich spüre ... nacktes Grauen!"
181,0,2,false,false,3,5.0,false,1.0,"Ich zeig dir, was 'ne Harke ist."
182,0,2,false,false,3,5.0,false,1.0,"Mit dieser Schande werden wir leben müssen ..."
183,0,2,false,false,3,5.0,false,1.0,"Zeit für die nächtliche Patrouille!"
184,0,2,false,false,3,5.0,false,1.0,"Was ... ist das? Klingt wie tausend schlagende Flügel?"
185,0,2,false,false,3,5.0,false,1.0,"H-Höhlenfledermäuse? Wo kommen die her?"
186,0,2,false,false,3,5.0,false,1.0,"Ich bin fix und alle. Jetzt erst mal 'n heißes Bad!"
187,0,2,false,false,3,5.0,false,1.0,"Verdammt, sie fliegen zu den Höfen!"
188,0,2,false,false,3,5.0,false,1.0,"Meine Dodos!"
189,0,2,false,false,2,5.0,false,1.0,"Stutzt ihnen die Flügel!\nKoste es, was es wolle!"
190,0,2,false,false,3,3.0,false,1.0,"Mist, ich komme zu spät!"
191,0,2,false,false,3,3.0,false,1.0,"Wo bleibt er denn nur ...?"
192,0,2,false,false,3,3.0,false,1.0,"<prust> ... <schnauf> ... "
193,0,2,false,false,3,3.0,false,1.0,"Heute werde ich um ihre Hand anhalten! Ganz bestimmt!"
194,0,2,false,false,3,3.0,false,1.0,"Entschuldige die Verspätung!"
195,0,2,false,false,3,1.0,false,1.0,"Was fällt dir ein, mich so warten zu lassen?"
196,0,2,false,false,3,2.0,false,1.0,"Und überhaupt: Worüber willst du denn hier mit mir reden?"
197,0,2,false,false,3,2.0,false,1.0,"Ich ... Also ..."
198,0,2,false,false,3,1.0,false,1.0,"Ja?"
199,0,2,false,false,3,2.0,false,1.0,"W-W-Willst du mich hei...!"
200,0,2,false,false,3,1.0,false,1.0,"Was ist das auf einmal so windig?"
201,0,2,false,false,3,3.0,false,1.0,"U-Und was will dieses Monster hier?"
202,0,2,false,false,3,3.0,false,1.0,"M-Monster?!"
203,0,2,false,false,2,5.0,false,1.0,"Steh hier nicht mit offenem Mund rum!"
204,0,2,false,false,2,5.0,false,1.0,"Rette mich vor diesem Ungetüm!"
205,0,2,false,false,3,2.0,false,1.0,"Mir reicht's! Ich geh nach Hause!"
206,0,2,false,false,3,2.0,false,1.0,"S-So warte doch!"
207,0,2,false,false,3,2.0,false,1.0,"Du bist eine elende Memme!"
208,0,2,false,false,3,2.0,false,1.0,"A-Aber ich wollte dir\ndoch ...!"
209,0,2,false,false,3,3.0,false,1.0,"Erspare mir deine Ausflüchte!"
210,0,2,false,false,3,3.0,false,1.0,"Das ... Das ist einfach nicht fair!"
211,0,2,false,false,3,3.0,false,1.0,"Hm? Irgendwas stimmt hier nicht?"
212,0,2,false,false,3,3.0,false,1.0,"Harhar! Frische Beute, Jungs!"
213,0,2,false,false,3,3.0,false,1.0,"Jetzt unternimm doch was!"
214,0,2,false,false,3,3.0,false,1.0,"Das sagst du so!"
215,0,2,false,false,3,3.0,false,1.0,"Rückt eure Gil raus!"
216,0,2,false,false,3,5.0,false,1.0,"Der wütet ja immer noch rum ..."
217,0,2,false,false,2,5.0,false,1.0,"Du da, gib endlich Ruhe!"
218,0,2,false,false,2,5.0,false,1.0,"Du sollst Ruhe geben, hab ich gesagt!"
219,0,2,false,false,2,5.0,false,1.0,"Sag mal, hast du Bohnen in den Ohren?!"
220,0,2,false,false,2,5.0,false,1.0,"Lasst mich in Ruhe! Ausm Weg da!"
221,0,2,false,false,2,5.0,false,1.0,"Habt ihr etwa Beweise?"
222,0,2,false,false,2,5.0,false,1.0,"Ich hab die Überfahrt anstandsgemäß bezahlt!"
223,0,2,false,false,3,5.0,false,1.0,"Das werden wir sehen. Du kommst mit uns, Freundchen!"
224,0,2,false,false,3,5.0,false,1.0,"Ich könnte hier etwas Hilfe gebrauchen, Sir!"
225,0,2,false,false,3,5.0,false,1.0,"Willst 'ne Abreibung? Kannste haben!"
226,0,2,false,false,3,5.0,false,1.0,"Na endlich ..."
227,0,2,false,false,3,5.0,false,1.0,"Elende Schweinerei!"
228,0,2,false,false,3,5.0,false,1.0,"So, jetzt unterhalten wir uns mal ganz in Ruhe."
229,0,2,false,false,3,5.0,false,1.0,"Könnte dir so passen, du dreckiges Schwein!"
230,0,2,false,false,3,5.0,false,1.0,"Das werden wir ja sehen!"
231,0,2,false,false,3,5.0,false,1.0,"Elende Gelbjacken! Ich mach euch alle kalt!"
232,0,2,false,false,3,5.0,false,1.0,"Verdammt ..."
233,0,2,false,false,3,5.0,false,1.0,"Wenn ihr mich fangen wollt, müsst ihr schon 'n bisschen mehr Müsli zum Frühstück essen."
234,0,2,false,false,3,5.0,false,1.0,"Weg ist er ..."
235,0,2,false,false,3,5.0,false,1.0,"Man sieht sich, Pfeifen!"
236,0,2,false,false,2,3.0,false,1.0,"Gib's zu, du hast mir meinen Grog weggesoffen!"
237,0,2,false,false,2,3.0,false,1.0,"Kannst das gern mit meinen Fäusten ausdiskutieren!"
238,0,2,false,false,2,3.0,false,1.0,"Das wirst du bereuen, du ...!"
239,0,2,false,false,2,3.0,false,1.0,"Komm doch, wenn du dich traust!"
240,0,2,false,false,2,5.0,false,1.0,"Selber Seegurke, du ...!"
241,0,2,false,false,3,3.0,false,1.0,"Eine Peiste-Herde! Wir müssen sie aufhalten!"
242,0,2,false,false,3,3.0,false,1.0,"Orobon? Wo kommen die her?"
243,0,2,false,false,3,3.0,false,1.0,"Kobalosse voraus, streckt sie nieder!"
244,0,2,false,false,3,3.0,false,1.0,"Lasst diese Ungetüme nicht durch!"
245,0,2,false,false,3,3.0,false,1.0,"An alle, sichert die Route!"
246,0,2,false,false,3,3.0,false,1.0,"Schon wieder Steinböcke?! Verjagt sie!"
247,0,2,false,false,3,3.0,false,1.0,"Ein Stoßtrupp der Amalj'aa! Auf sie mit Gebrüll!"
248,0,2,false,false,3,3.0,false,1.0,"Amalj'aa! Macht euch kampfbereit!"
249,0,2,false,false,3,3.0,false,1.0,"Elende Imps! Was führt ihr diesmal im Schilde!"
250,0,2,false,false,3,3.0,false,1.0,"Die haben irgendwas vor! Schaltet sie aus!"
251,0,2,false,false,3,3.0,false,1.0,"Wo kommen die her? Aus dem Finsterwald?"
252,0,2,false,false,3,3.0,false,1.0,"Verdammt, da hat mal wieder jemand geschlafen!"
253,0,2,false,false,3,3.0,false,1.0,"Hier sollen sie\nauftauchen ...\nImmer nachts!"
254,0,2,false,false,3,3.0,false,1.0,"D-Dann geh ich jetzt lieber nach Hause."
255,0,2,false,false,3,3.0,false,1.0,"Hast du etwa Angst?"
256,0,2,false,false,3,3.0,false,1.0,"Q-Q-Quatsch!"
257,0,2,false,false,3,3.0,false,1.0,"Dir schlottern ja die Zähne!"
258,0,2,false,false,3,3.0,false,1.0,"Als würde es Gespenster geben!"
259,0,2,false,false,3,3.0,false,1.0,"Hiiieeeh! H-Hast du das gesehen?!"
260,0,2,false,false,3,3.0,false,1.0,"Jetzt hör doch auf!"
261,0,2,false,false,3,3.0,false,1.0,"D-Da leuchtet aber was!"
262,0,2,false,false,3,3.0,false,1.0,"Bestimmt Bootslampen oder so!"
263,0,2,false,false,3,3.0,false,1.0,"Beim Klabautermann!"
264,0,2,false,false,3,5.0,false,1.0,"Hiiiiiieeeh!"
265,0,2,false,false,3,5.0,false,1.0,"H-He! Lass mich hier nicht alleine!"
266,0,2,false,false,2,5.0,false,1.0,"Uiuiui ..."
267,0,2,false,false,2,5.0,false,1.0,"Bitte nicht hierher\nkommen ..."
268,0,2,false,false,3,5.0,false,1.0,"Sind ... sind sie weg?"
269,0,2,false,false,3,5.0,false,1.0,"H-Hier kriegen mich keine zehn Chocobos mehr hin!"
270,0,2,false,false,3,3.0,false,1.0,"Ein Rattenangriff!"
271,0,2,false,false,3,3.0,false,1.0,"Freiwillige für die Übung! Antreten!"
272,0,2,false,false,3,3.0,false,1.0,"Ach, könnte doch nur jemand die Galagos vertreiben ..."
273,0,2,false,false,3,3.0,false,1.0,"Schon wieder diese verdammten Yarzons ..."
274,0,2,false,false,3,3.0,false,1.0,"Die Goblins stehen sicher schon bald hier auf der Matte."
275,0,2,false,false,3,3.0,false,1.0,"Wir brauchen unbedingt neue Ersatzteile ..."
276,0,2,false,false,3,3.0,false,1.0,"Verdammte Orobon! Das werd ich euch nie verzeihen!"
277,0,2,false,false,3,3.0,false,1.0,"Wie soll ich bloß meine Sachen zurückbekommen?"
278,0,2,false,false,3,3.0,false,1.0,"So ein wichtiger Auftrag! Für mich!"
279,0,2,false,false,3,3.0,false,1.0,"Interessiert, ein paar Rekruten den Ernst des Lebens beizubringen?"
280,0,2,false,false,3,3.0,false,1.0,"Hach, es geht einfach nichts über Elezen!"
281,0,2,false,false,3,3.0,false,1.0,"Hach, es geht einfach nichts über Miqo'te!"
282,0,2,false,false,3,3.0,false,1.0,"Hm?!"
283,0,2,false,false,3,3.0,false,1.0,"Es geht nichts über Miqo'te, sagst du?!"
284,0,2,false,false,3,3.0,false,1.0,"Es geht nichts über Elezen, sagst du?!"
285,0,2,false,false,3,3.0,false,1.0,"Elezen haben die längsten Beine!"
286,0,2,false,false,3,3.0,false,1.0,"Miqo'te räkeln sich, da guckst du nur!"
287,0,2,false,false,3,3.0,false,1.0,"Ruhe jetzt, Jungs!"
288,0,2,false,false,3,3.0,false,1.0,"Misch dich nicht ein!"
289,0,2,false,false,3,3.0,false,1.0,"Das machen wir unter uns aus!"
290,0,2,false,false,2,5.0,false,1.0,"<keuch> ... <schnauf> ..."
291,0,2,false,false,3,3.0,false,1.0,"Ausgezeichnet! Um diesen Grenzposten brauche ich mir wohl keine Sorgen mehr zu machen."
292,0,2,false,false,3,3.0,false,1.0,"Beschämend! Ab heute jeden morgen hundert Liegestützen extra!"
293,0,2,false,false,2,3.0,false,1.0,"Ha, standgehalten!"
294,0,2,false,false,2,3.0,false,1.0,"Weichliches Pack ..."
295,0,2,false,false,3,3.0,false,1.0,"Das wird den Rekruten eine Lehre sein."
296,0,2,false,false,3,3.0,false,1.0,"Du willst <if:eine Abenteurerin/ein Abenteurer> sein? Lachhaft ..."
297,0,2,false,false,2,3.0,false,1.0,"Gegen <if:die/den> ist kein Kraut gewachsen!"
298,0,2,false,false,3,3.0,false,1.0,"Danke! Auch im Namen meiner Orangen!"
299,0,2,false,false,2,3.0,false,1.0,"Meine schönen Orangen! Alle weggefressen!"
300,0,2,false,false,2,3.0,false,1.0,"Das sollte ihm eine Lehre sein, sich an anderer Leute Tafel zu bedienen."
301,0,2,false,false,2,3.0,false,1.0,"Diese Brücke wird niemals in die Hände dieser Banditen fallen!"
302,0,2,false,false,2,3.0,false,1.0,"Wir haben versagt ... Welch Schande ..."
303,0,2,false,false,2,3.0,false,1.0,"Hurra, jetzt kann ich endlich mein Mehl ausliefern!"
304,0,2,false,false,2,3.0,false,1.0,"Wo du sein, wenn man dich brauchen, Boss?"
305,0,2,false,false,3,3.0,false,1.0,"Ihr mit mir kämpfen, Feiglinge!"
306,0,2,false,false,2,3.0,false,1.0,"Danke, jetzt können wir hier ungestört weiterarbeiten."
307,0,2,false,false,2,3.0,false,1.0,"Zum Glück scheint der Schaden nicht allzu groß zu sein."
308,0,2,false,false,2,3.0,false,1.0,"Jetzt müssen wir wieder neue Zahnräder bestellen. Das wird dauern ..."
309,0,2,false,false,2,3.0,false,1.0,"Dankeviel, dankeviel!"
310,0,2,false,false,2,3.0,false,1.0,"Die Kerne werden uns gute Dienste leisten."
311,0,2,false,false,2,3.0,false,1.0,"An mir kommt keiner vorbei!"
312,0,2,false,false,2,3.0,false,1.0,"Unser Abendessen ist damit gesichert."
313,0,2,false,false,2,3.0,false,1.0,"Mission erfüllt, wir zieh'n uns zurück!"
314,0,2,false,false,3,3.0,false,1.0,"Verjagt das Pack von der Brücke!"
315,0,2,false,false,2,3.0,false,1.0,"Das war erst der Anfang, ihr miesen Orobon!"
316,0,2,false,false,2,3.0,false,1.0,"In Ordnung, Leute! Füllt die Löcher!"
317,0,2,false,false,2,3.0,false,1.0,"Jetzt komme ich erst mal über die Runden. Zumindest bis morgen ..."
318,0,2,false,false,2,3.0,false,1.0,"Straße geräumt! Patrouille wird fortgesetzt!"
319,0,2,false,false,2,3.0,false,1.0,"Na dann, gute Reise!"
320,0,2,false,false,2,3.0,false,1.0,"Habt ihr gesehen, Echsen? Mit uns ist nicht zu spaßen!"
321,0,2,false,false,2,3.0,false,1.0,"Diese Schlacht ist verloren! Rückzug, Männer!"
322,0,2,false,false,2,3.0,false,1.0,"Ha, so leicht bekommt ihr den Goldbasar nicht!"
323,0,2,false,false,2,3.0,false,1.0,"Heut ist nicht das Ende aller Tage!"
324,0,2,false,false,2,3.0,false,1.0,"Keiner verwandelt? Dann zurück zur Basis!"
325,0,2,false,false,2,3.0,false,1.0,"Ein weiterer Schritt zu unsterblichem Ruhm!"
326,0,2,false,false,2,3.0,false,1.0,"In Thanalan ist kein Platz für euch, merkt euch das!"
327,0,2,false,false,2,3.0,false,1.0,"Das ist nur ein vorläufiger Rückzug!"
328,0,2,false,false,2,3.0,false,1.0,"Unsere gefallenen Kameraden wären stolz auf uns!"
329,0,2,false,false,2,3.0,false,1.0,"Mein Vorgesetzter war mächtig stolz auf mich, glaub ich!"
330,0,2,false,false,2,3.0,false,1.0,"All der Aufwand für diesen Tand ... Ts!"
331,0,2,false,false,3,5.0,false,1.0,"Verfluchtes Weib!"
332,0,2,false,false,3,5.0,false,1.0,"Was denn? Schon aus der Puste?"
333,0,2,false,false,3,5.0,false,1.0,"Na dann, viel Glück!"
334,0,2,false,false,3,5.0,false,1.0,"Also gut, kommen wir zu dir ..."
335,0,2,false,false,3,5.0,false,1.0,"Da vorne ist mehr Platz."
336,0,2,false,false,3,5.0,false,1.0,"Bereit zum Kampf?"
337,0,2,false,false,2,5.0,false,1.0,"Ist das alles?"
338,0,2,false,false,2,5.0,false,1.0,"Wundervoll!"
339,0,2,false,false,2,5.0,false,1.0,"Ich nehm's mit jedem auf!"
340,0,2,false,false,2,5.0,false,1.0,"Gibt's hier niemanden mit Mumm in den Knochen?"
341,0,2,false,false,3,5.0,false,1.0,"Ich ... gebe auf ..."
342,0,2,false,false,3,5.0,false,1.0,"Ich muss ... mehr trainieren!"
343,0,2,false,false,3,5.0,false,1.0,"Pah, reine Zeitverschwendung."
344,0,2,false,false,3,5.0,false,1.0,"Schlagt euch ruhig die Schädel ein!"
345,0,2,false,false,2,3.0,false,1.0,"Dreckige Ratten! Hinfort mit euch!"
346,0,2,false,false,2,3.0,false,1.0,"Meine Orangen! Meine Orangen!"
347,0,2,false,false,2,3.0,false,1.0,"Hiyaaah!"
348,0,2,false,false,2,3.0,false,1.0,"Jetzt zahlst du Wegzoll, Freundchen!"
349,0,2,false,false,2,3.0,false,1.0,"Rückt all euer Geld raus!"
350,0,2,false,false,2,3.0,false,1.0,"Verjag die Biester, schnell!"
351,0,2,false,false,2,3.0,false,1.0,"So kümmre sich doch jemand um diese Galagos!"
352,0,2,false,false,2,3.0,false,1.0,"Passage ich dir nicht gewähren."
353,0,2,false,false,2,3.0,false,1.0,"Inhalt von Taschen du geben!"
354,0,2,false,false,2,3.0,false,1.0,"Meine Schläge sehr schmerzhaft sein."
355,0,2,false,false,2,3.0,false,1.0,"Dies du nehmen!"
356,0,2,false,false,2,3.0,false,1.0,"Ich rächen dich werde, Jungbold!"
