1729,0,2,false,false,3,3.0,false,1.0,"Der Tag fängt ja mal wieder großartig an!"
1730,0,2,false,false,3,3.0,false,1.0,"Lass mich gehen!"
1731,0,2,false,false,3,3.0,false,1.0,"Vielleicht verschone ich dich dann."
1732,0,2,false,false,3,3.0,false,1.0,"Die Verfolger haben uns eingeholt!"
1733,0,2,false,false,3,3.0,false,1.0,"Da sind sie! Wir haben sie!"
1734,0,2,false,false,3,3.0,false,1.0,"Lasst sie frei und wir verschonen euch. Für einen Moment."
1735,0,2,false,false,3,3.0,false,1.0,"Das ist doch ...!"
1736,0,2,false,false,3,3.0,false,1.0,"Hurra! Die Rettung!"
1737,0,2,false,false,3,3.0,false,1.0,"Jetzt wird alles gut!"
1738,0,2,false,false,3,3.0,false,1.0,"Nieder mit unseren Peinigern!"
1739,0,2,false,false,3,3.0,false,1.0,"Es ist die Legion!"
1740,0,2,false,false,3,3.0,false,1.0,"So schnell geben wir unsere Beute nicht auf!"
1741,0,2,false,false,3,3.0,false,1.0,"Wollen wir doch mal sehen, wer hier der Stärkere ist!"
1742,0,2,false,false,3,3.0,false,1.0,"Und wer rettet die Retter? Hehehe."
1743,0,2,false,false,3,3.0,false,1.0,"Angriff!"
1744,0,2,false,false,3,3.0,false,1.0,"Macht euch auf eine ordentliche Abreibung gefasst!"
1745,0,2,false,false,3,3.0,false,1.0,"Mit Entführern machen wir kurzen Prozess!"
1746,0,2,false,false,3,3.0,false,1.0,"Ihr wollt euch wohl anschließen? Von mir aus!"
1747,0,2,false,false,3,3.0,false,1.0,"Dann kommt doch her!"
1748,0,2,false,false,3,3.0,false,1.0,"Ich habe noch ein paar Überraschungen auf Lager ..."
1749,0,2,false,false,3,3.0,false,1.0,"Ahhhh!"
1750,0,2,false,false,3,3.0,false,1.0,"Hilfe! So helft mir doch!"
1751,0,2,false,false,3,3.0,false,1.0,"He, versteck dich lieber!"
1752,0,2,false,false,3,3.0,false,1.0,"Sehr gut, er hat mich nicht bemerkt."
1753,0,2,false,false,3,3.0,false,1.0,"Seid ihr alle in Ordnung?"
1754,0,2,false,false,3,3.0,false,1.0,"Jetzt oder nie! Lasst uns abhauen!"
1755,0,2,false,false,3,3.0,false,1.0,"He, dich kenn ich doch!"
1756,0,2,false,false,3,3.0,false,1.0,"Ihr habt uns gerettet!"
1757,0,2,false,false,3,3.0,false,1.0,"Puh, bin ich erleichtert."
1758,0,2,false,false,3,3.0,false,1.0,"Auf die Legion kann man sich verlassen!"
1759,0,2,false,false,3,3.0,false,1.0,"D-Danke!"
1760,0,2,false,false,3,3.0,false,1.0,"Wir seh'n uns wieder!"
1761,0,2,false,false,3,3.0,false,1.0,"Ich kratz mal lieber\ndie Kurve ..."
1762,0,2,false,false,3,3.0,false,1.0,"Beim nächsten Mal läuft alles ganz anders!"
1763,0,2,false,false,3,3.0,false,1.0,"Hahaha! Siiieg!"
1764,0,2,false,false,3,3.0,false,1.0,"Ja, lauf nur! Lauf um dein Leben!"
1765,0,2,false,false,3,3.0,false,1.0,"Willst du dich nicht lieber uns anschließen?"
1766,0,2,false,false,3,3.0,false,1.0,"D-Das darf doch nicht wahr sein ..."
1767,0,2,false,false,3,3.0,false,1.0,"Neeein, lasst uns nicht im Stich!"
1768,0,2,false,false,3,3.0,false,1.0,"Verdammte Legion, zu nichts zu gebrauchen!"
1769,0,2,false,false,3,3.0,false,1.0,"Hm?! Sie haben mich nicht entdeckt, aber ..."
1770,0,2,false,false,3,3.0,false,1.0,"Mist, das ist schiefgegangen ..."
1771,0,2,false,false,3,3.0,false,1.0,"Also, auf ein Neues!"
1772,0,2,false,false,3,3.0,false,1.0,"Klar ist er das! Ich hab's doch geahnt."
1773,0,2,false,false,2,3.0,false,1.0,"Degeneriertes Pack!"
1774,0,2,false,false,2,3.0,false,1.0,"Ihr taugt nur als Opfer für Dalamud!"
1775,0,2,false,false,2,3.0,false,1.0,"Euer Blut wird in Strömen fließen!"
1776,0,2,false,false,2,3.0,false,1.0,"Für Dalamud, unseren Erlöser!"
1777,0,2,false,false,2,3.0,false,1.0,"Achte auf deinen Rücken!"
1778,0,2,false,false,2,3.0,false,1.0,"Ha, wie langweilig."
1779,0,2,false,false,2,3.0,false,1.0,"Jetzt mach ich ernst!"
1780,0,2,false,false,2,3.0,false,1.0,"Das war eine Finte!"
1781,0,2,false,false,3,3.0,false,1.0,"Halt gefälligst still!"
1782,0,2,false,false,3,3.0,false,1.0,"Hey! Er kommt zu dir!"
1783,0,2,false,false,3,3.0,false,1.0,"Ich hab ihn! Ich hab ihn!"
1784,0,2,false,false,3,3.0,false,1.0,"Nein, ich hab ihn!"
1785,0,2,false,false,3,3.0,false,1.0,"Wer hätte gedacht, dass die so flink sind."
1786,0,2,false,false,3,5.0,false,1.0,"Er ist mir entwischt ..."
1787,0,2,false,false,3,5.0,false,1.0,"Nur mit der Ruhe. Wir fangen einen anderen."
1788,0,2,false,false,2,5.0,false,1.0,"Augen und Ohren auf!"
1789,0,2,false,false,2,5.0,false,1.0,"Wir müssen unbedingt einen fangen!"
1790,0,2,false,false,2,5.0,false,1.0,"Sonst zieht uns der Hauptmann das Fell über die Ohren."
1791,0,2,false,false,2,5.0,false,1.0,"So große Viecher können sich doch wohl nicht verstecken."
1792,0,2,false,false,2,5.0,false,1.0,"Siehst du da drüben einen?"
1793,0,2,false,false,2,5.0,false,1.0,"Komm her, kleine Schildkröte! Put-put-put ..."
1794,0,2,false,false,2,5.0,false,1.0,"Komm uns bloß nicht in die Quere!"
1795,0,2,false,false,2,5.0,false,1.0,"Hau ab, solange du noch kannst."
1796,0,2,false,false,2,5.0,false,1.0,"Such dir deine eigene Schildkröte!"
1797,0,2,false,false,2,5.0,false,1.0,"Du hast hier nichts verloren!"
1798,0,2,false,false,2,5.0,false,1.0,"Wart nur ab, bis wir unsere Kriegs-Schildkröte haben!"
1799,0,2,false,false,2,5.0,false,1.0,"Bete darum, dass sich unsere Wege nie wieder kreuzen!"
1800,0,2,false,false,2,5.0,false,1.0,"Ganz schön mutig!"
1801,0,2,false,false,2,5.0,false,1.0,"Heute hattest du Glück! Nichts weiter ..."
1802,0,2,false,false,2,5.0,false,1.0,"Verdammter Störenfried ..."
1803,0,2,false,false,2,5.0,false,1.0,"Dein Gesicht merk ich mir."
1804,0,2,false,false,2,5.0,false,1.0,"Für heute lassen wir's lieber gut sein ..."
1805,0,2,false,false,2,5.0,false,1.0,"Wenn das der Hauptmann erfährt ..."
1806,0,2,false,false,2,5.0,false,1.0,"Das behalten wir besser für uns ..."
1807,0,2,false,false,2,5.0,false,1.0,"Wir waren nur spazieren, klar!"
1808,0,2,false,false,2,5.0,false,1.0,"Lasst uns woanders suchen."
1809,0,2,false,false,2,5.0,false,1.0,"Wir brauchen Verstärkung! Los, Männer!"
1810,0,2,false,false,3,5.0,false,1.0,"O Dalamud!"
1811,0,2,false,false,3,5.0,false,1.0,"Nimm mein Leben und das Leben dieser Unwürdigen!"
1812,0,2,false,false,3,5.0,false,1.0,"Ohhh ... Wesen aus dem Nichts, fahre in mich und nimm meinen Körper!"
1813,0,2,false,false,3,5.0,false,1.0,"Ohhh!"
1814,0,2,false,false,2,5.0,false,1.0,"Das reicht nicht. Ich brauche mehr Blut!"
1815,0,2,false,false,2,5.0,false,1.0,"Beim nächsten Mal muss ich besser vorsorgen."
1816,0,2,false,false,2,5.0,false,1.0,"Ist das der Widerborstige?!"
1817,0,2,false,false,2,5.0,false,1.0,"Ja, ja! Der Fluch der Ältigsten!"
1818,0,2,false,false,2,5.0,false,1.0,"Der Widerborstige muss sterben!"
1819,0,2,false,false,2,5.0,false,1.0,"Der Widerborstige muss für seine Taten bezahlen!"
1820,0,2,false,false,2,5.0,false,1.0,"Die Unsrigen können ihm niemals nicht verzeihen!"
1821,0,2,false,false,2,5.0,false,1.0,"O Ältigste, die Meinige wird dich rächen!"
1822,0,2,false,false,2,5.0,false,1.0,"Der Widerborstige ist gefallen ..."
1823,0,2,false,false,2,5.0,false,1.0,"Trotzdem ist das Herz der Meinigen schwer ..."
1824,0,2,false,false,2,5.0,false,1.0,"Widerborstiger, bleib hier!"
1825,0,2,false,false,2,5.0,false,1.0,"Die Meinige dürstet nach Rache!"
1826,0,2,false,false,3,5.0,false,1.0,"Das ist ja schlimmer, als einen Sack Flöhe zu hüten."
1827,0,2,false,false,3,5.0,false,1.0,"Puh, das macht die Lage kompliziert."
1828,0,2,false,false,3,5.0,false,1.0,"Danke, du warst meine Rettung!"
1829,0,2,false,false,3,5.0,false,1.0,"Heute ist nicht mein Tag ..."
1830,0,2,false,false,3,5.0,false,1.0,"Das wird eine reiche Traubenernte!"
1831,0,2,false,false,3,5.0,false,1.0,"Es reicht, wir sollten aufgeben."
1832,0,2,false,false,3,3.0,false,1.0,"Die Golems müssen vernichtet werden!"
1833,0,2,false,false,3,5.0,false,1.0,"Erwacht der Steinmann ist! Wütend der Steinmann ist!"
1834,0,2,false,false,3,5.0,false,1.0,"Du uns retten! Du uns retten vor Steinmann!"
1835,0,2,false,false,3,5.0,false,1.0,"Zurück in die Mine! In die Mine zurück!"
1836,0,2,false,false,2,3.0,false,1.0,"Steinmann bewegt! Steinmann bewegt!"
1837,0,2,false,false,2,3.0,false,1.0,"Graben nicht mehr gut! Schnell laufen besser!"
1838,0,2,false,false,2,3.0,false,1.0,"Titan rettet uns! <if:Abenteurerin/Abenteurer> rettet uns!"
1839,0,2,false,false,2,5.0,false,1.0,"Ssssh! Ssschickt die Flosssenlosen zum Grund des Meeresss!"
1840,0,2,false,false,2,5.0,false,1.0,"Werdet einsss mit dem Meer!"
1841,0,2,false,false,2,5.0,false,1.0,"O Leviathan! Gib uns Shhtärke!"
1842,0,2,false,false,2,5.0,false,1.0,"Leviathan ist der eintzzzig wahre Gott!"
1843,0,2,false,false,3,5.0,false,1.0,"O Zwölf, sind das viele!"
1844,0,2,false,false,3,5.0,false,1.0,"Wir brauchen Verstärkung! Und zwar schnell!"
1845,0,2,false,false,3,5.0,false,1.0,"Granaten! Es sind zu viele!"
1846,0,2,false,false,3,5.0,false,1.0,"Verriegelt die Türen! Stellt die Pumpen ab!"
1847,0,2,false,false,3,5.0,false,1.0,"Sie haben es auf unser Erdseim abgesehen!"
1848,0,2,false,false,3,5.0,false,1.0,"Sie werden es nie kapieren."
1849,0,2,false,false,2,3.0,false,1.0,"Du besiegst mich nicht! Nicht hier und nicht heute!"
1850,0,2,false,false,3,5.0,false,1.0,"Okay, der Anfang wäre geschafft!"
1851,0,2,false,false,3,3.0,false,1.0,"Aber das Schlimmste kommt erst noch."
1852,0,2,false,false,2,3.0,false,1.0,"Was genau ist unser Ziel?"
1853,0,2,false,false,3,3.0,false,1.0,"Habt ihr die Einsatzbesprechung etwa verschlafen?"
1854,0,2,false,false,2,2.0,false,1.0,"Nein ... äh ... ich bin nur so vergesslich."
1855,0,2,false,false,3,3.0,false,1.0,"Die Windsteine, ihr vertrottelten Hochländer!"
1856,0,2,false,false,2,2.0,false,1.0,"Wiesländer, Hauptmann!"
1857,0,2,false,false,3,3.0,false,1.0,"Wie auch immer. Ihr kennt euren Befehl. Führt ihn aus!"
1858,0,2,false,false,2,3.0,false,1.0,"Äh, wie lautet der Befehl doch gleich?"
1859,0,2,false,false,3,3.0,false,1.0,"ZERSTÖRT DIE VERDAMMTEN WINDSTEINE!"
1860,0,2,false,false,2,3.0,false,1.0,"Jawohl, Hauptmann!"
1861,0,2,false,false,3,3.0,false,1.0,"Okay, macht euch bereit! Der Einsatz beginnt."
1862,0,2,false,false,2,2.0,false,1.0,"Jawohl!"
1863,0,2,false,false,2,5.0,false,1.0,"Geschafft! Ich kann unser Glück kaum fassen."
1864,0,2,false,false,2,5.0,false,1.0,"Haha! So sehen Sieger aus!"
1865,0,2,false,false,2,5.0,false,1.0,"Rückzug! Wir haben versagt!"
1866,0,2,false,false,2,5.0,false,1.0,"Woran lag es bloß?"
1867,0,2,false,false,3,5.0,false,1.0,"Ahriman greifen an! Schlagt sie zurück!"
1868,0,2,false,false,3,5.0,false,1.0,"So, das wäre geklärt. Abrücken!"
1869,0,2,false,false,3,5.0,false,1.0,"Noch mehr Dobalosse?!"
1870,0,2,false,false,3,5.0,false,1.0,"Hoffentlich haben wir jetzt erst einmal unsere Ruhe."
1871,0,2,false,false,2,3.0,false,1.0,"Hier sind wir in einer schlechten Position!"
1872,0,2,false,false,2,3.0,false,1.0,"Uns bleibt keine Wahl. Bringen wir's hinter uns!"
1873,0,2,false,false,2,3.0,false,1.0,"Vorwärts, <forename>!"
1874,0,2,false,false,2,3.0,false,1.0,"Haltet durch! Wir können es schaffen!"
1875,0,2,false,false,3,5.0,false,1.0,"Dann woll'n wir mal!"
1876,0,2,false,false,3,5.0,false,1.0,"Ja, komm doch!"
1877,0,2,false,false,2,3.0,false,1.0,"Harhar!"
1878,0,2,false,false,2,3.0,false,1.0,"Ah, wird da jemand wütend?!"
1879,0,2,false,false,2,3.0,false,1.0,"Ja, so macht das Spaß!"
1880,0,2,false,false,2,3.0,false,1.0,"Du hast das Klageregiment wohl unterschätzt!"
1881,0,2,false,false,4,5.0,false,1.0,"Hass, Hass, Hass steigt in mir auf!\nHass, Hass, Hass gibt mir Kraft!"
1882,0,2,false,false,3,3.0,false,1.0,"Hallo, hört mich jemand? Wir brauchen sofort Unterstützung."
1883,0,2,false,false,2,5.0,false,1.0,"Die Garlear sind in den Wald eingedrungen. Das müssen wir sofort ans Hauptquartier melden."
1884,0,2,false,false,3,5.0,false,1.0,"Ohhhh! Kommt herbei, meine Diener!"
1885,0,2,false,false,2,10.0,false,1.0,"Wir sind schon zur Stelle!"
1886,0,2,false,false,5,1.0,false,5.0,"... Einmal mehr muss ich zur Waffe greifen."
1887,0,2,false,false,5,1.0,false,5.0,"Bin ich endlos dazu verdammt, in dieser fremden Welt Gefechte auszutragen?"
1888,0,2,false,false,5,1.0,false,5.0,"So sei es! Ich stelle mich meinem Schicksal!"
1889,0,2,false,false,5,1.0,false,5.0,"Spür meine Klinge!"
1890,0,2,false,false,2,3.0,false,1.0,"Bloß nicht übermütig werden!"
1891,0,2,false,false,2,3.0,false,1.0,"Mehr hast du nicht zu bieten?!"
1892,0,2,false,false,2,3.0,false,1.0,"Los, ausschwärmen!"
1893,0,2,false,false,2,3.0,false,1.0,"Das wird dir eine Lehre sein!"
1894,0,2,false,false,2,3.0,false,1.0,"Deine letzte Stunde hat geschlagen!"
1895,0,2,false,false,5,1.0,false,5.0,"Was passiert mit mir? Die Welt um mich herum verschwindet ... oder verschwinde ich aus dieser Welt?"
1896,0,2,false,false,5,1.0,false,5.0,"Bist du in Ordnung? Tut mir leid, dass ich dich in die Sache hineingezogen habe. Ich bin Lightning."
1897,0,2,false,false,5,1.0,false,5.0,"Aus tiefem Schlaf, der ewig währen sollte, erwachte ich in dieser fremden Welt, um eine Bestimmung zu erfüllen."
1898,0,2,false,false,5,1.0,false,5.0,"Was wird nun aus mir? Welches Schicksal erwartet mich? Gelange ich an einen neuen Ort oder falle ich in ewigen Schlaf zurück?"
1899,0,2,false,false,3,5.0,false,1.0,"Hiiilfe!"
1900,0,2,false,false,3,5.0,false,1.0,"Was ist das nur für eine Bestie?!"
1901,0,2,false,false,3,5.0,false,1.0,"Sie muss den Sieben Höllen entsprungen sein!"
1902,0,2,false,false,3,5.0,false,1.0,"Bringt euch in Sicherheit!"
1903,0,2,false,false,3,5.0,false,1.0,"Flieht, ihr Narren!"
1904,0,2,false,false,3,5.0,false,1.0,"Wir verschaffen euch Zeit!"
1905,0,2,false,false,3,5.0,false,1.0,"Sie darf die Stadt nicht erreichen!"
1906,0,2,false,false,5,1.0,false,5.0,"Zieht euch zurück! Diesem Ungetüm seid ihr nicht gewachsen!"
1907,0,2,false,false,5,1.0,false,5.0,"Ohne schwere Geschütze ist ihm kaum beizukommen."
1908,0,2,false,false,5,1.0,false,5.0,"Trotzdem muss ich es versuchen. Ich kann nicht zulassen, dass Unschuldige sterben müssen."
1909,0,2,false,false,5,1.0,false,5.0,"Ich werde sie beschützen!"
1910,0,2,false,false,2,3.0,false,1.0,"So läuft das also in Eorzea!"
1911,0,2,false,false,2,3.0,false,1.0,"Mit einer solch tatkräftigen Unterstützung hätte ich nicht gerechnet."
1912,0,2,false,false,2,3.0,false,1.0,"Du gefällst mir!"
1913,0,2,false,false,5,1.0,false,5.0,"Wie ist der Behemoth in diese Welt gelangt?! Hat er sich wie ich hierher verirrt?!"
1914,0,2,false,false,5,1.0,false,5.0,"Oder hat er mich hierher verfolgt?"
1915,0,2,false,false,5,1.0,false,5.0,"Es tut mir leid ... meine Zeit ist abgelaufen ..."
1916,0,2,false,false,3,1.0,false,5.0,"Geschafft!"
1917,0,2,false,false,3,5.0,false,1.0,"Danke für deine Hilfe!"
1918,0,2,false,false,5,1.0,false,5.0,"Seltsam ... Der Kampf ist gewonnen, doch ich werde noch nicht zurückgeschickt. Bedeutet das, ich habe noch eine Aufgabe zu erfüllen?"
1919,0,2,false,false,5,1.0,false,5.0,"Nun, da ich schon einmal hier bin, will ich mir diese fantastische Welt genauer ansehen."
1920,0,2,false,false,3,5.0,false,1.0,"Hilfe!"
1921,0,2,false,false,3,5.0,false,1.0,"Eine Frau kämpft allein gegen ein Monster!"
1922,0,2,false,false,5,1.0,false,5.0,"So kreuzen sich unsere Wege also wieder. Bist du bereit, abermals an meiner Seite zu kämpfen?"
1923,0,2,false,false,5,1.0,false,5.0,"So langsam dämmert mir, warum ich auf diese Welt geschickt wurde. Es ist eine göttliche Prüfung ..."
1924,0,2,false,false,5,1.0,false,5.0,"Ich wurde aus meinem ewigen Schlaf geweckt, um meine Bereitschaft zum Kampf zu beweisen."
1925,0,2,false,false,5,1.0,false,5.0,"Diese Bestien sind hier, um mich zurückzurufen!"
1926,0,2,false,false,5,1.0,false,5.0,"Sie wollen, dass ich in meine vom Chaos verschlungene Welt zurückkehre und mich göttlicher Willkür unterwerfen!"
1927,0,2,false,false,5,1.0,false,5.0,"Doch da kennen sie mich schlecht! Ich war lange genug ein Spielball der Götter."
1928,0,2,false,false,5,1.0,false,5.0,"Was hat das zu bedeuten?! Die Boten des Chaos sind besiegt, und trotzdem schwillt es weiter an."
1929,0,2,false,false,5,1.0,false,5.0,"Das Chaos schwappt förmlich über Eorzea und wird es ertränken. Das kann nur eins bedeuten: Der Herr des Chaos ist nah!"
1930,0,2,false,false,5,1.0,false,5.0,"Um mich zurückzuholen, schreckt die Gottheit wohl vor nichts zurück."
1931,0,2,false,false,5,1.0,false,5.0,"Sie nimmt billigend in Kauf, dass Eorzea im Chaos versinkt. Doch das werde ich nicht zulassen!"
1932,0,2,false,false,5,1.0,false,5.0,"Ich werde die Gottheit in ihre Schranken weisen und diese wundervolle Welt retten!"
1933,0,2,false,false,5,1.0,false,5.0,"Los, Odin, steh mir bei!"
1934,0,2,false,false,5,1.0,false,5.0,"Danke, Odin!"
1935,0,2,false,false,5,1.0,false,5.0,"... Mir kommt es wie ein Traum vor, der sich dem Ende neigt."
1936,0,2,false,false,5,1.0,false,5.0,"Ist es vorbei? War es nur eine schlechte Laune der Götter?"
1937,0,2,false,false,2,5.0,false,1.0,"Ich werde auch kämpfen, kupo!"
1938,0,2,false,false,2,5.0,false,1.0,"Wir müssen uns beeilen, kupo!"
1939,0,2,false,false,2,5.0,false,1.0,"Weiter, kupo!"
1940,0,2,false,false,2,5.0,false,1.0,"Nicht so schnell, kupo!"
1941,0,2,false,false,2,5.0,false,1.0,"Wir werden angegriffen, kupo!"
1942,0,2,false,false,2,5.0,false,1.0,"Ich habe Angst, kupo!"
1943,0,2,false,false,2,5.0,false,1.0,"Wir müssen sie aufhalten, kupo!"
1944,0,2,false,false,2,5.0,false,1.0,"Hilfe, kupo!"
1945,0,2,false,false,2,5.0,false,1.0,"Ab auf den Opfertisch mit dir, kupo!"
1946,0,2,false,false,2,5.0,false,1.0,"Argh, kupo!"
1947,0,2,false,false,2,5.0,false,1.0,"<röchel>, kupo!"
1948,0,2,false,false,2,5.0,false,1.0,"Euch knöpf ich mir vor, kupo!"
1949,0,2,false,false,2,5.0,false,1.0,"Rächt uns, Eure Kupolichkeit!"
1950,0,2,false,false,2,5.0,false,1.0,"Wir machen Hackfleisch aus euch, kupo!"
1951,0,2,false,false,2,5.0,false,1.0,"Autsch, kupo!"
1952,0,2,false,false,2,5.0,false,1.0,"Tschüs, kupo!"
1953,0,2,false,false,2,5.0,false,1.0,"Wer uns zu nahe komme, wird platt gemacht, kupo!"
1954,0,2,false,false,2,5.0,false,1.0,"Zeigt ihnen, wo der Bommel bommelt, König!"
1955,0,2,false,false,2,5.0,false,1.0,"Hokus-kupokus!"
1956,0,2,false,false,2,5.0,false,1.0,"Bin nur mal eben für kleine Zauberkupos! <röchel>"
1957,0,2,false,false,2,5.0,false,1.0,"Uff ..."
1958,0,2,false,false,2,5.0,false,1.0,"Dies ist wahre Mogry-Magie, kupo!"
1959,0,2,false,false,2,5.0,false,1.0,"Schwingt den Bommel, Eure Kupolichkeit!"
1960,0,2,false,false,2,5.0,false,1.0,"Rennt um eure Bommel, kupo!"
1961,0,2,false,false,2,5.0,false,1.0,"Wehe mir, kupo!"
1962,0,2,false,false,2,5.0,false,1.0,"Ich hatte noch so viel vor, kupo!"
1963,0,2,false,false,2,5.0,false,1.0,"Jetzt setzt's Schläge, kupo!"
1964,0,2,false,false,2,5.0,false,1.0,"Ein Kupo dem König!"
1965,0,2,false,false,2,5.0,false,1.0,"Ich fackle nicht lange, aber ihr dafür gleich ab, kupo! Muhaha!"
1966,0,2,false,false,2,5.0,false,1.0,"Ich hätte doch so gerne noch rumgekokelt, kupo!"
1967,0,2,false,false,2,5.0,false,1.0,"Burn-out, kupo!"
1968,0,2,false,false,2,5.0,false,1.0,"Kupo heiß, Baby!"
1969,0,2,false,false,2,5.0,false,1.0,"Steht uns kupo, guter König!"
1970,0,2,false,false,2,5.0,false,1.0,"Bommelbombe, kupo!"
1971,0,2,false,false,2,5.0,false,1.0,"Euch kriegen wir, kupo!"
1972,0,2,false,false,2,5.0,false,1.0,"Unachtsamkeit ist so was von unkupo ..."
1973,0,2,false,false,2,5.0,false,1.0,"Tanz für uns, kupo!"
1974,0,2,false,false,2,5.0,false,1.0,"Hab noch 'nen Topf auf dem Herd, kupo!"
1975,0,2,false,false,2,5.0,false,1.0,"Mein Vorhang fällt, kupo!"
1976,0,2,false,false,2,5.0,false,1.0,"Jetzt geht's erst richtig los, kupo!"
1977,0,2,false,false,2,5.0,false,1.0,"Erweist uns die Ehre, König, kupo!"
1978,0,2,false,false,2,5.0,false,1.0,"M-Muss ich wirklich kämpfen?"
1979,0,2,false,false,2,5.0,false,1.0,"H-Hilfe, kupo!"
1980,0,2,false,false,2,5.0,false,1.0,"Ich will noch nicht sterben, kupo!"
1981,0,2,false,false,2,5.0,false,1.0,"Ertrinkt in Gift, kupo!"
1982,0,2,false,false,2,5.0,false,1.0,"Ähm, König, äh, wie ging das noch mal, kupo?"
1983,0,2,false,false,2,3.0,false,1.0,"Ist das galant genug so, Meister?"
1984,0,2,false,false,2,3.0,false,1.0,"Wer wagt es, unsere Dehnübungen zu stören?"
1985,0,2,false,false,2,3.0,false,1.0,"Niemand kehrt lebend von hier zurück!"
1986,0,2,false,false,2,3.0,false,1.0,"Pistolen sind stärker als das Schwert!"
1987,0,2,false,false,3,5.0,false,1.0,"Stürzt du ab, Flügellose<if:none/r>, kha!"
1988,0,2,false,false,3,5.0,false,1.0,"Ihr euch auf Feind stürzen, kha!"
1989,0,2,false,false,3,5.0,false,1.0,"Feind Flügel gestutzt gehören, kha!"
1990,0,2,false,false,3,5.0,false,1.0,"Feind gerupft gehören, kha!"
1991,0,2,false,false,3,5.0,false,1.0,"Oh, Garuda!"
1992,0,2,false,false,3,5.0,false,1.0,"Miiiine alles meiiins!"
1993,0,2,false,false,3,5.0,false,1.0,"Böööse Eindringlinge! Muss töööööten!"
1994,0,2,false,false,3,5.0,false,1.0,"Brüüder werden töööten! Flink herbeiii!"
1995,0,2,false,false,3,5.0,false,1.0,"Ein Rettungstrupp? Endlich! Zahlen wir's den Riesen heim!"
1996,0,2,false,false,3,5.0,false,1.0,"Zeigen wir ihnen, was 'ne Spitzhacke ist, Jungs!"
1997,0,2,false,false,3,5.0,false,1.0,"Momodi! Noch einmal möchte ich vor meinem Tod in deine Augen blicken!"
1998,0,2,false,false,3,5.0,false,1.0,"Auf die Riesen, schnappt sie euch!"
1999,0,2,false,false,3,5.0,false,1.0,"Gute Arbeit , Jungs! Darauf heben wir einen im Treibsand!"
2000,0,2,false,false,3,5.0,false,1.0,"Auf geht's!"
2001,0,2,false,false,3,5.0,false,1.0,"Ich bin gleich hinüber!"
2002,0,2,false,false,3,5.0,false,1.0,"Auf sie!"
2003,0,2,false,false,3,5.0,false,1.0,"Wir sind unschlagbar!"
2004,0,2,false,false,3,5.0,false,1.0,"Helft mir!"
2005,0,2,false,false,3,5.0,false,1.0,"Jetzt nichts wie raus!"
2006,0,2,false,false,3,5.0,false,1.0,"Hätte nicht gedacht, noch mal das Tageslicht zu erblicken!"
2007,0,2,false,false,3,5.0,false,1.0,"Ich bin am Ende!"
2008,0,2,false,false,3,5.0,false,1.0,"Ich bin fix und alle."
2009,0,2,false,false,3,5.0,false,1.0,"Wir haben's geschafft? Unglaublich!"
2010,0,2,false,false,2,3.0,false,1.0,"HERREN ALLE BRENNEN! GROARRR!"
2011,0,2,false,false,2,5.0,false,1.0,"Ein Riesengolem! Rette sich, wer kann!"
2012,0,2,false,false,5,1.0,false,5.0,"Ohohohohoho!"
2013,0,2,false,false,2,5.0,false,1.0,"Der Sieg ist unser!"
2014,0,2,false,false,5,1.0,false,5.0,"Was krabbelt da am Boden rum?\nWer kitzelt mich, wer ist so dumm? "
2015,0,2,false,false,5,1.0,false,5.0,"Ihr könnt euch noch so heftig wehren,\nich werd euch schnell das Fürchten lehren!"
2016,0,2,false,false,5,1.0,false,5.0,"Ohohohohoho!"
2017,0,2,false,false,5,1.0,false,5.0,"Nanu, wär hätte das gedacht?\nIch hab euch wohl zu früh verlacht."
2018,0,2,false,false,5,1.0,false,5.0,"Der Mut, den ihr hier demonstriert,\nmich zweifelsohne interessiert."
2019,0,2,false,false,5,1.0,false,5.0,"Doch Muße ist mir leider fremd.\nMich ruft das nächste Experiment!"
2020,0,2,false,false,5,1.0,false,5.0,"Ohohohohoho!\nO-hohohohoho!"
2021,0,2,false,false,5,1.0,false,5.0,"Wer hat an der Uhr gedreht?\nIst es wirklich schon so spät?"
2022,0,2,false,false,5,1.0,false,5.0,"Beim nächsten Mal, das wünsch ich mir,\nreicht man das Wasser bitte mir."
2023,0,2,false,false,2,3.0,false,1.0,"Törichte Wichte, bald seid ihr Geschichte!"
2024,0,2,false,false,2,3.0,false,1.0,"O-hohohohoho!"
2025,0,2,false,false,2,3.0,false,1.0,"Wer sich zeigt frech, dem's Genick ich brech!"
2026,0,2,false,false,2,3.0,false,1.0,"Ein Kampf soll das sein? Ich schlaf ja gleich ein!"
2027,0,2,false,false,5,1.0,false,5.0,"Nehmt euch in Acht, habt mich wütend gemacht!"
2028,0,2,false,false,2,5.0,false,1.0,"Nimm dies!"
2029,0,2,false,false,2,5.0,false,1.0,"Nicht mit mir!"
2030,0,2,false,false,2,5.0,false,1.0,"<keuch>"
2031,0,2,false,false,3,5.0,false,1.0,"Nophica... stehe mir bei ...!"
2032,0,2,false,false,3,5.0,false,1.0,"Ich will ... noch nicht sterben ..."
2033,0,2,false,false,3,5.0,false,1.0,"Das war haarscharf, vielen Dank."
2034,0,2,false,false,3,5.0,false,1.0,"Ich verdanke dir mein Leben, Abenteurer<if:in/none>."
2035,0,2,false,false,3,5.0,false,1.0,"Ohne euch hätten wir es nicht geschafft."
2036,0,2,false,false,3,5.0,false,1.0,"Ich bringe mich in Sicherheit. Vergebt mir!"
2037,0,2,false,false,2,3.0,false,1.0,"Niemand trotzt dem Herrn des Infernos!"
2038,0,2,false,false,2,3.0,false,1.0,"Dies wird ein leichter Sieg, meine Brüder!"
2039,0,2,false,false,2,3.0,false,1.0,"Die Schwachen müssen brennen!"
2040,0,2,false,false,2,3.0,false,1.0,"Ah, da sind ja ein paar Zielscheiben. Sehr schön."
2041,0,2,false,false,2,3.0,false,1.0,"Zurück blieb nur Gemüseauflauf. Ha!"
2042,0,2,false,false,2,3.0,false,1.0,"Wer ist so töricht, sich mit unserem neuen Prototypen anzulegen?"
2043,0,2,false,false,2,3.0,false,1.0,"Unmöglich!"
2044,0,2,false,false,2,3.0,false,1.0,"Allmächtig ist der Herr des Infernos! Brenne, Ungläubiger!"
2045,0,2,false,false,2,3.0,false,1.0,"Asche zu Asche, Staub zu Staub!"
2046,0,2,false,false,2,3.0,false,1.0,"Eure Art werde ich ausrotten! Mit Stumpf und Stil!"
2047,0,2,false,false,2,3.0,false,1.0,"Bin ich unbesiegbar, kha!"
2048,0,2,false,false,2,3.0,false,1.0,"Kah! Ich dich glauben mache!"
2049,0,2,false,false,2,3.0,false,1.0,"Du aufgeben, Federloser!"
2050,0,2,false,false,2,3.0,false,1.0,"Niemand stört meine Zeremonie!"
2051,0,2,false,false,2,3.0,false,1.0,"Widerstand ist zwecklos! Zwecklos!"
2052,0,2,false,false,2,3.0,false,1.0,"Die Ungläubigen werden im Staube kriechen!"
2053,0,2,false,false,2,3.0,false,1.0,"Ssschuppenlose, versssinkt in der Sssee!"
2054,0,2,false,false,2,3.0,false,1.0,"Ssstrudel desss Untergangsss!"
2055,0,2,false,false,2,3.0,false,1.0,"Tod den Flossssssenlosen!"
2056,0,2,false,false,3,2.0,false,1.0,"Hiiier, Boss! Tataa! Töööten!"
2057,0,2,false,false,2,5.0,false,1.0,"Ich muss schnell zurückkehren."
2058,0,2,false,false,2,5.0,false,1.0,"Die anderen machen sich bestimmt schon Sorgen."
2059,0,2,false,false,2,5.0,false,1.0,"Nur noch ein kleines Stück bis zur Oase."
2060,0,2,false,false,2,5.0,false,1.0,"Bitte warte auf mich."
2061,0,2,false,false,2,5.0,false,1.0,"H-Hilfeee!"
2062,0,2,false,false,2,5.0,false,1.0,"Bitte halt mir diese Biester vom Leib, Abenteurer<if:in/none>!"
2063,0,2,false,false,2,5.0,false,1.0,"Das Kostüm ist der Hammer, oder?"
