key,0,1
376,"TEXT_VOICEMAN_05002_003490_YSHTOLA","ええ……。
今回は大丈夫そうだけれど、あくまで今回は……よ。
本人に黙っているつもりもないわ。"
377,"TEXT_VOICEMAN_05002_003500_YSHTOLA","……ねえ、ウリエンジェ。
取り戻した夜空は、綺麗かしら？"
378,"TEXT_VOICEMAN_05002_003510_URIANGER","すべらかなる漆黒に、星影は清か……
白に虹に、輝きはあまた散りばめられん。"
379,"TEXT_VOICEMAN_05002_003520_URIANGER","……原初世界と変わりない、美しい夜空です。
穏やかで、優しい……見惚れるほどの、天の暗き海でしょう。"
380,"TEXT_VOICEMAN_05002_003530_YSHTOLA","そう……。"
381,"TEXT_VOICEMAN_05002_003540_URIANGER","星もまた、命の流れを纏うもの。
あなたの眼にこそ、美しく映っているのではないですか？"
382,"TEXT_VOICEMAN_05002_003550_YSHTOLA","おつかれさま。
さあ……胸を張って、帰りましょう。"
383,"TEXT_VOICEMAN_05002_003560_YSHTOLA","この部屋の壁画……。
ロンカより古い時代のものね。"
384,"TEXT_VOICEMAN_05002_003570_RYNE","すごい……どうしてわかるんですか？"
385,"TEXT_VOICEMAN_05002_003580_YSHTOLA","使われている顔料に特徴があるのよ。
大抵の顔料は鉱物なんかを含んでいるから、視わけられるの。"
386,"TEXT_VOICEMAN_05002_003590_YSHTOLA","キタンナ神影洞は、古代の英知を護り伝えるための神殿だと、
アルメたちが語っていた……。
それが、この壁画ということかしら？"
387,"TEXT_VOICEMAN_05002_003600_EMETSELCH","こんなところで道草を食っているなよ……。
おかげで存外に歩かされた……。"
388,"TEXT_VOICEMAN_05002_003610_THANCRED","今度は出迎えのつもりか？"
389,"TEXT_VOICEMAN_05002_003620_EMETSELCH","馬鹿言え、私がそんな面倒なことするわけないだろう。"
390,"TEXT_VOICEMAN_05002_003630_EMETSELCH","……なるほど。
やはりあと数体倒さないと、なんとも言えないか。"
391,"TEXT_VOICEMAN_05002_003640_YSHTOLA","何の話かしら？"
392,"TEXT_VOICEMAN_05002_003650_EMETSELCH","厭だな、いちいち気にするなよ。
約束どおり手を貸して、約束どおり見ているだけだ。"
393,"TEXT_VOICEMAN_05002_003660_EMETSELCH","それじゃあ、私は帰る。
お前たちも、さっさと帰って次に進むことだな。"
394,"TEXT_VOICEMAN_05002_003670_EMETSELCH","……これはまた、懐かしい光景だな。"
395,"TEXT_VOICEMAN_05002_003680_RYNE","この壁画のこと、知っているんですか……？"
396,"TEXT_VOICEMAN_05002_003690_EMETSELCH","むかしむかしは、誰もが知っていたさ。"
397,"TEXT_VOICEMAN_05002_003700_EMETSELCH","世界が、原初世界と鏡像世界に分かたれたとき。
すべての命も14に分かたれ、
それぞれの世界で、別の存在として生まれ変わった。"
398,"TEXT_VOICEMAN_05002_003710_EMETSELCH","そうして、本来の世界を知る者はいなくなった。
……が、人はときに夢として、その光景を垣間見たのさ。"
399,"TEXT_VOICEMAN_05002_003720_EMETSELCH","知らないのに知っている、人類共通の夢。
昔は大層ふしぎがられて、絵に描かれたり唄にされたり、
まあ、いろいろ扱われたものだ。"
400,"TEXT_VOICEMAN_05002_003730_EMETSELCH","それも見なくなって久しいと思ったが……
こんなところで、またお目にかかるとはな。"
401,"TEXT_VOICEMAN_05002_003740_YSHTOLA","詳しいわね。
ということは、描かれている内容についても？"
402,"TEXT_VOICEMAN_05002_003750_EMETSELCH","……世界が分かたれる前。
そこには栄えた文明があり、多くの命が生きていた。"
403,"TEXT_VOICEMAN_05002_003760_EMETSELCH","しかし、理が乱れ、未曽有の災厄が発生。
文明は、命は、危機に立たされた。"
404,"TEXT_VOICEMAN_05002_003770_EMETSELCH","その文明の人々は、祈りと犠牲によって、
星の新たな理を紡ぐもの……「星の意志」を生み出した。"
405,"TEXT_VOICEMAN_05002_003780_EMETSELCH","名は、ゾディアーク。
それによって、災厄は鎮められた。"
406,"TEXT_VOICEMAN_05002_003790_YSHTOLA","待って、ゾディアーク？
それって……！"
407,"TEXT_VOICEMAN_05002_003800_EMETSELCH","こうして災厄は過ぎたが、
ゾディアークという強大な力を巡って、人の意見は割れた。"
408,"TEXT_VOICEMAN_05002_003810_EMETSELCH","それを封じるべきとする者によって、
枷となるもの……ハイデリンが生み出された。"
409,"TEXT_VOICEMAN_05002_003820_EMETSELCH","ゾディアークとハイデリンは戦った。
結果は、ハイデリンの辛勝……。"
410,"TEXT_VOICEMAN_05002_003830_EMETSELCH","ハイデリンが放った渾身の一撃で世界は分かたれ、
ゾディアークもまた、分断されて封印された。"
411,"TEXT_VOICEMAN_05002_003840_EMETSELCH","……以上、忘れられた歴史の話だ。
信じるかどうかは勝手にしてくれ。
ハイデリンの言い分は、どうせ違うだろうしな。"
412,"TEXT_VOICEMAN_05002_003850_THANCRED","仮に……仮にその話が真実だとして。
それじゃあ、ゾディアークとハイデリンというのは……！"
413,"TEXT_VOICEMAN_05002_003860_EMETSELCH","なんだ、それすら気づいてなかったのか。
あれは、この星にもとよりいた神なんかじゃない。"
414,"TEXT_VOICEMAN_05002_003870_EMETSELCH","かつての人によって創られた、星の意志。
お前たちにわかりやすいように言うとだな……"
415,"TEXT_VOICEMAN_05002_003880_EMETSELCH","最古にして、最強の「蛮神」だ。"
416,"TEXT_VOICEMAN_05002_003890_YSHTOLA","とてもじゃないけど、
今すぐ受け入れられる内容じゃないわ……。"
417,"TEXT_VOICEMAN_05002_003900_YSHTOLA","それが妄言でないと言うのなら、知っているあなたは何者なの？"
418,"TEXT_VOICEMAN_05002_003901_EMETSELCH","クク…"
419,"TEXT_VOICEMAN_05002_003910_EMETSELCH","やっと、ついに、それを問うか……。
私とは、アシエンとは何者か……。"
420,"TEXT_VOICEMAN_05002_003920_EMETSELCH","私たち、とくにオリジナルと呼ばれるアシエンはな……"
421,"TEXT_VOICEMAN_05002_003930_EMETSELCH","ゾディアークを召喚せし者。
つまり、分かたれる以前の世界の人だよ。"
422,"TEXT_VOICEMAN_05002_003940_EMETSELCH","だとすれば、世界の統合にこだわっているのも頷けるだろう？"
423,"TEXT_VOICEMAN_05002_003950_EMETSELCH","私は、世界を……人を……真なる形に戻したいのさ。"
424,"TEXT_VOICEMAN_05002_003960_EMETSELCH","当然の欲求だろう？"
425,"TEXT_VOICEMAN_05002_003970_RUNAR","みんな……！
無事だったんだな！"
426,"TEXT_VOICEMAN_05002_003980_YSHTOLA","もちろんよ。
どちらかというと、心配なのはこの拠点の方だわ。"
427,"TEXT_VOICEMAN_05002_003990_RUNAR","それなら、大丈夫。
ユールモア軍は、この空を見て完全撤退したみたいだ。"
428,"TEXT_VOICEMAN_05002_004000_RUNAR","「常闇の愛し子」も、また洞窟の奥に引っ込んだよ。
あいつら、もう無理にオイラたちの祈りを否定できないさ。"
429,"TEXT_VOICEMAN_05002_004010_RUNAR","だって、みんな見たんだ。
本当の、天の暗き海を……命の行く場所を。"
430,"TEXT_VOICEMAN_05002_004020_RUNAR","暗き海は満たされる……。
穏やかな静けさと、温かな慈しみで。
汝の行く先に、悲しみと恐れはない。"
431,"TEXT_VOICEMAN_05002_004030_RUNAR","……祈りは、ちゃんと届いてた。
そう感じたとき、言葉にできないほど勇気が出た。"
432,"TEXT_VOICEMAN_05002_004040_RUNAR","人の命は……きっと、ボロボロのこの世界でさえ、
ただ終わっていくだけじゃないんだ。"
433,"TEXT_VOICEMAN_05002_004050_RUNAR","なあ、あんたたちのこと、
ずっと不思議な人たちだと思ってたんだ。
でも、今回で納得がいったよ。"
434,"TEXT_VOICEMAN_05002_004060_RUNAR","みんなは、「闇の戦士」だったんだな……？"
435,"TEXT_VOICEMAN_05002_004070_YSHTOLA","馬鹿ね、それを聞く必要があって？"
436,"TEXT_VOICEMAN_05002_004080_YSHTOLA","「夜の民」の祈りは、誰かを奉るものじゃない。
過ぎていった人が紡ぎ、あなたたちが繋げていく、
命のための願いと知恵よ。"
437,"TEXT_VOICEMAN_05002_004090_RUNAR","わ、わかってるよ。
でも……そうだ、せめて一度くらい、みんなを讃えて宴を……！"
438,"TEXT_VOICEMAN_05002_004100_YSHTOLA","ルナル……。
彼らは行くわ、次に成すべきことをしに。"
439,"TEXT_VOICEMAN_05002_004110_YSHTOLA","そして、私もまた、彼らとともに……。
それが魔女マトーヤの、本当の役目なのだから。"
440,"TEXT_VOICEMAN_05002_004120_RUNAR","……わかった。
でも、みんなへの感謝は決して忘れないよ。
あの……美しい闇に誓って。"
441,"TEXT_VOICEMAN_05002_004130_WARRIOROFDARKNESS","お前の体に、光が封じられてる……か。
見たところ普通そうだが……。"
442,"TEXT_VOICEMAN_05002_Q8_000_001_NONE_VOICE","何と言う？"
443,"TEXT_VOICEMAN_05002_A8_000_001_NONE_VOICE","みんなを信じてる"
444,"TEXT_VOICEMAN_05002_A8_000_002_NONE_VOICE","あふれたらどうしよう……"
445,"TEXT_VOICEMAN_05002_A8_000_003_NONE_VOICE","とりあえず寝るしかない"
446,"TEXT_VOICEMAN_05002_004140_WARRIOROFDARKNESS","……まあ、そうだな。
ここで罪喰い討伐を投げ出しても、危機は去らないわけだしな。"
447,"TEXT_VOICEMAN_05002_004150_WARRIOROFDARKNESS","お、俺に聞くなよ……！
この状態じゃ、助けを呼んでやることすらできないんだぞ。"
448,"TEXT_VOICEMAN_05002_004160_WARRIOROFDARKNESS","だから……そうだな……
状況を知ってくれてる自分の仲間を、信じて、護る。
今はそれしかないんじゃないか……？"
449,"TEXT_VOICEMAN_05002_004170_WARRIOROFDARKNESS","確かに、体には気をつけておけって言われたもんな。
寝るのと食うのは大事だ、俺もそう思う。"
450,"TEXT_VOICEMAN_05002_004180_WARRIOROFDARKNESS","ところで、エメトセルクの言っていたこと……
ハイデリンが創り出された存在だって話が、もし本当なら……"
451,"TEXT_VOICEMAN_05002_004190_WARRIOROFDARKNESS","俺たち「光の加護を受けし者」は、
ハイデリンのテンパードみたいなものなのか……？"
452,"TEXT_VOICEMAN_05002_004200_WARRIOROFDARKNESS","ああいや……お前も知らないなら今はいい。
奴の話そのものが、
お前たちを揺さぶるための虚言だった可能性もある。"
453,"TEXT_VOICEMAN_05002_004210_WARRIOROFDARKNESS","……正しいかどうかなんて、簡単にひっくり返る。
楽しかった思い出も、削り取りたくなるくらい、
憎くなる日がくるかもしれない。"
454,"TEXT_VOICEMAN_05002_004220_WARRIOROFDARKNESS","だから、こんな俺はもう……
誰かを肯定も否定もすべきじゃないと思っていたが……。"
455,"TEXT_VOICEMAN_05002_004230_WARRIOROFDARKNESS","スリザーバウの奴らが、夜を見て感激していたこと。
……よかったなって、俺も思ったよ。"
456,"TEXT_VOICEMAN_05002_004240_WARRIOROFDARKNESS","冒険は楽しかったが、それと同じくらい、
戦ったあとに贈られる、誰かの想いが好きだった。"
457,"TEXT_VOICEMAN_05002_004250_WARRIOROFDARKNESS","……それを思い出した、少しだけな。"
458,"TEXT_VOICEMAN_05002_004260_SYSTEM_NONE_VOICE","一方 原初世界 帝都ガレマルド――"
459,"TEXT_VOICEMAN_05002_004270_ESTINIEN","……どうだった、定時連絡は。"
460,"TEXT_VOICEMAN_05002_004280_SHADOWHUNTER","今のところ、戦況に大きな変化はない。
何度か小規模な衝突を繰り返しているが、
同盟軍も帝国軍も、攻めあぐねているようだ。"
461,"TEXT_VOICEMAN_05002_004290_ESTINIEN","膠着状態か……。
兵力だけ見れば、同盟軍はよく耐えている方だな。"
462,"TEXT_VOICEMAN_05002_004300_ESTINIEN","まあ、あの竜詩戦争を乗り越えた国も加わってるんだ。
そうでなければ困るさ。"
463,"TEXT_VOICEMAN_05002_004310_SHADOWHUNTER","だが、戦の長期化は、双方の望むところではなかろう。"
464,"TEXT_VOICEMAN_05002_004320_SHADOWHUNTER","この停滞は、嵐の前の静けさともなり得る。
帝国が、一気に片をつけようとしたならば……。"
465,"TEXT_VOICEMAN_05002_004330_ESTINIEN","「黒薔薇」の投入もある……。"
466,"TEXT_VOICEMAN_05002_004340_ESTINIEN","やはり、調査を急ぐべきだろう。
侵入の手回しは？"
467,"TEXT_VOICEMAN_05002_004350_SHADOWHUNTER","無論、進めている。
……加えて、気がかりな情報を掴んだ。"
468,"TEXT_VOICEMAN_05002_004360_SHADOWHUNTER","国境地帯ギムリトの戦場から、
帝国百人隊長がひとり、姿を消したのだ。"
469,"TEXT_VOICEMAN_05002_004370_ESTINIEN","敵前逃亡か、どこかで死体になっているか……
どちらにせよ、珍しい話ではないだろう？"
470,"TEXT_VOICEMAN_05002_004380_SHADOWHUNTER","確かに、姿を消したままであればな。
だが、最近になって、
そやつがこの帝都で目撃されたとなれば、話は別だ。"
471,"TEXT_VOICEMAN_05002_004390_SHADOWHUNTER","敵前逃亡ならば、帝都に戻るような真似はすまい。
死んでいたならば……死体が戻ったということになろう。"
472,"TEXT_VOICEMAN_05002_004400_ESTINIEN","ほう……。
つい最近聞いた話じゃないか。"
473,"TEXT_VOICEMAN_05002_004410_SHADOWHUNTER","現在、ゼノスを騙っていると思われる、
アシエン・エリディブス……。
同様に、いずれかのアシエンが百人隊長の体を得たか……。"
474,"TEXT_VOICEMAN_05002_004420_SHADOWHUNTER","あるいは、まだ我らの知らぬ駒が、
盤上に置かれているのやもしれぬ……。"
475,"TEXT_VOICEMAN_05002_004430_SHADOWHUNTER","この件についても、引き続き追わせている。
……我らも行くとしよう。"
476,"TEXT_VOICEMAN_05002_004440_ZENOS","…………なるほど。
ずいぶんとつまらぬ戦になりかけているな。"
477,"TEXT_VOICEMAN_05002_004450_ZENOS","父上も……いや、この体では赤の他人か。
情のひとつもわかぬのは、それゆえとしておこう。"
478,"TEXT_VOICEMAN_05002_004460_ZENOS","そうだ……俺を俺と成せるのは、今やあの男のみ……。
我が猛き獲物……我が友よ…………。"
479,"TEXT_VOICEMAN_05002_004470_ZENOS","そうだ……俺を俺と成せるのは、今やあの女のみ……。
我が猛き獲物……我が友よ…………。"
480,"TEXT_VOICEMAN_05002_004480_ZENOS","いずこかで、爪は研げたであろうな？
貴様が道を拓かんとするなら、
俺もまた……宿命を、跪かせようぞ。"
