key,0,1
177,"TEXT_VOICEMAN_05002_001620_YSHTOLA","……どうかしたの？
とにかく、ここから出ないと。
外でサンクレッドとも合流しましょう。"
178,"TEXT_VOICEMAN_05002_001630_RUNAR","今日は、森がざわついてるなぁ……。"
179,"TEXT_VOICEMAN_05002_001640_RUNAR","見回りの奴らも、なんだか遅くなってるらしい。
食事はもう、すっかり準備できてるんだが……。"
180,"TEXT_VOICEMAN_05002_001650_RUNAR","仕方ない、先に食べていよう。
悪いが、姐さんたちに声をかけてきてくれないか？"
181,"TEXT_VOICEMAN_05002_001660_YSHTOLA","はぐらかさないで。
あの人のこと、あなたなら気づいてるでしょう！？"
182,"TEXT_VOICEMAN_05002_001670_YSHTOLA","あの人には「光の加護」がある。
だから、大罪喰いを倒しても、罪喰いになることはない……
確かにそう聞いたわ。"
183,"TEXT_VOICEMAN_05002_001680_YSHTOLA","でも、だとしたらあのエーテルの惨状は何？
とてもじゃないけれど……無事には視えないわ。"
184,"TEXT_VOICEMAN_05002_001690_YSHTOLA","……これは私の推測だけれどね。
大罪喰いから放出された光は、
「光の加護」に相殺されてなどいないのでしょう？"
185,"TEXT_VOICEMAN_05002_001700_YSHTOLA","あの人の内に……加護を受けた身に、封じられているだけ。
違うかしら？"
186,"TEXT_VOICEMAN_05002_001710_URIANGER","……最終的な対処については、考えがあります。
ただ、それを今話すことはできません。"
187,"TEXT_VOICEMAN_05002_001720_YSHTOLA","はぁ"
188,"TEXT_VOICEMAN_05002_001730_YSHTOLA","あなたの頑固さには恐れ入るわ。
この期に及んで、私たちにも話せないとはね。"
189,"TEXT_VOICEMAN_05002_001740_YSHTOLA","ウリエンジェ。
あなたが悪事を働こうとしているとは思わないわ。"
190,"TEXT_VOICEMAN_05002_001750_YSHTOLA","でも、あまり隠しごとばかりでは、
今までどおり信じてあげるのが難しくなる。"
191,"TEXT_VOICEMAN_05002_001760_YSHTOLA","……ねえ。
あなたと同時に喚ばれた私には、ずっと違和感があったのよ。"
192,"TEXT_VOICEMAN_05002_001770_YSHTOLA","すべての発端になった、あなたが視たという第八霊災の光景……
それは本当に、あなたが喚ばれたときに視たものなのかしら？"
193,"TEXT_VOICEMAN_05002_001780_PEOPLEOFNIGHTA","た、大変だぁー！"
194,"TEXT_VOICEMAN_05002_001790_PEOPLEOFNIGHTA","ゆ、ユールモア軍が……攻めてきた！"
195,"TEXT_VOICEMAN_05002_001800_SYSTEM_NONE_VOICE","一方 ユールモア樹葉の層 執務室――"
196,"TEXT_VOICEMAN_05002_001810_MYSTERYVOICE","久しいな。
こうして直接会うのは、お前の就任式以来か。
またずいぶんと大きくなったものだ。"
197,"TEXT_VOICEMAN_05002_001820_VAUTHRY","ンン……水晶公……。
私の前で、よくもそんな態度がとれるものダ。"
198,"TEXT_VOICEMAN_05002_001830_VAUTHRY","お前の街は、「闇の戦士」とか呼ばれている連中の、
罪喰い討伐に加担しているそうじゃないカ。"
199,"TEXT_VOICEMAN_05002_001840_VAUTHRY","それどころか、我が軍に粗相をしたとも聞いていル。
……いったい何のつもりダ？"
200,"TEXT_VOICEMAN_05002_001850_MYSTERYVOICE","意図を問いたいのはこちらだよ、ドン・ヴァウスリー。
大罪喰いの討伐は、世界の悲願だったはずだ。"
201,"TEXT_VOICEMAN_05002_001860_MYSTERYVOICE","実際、レイクランドの人々はもちろん、
あの妖精郷の住民までもが、
闇の帰還を喜びとともに迎えている。"
202,"TEXT_VOICEMAN_05002_001870_MYSTERYVOICE","人類がやっと手にした、反撃の兆し……
お前はなぜそれを潰そうとする？"
203,"TEXT_VOICEMAN_05002_001880_VAUTHRY","わかってない、なァにもわかっていないな水晶公！
お前たちの見ている希望は、いっときの幻ダ！"
204,"TEXT_VOICEMAN_05002_001890_VAUTHRY","仮に罪喰いを退けたとて、
この世界はもう、手の施しようがないほど壊れていル。"
205,"TEXT_VOICEMAN_05002_001900_VAUTHRY","残された土地も資源も、
人が自由に生きようとするには、あまりに乏しイ。"
206,"TEXT_VOICEMAN_05002_001910_VAUTHRY","そうなれば、人同士の争いがはじまるだろウ。
残り少ない人類は、今度こそ自滅すル！"
207,"TEXT_VOICEMAN_05002_001920_VAUTHRY","だァから、私が管理してやるのサ！
新たなる王……いや、神となって！"
208,"TEXT_VOICEMAN_05002_001930_VAUTHRY","人は私にのみ憧れ、私の足もとで夢を見ル。
私は秩序、私は平穏、私は人に残された唯一無二の幸福ダ！"
209,"TEXT_VOICEMAN_05002_001940_VAUTHRY","水晶公、人は愚かダ……どんな理想にも、ケチをつけたがル。
そんな連中を導くには、多少の恐怖が必要なのサ。"
210,"TEXT_VOICEMAN_05002_001950_VAUTHRY","私のもと以外、安心できなイ。
私のもとだけが、生きていける場所だとナ。"
211,"TEXT_VOICEMAN_05002_001960_VAUTHRY","罪喰いは、そのためのチカラ。
世界は私に彼らを与え、君臨せよと命じたのダ！"
212,"TEXT_VOICEMAN_05002_001970_MYSTERYVOICE","……なるほど。
第八霊災が起きた未来では、お前のうつろわぬ王国は、
きっと完成していたのだろうよ。"
213,"TEXT_VOICEMAN_05002_001980_VAUTHRY","ンン？　何を言っている……？"
214,"TEXT_VOICEMAN_05002_001990_MYSTERYVOICE","いいや、こちらの話だ。
お前の主張は、よく理解したよ。"
215,"TEXT_VOICEMAN_05002_002000_MYSTERYVOICE","ドン・ヴァウスリー。
お前は力を持つがゆえに、いつも人を屈服させる側だった。
自分以下の者しか知らなければ、その結論にも至るだろう。"
216,"TEXT_VOICEMAN_05002_002010_MYSTERYVOICE","だが、人類は、お前が思うよりしぶとく、したたかだぞ。"
217,"TEXT_VOICEMAN_05002_002020_MYSTERYVOICE","足りないものを奪い合うのではなく、
足りるように作り出せばいい……
人の知恵や技術は、そういう夢で磨かれてきた。"
218,"TEXT_VOICEMAN_05002_002030_MYSTERYVOICE","時間はかかるだろうが、今回だって絶対に乗り越える。
そのためにも、まず罪喰いを倒すことが必要なのだ。"
219,"TEXT_VOICEMAN_05002_002040_VAUTHRY","くだらなイ……。
誰しも、求めるのは今、自分の幸福ダ。
100年、1000年先に築かれる楽園に、価値などあるものカ。"
220,"TEXT_VOICEMAN_05002_002050_MYSTERYVOICE","……それでも、私は見てきたよ。
自分ではもう届くことない希望に向かって、
涙も血も流しながら、誰かの背を押す人を。"
221,"TEXT_VOICEMAN_05002_002060_MYSTERYVOICE","託された重みに苦しみ、過ぎゆく別れに泣きながら、
その意味を失くしはしまいと、進んでいく人を。"
222,"TEXT_VOICEMAN_05002_002070_MYSTERYVOICE","世界は、そうして繋がれてきたと、私は知っている。
だからこそ、信じて……
眼前のしがらみを断つことに、この命を懸けられる。"
223,"TEXT_VOICEMAN_05002_002080_VAUTHRY","……つまり、罪喰い討伐に加担するのはやめないト？"
224,"TEXT_VOICEMAN_05002_002090_MYSTERYVOICE","ああ、私は楽しみにしているんだ。
未来への道が開いて、皆が……あの人が、踏み出す瞬間を。"
225,"TEXT_VOICEMAN_05002_002100_VAUTHRY","はぁ……まったく……。"
226,"TEXT_VOICEMAN_05002_002110_VAUTHRY","実に予想どおりの回答だヨ！
お前たちは、本当にバ～～～カだナァ！"
227,"TEXT_VOICEMAN_05002_002120_VAUTHRY","この会談を待つことなく、
我が軍は、光の残る各地に向けて出発しタ。"
228,"TEXT_VOICEMAN_05002_002130_VAUTHRY","残る大罪喰いを護るため……
そして、それを狙う反逆者を、根絶やしにするためにナ！"
229,"TEXT_VOICEMAN_05002_002140_VAUTHRY","私がお前を呼んだのも、話をするためではない……"
230,"TEXT_VOICEMAN_05002_002150_VAUTHRY","操り人形にするためダ！"
231,"TEXT_VOICEMAN_05002_002160_VAUTHRY","なっ……消えタ！？"
232,"TEXT_VOICEMAN_05002_002170_VAUTHRY","まやかしの術カ……！
どいつもこいつも、私をコケにしやがっテ……！"
233,"TEXT_VOICEMAN_05002_002180_VAUTHRY","ぎぃぃぃ！"
234,"TEXT_VOICEMAN_05002_002190_RANJIT","貴様らが、「夜の民」の代表か。"
235,"TEXT_VOICEMAN_05002_002200_YSHTOLA","ええ、ひとまず私が話を聞かせてもらうわ。"
236,"TEXT_VOICEMAN_05002_002210_YSHTOLA","もっとも……
あなたたち、うちの見回り役に何かしたわね。"
237,"TEXT_VOICEMAN_05002_002220_YSHTOLA","穏便に話し合いをしたいのなら、まずはその子を返しなさい。"
238,"TEXT_VOICEMAN_05002_002230_RANJIT","こちらの要件を伝えるのが先だ。
おとなしく聞くがよい。"
239,"TEXT_VOICEMAN_05002_002240_RANJIT","我が主、ドン・ヴァウスリーの命にて、
今よりこの森は、ユールモアの管理下に入ることとなった。
以後は我らの指示に従え。"
240,"TEXT_VOICEMAN_05002_002250_YSHTOLA","またずいぶんと乱暴なこと……。"
241,"TEXT_VOICEMAN_05002_002251_YSHTOLA","……同行しているところを見ると、
「常闇の愛し子」は、それを呑んだのかしら？"
242,"TEXT_VOICEMAN_05002_002260_RANJIT","こやつらとは、我が主が、前もって密約を結んでいたのだ。"
243,"TEXT_VOICEMAN_05002_002270_RANJIT","貴様ら「夜の民」は、これまでも幾度となく、
ユールモアの庇護を拒んでおろう。
いつ反旗を翻すとも知れぬ、危険な存在だ。"
244,"TEXT_VOICEMAN_05002_002280_RANJIT","よって主は、この森を管理するにあたり、
こちらの一派を協力者とし、主権をお与えになったのだ。"
245,"TEXT_VOICEMAN_05002_002290_EVERLASTINGDARKNESS","ドン・ヴァウスリーは誓ってくれた……。
ユールモアの管理下では、我ら「常闇の愛し子」のみが、
正当な一派として存在を認められると。"
246,"TEXT_VOICEMAN_05002_002300_EVERLASTINGDARKNESS","聞けば、レイクランドとイル・メグには、
闇の戦士様が、ご降臨なされたそうではないか！"
247,"TEXT_VOICEMAN_05002_002310_EVERLASTINGDARKNESS","かのお方が、真っ先にここへいらしてくださらないのは何故か？
お前ら「夜の民」の、たるんだ信仰がはびこっているからだッ！"
248,"TEXT_VOICEMAN_05002_002320_YSHTOLA","私たち憎しで、乗せられてしまったわけね……。
組む相手がユールモアでは、闇が遠ざかるばかりでしょうに。"
249,"TEXT_VOICEMAN_05002_002330_RANJIT","これより、数刻の猶予を与える。
「夜の民」のうち、ユールモアに従う者は、
ウォーヴンオウスに来い。"
250,"TEXT_VOICEMAN_05002_002340_RUNAR","「常闇の愛し子」の拠点に！？
オイラたちに、祈りを捨てろっていうのか……！？"
251,"TEXT_VOICEMAN_05002_002350_EVERLASTINGDARKNESS","お前らの祈りなぞ、はじめからどこにも届いていないわ！
これからは、我らが正しき祈り方を教えてやる。"
252,"TEXT_VOICEMAN_05002_002360_YSHTOLA","……行かなかった者は？"
253,"TEXT_VOICEMAN_05002_002370_RANJIT","忠告はした。
聞けぬものは反逆の意志ありとして、裁くのみ。"
254,"TEXT_VOICEMAN_05002_002380_YSHTOLA","……中で話しましょう。
先に、彼を受け入れる用意をしてもらって。"
255,"TEXT_VOICEMAN_05002_002390_YSHTOLA","来たわね……！"
256,"TEXT_VOICEMAN_05002_002400_ALMET","(-弓を携えた護り手-)外つ森からの侵入者よ！
ここは何人たりとも進入まかりならん。
疾く立ち去るがいい！"
257,"TEXT_VOICEMAN_05002_002410_YSHTOLA","ちょっ、待ちなさい……！"
258,"TEXT_VOICEMAN_05002_002420_UIMET","やっ！"
259,"TEXT_VOICEMAN_05002_002430_YSHTOLA","くっ"
260,"TEXT_VOICEMAN_05002_002440_YSHTOLA","待ちなさいって、言ってるでしょうッ！"
261,"TEXT_VOICEMAN_05002_002450_CYMET","(-杖を携えた護り手-)姉さん、あれって……！"
262,"TEXT_VOICEMAN_05002_002460_YSHTOLA","ロンカの……皇帝の書簡に従って、手に入れたわ……！
私たちは、ロンカの同盟者よ……！"
263,"TEXT_VOICEMAN_05002_002470_UIMET","むむむ？"
264,"TEXT_VOICEMAN_05002_002480_UIMET","おおー"
265,"TEXT_VOICEMAN_05002_002490_UIMET","(-槍を携えた護り手-)すごいぞ、姉ちゃん！
これ、なんか本物っぽいー！"
266,"TEXT_VOICEMAN_05002_002500_CYMET","(-杖を携えた護り手-)わあぁ～！
ということは、間に合ったってことでしょうかぁ～？"
267,"TEXT_VOICEMAN_05002_002510_ALMET","(-弓を携えた護り手-)どうやら……そのようだ。"
268,"TEXT_VOICEMAN_05002_002520_ALMET","(-弓を携えた護り手-)ロンカの印章を持つ者よ。
その印、きちんと確認させてもらいたい。"
269,"TEXT_VOICEMAN_05002_002530_ALMET","(-弓を携えた護り手-)足元にある青い花に従えば、我々の集落に辿り着ける。
そこで、お前たちを待っている。"
270,"TEXT_VOICEMAN_05002_002540_UIMET","(-槍を携えた護り手-)間違えんなよー？
んじゃ、またあとでなーっ！"
271,"TEXT_VOICEMAN_05002_002550_YSHTOLA","まったく……。
話くらい先に聞いたらどうなの……。"
272,"TEXT_VOICEMAN_05002_002560_YSHTOLA","でも、交渉のきっかけは掴んだわ。
とりあえず、言われたとおりに進んでみましょう。"
273,"TEXT_VOICEMAN_05002_002570_YSHTOLA","やったわ、作動したみたい……！"
274,"TEXT_VOICEMAN_05002_002580_ALMET","グッ！"
275,"TEXT_VOICEMAN_05002_002590_UIMET","うあっ！"
276,"TEXT_VOICEMAN_05002_002600_CYMET","きゃあぁ！"
277,"TEXT_VOICEMAN_05002_002610_YSHTOLA","やらせない……ッ！"
278,"TEXT_VOICEMAN_05002_002620_EULMOREADJUTANT","か、加勢いたします！"
279,"TEXT_VOICEMAN_05002_002630_EULMOREADJUTANT","…………へ？"
280,"TEXT_VOICEMAN_05002_002640_EULMOREADJUTANT","うおおお！？"
281,"TEXT_VOICEMAN_05002_002650_YSHTOLA","やれやれだわ……。
あなた、罠を踏んだわね。"
282,"TEXT_VOICEMAN_05002_002660_EULMOREADJUTANT","不慮の事故だッ！
まさか……こ、こんなことになるなんて……！"
283,"TEXT_VOICEMAN_05002_002670_EULMOREADJUTANT","そ、そ、そうだ！
ここは取引といこうじゃないか……！"
284,"TEXT_VOICEMAN_05002_002680_EULMOREADJUTANT","我々は、スリザーバウを制圧する際、
抵抗してきた数名に、毒を使った。
「常闇の愛し子」が造った、猛毒だ……！"
285,"TEXT_VOICEMAN_05002_002690_EULMOREADJUTANT","そして、これがその解毒薬さ。"
286,"TEXT_VOICEMAN_05002_002700_EULMOREADJUTANT","知っているだろう？
連中の毒は特別で、対になる解毒薬でないと治せない。
これを失ったら、スリザーバウの連中は死ぬしかないのさ！"
287,"TEXT_VOICEMAN_05002_002710_EULMOREADJUTANT","待て待て！
ここで揉めたら、みんなまとめて落ちるだけだ！
取引だと言っただろう！"
288,"TEXT_VOICEMAN_05002_002720_EULMOREADJUTANT","いいか？
じき、私かお前の仲間が、駆けつけてくるだろう。
そのときに、まず私から助けるんだ。"
289,"TEXT_VOICEMAN_05002_002730_EULMOREADJUTANT","そしたら、この解毒薬を渡してやろう。
な、悪くない条件だろう？　な？"
290,"TEXT_VOICEMAN_05002_002740_RANJIT","ならば、貴様の命を以て、敵をひとりでも葬るがいい。"
291,"TEXT_VOICEMAN_05002_002750_EULMOREADJUTANT","…………え？"
292,"TEXT_VOICEMAN_05002_002760_YSHTOLA","……頼むわね。"
293,"TEXT_VOICEMAN_05002_002770_RANJIT","何の迷いもなく飛び込むか……。"
294,"TEXT_VOICEMAN_05002_002780_RYNE","みなさん、ご無事ですか……！"
295,"TEXT_VOICEMAN_05002_002790_RYNE","これって……！？"
296,"TEXT_VOICEMAN_05002_002800_THANCRED","ウリエンジェ！"
297,"TEXT_VOICEMAN_05002_002810_URIANGER","御意！"
298,"TEXT_VOICEMAN_05002_002820_THANCRED","落ちろッ！"
299,"TEXT_VOICEMAN_05002_002830_RANJIT","くっ！"
300,"TEXT_VOICEMAN_05002_002840_RYNE","あの……ヤ・シュトラさんは……？"
301,"TEXT_VOICEMAN_05002_002850_RYNE","よかった……。
ルナルさんは、こっちにいたんですね。"
302,"TEXT_VOICEMAN_05002_002860_THANCRED","スリザーバウにも、解毒薬を届けてきた。
敵も、根城の方まで後退したようだから、
ひとまずは大丈夫だろう。"
303,"TEXT_VOICEMAN_05002_002870_THANCRED","ルナルの奴、毒を受けながら、
時間を稼ごうと食らいついていたらしくてな……。"
304,"TEXT_VOICEMAN_05002_002880_THANCRED","ユールモア軍を追って集落を出て行ったって、
あっちでも心配されていた。
……保護されていて何よりだ。"
305,"TEXT_VOICEMAN_05002_002890_RUNAR","う……ううん……。"
306,"TEXT_VOICEMAN_05002_002900_RUNAR","あれ……ここは…………？"
307,"TEXT_VOICEMAN_05002_002910_URIANGER","ここは、イキス・マヤエの森にある里です。
危険はありませんので、どうかまだ、安静に……。"
308,"TEXT_VOICEMAN_05002_002920_RUNAR","……いや、大丈夫だよ。
体はだるいが、動けないほどじゃない。"
309,"TEXT_VOICEMAN_05002_002930_RUNAR","それよりも、あんたたちが無事でよかった。
ユールモア軍がそっちに向かったから、
オイラ、止めなきゃと思って……。"
310,"TEXT_VOICEMAN_05002_002940_RUNAR","あれ……姐さんは……？
一緒にいるんだろう？"
311,"TEXT_VOICEMAN_05002_Q5_000_001_NONE_VOICE","何と言う？"
312,"TEXT_VOICEMAN_05002_A5_000_001_NONE_VOICE","命をかけて、解毒薬を……"
313,"TEXT_VOICEMAN_05002_A5_000_002_NONE_VOICE","彼女のおかげで、夜の民は救われた"
314,"TEXT_VOICEMAN_05002_A5_000_003_NONE_VOICE","…………"
315,"TEXT_VOICEMAN_05002_002950_RUNAR","それ、どういうことだよ……！
ちゃんと教えてくれよ！"
316,"TEXT_VOICEMAN_05002_002960_RUNAR","なんだよ……！？
黙ってないで、教えてくれよ……！"
317,"TEXT_VOICEMAN_05002_002970_RUNAR","そ……そんな…………。"
318,"TEXT_VOICEMAN_05002_002980_RUNAR","嘘だろ、なんで……。
姐さんが……そんなはず……。"
319,"TEXT_VOICEMAN_05002_002990_RUNAR","すごい人なんだ、本当に……。
穴くらい、落ちたって……そんな……。"
320,"TEXT_VOICEMAN_05002_003000_RUNAR","そうだ、調査はこれからか？
オイラも、オイラも連れて行ってくれよ！"
321,"TEXT_VOICEMAN_05002_003010_RUNAR","なんだよ、行こうよ……！
だって……だってマトーヤの姐さんは……ッ！"
322,"TEXT_VOICEMAN_05002_003020_RUNAR","姐さんは……んな、簡単に……いなくなる、はずが……！"
323,"TEXT_VOICEMAN_05002_003030_ALMET","……こんなときに、すまない。
周辺を見回っていた仲間が、不審者を捕まえたのだ。"
324,"TEXT_VOICEMAN_05002_003040_ALMET","私では、お前たちの仲間かどうか判断がつかないからな。
確認のため、連れてきてみたのだが……。"
325,"TEXT_VOICEMAN_05002_003050_THANCRED","エメトセルク……！"
326,"TEXT_VOICEMAN_05002_003060_EMETSELCH","いやぁ……。
ここの狩人たちを、少々甘く見すぎていた。
案外、逃げる隙がない。"
327,"TEXT_VOICEMAN_05002_003070_EMETSELCH","……で、何だこの状況は？"
328,"TEXT_VOICEMAN_05002_003080_EMETSELCH","ははぁ……。
遺跡に入るところまでは見ていたが、
中でそんなことになってたわけか。"
329,"TEXT_VOICEMAN_05002_003090_EMETSELCH","仲間が死んだとは、ご愁傷様だ。"
330,"TEXT_VOICEMAN_05002_003100_EMETSELCH","だって死んだんだろう？
事実をボカせば蘇るわけでもあるまいし。"
331,"TEXT_VOICEMAN_05002_003110_THANCRED","お前が思うほど、命は軽くないんだ……俺たちにとってはな。
それに彼女という賢人は、
そう易々と死を受け入れるようなタチじゃない。"
332,"TEXT_VOICEMAN_05002_003120_RYNE","あの……大丈夫ですか？
お疲れなら、少し休んだ方が……"
333,"TEXT_VOICEMAN_05002_Q6_000_001_NONE_VOICE","何と言う？"
334,"TEXT_VOICEMAN_05002_A6_000_001_NONE_VOICE","彼女は本当に落ちたんだろうか……"
335,"TEXT_VOICEMAN_05002_A6_000_002_NONE_VOICE","直後に、強い風が吹いていた……"
336,"TEXT_VOICEMAN_05002_003130_URIANGER","……彼女が転落する際のことを、
もう一度、詳しく教えていただけませんか？"
337,"TEXT_VOICEMAN_05002_003140_THANCRED","エンシェント・テレポ……。"
338,"TEXT_VOICEMAN_05002_003150_THANCRED","ほら、あの詠唱なしの転送魔法だ。
俺が以前あれに巻き込まれたときも、強い風が吹いた……！"
339,"TEXT_VOICEMAN_05002_003160_EMETSELCH","ああ、なるほど……。
さっき、一瞬だけ地脈が揺らいだと思ったが、
気のせいじゃなかったか。"
340,"TEXT_VOICEMAN_05002_003170_EMETSELCH","揺らいだのは1回だけだったから、
多分、入っただけで出ちゃいないな……。
まだ地脈をさまよってるんじゃないか？"
341,"TEXT_VOICEMAN_05002_003180_URIANGER","そうだとしたら難儀です……。
以前は確か、カヌ・エ様の力をお借りして、
彼女を地脈から引き揚げましたが……。"
342,"TEXT_VOICEMAN_05002_003190_EMETSELCH","ふむ……面倒だが、私がやってやろうか？"
343,"TEXT_VOICEMAN_05002_003200_EMETSELCH","お前たちは、私の言葉をてんで信じないからな。
敵ではないと示せる、いい機会だ。"
344,"TEXT_VOICEMAN_05002_003210_EMETSELCH","……ま、ここでいいだろう。"
345,"TEXT_VOICEMAN_05002_003220_EMETSELCH","探索ご苦労。
それじゃ、少し下がってろ。"
346,"TEXT_VOICEMAN_05002_003230_EMETSELCH","さて……魂の色は、どんなだったか……。"
347,"TEXT_VOICEMAN_05002_003240_EMETSELCH","ああ…………見つけた。"
348,"TEXT_VOICEMAN_05002_003250_RUNAR","間違いない、姐さんだ……ッ！"
349,"TEXT_VOICEMAN_05002_003260_YSHTOLA","うぅ……ん…………。"
350,"TEXT_VOICEMAN_05002_003270_THANCRED","おい、大丈夫か……？"
351,"TEXT_VOICEMAN_05002_003280_YSHTOLA","なんとか、ね……。
私は……いったい……？"
352,"TEXT_VOICEMAN_05002_003290_URIANGER","あなたは、二度目の帰還を果たしたのです。
エンシェント・テレポによる、地脈の放浪から……。"
353,"TEXT_VOICEMAN_05002_003300_YSHTOLA","ああ……そう……そうだったわ。
薬を、解毒薬を取るには、それしかないと思って……。"
354,"TEXT_VOICEMAN_05002_003310_YSHTOLA","ふふ、あははっ……！"
355,"TEXT_VOICEMAN_05002_003320_YSHTOLA","我ながら、ひどい無茶をしたものだわ！
……気づいてくれて、ありがとう。"
356,"TEXT_VOICEMAN_05002_003330_YSHTOLA","きゃっ"
357,"TEXT_VOICEMAN_05002_003340_RUNAR","姐さん、姐さん、マトーヤの姐さん……！"
358,"TEXT_VOICEMAN_05002_003350_RUNAR","無事でよかった……本当に……本当に！"
359,"TEXT_VOICEMAN_05002_003360_YSHTOLA","困った子ね……。
あなたが泣いていたら、みんなも不安になってしまうわ。"
360,"TEXT_VOICEMAN_05002_003370_YSHTOLA","この、魔女マトーヤが、そうそう死ぬものですか。
まだまだ、知りたいことは尽きなくてよ。"
361,"TEXT_VOICEMAN_05002_003380_EMETSELCH","功労者への感謝はなしかね？"
362,"TEXT_VOICEMAN_05002_003390_URIANGER","お話しした、アシエン・エメトセルクです。
あなたを地脈から引き揚げる役目は、彼が……。"
363,"TEXT_VOICEMAN_05002_003400_YSHTOLA","そう、あなたが例の……。"
364,"TEXT_VOICEMAN_05002_003410_YSHTOLA","信用するかどうかは別問題として。
今回は、感謝するわ……助けてくれてありがとう。"
365,"TEXT_VOICEMAN_05002_003420_YSHTOLA","それで……まさか先に「キタンナ神影洞」に行ったりは、
していないでしょうね？"
366,"TEXT_VOICEMAN_05002_003430_YSHTOLA","この私を置いて遺跡探索なんて、許さなくてよ。"
367,"TEXT_VOICEMAN_05002_Q7_000_001_NONE_VOICE","何と言う？"
368,"TEXT_VOICEMAN_05002_A7_000_001_NONE_VOICE","もちろん、一緒に行こう！"
369,"TEXT_VOICEMAN_05002_A7_000_002_NONE_VOICE","頼りにしてる"
370,"TEXT_VOICEMAN_05002_A7_000_003_NONE_VOICE","無茶もほどほどに……"
371,"TEXT_VOICEMAN_05002_003440_THANCRED","それだけ元気なら、アルメたちも安心するだろうさ。
遺跡のことを聞くためにも、一度ファノヴの里に戻ろう。"
372,"TEXT_VOICEMAN_05002_003450_RYNE","これで、3体目……。
「夜の民」のみんなにも、この空が見えてるかな……。"
373,"TEXT_VOICEMAN_05002_003460_THANCRED","ああ、きっとな……。"
374,"TEXT_VOICEMAN_05002_003470_URIANGER","……やはり、彼の具合が気になりますか？"
375,"TEXT_VOICEMAN_05002_003480_URIANGER","……やはり、彼女の具合が気になりますか？"
