key,0,1
#,,
int32,str,str
0,"TEXT_REGSEAPVPSEASONREWARD_00341_SEASONREWARD_000_000","（★未使用／削除予定★）"
1,"TEXT_REGSEAPVPSEASONREWARD_00341_SEASONREWARD_000_001","（★未使用／削除予定★）"
2,"TEXT_REGSEAPVPSEASONREWARD_00341_SEASONREWARD_000_005","ザ・フィーストでは「シーズン」終了時点の階級に応じて、
報酬が入手できます。"
3,"TEXT_REGSEAPVPSEASONREWARD_00341_SEASONREWARD_000_006","特にランキング上位者には、
特別な報酬が用意されていますので、
ぜひ、上位入賞を目指してください。"
4,"TEXT_REGSEAPVPSEASONREWARD_00341_SEASONREWARD_000_007","ですが、現在はプレシーズン期間中であるため、
シーズン報酬は用意されていません。
シーズン1の開幕をお待ちください。"
5,"TEXT_REGSEAPVPSEASONREWARD_00341_SEASONREWARD_000_008","現在はシーズン1を開催中です。
シーズン報酬は、シーズン1が終了したら交換を開始します。"
6,"TEXT_REGSEAPVPSEASONREWARD_00341_SYSTEM_000_009","シーズン1のランキングは、Lodestoneをご覧ください。"
