key,0,1
129,"TEXT_CTSDKBCHARACTER4_00570_QESHIRAE_000_503","Bon, il se peut aussi que ce soit un animal solitairrre. Ou qu'on se soit plantées dans nos conclusions, même si j'en doute."
130,"TEXT_CTSDKBCHARACTER4_00570_QESHIRAE_000_504","... En résumé, on peut être <If(PlayerParameter(4))>sûrrres<Else/>sûrrrs</If> de rien tant que Yalana nous aura pas donné ses résultats d'analyse<Indent/>!"
131,"TEXT_CTSDKBCHARACTER4_00570_QESHIRAE_000_505","Gnéhéhéhé... Cette aura de mystèrrre, c'est ce qui rend le simoun si passionnant<Indent/>! Plus il me fuit et plus je le suis<Indent/>!"
132,"TEXT_CTSDKBCHARACTER4_00570_QESHIRAE_000_506","T'es comme moi, pas vrai<Indent/>? Tu veux tout connaître de ce forrrmidable animal... Oh, comme je te comprends<Indent/>!"
133,"TEXT_CTSDKBCHARACTER4_00570_QESHIRAE_000_507","Tiens, toi qui es notre simounologue en chef, explique-moi comment les simouns font pour nous glisser entrrre les doigts<Indent/>! Allez, je t'écoute<Indent/>! Que te dit ton intuition<Indent/>?"
134,"TEXT_CTSDKBCHARACTER4_00570_Q2_000_000","Que répondez-vous<Indent/>?"
135,"TEXT_CTSDKBCHARACTER4_00570_A2_000_001","Qu'ils se camouflent."
136,"TEXT_CTSDKBCHARACTER4_00570_A2_000_002","Que ce sont des créatures magiques."
137,"TEXT_CTSDKBCHARACTER4_00570_A2_000_003","Qu'ils peuvent rétrécir à volonté."
138,"TEXT_CTSDKBCHARACTER4_00570_QESHIRAE_000_508","Des experrrts en camouflage, hein... Ça ex<SoftHyphen/>pli<SoftHyphen/>que<SoftHyphen/>rait pourquoi presque personne ne les a vus. Mais ça ne doit pas être facile pour eux de se fondre dans le décor, étant donné leur taille..."
139,"TEXT_CTSDKBCHARACTER4_00570_QESHIRAE_000_509","Si c'est le cas, ils pourraient nous jeter des sorrrts pour troubler nos sens et nous empêcher de les voir... En voilà, une hypothèse intéressante<Indent/>!"
140,"TEXT_CTSDKBCHARACTER4_00570_QESHIRAE_000_510","Ah, j'y avais pas pensé... Je partais du postulat qu'il s'agissait d'animaux géants, mais c'est vrrrai qu'il faudrait peut-être remettre cette idée-là en question..."
141,"TEXT_CTSDKBCHARACTER4_00570_QESHIRAE_000_511","Merci pour cet avis constructif<Indent/>! <Split(<Highlight>ObjectParameter(1)</Highlight>, ,1)/>, on t'a déjà dit que tu ferais <If(PlayerParameter(4))>une bonne<Else/>un bon</If> scien<SoftHyphen/>ti<SoftHyphen/>fi<SoftHyphen/>que<Indent/>? Tu t'efforrrces de considérer un problème sous divers angles. En général, c'est comme ça qu'on trouve de nouvelles pistes<Indent/>!"
142,"TEXT_CTSDKBCHARACTER4_00570_QESHIRAE_000_512","Je vais filer les échan<SoftHyphen/>til<SoftHyphen/>lons à Yalana et lui répéter ton hypothèse. Avec ça, elle sera arrrmée pour découvrir la vérité<Indent/>! "
143,"TEXT_CTSDKBCHARACTER4_00570_QESHIRAE_000_513","... Quoique, je pourrais peut-être analyser une ou deux traces à ma façon d'aborrrd... (bave)"
144,"TEXT_CTSDKBCHARACTER4_00570_QESHIRAE_000_514","... Hein<Indent/>? Vaut mieux pas<Indent/>? Dommage..."
145,"TEXT_CTSDKBCHARACTER4_00570_QESHIRAE_000_515","Yalana aura droit à <Emphasis>tous</Emphasis> ses échan<SoftHyphen/>til<SoftHyphen/>lons, alorrrs... Je te dirai quand elle aura terminé ses analyses."
146,"TEXT_CTSDKBCHARACTER4_00570_QESHIRAE_000_516","Je te jurrre que cette fois, c'est la bonne<Indent/>! Prépare-toi bien, notre prochaine excursion scien<SoftHyphen/>ti<SoftHyphen/>fi<SoftHyphen/>que promet d'être mouvementée<Indent/>!"
147,"TEXT_CTSDKBCHARACTER4_00570_SYSTEM_000_517","Votre rang de con<SoftHyphen/>tri<SoftHyphen/>bu<SoftHyphen/>tion a changé. Qeshi-Rae vous considère maintenant comme <If(PlayerParameter(4))>une simounologue émérite<Else/>un simounologue émérite</If><Indent/>!"
148,"TEXT_CTSDKBCHARACTER4_00570_SYSTEM_000_510","Elle propose la prochaine quête aux mineurs ou botanistes de niveau 80."
149,"TEXT_CTSDKBCHARACTER4_00570_SYSTEM_000_520",""
150,"TEXT_CTSDKBCHARACTER4_00570_QESHIRAE_000_530","Salut, salut<Indent/>! Alors, t'es venu<If(PlayerParameter(4))>e<Else/></If> me parler d'animaux fantastiques<Indent/>? De plantes jamais vues encore<Indent/>? De minerais précieux<Indent/>? Tu veux m'inviter en excurrrsion scien<SoftHyphen/>ti<SoftHyphen/>fi<SoftHyphen/>que<Indent/>!?"
151,"TEXT_CTSDKBCHARACTER4_00570_QESHIRAE_000_531","J'aurais accepté illico, si ça tenait qu'à moi. Mais si je quitte mon poste trrrop souvent, Katliss va me passer un savon... La vie est injuste..."
152,"TEXT_CTSDKBCHARACTER4_00570_QESHIRAE_000_540","De nouvelles recherches à mener, des p'tits jeunes à former... La nuit est peut-être revenue, mais à l'association des naturalistes, on n'est pas prrrès de se coucher<Indent/>!"
153,"TEXT_CTSDKBCHARACTER4_00570_SYSTEM_000_550","Impossible d'obtenir la récompense. Votre inventaire est plein. Faites de la place, puis reparlez à Qeshi-Rae."
154,"TEXT_CTSDKBCHARACTER4_00570_SYSTEM_000_560","L'association des naturalistes n'est ouverte qu'aux mineurs et aux botanistes."
155,"TEXT_CTSDKBCHARACTER4_00570_QESHIRAE_000_570","Salut <Split(<Highlight>ObjectParameter(1)</Highlight>, ,1)/>, la forrrme<Indent/>? Alors, y paraît que tu t'es procuré des tas de matériaux rares pour retaper les outils des merveilles<Indent/>?"
156,"TEXT_CTSDKBCHARACTER4_00570_QESHIRAE_000_571","Ça signifie que chacun d'entre eux est un véritable concentré de trésorrrs naturels<Indent/>! Sans compter qu'ils vont nous aider à défricher Norvrandt."
157,"TEXT_CTSDKBCHARACTER4_00570_QESHIRAE_000_572","À terrrme, vos outils pourraient bien ré<SoftHyphen/>vo<SoftHyphen/>lu<SoftHyphen/>tion<SoftHyphen/>ner le travail des artisans du monde entier. Y a pas à dire, on vit vraiment une époque formidable<Indent/>!"
