#,Description,DescriptionEnhanced,Tooltip,SpecialActionName,SpecialActionDescription,Attack,Defense,Speed,MinionSkillType,HasAreaAttack,StrengthGate,StrengthEye,StrengthShield,StrengthArcana
287,"Vous appelez votre mascotte Prince d'Anemos, une petite pieuvre que l'on dit être le successeur direct du terrible Seigneur d'Anemos.","Lorsqu'on l'agace, cet irascible descendant du Seigneur d'Anemos étend deux de ses tentacules pour les faire tournoyer à toute vitesse. Fort heureusement, il ne pourra jamais blesser quelqu'un tant qu'il sera bébé.",Bloub... ? Bloub !? Bloub bloub !!!,Double taloche tentaculaire,"Inflige des dégâts d'attaque 150 aux ennemis dans l'aire d'effet et réduit leur défense de 30%.
**Durée :** 6s",30,20,3,1,False,True,True,True,False
288,"Vous appelez votre mascotte petit Komainu, une poupée à l'effigie d'une créature réputée pour protéger les sanctuaires en Orient.","Cette poupée représente une célèbre créature orientale chargée de protéger les lieux sacrés contre les mauvais esprits. D'apparence léonine, les Komainu vont souvent par paire, ce qui fait que cette mascotte fera na­tu­rel­le­ment face à une autre du même genre.",. . . . .,Aun-no-Kokyû,Enlève un piège mis en place par l'ennemi.,50,50,3,6,False,False,True,True,False
289,"Vous appelez votre mascotte Namazu nain doré, une marionnette de namazu entièrement recouverte d'or. Elle frétille si bien qu'on dirait un vrai !",Cette mascotte en forme de Namazu doré aurait été con­fec­tion­née en tant que porte-bonheur pour le Proche-Orient par un fabricant de marionnettes hingashien. La dorure aurait été appliquée grâce à une technique locale appelée *maki-e*.,Plop-plop...,Clochette dorée,Augmente de 10 les PdT des mascottes dans l'aire d'effet. Les mascottes dont la technique a le même effet ne sont pas concernées.,60,80,2,3,False,False,False,False,False
290,"Vous appelez votre mascotte petit Qitian Dasheng, un pantin créé par le Zuijû Qitian Dasheng grâce à ses pouvoirs magiques.","Une version miniature de Qitian Dasheng créée par le Zuijû lui-même. Autrefois un singe espiègle, il a continué à taquiner son entourage même après avoir acquis ses pouvoirs. Il adore virevolter sur son petit nuage magique.","À moi, nuage magique !",Roi des singes,Inflige des dégâts d'attaque 230 aux ennemis dans l'aire d'effet.,90,20,4,1,False,False,False,False,False
291,"Vous appelez votre mascotte lanterne mécanique, capable de se déplacer toute seule grâce à des mécanismes avancés.",Cette lanterne mécanique est le fruit d'une col­la­bo­ra­tion entre les guildes des orfèvres et des alchimistes pour satisfaire le souhait des aventuriers. Elle peut se déplacer seule grâce à des mécanismes avancés et produire de la lumière par le biais de procédés alchimiques.,. . . . .,Jeux de lumière,"Place un piège qui peut être déclenché 10 secondes plus tard.
Piège : inflige des dégâts d'attaque 260 aux ennemis dans l'aire d'effet.",20,70,2,2,False,False,False,True,False
292,"Vous appelez votre mascotte lézard à collerette. Ce petit reptile a la particularité d'avoir une sorte de collerette autour de son cou, et il est également connu sous le nom de chlamydo... saurus.","Ce petit lézard vit dans les arbres et en descend ré­gu­liè­re­ment pour se nourrir. Il chasse en piquant des pointes de vitesse sur ses pattes arrière, et lorsque les rôles sont inversés, il déploie sa collerette pour intimider ses prédateurs.",Uhonn ! Uhonn !,Sprint mirage,"Augmente de 35% la vitesse de déplacement des alliés dans l'aire d'effet.
**Durée :** 6s",35,30,3,3,False,False,False,True,False
293,"Vous appelez votre mascotte Cirina miniature, un pantin à l'effigie d'une jeune femme de la tribu des Mol.","Ce pantin était offert durant la fête de la Commémoration afin de promouvoir la culture xaela. Cirina, son modèle, est représentée comme au quotidien, vêtue d'une tenue tra­di­tion­nel­le ornée de broderies magnifiquement ouvragées.",Hors de question que vous partiez le ventre vide !,Ôracle sacré,"Réduit de moitié le temps de recharge pour l'invocation des mascottes.
**Durée :** 10s",20,50,2,9,False,False,True,False,False
294,"Vous appelez votre mascotte Sadu miniature, un pantin à l'effigie de la fière chef de la tribu des Dotharl.","Ce pantin à l'effigie de Sadu a été conçu par un guerrier Dotharl qui rêvait d'étreindre la chef de sa tribu. Lorsqu'il a réalisé à quel point la jeune femme était farouche, il s'est résolu à fabriquer cette reproduction fidèle à la place.","Les Dotharl ne craignent rien, pas même la mort.",Tombée du crépuscule,Inflige des dégâts d'attaque 300 aux ennemis dans l'aire d'effet. Les mascottes qui ont utilisé des PdT sont au­to­ma­ti­que­ment renvoyées.,75,35,3,1,True,False,False,True,False
295,"Vous appelez votre mascotte pousse de Cassie, un bourgeon issu de la morbole éponyme.","La jeune pousse morbole aime déjà se faire belle. Elle a utilisé un morceau d'étoffe vermeil pour s'en faire une robe et porte même des boucles d'oreilles trouvées on ne sait où. Mal­heu­reu­se­ment, son haleine reste toujours aussi fétide.",Smack !♥,Haleine sucrée,"Immobilise les ennemis dans l'aire d'effet.
**Durée :** 5s",30,50,3,4,False,True,True,True,False
296,"Vous appelez votre mascotte poupée tarutaru, une poupée à l'effigie d'une Tarutaru, membre d'un peuple légendaire.","Un savant des Élèves de Baldesion a tenté de représenter ce à quoi les anciennes Lalafelles pouvaient ressembler. Il l'a habillée d'une pelisse vermillon, un manteau à capuche affectionné des mages qui régénérerait les forces magiques.",Ma pelisse vermillon est magnifique !,Recharge,Augmente de 10 les PdT des mascottes dans l'aire d'effet. Les mascottes dont la technique a le même effet ne sont pas concernées.,80,25,3,3,False,True,False,False,False
297,"Vous appelez votre mascotte poupée Tsukuyomi, un pantin à l'effigie de la Maîtresse de la lune et de la nuit qui pourrait bien vous attirer dans des ténèbres sans fin.",Un orfèvre enrôlé de force par Garlemald aurait con­fec­tion­né cette poupée aussitôt après avoir retrouvé sa liberté grâce à un échange de prisonniers. L'émotion qu'il ressentit alors transparaît dans la finition magnifique de son œuvre.,Haa...,Lis araignée,Inflige des dégâts d'attaque 90 aux ennemis dans l'aire d'effet.,60,35,2,1,True,True,False,False,False
298,"Vous appelez votre mascotte Zhloe miniature, un pantin à l'effigie de la jeune Miqo'te qui a décidé de se lancer dans les affaires pour ouvrir un orphelinat.","Touché par le combat de Zhloe Aliapoh pour son orphelinat, un artisan de la maison des splendeurs de Rowena a décidé de fabriquer ce pantin à l'effigie de la Miqo'te. Il l'a ensuite offert à la sœur de cette dernière, Khloe, pour qu'elle l'ajoute à sa collection de récompenses.",Merrrci beaucoup !,Pain plat tout chaud,"Soigne 100 PV aux alliés dans l'aire d'effet, ou 150 PV s'ils sont de type “Poupée”.",20,60,2,7,False,False,True,False,False
299,"Vous appelez votre mascotte Bâtisseur n°8, un robot bâtisseur découvert dans l'ancienne cité des machines de Goug.","Inactif lorsqu'il a été découvert dans l'ancienne cité des machines de Goug, ce robot bâtisseur s'est subitement animé lorsqu'on a inséré un cristal dans son torse. Il devrait rester inoffensif, tant que personne ne remplace sa source d'énergie par une auralithe...","J'ATTENDS VOS ORDRES, MAÎTRE !",Traitement,Inflige des dégâts équivalents à cinq fois l'attaque aux ennemis dans l'aire d'effet.,60,35,1,1,False,False,False,False,True
300,"Vous appelez votre mascotte Felyne, un Palico des plus amicaux !","Les Felynes sont des hommes-bêtes ayant pactisé avec les chasseurs pour les assister durant les quêtes. Après avoir formé cette alliance, ils prennent le surnom de “Palico”.",Chat c'est sûr !,Orchestre de corail,"Augmente de 25 l'attaque des alliés dans l'aire d'effet.
**Durée :** 6s",40,30,4,3,False,False,True,False,False
301,"Vous appelez votre mascotte Poogie, un adorable petit cochon capable de rendre n'importe quel chasseur com­plè­te­ment gaga.","Les Poogies ont tellement de fans au sein des chasseurs de monstres que certains en ont fait l'emblème de leur guilde, sans oublier ceux qui viennent des quatre coins du monde pour leur faire quelques caresses.",Grouik !,Creuser,Désamorce les pièges des ennemis.,30,45,2,6,False,True,False,True,False
302,"Vous appelez votre mascotte Namazu nain festif, un pantin portant la tenue de la grande frairie namazu.","Gyoshin a travaillé pendant plusieurs nuits pour con­fec­tion­ner ce petit Namazu (même si le happi est manifestement l'œuvre de Gyorei). Il a d'abord eu l'intention de le créer à l'image du 777e festivalier, mais ayant vite perdu le compte, il finit par choisir un modèle au hasard.",Oyoyoyo !,Vent de l'llumination,"Augmente de 20 la défense des alliés dans l'aire d'effet.
**Durée :** 10s",50,65,1,3,False,False,True,True,False
303,"Vous appelez votre mascotte paonne vermillon, une magnifique poupée magique en forme d'oiseau écarlate qui ne doit pas être confondu avec Suzaku.","La splendeur des plumes de cette paonne vermillon attire les regards de tous ceux qui la croisent, et sa consommation de serpents et d'insectes venimeux lui a donné l'image d'un oiseau de bon augure que certains vénèrent comme une divinité.",Pouet ! Yahoooo !,Rêve vermillon,"Inflige des dégâts d'attaque 80 aux ennemis dans l'aire d'effet et réduit leur défense de 30%.
**Durée :** 6s",50,40,2,1,True,True,False,False,False
304,"Vous appelez votre mascotte Alpha mécanique, le prototype final d'un automate promis à un grand succès.",Le prototype final d'un automate à l'image d'Alpha que vous avez reçu en récompense de vos exploits face à Oméga et ses sujets de test. Jessie a bon espoir que sa commercialisation permettra de renflouer les caisses des Forges de Garlond !,Kwé... ?,Carte téléportation,Téléporte les mascottes qui ont utilisé des PdT vers le portail central.,70,70,4,9,False,False,False,False,False
305,"Vous appelez votre mascotte mini-Oméga, une réplique mécanique ultra-détaillée de l'arme autonome.","Un automate découvert dans la fissure interdimensionnelle et reproduisant l'apparence d'Oméga dans les moindres détails. D'après Wedge, il est possible qu'il ait été créé par l'arme autonome elle-même pour observer les humains...",Bip... Pshhh...,Ciblage,"Inflige des dégâts d'attaque 150 aux ennemis dans l'aire d'effet et ajoute le type “Monstre” à leurs points faibles.
**Durée :** 10s",70,65,1,1,False,False,False,True,True
306,Vous appelez votre mascotte G'raha Tia miniature. Il a hâte de voir tous les exploits historiques que vous aurez accomplis pendant son sommeil...,"Tataru a fabriqué cette poupée à l'effigie d'un érudit du Nord pour récolter des fonds pour l'exploration de la gorge de Syrcus, d'après une histoire que lui avait rapporté Rammbroes, de la Fondation de Saint-Coinach.",Mes yeux !!,Yeux de rang,"Rend vos portails, votre bouclier et votre œil scrutateur invulnérables à toutes les attaques.
**Durée :** 20s",40,50,3,9,False,True,True,True,False
307,"Vous appelez votre mascotte fantôme triste, une pauvre âme errante qui semble quelque peu dépressive.",Même les arlequins du Cirque intercontinental ignorent comment ce fantôme de la Veillée des saints fait pour se mouvoir. Se pourrait-il que ce soit dû à sa dépression chronique ?,Pfff... Bouh !,Dissipation blasée,Dissipe tous les effets bénéfiques des ennemis dans l'aire d'effet.,10,50,4,6,False,False,True,False,False
308,"Vous appelez votre mascotte fantôme joyeux, un gai luron toujours souriant !","Depuis qu'il a obtenu une forme physique, ce fantôme à l'air enjoué virevolte dans les airs sans que personne ne sache comment il fait ! Est-ce vraiment un pur esprit, ou une poupée à qui on aurait insufflé la vie à l'aide d'un pouvoir magique ?",Hi hi ! Bouh !,Transparence joviale,"Rend les mascottes qui ont utilisé des PdT invulnérables à toutes les attaques.
**Durée :** 6s",35,65,1,3,False,True,False,False,False
309,"Vous appelez votre mascotte Cloud miniature, avec ses cheveux pleins de gel et son air indifférent.","Ce soldat est à n'en point douter une véritable légende, mais comment fait-il pour soulever une telle épée avec des bras aussi frêles ? Aujourd'hui encore, la question reste en suspens.",Ça m'intéresse pas.,Finition,Inflige des dégâts d'attaque 380 aux ennemis dans l'aire d'effet.,75,65,3,1,False,False,False,True,False
310,"Vous appelez votre mascotte Aerith miniature, au charme qui rappelle quelque peu les temps anciens.","Après avoir passé son temps dans des ruelles sombres, cette vendeuse de fleurs au destin ex­cep­tion­nel mais tragique a acquis l'immortalité grâce à sa version réduite.",Va pour un rendez-vous !,Grand évangile,"Rend les mascottes dans l'aire d'effet invulnérables aux attaques venant des ennemis de type “Créature”.
**Durée :** 5s",35,55,2,3,False,False,False,False,False
311,"Vous appelez votre mascotte Tifa miniature, au charme qui évoque clairement les temps modernes.","Cette tenancière de bar aux arguments imparables sait mieux que personne botter les fesses de ses adversaires à l'aide de puissantes techniques d'arts martiaux, mais elle garde souvent le silence sur ses véritables sentiments.",En avant toute !,Dernier paradis,Inflige des dégâts d'attaque 150 aux ennemis dans l'aire d'effet et les projette en arrière.,60,40,3,1,False,True,True,False,False
312,Vous appelez votre mascotte pâté de boue. La joie d'avoir été libéré de l'emprise de Tokkapchi se lit sur son visage.,"Ce gentil petit tas de fange a beau arborer un sourire ravageur, il n'en reste pas moins qu'il ne sent pas la rose... Heu­reu­se­ment que les végétaux de toutes les sortes en raffolent !",Bloup bloup...,Gadoue,"Inflige des dégâts d'attaque 60 aux ennemis dans l'aire d'effet et réduit leur vitesse de déplacement de 70%.
**Durée :** 10s",40,50,2,1,True,False,False,True,False
313,"Vous appelez votre mascotte Mog d'honneur, un souvenir reçu lors d'une cérémonie du lien éternel.",Cette adorable mascotte articulée tient dans ses pattes un petit panier pour vous baigner de pétales et vous rappeler la cérémonie du lien éternel au cours de laquelle vous l'avez reçue. On dit d'elle qu'elle porte bonheur !,Kuuupo kupo !♪,Kuuupo kupo !♪,"Augmente de 10 l'attaque des alliés dans l'aire d'effet.
**Durée :** 10s",30,30,3,3,False,True,False,False,False
314,"Vous appelez votre mascotte poupée elvaan, une poupée à l'effigie d'un Elvaan, membre d'un peuple légendaire.",Un savant des Élèves de Baldesion a tenté de représenter ce à quoi les anciens Élézens pouvaient ressembler. La poupée porte la tra­di­tion­nel­le cotte-hardie bleue (et non pas noire comme tient à le préciser son créateur).,Jamais sans ma cotte-hardie bleue !,Danse de l'éventail,"Augmente de 40 la défense des mascottes qui ont utilisé des PdT.
**Durée :** 10s",50,50,4,3,False,False,True,False,False
315,"Vous appelez votre mascotte bébé dhalmel, une jeune bête sauvage au long cou, enfin... relativement à son corps.","On soupçonne que ce jeune animal au cou bizarrement proportionné a été élevé pour servir de cobaye. Le plus étonnant cependant, est qu'il soit encore vivant après avoir vécu sur Eurêka, une île où grouille une multitude de monstres pernicieux.",Gniiiinn !,Regard froid,Réduit les PdT des ennemis dans l'aire d'effet de 50% de leur valeur maximale.,30,35,3,4,False,True,True,False,False
316,"Vous appelez votre mascotte bébé cabiaï, un rongeur qui adore barboter dans l'eau.","Ce rongeur aime tellement se prélasser dans les sources d'eau qu'il lui arrive d'oublier de se nourrir. Quant à son nom hingashien, il est d'une complexité telle que même les Orientaux préfèrent l'ignorer.",Kyu kyu !,Dents de devant,Inflige des dégâts équivalents à 5% de sa solidité à la pierre arcanique ennemie la plus proche.,40,30,3,8,False,False,False,True,False
317,Vous appelez votre mascotte bébé gremlin. Ce jeune gremlin ne se multiplie pas au contact de l'eau.,Un démon de bas rang dans la Hiérarchie du néant. Son beau pelage immaculé contraste avec sa tendance à injurier les gens. Ce spécimen ne craint pas la lumière et ne se multiplie plus au contact de l'eau.,Hou-hou-hou !,Injure,"Réduit de 50% l'attaque des ennemis dans l'aire d'effet.
**Durée :** 15s",50,35,2,4,False,False,True,True,False
318,Vous appelez votre mascotte mini-vertu. Il s'agirait d'un fragment tombé de Vertu absolue.,"Un être né d'un fragment de l'immense entité magique Vertu absolue découverte à Eurêka. De par sa grande con­cen­tra­tion en éther, on la rapproche des élémentaires et autres êtres semi-vivants. Ne disparaît pas après deux heures.",Par vos principes... j'ai été... libéré... des chaînes...,Existence suprême,"Augmente son attaque et sa défense. Les montants sont majorés de 10 pour l'attaque et de 5 pour la défense par tranche de 5% de PV perdus.
**Durée :** 10s",90,55,4,3,False,True,False,True,False
319,Vous appelez votre mascotte ko-yukinko. Une jeune yukinko qui est parée pour le froid de l'hiver.,"Une jeune yukinko. D'une nature maniaque, elle renouvelle sa coiffe de chaume en permanence avec de la paille de graminée. Timide, elle ne montre jamais sa tête découverte en public. Ceux qui ont tenté de la voir de force auraient été maudits...",Pom-pom-pom...,Petit flocon,"Inflige des dégâts d'attaque 70 aux ennemis dans l'aire d'effet et réduit leur vitesse de déplacement de 50%.
**Durée :** 10s",30,50,2,1,False,True,False,False,False
320,Vous appelez votre mascotte nouvelle Tataru miniature. Elle est vêtue à la mode hingashienne.,"Une poupée inspirée de ma­de­moi­sel­le Tataru, réceptionniste des Héritiers. Elle l'aurait commandée exprès à un artisan oriental pour l'offrir aux personnes l'ayant aidée à Kugane. Son kimono est tissé en fine soie de Bukyo.","♪ Les Héritiers n'ont pas à s'inquiéter,
♪ Car Tataru est là pour les aider !",Jolie rose,"Réduit de moitié le temps de recharge pour l'invocation des mascottes.
**Durée :** 10s",30,35,3,9,False,False,True,False,False
321,Vous appelez votre mascotte blindée. Ce modèle réduit basé sur l'arme blindée a été conçu pour l'en­traî­ne­ment.,Une reproduction à petite échelle d'arme blindée développée par les Garlemaldais pour l'en­traî­ne­ment. Les jeunes recrues s'en servent pour mieux connaître la structure de ces armes et leur entretien. C'est donc un modèle très fidèle.,Cible verrouillée...,Brouilleur sensoriel,"Place un piège qui peut être déclenché 10 secondes plus tard.
Piège : inflige des dégâts d'attaque 260 aux ennemis dans l'aire d'effet.",40,65,2,2,False,True,True,False,False
322,"Vous appelez votre mascotte poupée qalyana, un automate inspiré d'une Ananta de la tribu des Qalyanas. Ssss...","Une poupée con­fec­tion­née par un ancien garde-frontière de la Velodyna, dans l'espoir que cet objet évoquant les Qalyanas ayant fui pour rejoindre les garde-frontières aide à resserrer les liens entre tribus.",Ssss...,Gifle caudale,Inflige des dégâts d'attaque 30 aux ennemis dans l'aire d'effet.,80,30,2,1,False,True,True,True,False
323,"Vous appelez votre mascotte Kojin rouge mécanique, un automate inspiré de la tribu des Rouges. C'est terriiiible !","Un automate inspiré de la tribu des Rouges. Les Kojin verts confectionnent ces objets avec amour, dans l'espoir de se réconcilier un jour avec les Rouges. Il représente un Rouge jadis vu comme le démon de l'île de Zekki.",C'est terriiiible !,Kasaya,"Inflige des dégâts d'attaque 80 aux ennemis dans l'aire d'effet et réduit leur défense de 10%.
**Durée :** 10s",40,40,3,1,False,True,True,True,False
324,"Vous appelez votre mascotte transporteur miniature, un modèle nouvelle génération développé pour servir au transport des mascottes.","Cette plateforme de transport de nouvelle génération a été conçue pour déplacer des mascottes. Sans que ce soit prévu dans la conception de l'objet, on dit que les mascottes qui y sont transportées entendent chaque nuit un rire moqueur...",Hihihi...,Mini détournement cérébral,"Immobilise les ennemis dans l'aire d'effet.
**Durée :** 8s",80,30,1,4,False,False,True,False,True
325,Vous appelez votre mascotte Fran miniature. Ce pantin à l'effigie de la Viéra a des oreilles aussi longues que son modèle.,"La chef des Larmes de Lenté, un groupe de résistants dalmasquiens. Rinok, guerrière vangaa des Larmes, aurait passé une nuit à con­fec­tion­ner ces poupées pour décrocher un budget. Très abouties, elles se vendent comme des petits pains.",Pas du brouillard... du myste.,Avalanche de coups,Inflige des dégâts équivalents à 70% de sa solidité au bouclier ennemi. N'a aucun effet si ce dernier est déjà détruit.,65,55,3,8,False,True,False,True,False
326,"Vous appelez votre mascotte Nu Mou miniature, profitez-en pour lui faire un gros câlin.","Cette poupée a été façonnée par un Nu Mou du clan Kupo. Parfaite pour les câlins, elle est douce comme une grosse boule de coton. Il s'avère cependant que son créateur se sert uniquement de spores de champignons et d'argile sèche pour la fabriquer.",Hé oh !,Transaction équitable,Augmente de 10 les PdT des mascottes dans l'aire d'effet. Les mascottes dont la technique a le même effet ne sont pas concernées.,45,50,2,3,False,True,True,False,False
327,"Vous appelez votre mascotte dragonnet azur, une repré­sen­ta­tion tra­di­tion­nel­le de Seiryû quand il n'était encore qu'un bébé.","Seiryû a beau avoir l'apparence d'un serpent géant, il prend ici la forme d'un petit dragon semblable au légendaire Kirin, bien que les lettres de ce nom ne figurent nulle part sur son corps fluet.","Prépare-toi à être surpassé, Tenzen !",Parade azur,Inflige des dégâts d'attaque 90 aux ennemis dans l'aire d'effet.,70,20,3,1,True,True,False,False,False
328,"Vous appelez votre mascotte coussin zabuton moelleux. Un coussin ex­trê­me­ment confortable, accessoire in­dis­pen­sa­ble dans les régions où l'ont s'assoit beaucoup par terre.","Dans les terres orientales, où l'on s'assoit beaucoup par terre, cet objet de confort est in­dis­pen­sa­ble. On raconte aussi que dans certaines cultures, il peut servir d'arme lors de batailles épiques...",Fwih fwih...,Lancer de zabuton,Téléporte les mascottes qui ont utilisé des PdT vers le portail central.,30,40,4,9,False,True,False,False,False
329,"Vous appelez votre mascotte loutre aloha, une version méridionale de la loutre choute.","Cette loutre est habillée façon méridionale. Elle vient à l'origine d'Orient, mais semble s'être totalement acclimatée aux us et coutumes des îles du sud. Elle semble apprécier la pêche, mais un beau jour, son bateau a chaviré et fait naufrage, semble-t-il.",Aloha !,Aloha !,"Double le montant de PV récupérés par les mascottes qui se trouvent à l'intérieur des portails.
**Durée :** 20s",40,45,3,9,False,False,False,True,False
330,"Vous appelez votre mascotte hérisson mignon, un adorable mammifère qui n'est victime d'aucun complexe à l'heure actuelle.","Cet insectivore était jadis élevé pour l'ali­men­ta­tion au Proche-Orient, mais il s'est récemment élevé au rang d'animal familier grâce à son apparence adorable. Il n'a aucun complexe, si ce n'est qu'on le confonde fréquemment avec le porc-épic...",Tchui tchui !,Acupuncture,Dissipe toutes les altérations d'état des alliés dans l'aire d'effet.,60,40,3,6,False,True,True,False,False
331,"Vous appelez votre mascotte Y'shtola miniature (premier reflet). À l'instar de son modèle, ce pantin n'a pas l'intention de fuir ses problèmes.","Ce pantin à l'effigie de Y'shtola possède deux accessoires notables : la robe noire, symbole du soutien de l'Héritière au peuple de la Nuit, et le bâton, avec lequel elle entend combattre les purgateurs. Il ne reste plus qu'à l'appeler “Matoya miniature”...",Je continuerai de tenir bon !,Fureur de Matoya,Inflige des dégâts d'attaque 90 aux ennemis dans l'aire d'effet.,45,30,2,1,True,False,True,False,False
332,"Vous appelez votre mascotte Ryne miniature. Comme l'originale, elle semble apprécier son nouveau nom.","Ce pantin a été fabriqué après que Ryne a pris les rênes de sa destinée. Ce n'est donc pas le regard turquoise des réincarnations de Minfilia qui emplit ses yeux, mais l'éclat d'une détermination acquise au cours de son voyage initiatique.","Merci, Thancred !",Pouvoir de Minfilia,"Double le montant de PV récupérés par les mascottes qui se trouvent à l'intérieur des portails.
**Durée :** 20s",65,50,3,9,False,True,True,False,False
333,"Vous appelez votre mascotte kuro shiba, qui a le poil aussi noir que l'ébène.","Ce mame shiba a le poil noir, et est ex­trê­me­ment mignon. Attention à ne pas se méprendre, cependant, car ce spécimen est en réalité très proche du loup, et on l'utilise depuis belle lurette pour la chasse ou en tant que chien de garde.",Ouaf ! Ouaf !,Dévotion canine,"Augmente de 40 l'attaque des mascottes qui ont utilisé des PdT.
**Durée :** 15s",30,60,3,3,False,False,True,False,False
