202,TEXT_VOICEMAN_04100_001650_RAUBAHN,"Vraiment ? Malgré leur trahison et leurs crimes, tu serais prête à leur laisser la vie sauve ? Je te trouve bien clémente."
203,TEXT_VOICEMAN_04100_001660_RAUBAHN,"Quoi qu'il en soit, c'est sûrement à l'Alliance éorzéenne qu'il reviendra de juger ces hommes, et je ne manquerai pas de faire part de ton opinion au moment du procès."
204,TEXT_VOICEMAN_04100_001670_RAUBAHN,"C'est tout pour cette affaire, mais si ça ne te dérange pas, j'aimerais te parler d'autre chose... Marchons un peu."
205,TEXT_VOICEMAN_04100_001680_RAUBAHN,Je me sens responsable pour les actes d'Ilberd. Mon manque de fermeté dans cette histoire a indubitablement contribué à sa folie.
206,TEXT_VOICEMAN_04100_001690_RAUBAHN,Je m'en veux tellement.
207,TEXT_VOICEMAN_04100_001700_RAUBAHN,"Heu­reu­se­ment, grâce à ton courage, à celui des autres Héritiers, des soldats de l'Alliance et de mes compatriotes, nous avons réussi à libérer Ala Mhigo."
208,TEXT_VOICEMAN_04100_001710_RAUBAHN,Nul doute que le gouvernement de transition donnera à ce pays les moyens de se reconstruire sous un nouveau régime.
209,TEXT_VOICEMAN_04100_001720_RAUBAHN,"Lorsque ce sera fait, je pourrai alors retourner à Ul'dah et continuer de servir dame Nanamo comme avant."
210,TEXT_VOICEMAN_04100_001730_PIPIN,Père...
211,TEXT_VOICEMAN_04100_001740_RAUBAHN,Loin de moi l'idée de renier la patrie qui m'a vu naître et grandir. J'ai bien sûr envisagé la possibilité de m'installer à nouveau à Ala Mhigo.
212,TEXT_VOICEMAN_04100_001750_RAUBAHN,"Pour tout t'avouer, j'ai même rêvé de pouvoir redevenir un simple mercenaire, libre d'aller où bon me semble, et de me battre à tes côtés."
213,TEXT_VOICEMAN_04100_001760_RAUBAHN,"Toutefois, j'ai juré à la Sultane de mettre mon épée à son service, et ni mes désirs, ni mes aspirations ne sauraient me faire oublier cette promesse."
214,TEXT_VOICEMAN_04100_001770_PIPIN,"Père, est-ce vraiment ce que vous souhaitez au plus profond de vous-même ?"
215,TEXT_VOICEMAN_04100_001780_RAUBAHN,Tout à fait. Mon être et ma lame sont à jamais à la disposition de dame Nanamo.
216,TEXT_VOICEMAN_04100_001790_RAUBAHN,"Je tenais absolument à te faire part de ce sentiment, mon amie."
217,TEXT_VOICEMAN_04100_001800_LYSE,Je vous remercie tous d'avoir répondu à l'appel.
218,TEXT_VOICEMAN_04100_001801_LYSE,"Je suis Lyse Hext, et je parle au nom de l'armée de libération mhigoise."
219,TEXT_VOICEMAN_04100_001810_LYSE,"Sont réunis ici les chefs des villages, les délégués des réfugiés installés hors de nos frontières, et les chefs de tribus des Anantas et des Qiqirns."
220,TEXT_VOICEMAN_04100_001820_LYSE,"Autrement dit, vous êtes les re­pré­sen­tants des peuples de Gyr Abania. Je désire discuter avec vous de l'avenir de notre patrie."
221,TEXT_VOICEMAN_04100_001830_LYSE,"Mais avant cela, qu'avez-vous d'abord remarqué en entrant dans cette salle ?"
222,TEXT_VOICEMAN_04100_001831_LYSE,"Moi, c'est cet objet qui a attiré mon regard en premier..."
223,TEXT_VOICEMAN_04100_001840_LYSE,"C'est sur ce trône que s'asseyait le gouverneur impérial, et avant lui, le tyran qui nous persécutait."
224,TEXT_VOICEMAN_04100_001850_LYSE,"Maintenant qu'il est vacant, est-ce que l'un d'entre vous désire y prendre place ?"
225,TEXT_VOICEMAN_04100_001860_LYSE,Ou y a-t-il quelqu'un que vous souhaitez y voir installé ?
226,TEXT_VOICEMAN_04100_001870_LYSE,"Personne ? Alors je vous propose de nous asseoir en rond ici même. En tant qu'habitants de ces terres, je considère que nous sommes tous égaux et amis."
227,TEXT_VOICEMAN_04100_001880_ALPHINAUD,Lyse est clairement sûre d'elle. Elle a tout de suite exclu la possibilité d'une nouvelle monarchie et essaie de proposer un régime républicain ou fédéral.
228,TEXT_VOICEMAN_04100_001890_ALPHINAUD,Les pourparlers devraient se dérouler bien plus facilement que je le pensais.
229,TEXT_VOICEMAN_04100_001900_RAGANFRID,Voilà. C'est tout ce que j'ai à dire au nom des villageois d'Ala Gannha.
230,TEXT_VOICEMAN_04100_001910_LYSE,"Merci, Raganfrid. J'aimerais maintenant entendre l'avis de Shanti. Nombreux sont ceux qui désirent un régime républicain, mais quelle est la position des Qalyanas à ce sujet ?"
231,TEXT_VOICEMAN_04100_001920_QALYANAPATRIARCH,Nous autres Anantas n'avons qu'une requête envers les humains et les autres habitants de Gyr Abania. Ssss...
232,TEXT_VOICEMAN_04100_001930_QALYANAPATRIARCH,C'est qu'ils se dévouent tous au culte de notre Déesse ! Ssss...
233,TEXT_VOICEMAN_04100_001940_QALYANAPATRIARCH,"Ô Lakshmi, ô Béatificatrice onirique, viens à moi ! Ssss..."
234,TEXT_VOICEMAN_04100_001950_LYSE,Comment est-ce possible sans cristaux !?
235,TEXT_VOICEMAN_04100_001960_ALPHINAUD,On enquêtera là-dessus après ! Pour le moment il faut évacuer tout le monde ! Fuyez ! Vite ! Vous risquez d'être subjugués par cette Primordiale !
236,TEXT_VOICEMAN_04100_001970_ARENVALD,Interposons-nous ! Ça permettra aux autres de s'échapper !
237,TEXT_VOICEMAN_04100_001980_RAUBAHN,Meurs !
238,TEXT_VOICEMAN_04100_001990_RAUBAHN,Je comprends mieux... Les gardes avaient été subjugués !
239,TEXT_VOICEMAN_04100_001991_RAUBAHN,Raaah !
240,TEXT_VOICEMAN_04100_002000_LYSE,N'approchez pas !
241,TEXT_VOICEMAN_04100_002010_RAUBAHN,Ils sont prêts à tout pour faire de ces gens des esclaves de Lakshmi...
242,TEXT_VOICEMAN_04100_002020_LYSE,"Notre amie et Arenvald sont restés en arrière pour affronter la Primordiale, mais à deux, ils ne tiendront pas longtemps !"
243,TEXT_VOICEMAN_04100_002030_RAUBAHN,Raah ! Difficile de se battre efficacement avec toutes ces personnes à protéger !
244,TEXT_VOICEMAN_04100_002040_LYSE,"Raubahn, j'ai une idée ! Continuez de retenir nos ennemis ici ! ... Je vais chercher du renfort !"
245,TEXT_VOICEMAN_04100_002050_RAUBAHN,Hmpf ! J'imagine que je n'ai pas d'autre choix...
246,TEXT_VOICEMAN_04100_002060_RAUBAHN,Venez tous autant que vous êtes ! Je ne vous laisserai pas faire de mal à ces gens !
247,TEXT_VOICEMAN_04100_002070_ARENVALD,Je... je commence à faiblir ! ...
248,TEXT_VOICEMAN_04100_002080_ARENVALD,Mais qu'est-ce que tu fais ici !?
249,TEXT_VOICEMAN_04100_002090_FORDOLA,Je suis venue vous aider ! Dépêchons-nous d'annihiler cette abomination !
250,TEXT_VOICEMAN_04100_002100_ARENVALD,(souffle)... (souffle)... (souffle)...
251,TEXT_VOICEMAN_04100_002101_ARENVALD,Nous... nous avons réussi ! ...
252,TEXT_VOICEMAN_04100_002110_FORDOLA,Qu'est-ce que ça veut dire !?
253,TEXT_VOICEMAN_04100_002120_LYSE,"Je ne le dirai pas deux fois, alors ouvre grand tes oreilles."
254,TEXT_VOICEMAN_04100_002130_LYSE,Les Anantas ont invoqué leur Primordiale dans le palais royal. Deux de mes camarades sont en train de l'affronter en ce moment même.
255,TEXT_VOICEMAN_04100_002140_LYSE,"Fordola, contrairement à moi, tu possèdes un pouvoir qui te permet de faire face à ces entités sans risque d'être subjuguée."
256,TEXT_VOICEMAN_04100_002150_LYSE,"La dernière fois, je t'ai dit que tu avais le temps de réfléchir à ton avenir, mais ça n'est plus le cas."
257,TEXT_VOICEMAN_04100_002160_LYSE,"Tu dois choisir maintenant : soit tu utilises cette épée pour mettre fin à tes jours comme Zenos, soit tu t'en sers pour protéger les gens d'Ala Mhigo !"
258,TEXT_VOICEMAN_04100_002170_RAGANFRID,"Je te reconnais, toi. Tu es l'Exécutrice... La femme qui commandait les Crânes !"
259,TEXT_VOICEMAN_04100_002180_FORDOLA,Je n'ai plus rien à faire ici. Je retourne dans ma cellule.
260,TEXT_VOICEMAN_04100_002190_RAGANFRID,Je...
261,TEXT_VOICEMAN_04100_002200_RAGANFRID,"Je ne vous pardonnerai jamais, à toi et à tes hommes, ce que vous nous avez fait."
262,TEXT_VOICEMAN_04100_002210_RAGANFRID,Toutefois...
263,TEXT_VOICEMAN_04100_002220_RAGANFRID,Je te remercie d'être venue en aide à nos libérateurs malgré la menace de cette Primordiale.
264,TEXT_VOICEMAN_04100_002230_RAUBAHN,Je me demandais qui était ici. Je suis content de voir que c'est toi.
265,TEXT_VOICEMAN_04100_002240_RAUBAHN,"Les re­pré­sen­tants gyrabaniens viennent tout juste de rendre leur décision. Une assemblée composée d'élus du peuple, à l'image de celle d'Ishgard, va être créée."
266,TEXT_VOICEMAN_04100_002250_RAUBAHN,Ma mission à Ala Mhigo touche à sa fin. Je suis venu voir le ciel étoilé de ma patrie une dernière fois avant de rentrer.
267,TEXT_VOICEMAN_04100_002260_RAUBAHN,"Eh bien, aurais-tu oublié quelque chose, mon amie ? ..."
268,TEXT_VOICEMAN_04100_002270_RAUBAHN,Votre Majesté !? Mais... pourquoi êtes-vous ici !?
269,TEXT_VOICEMAN_04100_002280_NANAMOULNAMO,"Raubahn, nous avons décidé de te libérer de tes res­pon­sa­bi­li­tés de général des Immortels et de membre du Cartel des Scorpions à compter de ce jour même."
270,TEXT_VOICEMAN_04100_002290_RAUBAHN,Comment !? Mais pourtant...
271,TEXT_VOICEMAN_04100_002300_NANAMOULNAMO,Ne t'inquiète pas pour nous... Nous saurons continuer sans toi...
272,TEXT_VOICEMAN_04100_002301_NANAMOULNAMO,Tu peux donc rester à Ala Mhigo et aider tes compatriotes dans les défis qui les attendent !
273,TEXT_VOICEMAN_04100_002310_RAUBAHN,Ne me dites pas que vous comptez prendre seule une décision aussi importante ! ... Sans même écouter mon avis !
274,TEXT_VOICEMAN_04100_002320_NANAMOULNAMO,Nous ne sommes pas aussi imprudente ! Nous avons demandé conseil à la personne en qui nous avons le plus confiance et nous avons mûrement réfléchi notre décision.
275,TEXT_VOICEMAN_04100_002330_RAUBAHN,"La personne en qui vous avez le plus confiance !? Et moi, alors ? Mon avis compte-t-il si peu à vos yeux !?"
276,TEXT_VOICEMAN_04100_002340_NANAMOULNAMO,"Raubahn, comment pourrions-nous te demander ton avis sincère... alors que tu n'oses pas nous révéler ton plus grand souhait ?"
277,TEXT_VOICEMAN_04100_002350_NANAMOULNAMO,"Nous avons lu le doute dans ton regard, lorsque tu t'es dit prêt à retourner à Ul'dah une fois la situation stabilisée ici. Es-tu naïf au point de croire que nous ne nous apercevrions de rien ?"
278,TEXT_VOICEMAN_04100_002360_NANAMOULNAMO,"S'il y a quelqu'un qui ne réalise pas à quel point nous nous sommes reposée sur toi, à quel point nous avons écouté tes conseils jusqu'à présent... c'est bien toi !"
279,TEXT_VOICEMAN_04100_002370_RAUBAHN,"Votre Majesté, vous n'avez pas oublié ce jour où j'ai juré de mettre mon épée à votre service, n'est-ce pas ?"
280,TEXT_VOICEMAN_04100_002380_NANAMOULNAMO,Non. Mais tu as toi-même désigné ton successeur en remettant ta précieuse épée à Pipin.
281,TEXT_VOICEMAN_04100_002390_NANAMOULNAMO,"C'est sur lui désormais, ainsi que sur les monétaristes comme Lolorito, que nous allons compter."
282,TEXT_VOICEMAN_04100_002400_NANAMOULNAMO,"Tu peux donc rester à Ala Mhigo, Raubahn. Car c'est ici, parmi les tiens, qu'est ta place."
283,TEXT_VOICEMAN_04100_002410_RAUBAHN,Dame Nanamo... Je... je...
284,TEXT_VOICEMAN_04100_002420_NANAMOULNAMO,"Nous t'en prions, Raubahn, ne pleure pas. Nous souhaitons prendre congé de toi avec le sourire."
285,TEXT_VOICEMAN_04100_002430_RAUBAHN,"Je vous remercie... Cela a été un immense honneur de vous servir toutes ces années, Votre Majesté."
286,TEXT_VOICEMAN_04100_002440_NANAMOULNAMO,"À partir de demain, ce n'est plus au service d'Ul'dah, mais à celui d'Ala Mhigo que tu brandiras ton épée. Tu seras le protecteur d'un plus grand nombre d'Éorzéens."
287,TEXT_VOICEMAN_04100_002450_RAUBAHN,Très bien... Votre Majesté...
288,TEXT_VOICEMAN_04100_002460_LYSE,"Merci à vous deux de nous avoir protégés de cette Primordiale. Grâce à vous, nous avons pu poursuivre nos discussions et prendre une décision."
289,TEXT_VOICEMAN_04100_002470_ARENVALD,"Il n'y a pas de quoi en ce qui me concerne, franchement. C'est à peine si j'ai eu la moindre influence sur le combat."
290,TEXT_VOICEMAN_04100_002480_ARENVALD,"En tout cas, je comprends mieux pourquoi on vous appelle la Guerrière de la Lumière. Vous m'avez im­pres­sion­né."
291,TEXT_VOICEMAN_04100_002490_ALPHINAUD,"À propos, j'ai croisé dame Nanamo au palais. Si j'ai bien compris, elle est venue ici pour régler les derniers détails de son projet devant permettre aux réfugiés mhigois de réintégrer leur patrie."
292,TEXT_VOICEMAN_04100_002500_ALPHINAUD,"Comme elle cherchait le général Aldynn, je lui ai dit qu'il se trouvait à la Ménagerie royale..."
293,TEXT_VOICEMAN_04100_002510_NANAMOULNAMO,"On parle de nous dans notre dos, semble-t-il."
294,TEXT_VOICEMAN_04100_002520_ALPHINAUD,"Dame Nanamo !? Euh, non, ce n'est pas ce que vous croyez..."
295,TEXT_VOICEMAN_04100_002530_NANAMOULNAMO,"Ce n'est rien, Alphinaud. Nous ne faisions que te taquiner."
296,TEXT_VOICEMAN_04100_002540_NANAMOULNAMO,"Raubahn, tu devrais annoncer la nouvelle à tout le monde."
297,TEXT_VOICEMAN_04100_002550_RAUBAHN,
298,TEXT_VOICEMAN_04100_002551_RAUBAHN,"Aujourd'hui, j'ai été libéré de mes fonctions de général des Immortels et de membre du Cartel des Scorpions."
299,TEXT_VOICEMAN_04100_002560_PIPIN,C'est à moi que revient l'honneur de reprendre les res­pon­sa­bi­li­tés de mon père. L'épée qu'il m'a généreusement transmise me paraît un bien lourd fardeau.
300,TEXT_VOICEMAN_04100_002570_RAUBAHN,"Par conséquent, je suis désormais sans travail. Si Ala Mhigo a besoin d'une fine lame, je suis prêt à offrir mes services."
301,TEXT_VOICEMAN_04100_002580_PIPIN,"Malgré votre âge, je suis sûr qu'un gladiateur ayant autant brillé que vous dans l'arène n'aura aucun mal à trouver de quoi faire."
302,TEXT_VOICEMAN_04100_002590_NANAMOULNAMO,
303,TEXT_VOICEMAN_04100_002591_NANAMOULNAMO,"Le taureau d'Ala Mhigo sans emploi, on n'entend pas ça tous les jours !"
304,TEXT_VOICEMAN_04100_002592_NANAMOULNAMO,
305,TEXT_VOICEMAN_04100_002600_RAUBAHN,"Je trouve que vous avez vraiment mauvais caractère der­niè­re­ment, Dame Nanamo. Quant à toi, Pipin, tu n'es pas en position de rire, crois-moi !"
306,TEXT_VOICEMAN_04100_002610_LYSE,"Vous êtes donc de retour dans votre patrie, Raubahn ?"
307,TEXT_VOICEMAN_04100_002620_RAUBAHN,"Oui, il semblerait que je n'aie plus ma place à Ul'dah. Si on a besoin de moi, je me ferai un plaisir d'aider à rebâtir Ala Mhigo."
308,TEXT_VOICEMAN_04100_002630_LYSE,"Mais ce sera avec plaisir, bien sûr !"
309,TEXT_VOICEMAN_04100_002640_ALPHINAUD,"Voici une nouvelle pour le moins inattendue, mais à voir votre réaction, je devine que vous étiez déjà au courant, n'est-ce pas ?"
310,TEXT_VOICEMAN_04100_002650_ALPHINAUD,"J'ai l'impression d'avoir été un peu trompé, moi aussi, mais c'est de bonne guerre."
311,TEXT_VOICEMAN_04100_002660_ALPHINAUD,"En tout cas, ceci augure bien pour l'avenir d'Ala Mhigo."
