0,TEXT_CTSMJICONTACTNPC_00807_OPERATORMAMMET_000_000,"Oh, ne vous préoccupez pas de moi ! Je vous préviendrai lorsque Tataru aura un message pour vous."
1,TEXT_CTSMJICONTACTNPC_00807_OPERATORMAMMET_000_010,"Oh, ne vous préoccupez pas de moi ! Je vous préviendrai lorsque Tataru aura un nouveau message pour vous."
2,TEXT_CTSMJICONTACTNPC_00807_OPERATORMAMMET_000_020,Bienvenue ! Je vous souhaite une agréable visite !
3,TEXT_CTSMJICONTACTNPC_00807_OPERATORMAMMET_000_030,De nouveaux invités sont venus vous rendre visite ! Profitez de leur séjour pour vous détendre un peu !
4,TEXT_CTSMJICONTACTNPC_00807_OPERATORMAMMET_000_040,Tataru souhaite amener un dernier invité sur votre île. Je vous contacterai dès que j'en saurai davantage.
5,TEXT_CTSMJICONTACTNPC_00807_OPERATORMAMMET_000_050,"Je n'ai aucun message pour vous ! Profitez de cette accalmie pour prendre un peu de bon temps, ou vous pouvez toujours inviter vos amis ! Les poupées magiques seront là pour les recevoir comme il se doit."
