0,TEXT_BANGNA001_02255_SEQ_00,"**Règle spéciale :  synchronisation de quête avec limitation de job ou de classe**

Le conteur des Vathes semble préoccupé."
147,TEXT_BANGNA001_02255_NANASHI_000_113,"Ksss... Ksss... Ce n'est pas grave, je comprends. Vous avez sûrement mieux à faire que de vous occuper des affaires de notre hameau insignifiant. Ksss..."
148,TEXT_BANGNA001_02255_SYSTEM_000_200,"Sans-nom, qui se fait désormais appeler Futé, a fondé la guilde des aventuriers de Loth ast Vath. Les chasseurs de La Penne en sont les premiers partenaires."
149,TEXT_BANGNA001_02255_SYSTEM_000_210,"Grâce à vos nombreuses con­tri­bu­tions passées, votre réputation auprès des Égarés de Loth ast Vath est passée à “Ami”."
150,TEXT_BANGNA001_02255_SYSTEM_000_211,Vous pouvez à présent lancer des quêtes quotidiennes répétables en vous adressant à Guetteur.
151,TEXT_BANGNA001_02255_SYSTEM_100_212,Vous pouvez aussi faire l'acquisition de divers articles auprès de Camelot. Faites-en bon usage au cours de vos aventures !
