key,0,1
#,,
int32,str,str
0,"TEXT_AKTKMD109_04417_SEQ_00","Matsya piétine d'impatience."
1,"TEXT_AKTKMD109_04417_SEQ_01","Matsya a été soulagé d'apprendre que Mehvan reposait désormais aux côtés de Qerasaf. L'Écoute des Palaka a retrouvé son calme et la présence des alchimistes et de l'Ost rayonnant devrait permettre d'éviter d'autres transformations en bête. Il est donc temps de retourner à Radz-at-Han pour vérifier l'état des lieux. Rejoignez maintenant Estinien, qui vous attend déjà au Torana veilleur."
2,"TEXT_AKTKMD109_04417_SEQ_02","Vous avez retrouvé un Estinien indemne qui vous a déclaré n'avoir aperçu aucune bête rôdant dans les parages. Il vous a également expliqué avoir été contacté par Thancred, qui attend votre retour à l'entrée de Radz-at-Han."
3,"TEXT_AKTKMD109_04417_SEQ_03","La situation à Radz-at-Han s'est également calmée. Thancred vous a appris que les citoyens avaient été appelés à se rassembler devant le palais du Meghaduta pour une annonce importante. Vous en déduisez que Vrtra a décidé d'annoncer à tout le monde sa véritable identité de satrape. Thancred, craignant que certains habitants n'aient pas reçu le message, vous a demandé de prévenir quiconque ne serait pas au courant, afin de les guider vers le lieu de ras<SoftHyphen/>sem<SoftHyphen/>ble<SoftHyphen/>ment."
4,"TEXT_AKTKMD109_04417_SEQ_04","Vous avez croisé un jeune Hyurois, qui vous a confié être inquiet pour son ami Varshahn. Le garçon a filé vers le palais afin de le retrouver, puisqu'il savait que celui-ci travaillait pour le satrape. Continuez à vous diriger vers la place, vous rencontrerez peut-être d'autres personnes qui n'ont pas encore entendu parler du ras<SoftHyphen/>sem<SoftHyphen/>ble<SoftHyphen/>ment."
5,"TEXT_AKTKMD109_04417_SEQ_05","Vous avez trouvé un jeune homme com<SoftHyphen/>plè<SoftHyphen/>te<SoftHyphen/>ment effrayé. Lorsque vous lui avez parlé du ras<SoftHyphen/>sem<SoftHyphen/>ble<SoftHyphen/>ment devant le palais du Meghaduta, il s'est mis à craindre un coup d'État, et s'est rué vers la place afin de l'empêcher. Maintenant, rendez-vous à l'endroit indiqué afin d'assister à l'annonce de Vrtra."
6,"TEXT_AKTKMD109_04417_SEQ_06","Vrtra a annoncé aux habitants de Thavnair qu'il était leur véritable satrape, et contrairement à ce qu'il craignait, ceux-ci l'ont accueilli avec joie et enthousiasme. Ce chaleureux moment fut néanmoins interrompu par l'arrivée d'une délégation sharlayanaise menée par nul autre que Fourchenault Leveilleur, venu annoncer à tout le monde que la seule façon d'échapper à cette catastrophe était de quitter leur planète et de s'enfuir sur la lune, un plan sur lequel Sharlayan travaillait apparemment depuis un certain temps. Cette proposition a bien entendu laissé les citoyens de Radz-at-Han perplexes, mais Vrtra a pris im<SoftHyphen/>mé<SoftHyphen/>dia<SoftHyphen/>te<SoftHyphen/>ment la situation en main et fait conduire la délégation au palais afin de s'entretenir avec ses membres. Discutez avec Alphinaud pour savoir ce qu'il pense de cette soudaine déclaration."
7,"TEXT_AKTKMD109_04417_SEQ_07","Alphinaud vous a dit être d'accord avec Nidhana et est arrivé à l'amère constatation que vous en savez tout simplement trop peu pour pouvoir faire quoi que ce soit contre ce désastre. Il est temps de discuter avec le reste de vos compagnons afin de décider de la prochaine étape de votre plan d'action."
8,"TEXT_AKTKMD109_04417_SEQ_08",""
9,"TEXT_AKTKMD109_04417_SEQ_09",""
10,"TEXT_AKTKMD109_04417_SEQ_10",""
11,"TEXT_AKTKMD109_04417_SEQ_11",""
12,"TEXT_AKTKMD109_04417_SEQ_12",""
13,"TEXT_AKTKMD109_04417_SEQ_13",""
14,"TEXT_AKTKMD109_04417_SEQ_14",""
15,"TEXT_AKTKMD109_04417_SEQ_15",""
16,"TEXT_AKTKMD109_04417_SEQ_16",""
17,"TEXT_AKTKMD109_04417_SEQ_17",""
18,"TEXT_AKTKMD109_04417_SEQ_18",""
19,"TEXT_AKTKMD109_04417_SEQ_19",""
20,"TEXT_AKTKMD109_04417_SEQ_20",""
21,"TEXT_AKTKMD109_04417_SEQ_21",""
22,"TEXT_AKTKMD109_04417_SEQ_22",""
23,"TEXT_AKTKMD109_04417_SEQ_23",""
24,"TEXT_AKTKMD109_04417_TODO_00","Parler à Estinien"
25,"TEXT_AKTKMD109_04417_TODO_01","Parler à Thancred, à Radz-at-Han"
26,"TEXT_AKTKMD109_04417_TODO_02","Rechercher les habitants manquant à l'appel"
27,"TEXT_AKTKMD109_04417_TODO_03","Continuer à chercher les habitants manquant à l'appel"
28,"TEXT_AKTKMD109_04417_TODO_04","Attendre à l'endroit indiqué"
29,"TEXT_AKTKMD109_04417_TODO_05","Parler à Alphinaud"
30,"TEXT_AKTKMD109_04417_TODO_06",""
31,"TEXT_AKTKMD109_04417_TODO_07",""
32,"TEXT_AKTKMD109_04417_TODO_08",""
33,"TEXT_AKTKMD109_04417_TODO_09",""
34,"TEXT_AKTKMD109_04417_TODO_10",""
35,"TEXT_AKTKMD109_04417_TODO_11",""
36,"TEXT_AKTKMD109_04417_TODO_12",""
37,"TEXT_AKTKMD109_04417_TODO_13",""
38,"TEXT_AKTKMD109_04417_TODO_14",""
39,"TEXT_AKTKMD109_04417_TODO_15",""
40,"TEXT_AKTKMD109_04417_TODO_16",""
41,"TEXT_AKTKMD109_04417_TODO_17",""
42,"TEXT_AKTKMD109_04417_TODO_18",""
43,"TEXT_AKTKMD109_04417_TODO_19",""
44,"TEXT_AKTKMD109_04417_TODO_20",""
45,"TEXT_AKTKMD109_04417_TODO_21",""
46,"TEXT_AKTKMD109_04417_TODO_22",""
47,"TEXT_AKTKMD109_04417_TODO_23",""
48,"TEXT_AKTKMD109_04417_ALPHINAUD_000_000","Tous les survivants semblent avoir regagné leur domicile. C'est une bonne chose, ils sont cer<SoftHyphen/>tai<SoftHyphen/>ne<SoftHyphen/>ment plus en sécurité à l'abri que livrés à eux-mêmes en pleine jungle."
49,"TEXT_AKTKMD109_04417_ALISAIE_000_005","Ce chai sent délicieusement bon... Tu crois que je pourrai en avoir une tasse, moi aussi<Indent/>?"
50,"TEXT_AKTKMD109_04417_NIDHANA_000_010","Notre foi nous enseigne que la douleur et la souffrance font na<SoftHyphen/>tu<SoftHyphen/>rel<SoftHyphen/>le<SoftHyphen/>ment partie de la vie. C'est sûrement pour ça que certains peuvent penser que nous sommes résignés à notre sort... Mais ce n'est pas du tout le cas."
51,"TEXT_AKTKMD109_04417_TIREDMAN04416_000_015","Maintenant, j'ai besoin de nourriture et d'un endroit pour dormir. Je devrais aussi retourner à Radz-at-Han pour voir comment est la situation là-bas. Je n'ai donc vraiment pas le temps de me morfondre<Indent/>!"
52,"TEXT_AKTKMD109_04417_NAHBSHAYRA_000_020","（★未使用／削除予定★）"
53,"TEXT_AKTKMD109_04417_VISHRYDE_000_025","（★未使用／削除予定★）"
54,"TEXT_AKTKMD109_04417_MATSYA_000_030","Puisque tu as fini de distribuer le thé, est-ce que je peux te déranger un instant<Indent/>? Je voulais savoir... ce que vous aviez fait de la dépouille de Mehvan."
55,"TEXT_AKTKMD109_04417_MATSYA_000_031","Elle repose aux côtés de Qerasaf, alors<Indent/>? Merci beaucoup<Indent/>!"
56,"TEXT_AKTKMD109_04417_MATSYA_000_032","Je connais l'endroit. J'emmènerai les autres villageois après et on ira se recueillir sur leur tombe."
57,"TEXT_AKTKMD109_04417_MATSYA_000_033","Je ne sais pas ce que va devenir leur bébé, mais je lui rendrai visite le plus souvent possible. Et dès qu'elle sera en âge de pouvoir en manger, je lui apporterai du délicieux poisson<Indent/>!"
58,"TEXT_AKTKMD109_04417_ALISAIE_000_034","Nous avons terminé de distribuer les tasses de chai à tout le monde."
59,"TEXT_AKTKMD109_04417_ALPHINAUD_000_035","C'était fascinant de voir les gens se détendre à peine les lèvres trempées dans le thé... De quoi écarter de nouvelles transformations pendant un certain temps."
60,"TEXT_AKTKMD109_04417_ALPHINAUD_000_036","Le problème est loin d'être réglé, pour sûr. Toutefois, nous pouvons laisser le village aux mains des alchimistes et de l'Ost rayonnant pour le moment et retourner à Radz-at-Han."
61,"TEXT_AKTKMD109_04417_NIDHANA_000_037","Tout à fait<Indent/>! D'autres ont cer<SoftHyphen/>tai<SoftHyphen/>ne<SoftHyphen/>ment besoin de votre force et de votre con<SoftHyphen/>nais<SoftHyphen/>san<SoftHyphen/>ce de l'apocalypse, là-bas<Indent/>!"
62,"TEXT_AKTKMD109_04417_MATSYA_000_038","Quant à moi, je vais aller apporter mon aide et de la nourriture aux habitants d'Akyaali."
63,"TEXT_AKTKMD109_04417_ALISAIE_000_039","Parfait. Mettons-nous en route sans plus tarder. Euh... Quelqu'un a vu Estinien<Indent/>?"
64,"TEXT_AKTKMD109_04417_ALISAIE_000_040","Il nous attend au Torana veilleur<Indent/>? Entendu, allons-y<Indent/>!"
65,"TEXT_AKTKMD109_04417_NIDHANA_000_050","Tu peux nous faire confiance, le village est en sécurité. Et si on découvre du nouveau sur l'apocalypse, je te préviendrai im<SoftHyphen/>mé<SoftHyphen/>dia<SoftHyphen/>te<SoftHyphen/>ment."
66,"TEXT_AKTKMD109_04417_MATSYA_000_055","Savoir que le bébé de Qerasaf et Mehvan est entre de bonnes mains me redonne du courage."
67,"TEXT_AKTKMD109_04417_MATSYA_000_056","Quoi qu'il puisse m'arriver maintenant, j'ai déjà vécu pire ces dernières heures... Étrangement, je trouve cette pensée plutôt réconfortante..."
68,"TEXT_AKTKMD109_04417_MATSYA_000_057","En tout cas, ça m'a fait plaisir de tous vous revoir. Que les Dieux vous accordent leur bénédiction tout au long de votre parcours<Indent/>!"
69,"TEXT_AKTKMD109_04417_ALPHINAUD_000_060","Je viens d'expliquer à Estinien la situation à l'Écoute des Palaka."
70,"TEXT_AKTKMD109_04417_ALISAIE_000_065","J'espère que Raha et les autres vont bien et que le calme est revenu à la capitale..."
71,"TEXT_AKTKMD109_04417_ESTINIEN_000_070","Alphinaud m'a tout raconté. Les villageois ont retrouvé leur calme<Indent/>? En voilà une bonne nouvelle."
72,"TEXT_AKTKMD109_04417_ESTINIEN_000_071","Je n'ai vu aucune bête dans les alentours pendant que je patrouillais. Faut croire que tout votre raffut les a fait fuir."
73,"TEXT_AKTKMD109_04417_ESTINIEN_000_072","C'est maintenant que notre pas si nouveau satrape va devoir nous montrer ce qu'il a dans le ventre, pour sauver l'avenir de Thavnair."
74,"TEXT_AKTKMD109_04417_ESTINIEN_000_073","Enfin bref... Thancred m'a prévenu qu'il nous attendait sur la voie d'Alzadaal, juste à l'entrée de la ville. Allons le rejoindre."
75,"TEXT_AKTKMD109_04417_ALPHINAUD_000_080","Radz-at-Han a des allures de ville fantôme, mais je préfère ce cadre désolé aux hurlements et au chaos."
76,"TEXT_AKTKMD109_04417_ALISAIE_000_085","La femme âgée qui s'est transformée en bête... Elle disait que sa petite-fille était partie pour l'Écoute des Palaka, je me demande si elle se trouvait parmi les survivants..."
77,"TEXT_AKTKMD109_04417_ESTINIEN_000_090","Après tout ce que cette ville a enduré, elle aura bien du mal à s'en remettre. Heu<SoftHyphen/>reu<SoftHyphen/>se<SoftHyphen/>ment qu'elle semble peuplée de battants."
78,"TEXT_AKTKMD109_04417_THANCRED_000_100","Ah, content de voir que tu vas bien."
79,"TEXT_AKTKMD109_04417_THANCRED_000_101","On a réussi à se débarrasser des bêtes ici, et à suf<SoftHyphen/>fi<SoftHyphen/>sam<SoftHyphen/>ment calmer la population pour que les transformations cessent pour le moment."
80,"TEXT_AKTKMD109_04417_THANCRED_000_102","L'Ost rayonnant a demandé à tous les habitants de la ville de se rassembler sur la place devant le palais du Meghaduta. Apparemment, ils ont une annonce importante à leur faire. Tu as une idée de quoi il s'agit<Indent/>?"
81,"TEXT_AKTKMD109_04417_THANCRED_000_103","Je vois, Vrtra a donc décidé de révéler sa véritable identité... Dans ce cas, on doit y assister, nous aussi."
82,"TEXT_AKTKMD109_04417_THANCRED_000_104","J'aimerais bien m'y rendre sur-le-champ, mais je ne suis pas sûr que tous les habitants aient eu vent de la nouvelle..."
83,"TEXT_AKTKMD109_04417_THANCRED_000_105","Gardez l'œil ouvert et si vous croisez des gens qui n'ont pas l'air au courant sur le chemin, prévenez-les, d'accord<Indent/>? Je vais faire pareil de mon côté."
84,"TEXT_AKTKMD109_04417_THANCRED_000_110","L'Ost rayonnant a demandé à tout le monde de se rassembler devant le palais du Meghaduta. Si tu tombes sur des habitants qui semblent ne pas être au courant, préviens-les, d'accord<Indent/>?"
85,"TEXT_AKTKMD109_04417_HANNISHBOYB_000_120","Y a... y a plus de monstres, hein<Indent/>? Je me suis caché dans un placard pendant tout ce temps, alors je sais pas trop ce qui s'est passé depuis..."
86,"TEXT_AKTKMD109_04417_HANNISHBOYB_000_121","Oh, vraiment<Indent/>? Ouffff<Indent/>! J'ai eu peur que tout le monde se soit fait manger<Indent/>!"
87,"TEXT_AKTKMD109_04417_HANNISHBOYB_000_122","J'espère que Varshahn va bien... On joue ensemble des fois, mais il perd toujours à cache-cache, alors ça m'inquiète un peu."
88,"TEXT_AKTKMD109_04417_HANNISHBOYB_000_123","Il travaille pour le satrape, pas vrai<Indent/>? Ça veut dire qu'il va aller sur la place, lui aussi, alors...<Indent/>! J'y fonce<Indent/>!"
89,"TEXT_AKTKMD109_04417_HANNISHMAN04417_000_130","Aaaargh<Indent/>! Non<Indent/>! Me mangez pas<Indent/>!"
90,"TEXT_AKTKMD109_04417_HANNISHMAN04417_000_131","Par tous les Dieux<Indent/>! Ne me faites pas peur comme ça, enfin<Indent/>! Les bêtes vont me retrouver à cause de vous<Indent/>!"
91,"TEXT_AKTKMD109_04417_HANNISHMAN04417_000_132","Pardon<Indent/>? Les bêtes ont été éliminées et je dois rejoindre tout le monde sur la place du palais du Meghaduta<Indent/>?"
92,"TEXT_AKTKMD109_04417_HANNISHMAN04417_000_133","Mais... J'ai tout vu<Indent/>! Le satrape s'est fait dévorer devant mes yeux<Indent/>! En une seule bouchée<Indent/>!"
93,"TEXT_AKTKMD109_04417_HANNISHMAN04417_000_134","Radz-at-Han a perdu son protecteur, à quoi ça sert de se rassembler encore au palais du Meghaduta<Indent/>? Attendez... Me dites pas que quelqu'un va essayer de prendre sa place<Indent/>? Jamais je laisserai faire une chose pareille<Indent/>!"
94,"TEXT_AKTKMD109_04417_ALPHINAUD_000_140","Tout le monde a encore l'air très inquiet..."
95,"TEXT_AKTKMD109_04417_ALPHINAUD_000_141","C'est com<SoftHyphen/>pré<SoftHyphen/>hen<SoftHyphen/>si<SoftHyphen/>ble. Mais compter un des sept dragons anciens parmi ses alliés représente un avantage de taille, nous en avons été témoins."
96,"TEXT_AKTKMD109_04417_ALISAIE_000_145","Quelques habitants se sont déplacés, et c'est seulement maintenant qu'on se rend compte de l'hécatombe provoquée par l'apocalypse. Espérons qu'elle s'arrêtera là..."
97,"TEXT_AKTKMD109_04417_THANCRED_000_150","Merci d'avoir prévenu ceux qui n'avaient pas reçu le message, <Split(<Highlight>ObjectParameter(1)</Highlight>, ,1)/>."
98,"TEXT_AKTKMD109_04417_YSHTOLA_000_155","Contente de te revoir, <Split(<Highlight>ObjectParameter(1)</Highlight>, ,1)/>. Alphinaud m'a prévenue pour Vrtra."
99,"TEXT_AKTKMD109_04417_YSHTOLA_000_156","Une sage décision, selon moi. Sans un meneur puissant, la peur se répandrait pro<SoftHyphen/>ba<SoftHyphen/>ble<SoftHyphen/>ment comme une traînée de poudre et nous risquerions de faire face à une nouvelle vague de transformations."
100,"TEXT_AKTKMD109_04417_GRAHATIA_000_160","Je suis heureux d'apprendrrre que le calme est temporairement revenu à l'Écoute des Palaka."
101,"TEXT_AKTKMD109_04417_GRAHATIA_000_161","Quant à moi, en prenant le commandement des opérations à Radz-at-Han, je me suis sou<SoftHyphen/>dai<SoftHyphen/>ne<SoftHyphen/>ment retrouvé avec un nombre im<SoftHyphen/>pres<SoftHyphen/>sion<SoftHyphen/>nant de citoyens à prrrotéger, et je peux te dire que c'est une bien trop grande res<SoftHyphen/>pon<SoftHyphen/>sa<SoftHyphen/>bi<SoftHyphen/>li<SoftHyphen/>té pour un voyageur de passage..."
102,"TEXT_AKTKMD109_04417_GRAHATIA_000_162","Cette position doit être réserrrvée à quelqu'un qui connaît bien la ville et ses habitants... Et personne ne remplit aussi bien ces conditions que Vrtra."
103,"TEXT_AKTKMD109_04417_ESTINIEN_000_165","Une alliance entre un dragon et des humains..."
104,"TEXT_AKTKMD109_04417_ALISAIE_000_170","Je sais bien que nous n'avons pas d'autre alternative que de fuir sur la lune. Mais je comprends par<SoftHyphen/>fai<SoftHyphen/>te<SoftHyphen/>ment que Vrtra et les habitants de Radz-at-Han n'aient pas envie d'abandonner cette ville qu'ils affectionnent tant."
105,"TEXT_AKTKMD109_04417_THANCRED_000_175","Ça me démange, hein, mais ce n'est pas le moment de prendre le palais d'assaut... Réfléchissons d'abord à un plan."
106,"TEXT_AKTKMD109_04417_YSHTOLA_000_180","Même si Vrtra accepte que les citoyens fuient vers la lune, comment le Conseil de Sharlayan compte-t-il y envoyer tous les habitants de Thavnair<Indent/>?"
107,"TEXT_AKTKMD109_04417_GRAHATIA_000_185","Ce soldat de l'Ost rayonnant, c'est un de ceux qui ont escorrrté Ahewann à travers Vanaspati, non<Indent/>? Il est donc fidèle à Vrtra et connaissait déjà son secret..."
108,"TEXT_AKTKMD109_04417_ESTINIEN_000_190","Aussi folle que la proposition du Conseil puisse paraître, s'enfuir vers la lune ne me semble pas aussi insensé, à la lumière des récents événements."
109,"TEXT_AKTKMD109_04417_ESTINIEN_000_191","Et puis, je ne pense pas que Vrtra s'oppose à l'idée, si ça lui permet d'assurer la sécurité des habitants de Thavnair."
110,"TEXT_AKTKMD109_04417_HANNISHROYALGUARD_000_195","J'ai un message pour vous. Je vous en parlerai au moment opportun."
111,"TEXT_AKTKMD109_04417_ALPHINAUD_000_200","Nous avons assisté à toute cette tragédie, et pourtant elle dépasse com<SoftHyphen/>plè<SoftHyphen/>te<SoftHyphen/>ment notre entendement..."
112,"TEXT_AKTKMD109_04417_ALPHINAUD_000_201","Comme Nidhana l'a souligné, nous assistons à un phénomène sans précédent. Nous devons affronter l'inconnu... La question est maintenant de savoir comment agir en conséquence."
