0,TEXT_CTSMKDWEPTRADE3_00967_GEROLT_000_000,"Dann wollen wir mal sehen, was die ätherische Umwandlung mit meinem Hammer angestellt hat - und was dieser aus deiner Phantomwaffe machen kann!"
1,TEXT_CTSMKDWEPTRADE3_00967_GEROLT_000_001,*Muahahahahaha!*
2,TEXT_CTSMKDWEPTRADE3_00967_GEROLT_000_002,"Ein voller Erfolg! Wenn du mich vorhin gefragt hättest, ich hätte geschworen, dass eine solch perfekte ätherische Harmonie unmöglich zu erreichen ist ..."
3,TEXT_CTSMKDWEPTRADE3_00967_GEROLT_000_003,"Die furchterregende Macht des Nichts, manifestiert in diesem Meisterwerk: !"
4,TEXT_CTSMKDWEPTRADE3_00967_GEROLT_000_004,"Die furchterregende Macht des Nichts, manifestiert in diesen Meisterwerken:  und !"
5,TEXT_CTSMKDWEPTRADE3_00967_GEROLT_000_005,"Schau mal, wie du damit zurechtkommst. Solange du sie nicht einsetzt, fühlen sich schließlich selbst die besten Waffen in deinen Händen wie ein Haufen Alteisen an."
6,TEXT_CTSMKDWEPTRADE3_00967_GEROLT_000_006,"Anders ausgedrückt: Du musst das verdammte Ding in Aktion erleben. Schwinge es, erschlage ein paar Gegner - tu das, was du am besten kannst, Mädel!"
