key,0,1
#,,
int32,str,str
0,"TEXT_CTSMKDWEPTRADE3_00967_GEROLT_000_000","Dann wollen wir mal sehen, was die ätherische Umwandlung mit meinem Hammer angestellt hat<Indent/>- und was dieser aus deiner Phantomwaffe machen kann!"
1,"TEXT_CTSMKDWEPTRADE3_00967_GEROLT_000_001","<Emphasis>Muahahahahaha!</Emphasis>"
2,"TEXT_CTSMKDWEPTRADE3_00967_GEROLT_000_002","Ein voller Erfolg! Wenn du mich vorhin gefragt hättest, ich hätte geschworen, dass eine solch perfekte ätherische Harmonie unmöglich zu erreichen ist<Indent/>..."
3,"TEXT_CTSMKDWEPTRADE3_00967_GEROLT_000_003","Die furchterregende Macht des Nichts, manifestiert in diesem Meisterwerk: <Clickable(<SheetDe(Item,2,IntegerParameter(1),1,1,1)/>)/>!"
4,"TEXT_CTSMKDWEPTRADE3_00967_GEROLT_000_004","Die furchterregende Macht des Nichts, manifestiert in diesen Meisterwerken: <Clickable(<SheetDe(Item,2,IntegerParameter(1),1,1,1)/>)/> und <SheetDe(Item,2,IntegerParameter(2),1,1,1)/>!"
5,"TEXT_CTSMKDWEPTRADE3_00967_GEROLT_000_005","Schau mal, wie du damit zurechtkommst. Solange du sie nicht einsetzt, fühlen sich schließlich selbst die besten Waffen in deinen Händen wie ein Haufen Alteisen an."
6,"TEXT_CTSMKDWEPTRADE3_00967_GEROLT_000_006","Anders ausgedrückt: Du musst das verdammte Ding in Aktion erleben. Schwinge es, erschlage ein paar Gegner<Indent/>- tu das, was du am besten kannst, <If(PlayerParameter(4))>Mädel<Else/>Junge</If>!"
