130,TEXT_CTSSFSCHARACTER7_00710_LCUT_RANKUP_CHARLEMEND_002_108,"En me mettant au service de la maison de repos, j'ai bon espoir de lui prouver que le système de classes est obsolète et que tous les Ishgardais doivent désormais s'entraider pour atteindre un idéal commun."
131,TEXT_CTSSFSCHARACTER7_00710_LCUT_RANKUP_CHARLEMEND_002_109,"Cette confession est aussi pour moi l'occasion de vous avouer que ma présence ici n'est pas totalement désintéressée. C'est un manque de respect de vous l'avoir caché, et pour cela je vous présente mes excuses."
132,TEXT_CTSSFSCHARACTER7_00710_LCUT_RANKUP_MAURILETTE_002_110,"Ce n'est pas nécessaire, Charlemend. Quelles que soient vos motivations, vous êtes d'une aide précieuse pour la maison de repos, au même titre que Maelie."
133,TEXT_CTSSFSCHARACTER7_00710_LCUT_RANKUP_MAURILETTE_002_111,"D'ailleurs, je suis tellement satisfaite de votre travail que j'ai décidé de vous confier de nouvelles res­pon­sa­bi­li­tés."
134,TEXT_CTSSFSCHARACTER7_00710_LCUT_RANKUP_MAURILETTE_002_112,Il s'avère que nombre de nos patients souffrent de blessures handicapantes qui nécessitent une rééducation. J'aimerais que vous les accompagniez dans ce travail long et fastidieux.
135,TEXT_CTSSFSCHARACTER7_00710_LCUT_RANKUP_MAURILETTE_002_113,"Toute rééducation nécessite divers équipements spécialisés dont la fabrication ne peut être confiée qu'à des artisans chevronnés. Puis-je à nouveau me tourner vers vous, Player ?"
136,TEXT_CTSSFSCHARACTER7_00710_LCUT_RANKUP_CHARLEMEND_004_100,"Non seulement notre goûter dînatoire a été un véritable succès, mais mon neveu a aussi commencé à changer sa vision du monde. Tout s'est passé pour le mieux !"
137,TEXT_CTSSFSCHARACTER7_00710_LCUT_RANKUP_CHARLEMEND_004_101,"À l'avenir, j'aimerais continuer à organiser ce genre d'événement ré­gu­liè­re­ment. Player, n'hésitez pas à nous fournir davantage d'articles requis à cet effet, ainsi que le nécessaire habituel."
138,TEXT_CTSSFSCHARACTER7_00710_LCUT_RANKUP_MAELIE_004_102,"On dirait que vous vous plaisez ici, Monsieur Charlemend !"
139,TEXT_CTSSFSCHARACTER7_00710_LCUT_RANKUP_CHARLEMEND_004_103,"Pour être tout à fait honnête, je ne pensais pas apprécier à ce point le travail d'aide-soignant. Et je n'aurais jamais vécu cette formidable expérience si toi et Player n'aviez pas été là !"
140,TEXT_CTSSFSCHARACTER7_00710_LCUT_RANKUP_CHARLEMEND_004_104,"D'ailleurs, avec le futur de ma famille désormais sur de bons rails, j'ai bien l'intention de prolonger ma mission à la maison de repos Rouchemande, tant pour me rendre utile que pour apprendre de mes pairs."
141,TEXT_CTSSFSCHARACTER7_00710_LCUT_RANKUP_CHARLEMEND_004_105,"Et toi, ma petite Maelie ? J'espère que tu me feras l'honneur de rester à mes côtés, aussi bien en qualité de collègue que de mentor."
142,TEXT_CTSSFSCHARACTER7_00710_LCUT_RANKUP_MAELIE_004_106,"Avec plaisir ! J'apprends moi aussi beaucoup à votre contact, et c'est toujours amusant de travailler avec vous !"
143,TEXT_CTSSFSCHARACTER7_00710_LCUT_RANKUP_CHARLEMEND_004_107,"Quant à vous, Player, les mots me manquent pour exprimer toute ma recon­nais­san­ce."
144,TEXT_CTSSFSCHARACTER7_00710_LCUT_RANKUP_CHARLEMEND_004_108,"Vous avez déjà rendu d'immenses services à la maison de repos Rouchemande, mais sachez que vous serez toujours la bienvenue au cas où vous voudriez nous faire profiter de vos talents à nouveau."
145,TEXT_CTSSFSCHARACTER7_00710_LCUT_RANKUP_CHARLEMEND_004_109,À ce sujet... J'aurais une faveur à vous demander.
146,TEXT_CTSSFSCHARACTER7_00710_LCUT_RANKUP_CHARLEMEND_004_110,"Malgré mon déguisement pour éviter d'attirer l'attention, vous m'avez tout de suite reconnu, n'est-ce pas ? Dorénavant, j'aimerais éviter ce genre d'artifice et plutôt m'habiller comme Monsieur Tout-le-monde."
147,TEXT_CTSSFSCHARACTER7_00710_LCUT_RANKUP_CHARLEMEND_004_111,"Cela me permettrait d'être mieux accepté par les patients, et les Ishgardais en général. Lorsque vous aurez un petit moment, accepteriez-vous de me donner quelques conseils vestimentaires ?"
148,TEXT_CTSSFSCHARACTER7_00710_RANKUPINFO_000_000,Votre rang de sa­tis­fac­tion a augmenté. Le comte de Durendaire vous considère maintenant comme une collaboratrice complaisante de la maison de repos Rouchemande !
149,TEXT_CTSSFSCHARACTER7_00710_RANKUPINFO_000_001,Votre rang de sa­tis­fac­tion a augmenté. Le comte de Durendaire vous considère maintenant comme une partenaire providentielle de la maison de repos Rouchemande !
150,TEXT_CTSSFSCHARACTER7_00710_RANKUPINFO_000_002,Votre rang de sa­tis­fac­tion a augmenté. Le comte de Durendaire vous considère maintenant comme une bienfaitrice bien­veil­lan­te de la maison de repos Rouchemande !
151,TEXT_CTSSFSCHARACTER7_00710_RANKUPINFO_000_003,Votre rang de sa­tis­fac­tion a augmenté. Le comte de Durendaire vous considère maintenant comme la sainte sauveuse de la maison de repos Rouchemande !
152,TEXT_CTSSFSCHARACTER7_00710_RANKUPINFO_001_001,"Il reste cependant beaucoup à faire, et il compte toujours sur votre aide au service de la maison de repos Rouchemande."
153,TEXT_CTSSFSCHARACTER7_00710_RANKUPINFO_001_002,"Cette fois, il semblerait qu'il souhaite vous demander un nouveau service."
154,TEXT_CTSSFSCHARACTER7_00710_AFTRANKUP_000_001,Le comte de Durendaire a atteint l'objectif qu'il s'était fixé et a désormais besoin de nouveaux objets. Adressez-lui la parole et choisissez l'option “Livrer une commande spéciale” pour voir ce que votre ami requiert à présent.
155,TEXT_CTSSFSCHARACTER7_00710_AFTRANKUP_001_001,"Une quête des commandes spéciales du comte de Durendaire est disponible. Parlez à Maurilette, à la maison de repos Rouchemande, pour la commencer. Lorsque vous l'aurez accomplie, la liste des objets à livrer sera mise à jour."
156,TEXT_CTSSFSCHARACTER7_00710_AFTRANKUP_002_001,Les commandes à livrer au comte de Durendaire sont mises à jour toutes les semaines. Il vous demande ainsi un objet choisi aléatoirement parmi tous ceux dont il a pu avoir besoin par le passé.
157,TEXT_CTSSFSCHARACTER7_00710_AFTRANKUP_002_002,Adressez-lui la parole et choisissez “Livrer une commande spéciale” pour savoir ce que vous devez désormais lui apporter.
158,TEXT_CTSSFSCHARACTER7_00710_AFTRANKUP_002_003,"D'autre part, le *matériel créatif*, les *composants de matériel créatif* et les *poissons-sucre parfumés* rapportent une plus grande récompense. Concentrez donc vos efforts sur eux s'ils font partie des objets à livrer !"
159,TEXT_CTSSFSCHARACTER7_00710_AFTRANKUP_002_004,"Enfin, vous pouvez désormais modifier l'apparence du comte de Durendaire à l'aide de mirages."
160,TEXT_CTSSFSCHARACTER7_00710_RANKUP_MAELIE_001_000,"Merci pour toutes vos livraisons, Madame Player !"
161,TEXT_CTSSFSCHARACTER7_00710_RANKUP_CHARLEMEND_001_001,"Je me joins à Maelie pour vous remercier. Sans tous ces articles de qualité que vous nous avez fournis, nous ne pourrions nous concentrer pleinement sur nos tâches d'aides-soignants."
162,TEXT_CTSSFSCHARACTER7_00710_RANKUP_MAELIE_002_000,"Merci de toujours être là pour nous aider, Madame Player !"
163,TEXT_CTSSFSCHARACTER7_00710_RANKUP_CHARLEMEND_002_001,"Grâce à votre soutien, Maelie et moi-même avons gagné le respect de Maurilette et des patients de la maison de repos. J'espère que nous pourrons continuer à compter sur vous !"
164,TEXT_CTSSFSCHARACTER7_00710_RANKUP_CHARLEMEND_003_000,"Ma chère Player, je voulais vous dire que la rééducation de nos patients se déroule à merveille. J'ai même réussi à tisser des liens forts avec certains d'entre eux !"
165,TEXT_CTSSFSCHARACTER7_00710_RANKUP_MAELIE_002_001,"En plus, madame Maurilette nous a annoncé qu'elle nous considérait comme des membres à part entière de son équipe ! Ça me fait tellement plaisir !"
166,TEXT_CTSSFSCHARACTER7_00710_RANKUP_CHARLEMEND_004_000,"Je vous remercie pour votre coopération. Pour ma part, il y a bien longtemps que je n'avais pas appris autant chaque jour !"
167,TEXT_CTSSFSCHARACTER7_00710_RANKUP_MAELIE_004_001,"Et Ronantain est toujours là pour nous donner un coup de main ! Hein, Ronantain ?"
168,TEXT_CTSSFSCHARACTER7_00710_RANKUP_RONANTAIN_004_002,"Bah, je ne fais que suivre l'exemple de mon oncle."
169,TEXT_CTSSFSCHARACTER7_00710_RANKUP_CHARLEMEND_004_003,"Cela me met du baume au cœur de voir la jeune génération accepter le changement. Après tout, c'est eux, le futur d'Ishgard ! Par contre, à mon âge, ce n'est pas toujours facile de les suivre..."
170,TEXT_CTSSFSCHARACTER7_00710_RANKUP_CHARLEMEND_005_000,"Player, je vous suis pro­fon­dé­ment re­con­nais­sant pour le soutien inestimable que vous nous avez apporté. Avez-vous vu les progrès effectués par mon neveu ? Il met du cœur à l'ouvrage !"
171,TEXT_CTSSFSCHARACTER7_00710_RANKUP_MAELIE_005_001,Ronantain ! Il faut laver les draps des patients de ce côté !
172,TEXT_CTSSFSCHARACTER7_00710_RANKUP_RONANTAIN_005_002,"Attends-moi, j'arrive !"
173,TEXT_CTSSFSCHARACTER7_00710_RANKUP_CHARLEMEND_006_000,"Mon amie, je sais que vous êtes une femme occupée, et pourtant vous avez tant fait pour la maison de repos... Et pas seulement !"
174,TEXT_CTSSFSCHARACTER7_00710_RANKUP_CHARLEMEND_006_001,"Grâce à vos exploits au service d'Ishgard, la maison Durendaire a pu retrouver la voie de la prospérité."
175,TEXT_CTSSFSCHARACTER7_00710_RANKUP_CHARLEMEND_006_002,"En mettant fin à la Guerre du chant des dragons, vous avez non seulement apporté la paix à notre cité, mais vous l'avez aussi précipitée dans une nouvelle époque. Une révolution synonyme de nombreux changements."
176,TEXT_CTSSFSCHARACTER7_00710_RANKUP_CHARLEMEND_006_003,"Même si certains Ishgardais étaient au début réticents, moi y compris, c'est désormais la grande majorité de mon peuple qui vous exprime sa recon­nais­san­ce à travers moi."
177,TEXT_CTSSFSCHARACTER7_00710_RANKUP_CHARLEMEND_006_004,"Player, je vous remercie du fond du cœur pour tout ce que vous avez fait pour ma cité et tous ses habitants."
178,TEXT_CTSSFSCHARACTER7_00710_AFTWEEKLY_000_000,"Vous ne pouvez pas remettre plus d'objets au comte de Durendaire cette semaine.
La limite hebdomadaire est réinitialisée tous les mardis à 17h (temps réel)."
179,TEXT_CTSSFSCHARACTER7_00710_QUEST_CHARLEMEND_000_000,"Hmm... Je sais que vous avez un certain penchant pour le combat, mais peut-être devriez-vous revêtir des habits plus adaptés à notre prochaine entrevue avec Maurilette..."
180,TEXT_CTSSFSCHARACTER7_00710_QUEST_SYSTEM_000_002,"Il est nécessaire d'être dans une classe d'artisan ou de récolteur pour progresser dans cette quête. Parlez ensuite à Maurilette, à la maison de repos Rouchemande."
181,TEXT_CTSSFSCHARACTER7_00710_QUEST_CHARLEMEND_000_010,"Réapprendre à son corps des gestes qui semblaient acquis... Je me demande comment je le vivrais, à leur place..."
182,TEXT_CTSSFSCHARACTER7_00710_QUEST_SYSTEM_000_011,"Les commandes spéciales ne peuvent pas être livrées lorsqu'une quête est en cours. Pour reprendre les livraisons, il est nécessaire de terminer la quête “Un futur main dans la main”."
183,TEXT_CTSSFSCHARACTER7_00710_QUEST_CHARLEMEND_000_015,"Je suis sincèrement désolé pour l'attitude de mon neveu. C'est un bon garçon, je vous l'assure."
