175,TEXT_BANALL320_04788_TALKINGWAY_000_135,"Player a activé le mode surrégime pour rattraper Ra-la ! Les deux coureurs vont terminer au coude à coude, le suspense est insoutenable !"
176,TEXT_BANALL320_04788_TALKINGWAY_000_136,"Cela s'est joué à une carotte, mais N-7000 a tranché !"
177,TEXT_BANALL320_04788_TALKINGWAY_000_137,Le bondisseur lunaire a terminé premier ! Player remporte cette première édition de la course des “Fous volants” !
178,TEXT_BANALL320_04788_NIBIRAENOMI_000_140,Je ne comprends pas...
179,TEXT_BANALL320_04788_NIBIRAENOMI_000_141,J'ai pris la forme la plus adaptée et n'ai commis aucune erreur. Pourquoi ai-je tout de même perdu ?
180,TEXT_BANALL320_04788_NIBIRAENOMI_000_142,Aah... Moi qui croyais avoir totalement réprimé mes émotions... J'avais oublié l'impuissance induite par la “frustration” que je ressens...
181,TEXT_BANALL320_04788_TRNA_000_143,"On peut ne faire aucune erreur et perdre quand même. C'est pas un signe de faiblesse, c'est la “vie” ! Même avec un grand écart sur le papier, rien n'est jamais joué d'avance."
182,TEXT_BANALL320_04788_TRNA_000_144,"C'est cette incertitude qui rend la compétition si excitante. Les courses, vous le savez, c'est ma grande passion !"
183,TEXT_BANALL320_04788_DREAMINGWAY_000_145,"J'imagine que vous ferez tout pour ne pas perdre la prochaine fois, non ?"
184,TEXT_BANALL320_04788_DREAMINGWAY_000_146,Donc cela signifie que les Nibiréens se sont découvert le rêve de gagner aux courses !
185,TEXT_BANALL320_04788_NIBIRAENOMI_000_147,"C'est... correct. La prochaine fois qu'un tel événement sera organisé, je crois bien avoir envie de remporter la victoire..."
186,TEXT_BANALL320_04788_Q4_000_148,Que dites-vous ?
187,TEXT_BANALL320_04788_A4_000_001,J'ai hâte de refaire la course avec vous !
188,TEXT_BANALL320_04788_A4_000_002,Je ne serais peut-être pas si chanceuse la prochaine fois...
189,TEXT_BANALL320_04788_NIBIRAENOMI_000_149,"Afin de maximiser mes chances de succès, je pense qu'il est judicieux de procéder à des échanges d'opinions réguliers avec les piliers de ce débit de boissons."
190,TEXT_BANALL320_04788_N7000_000_150,"Bip bip... Pshhh... J'ai le plaisir de vous annoncer que d'après mes capteurs, cet événement a eu un effet positif sur le dynamis environnant."
191,TEXT_BANALL320_04788_N7000_000_151,"La variable “rêves” est nécessaire au lancement de l'exécutable “espoirs pour un avenir meilleur”... C'est la ligne directrice que Jammingway souhaite donner à ce café. Grâce à vous tous, nous avons progressé dans cette tâche."
192,TEXT_BANALL320_04788_N7000_000_152,"Bip bip... Pshhh... Victoire de l'entité alliée enregistrée. Pour la prochaine course des “Fous volants”, nous allons préparer une unité évolutive de classe Oméga. Alphatron vaincra !"
193,TEXT_BANALL320_04788_TRNA_000_153,Tu t'es pas mal débrouillée pour une conseillère ! J'ai vraiment apprécié courir avec toi !
194,TEXT_BANALL320_04788_ACALA_000_154,Le gulal a pas marché ! Acala va demander à son hippopotame ce qu'il aime pour la prochaine fois...
195,TEXT_BANALL320_04788_DREAMINGWAY_000_155,C'était une course riche en re­bon­dis­se­ments ! J'ai passé un bon moment !
196,TEXT_BANALL320_04788_TALKINGWAY_000_156,"Hum ! Je savais bien que vous sauriez tirer votre épingle du jeu, Player !"
197,TEXT_BANALL320_04788_INVENTINGWAY_000_157,"Avec mon génie inventif et votre dextérité, nous régnerons sur l'univers ! Nah ha ha ha !!"
198,TEXT_BANALL320_04788_OGUL_000_158,"Fé­li­ci­ta­tions, Player ! Tu réussis tout ce que tu entreprends, j'ai beaucoup de respect pour toi !"
199,TEXT_BANALL320_04788_JAMMINGWAY_000_160,"Bien joué, Player ! En plus, vous avez gagné la course en chevauchant une machine Loporrite ! C'est trop d'honneur !"
200,TEXT_BANALL320_04788_JAMMINGWAY_000_161,"Si vous n'aviez pas remporté la victoire, je doute que les Nibiréens auraient manifesté un quelconque intérêt pour la prochaine course ou en viennent à fréquenter le café ! Comme l'a laissé entendre N-7000, Ultima Thulé n'a jamais été un lieu aussi vivant."
201,TEXT_BANALL320_04788_JAMMINGWAY_000_162,"Bon... Je sais bien que l'excitation de la course a du mal à retomber, mais maintenant que tout a été débarrassé, il va falloir penser à plier bagage..."
202,TEXT_BANALL320_04788_TRNA_000_165,"Belle course, Player ! Au début, j'avais des réserves, mais je suis contente de m'être trompée ! Je me suis amusée comme une petite folle !"
203,TEXT_BANALL320_04788_TRNA_000_166,"J'aimerais bien rester un peu plus, mais j'ai laissé mes amis devant une montagne de travail. Je vais faire mes bagages et retourner à Thavnair pour les aider."
204,TEXT_BANALL320_04788_DREAMINGWAY_000_167,"De notre côté, nous retournerons aux Ateliers Dreaming dès que la station de radio sera démontée !"
205,TEXT_BANALL320_04788_JAMMINGWAY_000_168,C'était une course inoubliable ! Mon petit cœur se serre à l'idée de vous dire au revoir...
206,TEXT_BANALL320_04788_N7000_000_169,Bip bip... Pshhh... Je partage l'opinion de la petite boule de poils... Mais n'avez-vous pas oublié une tâche importante avant de fragmenter ce groupe ?
207,TEXT_BANALL320_04788_JAMMINGWAY_000_170,Qu'est-ce que tu racontes encore... ?
208,TEXT_BANALL320_04788_JAMMINGWAY_000_171,"Ah ! Mais oui, c'est vrai !!"
209,TEXT_BANALL320_04788_JAMMINGWAY_100_171,"Talkingway, Inventingway, vous pouvez apporter *vous-savez-quoi* ?"
210,TEXT_BANALL320_04788_JAMMINGWAY_000_172,"À la championne de la première édition des “Fous volants”, j'ai l'immense honneur de décerner ce trophée !"
211,TEXT_BANALL320_04788_JAMMINGWAY_000_173,"Lors de sa conception, nous avons incorporé des éléments évoquant les Ateliers Dreaming, les Hippotracteurs ainsi que Les Dernières Réminiscences. J'espère qu'il vous rappellera tous les bons souvenirs que nous avons vécus ensemble !"
212,TEXT_BANALL320_04788_DREAMINGWAY_000_174,"Ah, et j'allais oublier quelque chose de très important, moi aussi. Cette fois-ci, c'est pour Ultima Thulé et l'île de Thavnair..."
213,TEXT_BANALL320_04788_DREAMINGWAY_100_174,"Talkingway, Inventingway, j'ai encore besoin de votre huile de coude !"
214,TEXT_BANALL320_04788_DREAMINGWAY_000_175,"J'ai entendu dire que les Hippotracteurs avaient l'habitude de manger ensemble, c'est bien le cas ?"
215,TEXT_BANALL320_04788_DREAMINGWAY_000_176,"Je me suis donc dit que, comme beaucoup de nos auditeurs, vous aimeriez pouvoir écouter nos émissions de radio pendant votre pause repas. Et le deuxième poste, c'est pour ce café !"
216,TEXT_BANALL320_04788_TRNA_000_177,"Ah, je vois ! J'ai entendu parler de ces récepteurs. Merci beaucoup, vous allez faire un grand nombre d'heureux ! Sûrement qu'on vous écoutera avec nos clients."
217,TEXT_BANALL320_04788_JAMMINGWAY_000_178,"Ça tombe bien, c'est exactement ce que je voulais !"
218,TEXT_BANALL320_04788_N7000_000_179,Bip... Bip... Toutes mes simulations indiquent que l'installation d'une unité radiophonique apportera une augmentation du niveau de sa­tis­fac­tion de notre clientèle.
219,TEXT_BANALL320_04788_JAMMINGWAY_000_180,"Sans vous, Player, nous n'aurions jamais eu l'idée de cette course. Puis avec votre par­ti­ci­pa­tion, elle a été d'autant plus palpitante !"
220,TEXT_BANALL320_04788_JAMMINGWAY_000_181,"Vous avez su rapprocher les Arkasodaras, les Omicrons et les Loporrites. Comptez sur nous pour garder le contact avec ces radios. Merci mille fois !"
221,TEXT_BANALL320_04788_JAMMINGWAY_000_182,"Je suis un peu triste de vous voir partir, mais n'oubliez pas que Les Dernières Réminiscences sont toujours prêtes à vous accueillir... jusqu'à la fin des temps !"
222,TEXT_BANALL320_04788_JAMMINGWAY_000_183,Je compte sur vous tous pour participer à la prochaine édition des “Fous volants” ou peu importe l'événement que nous ne manquerons pas d'organiser !
223,TEXT_BANALL320_04788_SYSTEM_000_190,"Vous êtes à présent une amie précieuse des Arkasodaras, des Omicrons et des Loporrites. Vous avez atteint le rang “Allié” avec ces trois peuples !"
224,TEXT_BANALL320_04788_SYSTEM_000_191,"Grâce à vous, les trois groupes vivant sur l'île de Thavnair, sur la lune et aux confins de la galaxie ont réussi à atteindre un meilleur niveau d'entente et pourront peut-être tisser des liens plus profonds à l'avenir. 
Merci d'avoir persévéré par le biais des quêtes quotidiennes."
225,TEXT_BANALL320_04788_N7000_000_000,（★未使用／削除予定★）
