0,TEXT_VOICEMAN_07410_000010_METEM,"Avec elle, gare aux coups de fouets ! Voici venir la plus sulfureuse des combattantes : Vamp Fatale !"
1,TEXT_VOICEMAN_07410_000020_METEM,Ils sont tout feu tout flamme mais gardent la tête froide ! Accueillez ce duo de choc : les Xtrêmes !
2,TEXT_VOICEMAN_07410_000030_REFEREE,K.O. !
3,TEXT_VOICEMAN_07410_000040_METEM,"À l'issue de ce combat époustouflant, la victoire revient à notre challenger !"
4,TEXT_VOICEMAN_07410_000050_METEM,Tremblez devant le maître incontesté de l'Arcadion ! Le champion toutes catégories encore invaincu : The Tyrant !
5,TEXT_VOICEMAN_07410_000060_REFEREE,K.O. !
6,TEXT_VOICEMAN_07410_000070_METEM,Prodigieux ! Le challenger vient de remporter le Championnat céleste !
7,TEXT_VOICEMAN_07410_000080_METEM,"Voici donc la véritable identité du pro­prié­taire de l'Arcadion ! Le grand serpent des temps anciens, Lindwurm !"
8,TEXT_VOICEMAN_07410_000090_METEM,C'est tout bonnement hallucinant ! Le pro­prié­taire a enfin mordu la poussière !
