0,TEXT_CMNDEFBEGINNERGUIDE_00327_COACH00327_100_000,"Enchanté, je suis l'un des chefs instructeurs de la guilde chargés d'aider nos nouvelles recrues à prendre leurs marques."
1,TEXT_CMNDEFBEGINNERGUIDE_00327_COACH00327_000_000,"À chaque fois que je vois une jeune aventurière, ça me rappelle toujours mes débuts. C'était la panique... Je suppose que c'est pareil pour vous, non ? Vous devez vous demander à quelle sauce vous allez être mangée ?"
2,TEXT_CMNDEFBEGINNERGUIDE_00327_COACH00327_000_001,"Ici, en Éorzéa, on appelle les gens comme vous des “novices”. Certains vous envient parce que vous êtes encore libres de pouvoir décider de votre destin. Une infinité de possibilités s'offre à vous !"
3,TEXT_CMNDEFBEGINNERGUIDE_00327_COACH00327_000_002,"Mais la guilde est consciente que l'infini, ça peut vite devenir im­pres­sion­nant. Alors pour parer à ça, elle a demandé aux aventuriers les plus chevronnés de se porter volontaires pour devenir vos “mentors” et vous assister."
4,TEXT_CMNDEFBEGINNERGUIDE_00327_COACH00327_000_003,"N'hésitez pas à leur poser toutes les questions qui vous passeront par la tête. Ces personnes ont déjà rencontré les difficultés auxquelles vous vous heurterez sans doute. Et faire un bout de chemin ensemble devrait vous être profitable, à vous comme à eux."
5,TEXT_CMNDEFBEGINNERGUIDE_00327_COACH00327_000_004,La guilde des aventuriers serait plus qu'heureuse de voir ses nouvelles recrues s'épanouir aux côtés de leurs aînés. Venez me voir s'il y a quelque chose que vous n'avez pas compris et je me ferai un plaisir de vous l'expliquer.
6,TEXT_CMNDEFBEGINNERGUIDE_00327_SYSTEM_000_005,Un novice est un joueur dont les pérégrinations n'en sont encore qu'à leurs balbutiements.
7,TEXT_CMNDEFBEGINNERGUIDE_00327_SYSTEM_000_006,"De nombreux aventuriers parcourent les contrées éorzéennes. Si pour certains le voyage commence à peine, d'autres ont déjà fait face à mille dangers. Le poids de l'expérience leur permet ainsi de devenir des “mentors”."
8,TEXT_CMNDEFBEGINNERGUIDE_00327_SYSTEM_000_007,"Lorsque des novices jouent en équipe avec des mentors, chacun d'eux bénéficie d'un bonus de points d'expérience."
9,TEXT_CMNDEFBEGINNERGUIDE_00327_SYSTEM_000_008,"Ils peuvent également communiquer via le réseau des novices, sur lequel les nouveaux aventuriers posent leurs questions aux mentors ou partagent tout simplement leurs impressions avec leurs pairs."
10,TEXT_CMNDEFBEGINNERGUIDE_00327_COACH00327_000_015,"Alors cette aventure, comment ça se passe ? On croise pas mal de gens pour qui ce n'est pas la joie en Éorzéa. N'hésitez pas à adresser la parole à ceux qui ont l'air d'avoir besoin d'un petit coup de main."
11,TEXT_CMNDEFBEGINNERGUIDE_00327_COACH00327_000_016,"Et si vous éprouvez des difficultés ou que vous avez des questions, demandez de l'aide aux mentors. Ils seront cer­tai­ne­ment de bon conseil !"
12,TEXT_CMNDEFBEGINNERGUIDE_00327_COACH00327_000_020,"On peut dire que l'aventure en solitaire, ça vous connaît ! Mais quid du combat en équipe ? Parce que c'est bien beau de voyager seule comme une grande, mais une véritable aventurière a besoin de compagnons pour explorer les endroits les plus périlleux."
13,TEXT_CMNDEFBEGINNERGUIDE_00327_COACH00327_000_021,"Ce serait de la folie de pénétrer seule dans des ruines, grottes et autres hypogées qui vous glacent le sang au premier coup d'œil. Et je ne vous parle même pas des terribles créatures qui vous attendent ! Je ne le répéterai jamais assez : savoir combattre en équipe, c'est capital."
14,TEXT_CMNDEFBEGINNERGUIDE_00327_COACH00327_000_022,"C'est pour ça que la guilde des aventuriers a fait construire la Salle des novices, pour que nos recrues encore inex­pé­ri­men­tées voient un peu comment ça se passe sur un champ de bataille. Ce n'est vraiment pas comme un af­fron­te­ment d'homme à homme, vous savez."
15,TEXT_CMNDEFBEGINNERGUIDE_00327_COACH00327_000_025,"Ici, vous avez accès à des programmes d'en­traî­ne­ment variés dont vous feriez bien de maîtriser le contenu si vous voulez devenir une aventurière accomplie, sur laquelle les autres peuvent compter."
16,TEXT_CMNDEFBEGINNERGUIDE_00327_COACH00327_000_030,"Quiconque rêve de devenir un grand aventurier se doit d'accomplir les en­traî­ne­ments que l'on propose. Si ça vous intéresse, vous pouvez venir me voir directement, ou faire un saut au nord de Port-aux-Ales, dans la Noscea occidentale, pour voir la Salle de vos propres yeux."
17,TEXT_CMNDEFBEGINNERGUIDE_00327_SYSTEM_000_035,"Vous avez désormais accès à la Salle des novices. Dans le menu principal, choisissez “Missions” puis “Salle des novices” pour consulter les en­traî­ne­ments disponibles, ou adressez-vous directement à l'un des chefs instructeurs."
18,TEXT_CMNDEFBEGINNERGUIDE_00327_COACH00327_000_040,"Je vois sur mon registre que vous n'avez pas encore fini tous les exercices d'en­traî­ne­ment de la Salle des novices. Bien sûr, il n'y a rien qui vous y oblige, mais ça vous serait sans doute utile si vous vous destinez à une longue carrière d'aventurière."
19,TEXT_CMNDEFBEGINNERGUIDE_00327_COACH00327_000_050,"Alors comme ça, vous avez accompli l'exercice final ? Force est de constater que vous n'avez plus rien d'une novice."
20,TEXT_CMNDEFBEGINNERGUIDE_00327_COACH00327_000_051,"Vous verrez, surmonter de terribles épreuves avec vos compagnons, c'est un sentiment unique ! Je suis certain que ce que vous avez appris vous sera utile."
21,TEXT_CMNDEFBEGINNERGUIDE_00327_COACH00327_000_060,"Surmonter de terribles épreuves avec ses compagnons, c'est in­croya­ble­ment gratifiant ! Je suis certain que ce que vous avez appris à la Salle des novices vous sera utile en tout cas."
22,TEXT_CMNDEFBEGINNERGUIDE_00327_COACH00327_710_010,"La guilde des aventuriers collabore avec l'Alliance éorzéenne pour divers programmes d'en­traî­ne­ment, donc votre nom ne nous est pas étranger."
23,TEXT_CMNDEFBEGINNERGUIDE_00327_COACH00327_710_011,"Il semblerait que vous n'ayez pas encore pris part à tous les exercices que nous proposons. Je vous incite vivement à vous y intéresser, car ils vous seront sans nul doute utiles à vos activités d'aventurière."
24,TEXT_CMNDEFBEGINNERGUIDE_00327_COACH00327_710_020,"Je vois que vous avez terminé avec brio l'ensemble de nos programmes d'en­traî­ne­ment. Avec une telle expérience, je ne doute pas une seconde que vous êtes fin prête à affronter tous les dangers que ce monde recèle !"
25,TEXT_CMNDEFBEGINNERGUIDE_00327_COACH00327_000_070,Vous n'avez vraiment rien d'une novice... Vous avez déjà songé à devenir un mentor ? Une aventurière de votre trempe aurait beaucoup à apprendre aux petits nouveaux.
26,TEXT_CMNDEFBEGINNERGUIDE_00327_COACH00327_000_071,"Ils sont nombreux à avoir besoin d'un guide pour répondre à leurs questions. Si vous vous sentez l'âme d'une conseillère, n'hésitez pas à revenir me voir et je vous dirai tout ce qu'il y a à savoir pour vous lancer dans cette carrière."
27,TEXT_CMNDEFBEGINNERGUIDE_00327_COACH00327_000_080,On rencontre peu d'aventuriers qui ont autant voyagé que vous. Vous avez tout ce qu'il faut pour devenir un bon mentor. Vous y avez déjà songé ?
28,TEXT_CMNDEFBEGINNERGUIDE_00327_COACH00327_000_081,Les nouveaux aventuriers profiteraient un peu de votre savoir et de votre vécu... Et je vous assure que c'est un sentiment unique de veiller sur eux et de les voir progresser.
29,TEXT_CMNDEFBEGINNERGUIDE_00327_COACH00327_000_082,"J'ai la certitude que vous auriez beaucoup à leur apprendre et que vous sauriez faire preuve de la bienveillance nécessaire. Si ça vous intéresse, vous savez où me trouver en tout cas !"
30,TEXT_CMNDEFBEGINNERGUIDE_00327_COACH00327_000_090,"C'est toujours un plaisir de parler avec un mentor, qu'il soit actif aujourd'hui ou qu'il l'ait été par le passé ! Alors, en quoi puis-je vous aider ?"
31,TEXT_CMNDEFBEGINNERGUIDE_00327_MENU_TITLE,Que voulez-vous faire ?
32,TEXT_CMNDEFBEGINNERGUIDE_00327_MENU_02,En savoir plus sur les novices
33,TEXT_CMNDEFBEGINNERGUIDE_00327_MENU_02_02,En savoir plus sur les novices
34,TEXT_CMNDEFBEGINNERGUIDE_00327_MENU_07,En savoir plus sur les mentors
35,TEXT_CMNDEFBEGINNERGUIDE_00327_MENU_12,Obtenir un statut de mentor
36,TEXT_CMNDEFBEGINNERGUIDE_00327_MENU_13,Renoncer au statut de mentor
37,TEXT_CMNDEFBEGINNERGUIDE_00327_MENU_30,En savoir plus sur les rappelés
38,TEXT_CMNDEFBEGINNERGUIDE_00327_MENU_14,S'entraîner dans la Salle des novices
39,TEXT_CMNDEFBEGINNERGUIDE_00327_MENU_15,En savoir plus sur la Salle des novices
40,TEXT_CMNDEFBEGINNERGUIDE_00327_MENU_00,Annuler
41,TEXT_CMNDEFBEGINNERGUIDE_00327_MENU_03,Que sont les novices ?
42,TEXT_CMNDEFBEGINNERGUIDE_00327_MENU_06,Que sont les mentors ?
43,TEXT_CMNDEFBEGINNERGUIDE_00327_MENU_04,Qu'est-ce que le réseau des novices ?
44,TEXT_CMNDEFBEGINNERGUIDE_00327_MENU_05,Qu'est-ce que le bonus de points d'expérience ?
45,TEXT_CMNDEFBEGINNERGUIDE_00327_MENU_08,Que sont les mentors ?
46,TEXT_CMNDEFBEGINNERGUIDE_00327_MENU_09,Comment devenir un mentor ?
47,TEXT_CMNDEFBEGINNERGUIDE_00327_MENU_10,Qu'est-ce que l'option “” ?
48,TEXT_CMNDEFBEGINNERGUIDE_00327_MENU_11,Comment configurer son statut de mentor ?
49,TEXT_CMNDEFBEGINNERGUIDE_00327_MENU_50,Comment renouveler son statut de mentor ?
50,TEXT_CMNDEFBEGINNERGUIDE_00327_MENU_01,Retour
51,TEXT_CMNDEFBEGINNERGUIDE_00327_COACH00327_000_100,"Ici, en Éorzéa, on appelle les nouveaux aventuriers des “novices”. Certains les envient parce qu'ils sont encore libres de pouvoir décider de leur destin. Une infinité de possibilités s'offre à eux !"
52,TEXT_CMNDEFBEGINNERGUIDE_00327_SYSTEM_000_101,Un novice est un joueur dont les pérégrinations n'en sont encore qu'à leurs balbutiements.
53,TEXT_CMNDEFBEGINNERGUIDE_00327_SYSTEM_100_101,"Un novice est un joueur dont le temps de jeu est inférieur à 300 heures (temps réel), ou qui n'a pas encore accompli la quête “L'appel de l'aventure”."
54,TEXT_CMNDEFBEGINNERGUIDE_00327_SYSTEM_000_102,On le distingue à l'icone en forme de feuilles () qui apparaît à gauche du nom du personnage.
55,TEXT_CMNDEFBEGINNERGUIDE_00327_COACH00327_000_110,"La guilde des aventuriers a demandé à ses membres les plus chevronnés de se porter volontaires pour devenir des mentors. Leur rôle est de veiller sur nos nouvelles recrues, et de leur transmettre leurs con­nais­san­ces."
56,TEXT_CMNDEFBEGINNERGUIDE_00327_SYSTEM_000_111,"De nombreux aventuriers parcourent les contrées éorzéennes. Si pour certains le voyage commence à peine, d'autres ont déjà fait face à mille dangers. Le poids de l'expérience leur permet ainsi de devenir des “mentors”."
57,TEXT_CMNDEFBEGINNERGUIDE_00327_SYSTEM_100_111,"Il en existe deux types, chacun avec une spécialité propre : les mentors de combat et les mentors d'artisanat et récolte."
58,TEXT_CMNDEFBEGINNERGUIDE_00327_SYSTEM_000_112,On distingue les mentors à l'icone en forme de couronne qui apparaît à gauche du nom du personnage. Il en existe différents types en fonction du domaine de prédilection du joueur en question.
59,TEXT_CMNDEFBEGINNERGUIDE_00327_SYSTEM_000_113,"Ainsi, ceux qui se spécialisent dans les combats contre l'environnement (monstres, etc.) sont marqués par l'icone “”. Les experts de l'artisanat ou de la récolte utilisent celui-ci : “”. Quant aux férus de JcJ (joueur contre joueur), ils arborent le suivant : “”."
60,TEXT_CMNDEFBEGINNERGUIDE_00327_SYSTEM_000_114,"Certains mentors, qui sont capables d'aider ou de répondre à des questions sur divers éléments du jeu, choisissent l'icone générique “”. Regardez bien ces indications afin de vous adresser à la personne qui saura le mieux vous prêter main-forte."
61,TEXT_CMNDEFBEGINNERGUIDE_00327_COACH00327_000_120,"Il y a beaucoup d'in­for­ma­tions à assimiler quand on est un novice, tellement que c'est facile de s'y perdre. Ce réseau a donc été mis en place afin de permettre aux aventuriers de poser leurs questions à leur pairs, débutants ou ex­pé­ri­men­tés. Bien sûr, les mentors ont souvent réponse à tout."
62,TEXT_CMNDEFBEGINNERGUIDE_00327_COACH00327_100_120,"Il y a beaucoup d'in­for­ma­tions à assimiler pour les novices, tellement que c'est facile de s'y perdre. Le réseau permet aux mentors de les aider et de répondre à leurs questions, toujours avec patience et bienveillance !"
63,TEXT_CMNDEFBEGINNERGUIDE_00327_SYSTEM_000_121,"Les nouveaux aventuriers et les mentors peuvent communiquer grâce au réseau des novices. Il est également accessible aux rappelés, de retour en Éorzéa après avoir pris une pause."
64,TEXT_CMNDEFBEGINNERGUIDE_00327_SYSTEM_000_122,"Les mentors peuvent le rejoindre et le quitter librement, mais les novices et les rappelés doivent y être invités pour y participer."
65,TEXT_CMNDEFBEGINNERGUIDE_00327_SYSTEM_000_123,"Pour inviter un nouvel aventurier ou un rappelé, un mentor doit le cibler et choisir l'option “Inviter dans le réseau des novices”."
66,TEXT_CMNDEFBEGINNERGUIDE_00327_SYSTEM_100_123,"Pour le quitter, il suffit de sélectionner l'icone en forme de feuilles qui apparaît sous la fenêtre de log, puis le bouton Quitter en bas de la fenêtre Réseau des novices."
67,TEXT_CMNDEFBEGINNERGUIDE_00327_SYSTEM_000_124,"Les nouveaux aventuriers peuvent ainsi y poser leurs questions ou partager leurs impressions avec leurs pairs.
Échangez, discutez, partagez... mais restez toujours courtois !"
68,TEXT_CMNDEFBEGINNERGUIDE_00327_COACH00327_000_130,"C'est un atout non négligeable, car les novices et les mentors bénéficient de l'expérience de leur partenaire lorsqu'ils forment une équipe. Ça leur permet donc de progresser plus vite."
69,TEXT_CMNDEFBEGINNERGUIDE_00327_SYSTEM_000_131,"Lorsque des novices ou des rappelés jouent en équipe avec un mentor, chacun d'eux bénéficie d'un bonus de points d'expérience qui est attribué au cours des instances, des combats, ou encore en participant à des ALÉA."
70,TEXT_CMNDEFBEGINNERGUIDE_00327_SYSTEM_000_132,Ce bonus n'est cependant pas accordé aux personnages qui ont atteint le niveau 90.
71,TEXT_CMNDEFBEGINNERGUIDE_00327_COACH00327_000_140,"C'est un exemple à suivre pour les novices, un aventurier aguerri qu'ils regardent avec admiration. Et c'est pour qu'ils puissent partager leur savoir avec les novices que notre guilde recrute des mentors parmi les aventuriers les plus chevronnés."
72,TEXT_CMNDEFBEGINNERGUIDE_00327_SYSTEM_000_141,"De nombreux aventuriers parcourent les contrées éorzéennes. Si pour certains le voyage commence à peine, d'autres ont déjà fait face à mille dangers. Le poids de l'expérience leur permet ainsi de devenir des “mentors”."
73,TEXT_CMNDEFBEGINNERGUIDE_00327_SYSTEM_100_141,"Il en existe deux types, chacun avec une spécialité propre : les mentors de combat et les mentors d'artisanat et récolte."
74,TEXT_CMNDEFBEGINNERGUIDE_00327_SYSTEM_000_142,"Lorsqu'un aventurier devient un mentor, il a accès au réseau des novices et bénéficie d'un bonus de points d'expérience s'il joue avec un novice ou un rappelé."
75,TEXT_CMNDEFBEGINNERGUIDE_00327_SYSTEM_100_142,"En outre, les mentors de combat peuvent également utiliser l'option “” dans l'outil de mission."
76,TEXT_CMNDEFBEGINNERGUIDE_00327_SYSTEM_000_143,"La par­ti­ci­pa­tion automatique au réseau des novices peut être activée avec la commande texte **/réseaunovices on, ou désactivée avec **/réseaunovices off."
77,TEXT_CMNDEFBEGINNERGUIDE_00327_SYSTEM_000_144,Il est également possible de participer ou de quitter le réseau grâce au bouton en bas de la fenêtre Réseau des novices. Elle apparaîtra en sélectionnant l'icone en forme de feuilles sous la fenêtre de log.
78,TEXT_CMNDEFBEGINNERGUIDE_00327_COACH00327_000_150,"Certains critères doivent être remplis pour bénéficier de ce statut. Il faut évidemment avoir le vécu et le savoir nécessaires à tout bon aventurier, mais nous attendons également de nos bénévoles qu'ils sachent faire preuve d'altruisme."
79,TEXT_CMNDEFBEGINNERGUIDE_00327_COACH00327_000_151,"Si vous êtes dotée de toutes ces qualités, alors vous êtes faite pour ce travail !"
80,TEXT_CMNDEFBEGINNERGUIDE_00327_SYSTEM_000_152,Il est nécessaire d'avoir accompli certains hauts faits pour accéder aux statuts de mentor.
81,TEXT_CMNDEFBEGINNERGUIDE_00327_SYSTEM_000_153,Ces derniers sont différents pour les mentors de combat et les mentors d'artisanat et récolte.
82,TEXT_CMNDEFBEGINNERGUIDE_00327_SYSTEM_000_154,"Conditions requises pour les mentors de combat :
1. Finir 1 000 donjons ou défis.
2. Recevoir les honneurs de ses équipiers 1 500 fois."
83,TEXT_CMNDEFBEGINNERGUIDE_00327_SYSTEM_000_155,"3. Accomplir la quête de rôle de tank de niveau 100.
4. Accomplir la quête de rôle de soigneur de niveau 100."
84,TEXT_CMNDEFBEGINNERGUIDE_00327_SYSTEM_100_155,5. Accomplir une des trois quêtes de rôle de DPS (physique ou magique) de niveau 100.
85,TEXT_CMNDEFBEGINNERGUIDE_00327_SYSTEM_000_156,"Conditions requises pour les mentors d'artisanat et récolte :
1. Récolter 300 objets collectionnables.
2. Synthétiser 100 objets collectionnables."
86,TEXT_CMNDEFBEGINNERGUIDE_00327_SYSTEM_000_157,"3. Atteindre le niveau 100 dans l'une des disciplines de la terre.
4. Atteindre le niveau 100 dans l'une des disciplines de la main."
87,TEXT_CMNDEFBEGINNERGUIDE_00327_SYSTEM_000_158,"Une fois les conditions nécessaires remplies, vous devenez éligible au statut de mentor correspondant."
88,TEXT_CMNDEFBEGINNERGUIDE_00327_SYSTEM_000_159,Vous n'avez ensuite plus qu'à vous adresser à l'un des chefs instructeurs pour qu'il vous recrute of­fi­ciel­le­ment et vous dise tout ce qu'il y a à savoir.
89,TEXT_CMNDEFBEGINNERGUIDE_00327_COACH00327_000_160,"C'est un outil qui permet de trouver plus facilement des partenaires pour se lancer à l'aventure, car les mentors sont aussi là pour aider les aventuriers qui peinent à enrôler des gens dans leur équipe."
90,TEXT_CMNDEFBEGINNERGUIDE_00327_SYSTEM_000_161,"L'option “” permet aux aventuriers dotés du statut de mentor de combat d'être sélectionnés pour une mission au hasard, lorsque l'équipe n'est pas encore complète."
91,TEXT_CMNDEFBEGINNERGUIDE_00327_SYSTEM_000_162,"Les mentors de combat obtiennent des hauts faits, ainsi qu'une récompense de haut fait, lorsqu'ils accomplissent un certain nombre de ces missions aléatoires."
92,TEXT_CMNDEFBEGINNERGUIDE_00327_COACH00327_000_170,Rien n'oblige un mentor à passer sa vie à superviser des novices. Il est tout naturel de vouloir se consacrer à sa propre aventure en priorité. Leur avantage est cependant de pouvoir utiliser leur temps libre pour prêter main-forte aux autres.
93,TEXT_CMNDEFBEGINNERGUIDE_00327_SYSTEM_000_171,"Une fois qu'un chef instructeur vous nomme mentor, vous pouvez afficher ou masquer l'état du même nom en utilisant l'option “modifier le profil de recherche”, via l'icone du réseau des novices à droite des filtres du log ou par le biais de la fenêtre des équipiers."
94,TEXT_CMNDEFBEGINNERGUIDE_00327_SYSTEM_000_172,"Sélectionnez l'état “Mentor” qui correspond à votre domaine de prédilection dans la liste et l'icone correspondant apparaîtra à gauche du nom de votre personnage. Les mentors de combat ont accès à  et , les mentors d'artisanat et récolte à , et les mentors polyvalents à ."
95,TEXT_CMNDEFBEGINNERGUIDE_00327_SYSTEM_100_172,"Pour ceux par­ti­cu­liè­rement versés dans les combats contre l'environnement (monstres, etc.), nous recommandons “”. Les artisans et récolteurs chevronnés peuvent utiliser “” pour mieux se faire connaître. Quant aux férus de JcJ, leur icone est “”."
96,TEXT_CMNDEFBEGINNERGUIDE_00327_SYSTEM_101_172,"Si vous désirez vous rendre utile pour des questions touchant à divers éléments du jeu, vous pouvez également opter pour l'icone générique “”."
97,TEXT_CMNDEFBEGINNERGUIDE_00327_SYSTEM_000_173,"Vous bénéficiez du bonus de points d'expérience et de l'accès au réseau des novices que cette couronne soit affichée ou non, dans la mesure où vous êtes un mentor aux yeux de la guilde des aventuriers."
98,TEXT_CMNDEFBEGINNERGUIDE_00327_SYSTEM_000_174,"De même, les mentors de combat peuvent utiliser l'option “” de l'outil de mission du moment qu'ils sont reconnus par la guilde des aventuriers."
99,TEXT_CMNDEFBEGINNERGUIDE_00327_SYSTEM_000_175,"La par­ti­ci­pa­tion automatique au réseau des novices peut être activée avec la commande texte **/réseaunovices on, ou désactivée avec **/réseaunovices off."
100,TEXT_CMNDEFBEGINNERGUIDE_00327_SYSTEM_000_176,Il est également possible de participer ou de quitter le réseau grâce au bouton en bas de la fenêtre Réseau des novices. Elle apparaîtra en sélectionnant l'icone en forme de feuilles sous la fenêtre de log.
101,TEXT_CMNDEFBEGINNERGUIDE_00327_COACH00327_000_250,"Les techniques de combat, d'artisanat et de récolte évoluent chaque jour, nous devons donc nous assurer que les con­nais­san­ces de nos mentors ne vieillissent pas outre mesure. C'est pourquoi nous leur demandons ré­gu­liè­re­ment de renouveler leurs accréditations."
102,TEXT_CMNDEFBEGINNERGUIDE_00327_SYSTEM_000_251,"Les conditions d'obtention des différents statuts de mentor sont mises à jour ré­gu­liè­re­ment. Lorsqu'elles sont modifiées, une période de renouvellement de statut commence."
103,TEXT_CMNDEFBEGINNERGUIDE_00327_SYSTEM_000_252,"Durant celle-ci, les mentors peuvent mettre à jour leur accréditation auprès d'un chef instructeur afin de conserver leur statut."
104,TEXT_CMNDEFBEGINNERGUIDE_00327_SYSTEM_000_253,"S'ils ne le font pas avant la date limite, ils perdent alors leur statut. Prenez donc bien garde à mettre à jour votre accréditation."
105,TEXT_CMNDEFBEGINNERGUIDE_00327_SYSTEM_000_254,"Durant la période de renouvellement, les mentors qui ne remplissent pas encore les nouveaux critères gardent leur accès au réseau des novices et leur bonus d'expérience. L'option “” de l'outil de mission devient toutefois in­uti­li­sa­ble."
106,TEXT_CMNDEFBEGINNERGUIDE_00327_SYSTEM_000_255,Les différents états en ligne de mentor leur deviennent aussi in­uti­li­sa­bles.
107,TEXT_CMNDEFBEGINNERGUIDE_00327_COACH00327_000_180,"Avec une expérience pareille, la question ne se pose même pas ! Pour le bien de la guilde, acceptez-vous de devenir un mentor ? Nos nouvelles recrues vous remercient d'avance !"
108,TEXT_CMNDEFBEGINNERGUIDE_00327_COACH00327_000_185,"La guilde est toujours heureuse de compter de nouveaux mentors dans ses rangs ! N'hésitez pas à prêter main-forte aux nouvelles recrues en détresse, que ce soit en prenant les armes ou en partageant vos con­nais­san­ces !"
109,TEXT_CMNDEFBEGINNERGUIDE_00327_SYSTEM_000_186,"Vous êtes of­fi­ciel­le­ment un mentor. Fé­li­ci­ta­tions !
Vous pouvez désormais participer au réseau des novices et bénéficier du bonus de points d'expérience."
110,TEXT_CMNDEFBEGINNERGUIDE_00327_SYSTEM_100_186,"En outre, l'option “” de l'outil de mission vous est désormais accessible si vous êtes un mentor de combat."
111,TEXT_CMNDEFBEGINNERGUIDE_00327_SYSTEM_000_187,"Vous croiserez de nombreux aventuriers inex­pé­ri­men­tés sur le réseau des novices et au cours de vos “”. N'hésitez pas à discuter avec eux et à répondre à leurs questions, mais tâchez de rester cordiale en toutes cir­cons­tan­ces."
112,TEXT_CMNDEFBEGINNERGUIDE_00327_COACH00327_000_190,"Ça me peine énormément, mais je me dois de respecter votre choix. Je ne chercherai pas à vous convaincre, mais n'hésitez pas à vous adresser à l'un des chefs instructeurs si jamais vous changez d'avis."
113,TEXT_CMNDEFBEGINNERGUIDE_00327_COACH00327_000_200,Oh non... Vous voulez tout abandonner ? Enfin j'imagine que c'est une décision mûrement réfléchie et que rien ne vous fera changer d'avis. Vous êtes vraiment certaine de ne plus vouloir être un mentor ?
114,TEXT_CMNDEFBEGINNERGUIDE_00327_COACH00327_000_205,"Vous n'êtes of­fi­ciel­le­ment plus un mentor, mais rien n'est irréversible ! Retournez voir un de nos chefs instructeurs si le cœur vous en dit. Vous n'aurez qu'un mot à dire pour qu'il vous accorde à nouveau ce statut."
115,TEXT_CMNDEFBEGINNERGUIDE_00327_COACH00327_000_210,Vous ne pouviez pas me faire plus plaisir ! J'espère que vous guiderez encore longtemps les nouvelles recrues de la guilde des aventuriers.
116,TEXT_CMNDEFBEGINNERGUIDE_00327_COACH00327_000_300,Les rappelés sont des aventuriers dont le voyage reprend après une interruption plus ou moins longue. Certains d'entre eux peuvent ne plus être très au fait de l'actualité éorzéenne...
117,TEXT_CMNDEFBEGINNERGUIDE_00327_SYSTEM_000_301,Les joueurs de niveau 50 dans une ou plusieurs classes qui se reconnectent après une pause d'au moins 45 jours (temps réel) ont accès à l'état “Rappelé”.
118,TEXT_CMNDEFBEGINNERGUIDE_00327_SYSTEM_000_302,On les distingue à l'icone () qui apparaît à gauche du nom du personnage.
119,TEXT_CMNDEFBEGINNERGUIDE_00327_SYSTEM_000_303,"Comme les nouveaux aventuriers, les rappelés peuvent participer au réseau des novices s'ils y sont invités par un mentor, et ils bénéficient eux aussi d'un bonus de points d'expérience."
120,TEXT_CMNDEFBEGINNERGUIDE_00327_SYSTEM_000_304,Notez cependant que l'état “Rappelé” se désactive au­to­ma­ti­que­ment lorsque le temps de jeu après activation dépasse les 72 heures (temps réel).
121,TEXT_CMNDEFBEGINNERGUIDE_00327_COACH00327_000_220,"La guilde des aventuriers a fait bâtir la Salle des novices afin que ses membres puissent s'entraîner dès qu'ils le souhaitent. Il suffit donc de vous adresser à un chef instructeur pour qu'il vous propose un programme. Alors, on s'entraîne ?"
