151,TEXT_BANIXA002_01487_SEZULTOTOLOC_000_133,"Depuis, tous les semblables de celui-ci naissent sans pouvoir voler... Celle-là comprend maintenant pourquoi l'âme de ceux-ci n'aspire qu'à s'élever vers les cieux ?"
152,TEXT_BANIXA002_01487_SEZULTOTOLOC_000_134,"Heu­reu­se­ment, les ancêtres de ceux-ci, dans leur immense sagesse, ont eu l'idée lumineuse de remplacer leurs ailes emplumées par des ballons ! Il est donc du devoir de ceux-ci de se montrer dignes de leurs prédécesseurs et de continuer leur œuvre !"
153,TEXT_BANIXA002_01487_SEZULTOTOLOC_000_135,"Mais au grand dam de celui-ci, tous ses frères n'ont pas la même piété filiale... Ces crétins n'ont plus aucun respect pour les anciens et préfèrent remettre leur destin entre les mains d'une déesse de pacotille !"
154,TEXT_BANIXA002_01487_SEZULTOTOLOC_000_136,"Les autres Ixali ne comprendront donc jamais que Garuda se moque éperdument de leur volonté de parcourir les cieux à nouveau ? La Primordiale se sert des semblables de celui-ci pour assouvir sa soif de sacrifices, rien d'autre !"
155,TEXT_BANIXA002_01487_SEZULTOTOLOC_000_137,"Les pires, c'est ceux de Natalan, de vrais esclaves... Mais que les choses soient claires : jamais ceux-ci ne se comporteront comme des oisillons à leur maîtresse, celle-là entend celui-ci ? JAMAIS !!"
156,TEXT_BANIXA002_01487_SEZULTOTOLOC_000_138,"Un beau jour, les portes du firmament céleste s'ouvriront, des rayons aveuglants illumineront l'horizon, ceux-ci sentiront leurs ailes repousser sous la forme du plus grand aéronef de tous les temps, et c'est ainsi que le rêve merveilleux des Planeurs d'Ehcatl deviendra enfin réalité !"
157,TEXT_BANIXA002_01487_SEZULTOTOLOC_000_139,"Et celle-là a la chance immense d'y contribuer, alors celle-là a intérêt à y mettre du sien ! Ceux-ci espèrent bien voir celle-là faire des merveilles ! Croac !"
158,TEXT_BANIXA002_01487_SEZULTOTOLOC_000_110,... Et celui-ci qui croyait que les sans-plumes étaient aussi capables de rêver... Tant pis...
159,TEXT_BANIXA002_01487_SEZULTOTOLOC_000_111,"En tout cas, c'est tout pour cette fois. Bonne continuation à celle-là et pas question de battre de l'aile, ou celle-là va entendre celui-ci !"
160,TEXT_BANIXA002_01487_TATARAMU_000_115,"... Je m'excuse de vous avoir traitée de manière indigne, aventurière. Je dois admettre que vous m'avez im­pres­sion­né. Avec des compétences comme les vôtres, nous allons construire ce vaisseau en un rien de temps !"
161,TEXT_BANIXA002_01487_SYSTEM_000_500,"Grâce à vos efforts, la con­struc­tion de la coque du Dezul Qualan a commencé sur les chapeaux de roues !"
162,TEXT_BANIXA002_01487_SYSTEM_000_120,Votre réputation auprès des Ixali des Planeurs d'Ehcatl est passée à “Neutre”.
163,TEXT_BANIXA002_01487_SYSTEM_000_121,Vous pouvez désormais lancer des quêtes quotidiennes répétables en vous adressant à Yazel Ahuatan.
164,TEXT_BANIXA002_01487_SYSTEM_000_122,Vous pouvez également lancer des quêtes de livraison ixali par le biais du fournisseur des Planeurs dans le même lieu.
165,TEXT_BANIXA002_01487_SYSTEM_000_123,"En outre, le vendeur ixal vous permettra d'acheter des objets spécifiques."
166,TEXT_BANIXA002_01487_SYSTEM_000_124,Il vous permettra également de racheter votre  si jamais vous l'égarez. N'oubliez pas de lui rendre visite !
167,TEXT_BANIXA002_01487_POPMESSAGE_000_200,Vous pouvez maintenant utiliser les installations d'artisanat.
