0,"TEXT_BANIXA004_01489_SEQ_00","Tataramu has encountered a bump in the road towards completing the \x02\x1a\x02\x02\x03Dezul Qualan\x02\x1a\x02\x01\x03.\x02\x10\x01\x03\xe2\x80\xbbThe crafting portion of this quest is recommended for Disciples of the Hand level 6 and above."
1,"TEXT_BANIXA004_01489_SEQ_01","After explaining the need for certain notoriously difficult-to-acquire materials, Tataramu reluctantly asks that you deliver a letter to an acquaintance of his. Visit the airship ticket counter in Gridania, and ask Hida where you might find a gentleman by the name of Colson."
2,"TEXT_BANIXA004_01489_SEQ_02","Upon hearing of your wish to deliver a letter from \xe2\x80\x9cMaster Tataramu,\xe2\x80\x9d an obviously shocked Hida demands that you make haste to the headquarters of the Gods' Quiver and submit a report. Speak with Chansteloup at his post outside of Quiver's Hold."
3,"TEXT_BANIXA004_01489_SEQ_03","Chansteloup brushes aside your attempt to speak with him, claiming to be fully occupied with solving an important missing persons case. The agitated Quiverman does, however, confirm Colson's presence within Quiver's Hold. Head inside, and deliver the letter to Tataramu's acquaintance."
4,"TEXT_BANIXA004_01489_SEQ_04","After delivering the letter to Advisor Colson, you learn that Tataramu is actually the \xe2\x80\x9cmissing\xe2\x80\x9d son of Highwind Skyways chairman Tatabaru. Though vexed by the unapologetic nature of Tataramu's brief missive, Colson nevertheless agrees to cover the costs for the young Lalafell's requested materials. Take the promissory note and hand it to Hildeyerd at the Fallgourd Float crafting facility."
5,"TEXT_BANIXA004_01489_SEQ_05","You hand the promissory note to Hildeyerd, and receive what the workshop supervisor describes as a set of lavishly expensive materials. Use the facility to craft a high-quality engine jointing component, then deliver your handiwork to Tataramu.\x02\x10\x01\x03\x02\x10\x01\x03\xe2\x80\xbbIn the event that the status \x02\x13\x06\xfe\xff\xff{\x1a\x03Facility Access: Detailing\x02\x13\x02\xec\x03 wears off or the synthesis ends in failure, you may try again by speaking with Hildeyerd."
6,"TEXT_BANIXA004_01489_SEQ_06","You have delivered the engine jointing component to Tataramu. Realizing that you are now aware of his true identity, the young man explains his desire to pursue an honest career outside of the suffocating cocoon of his privileged position. Sezul assures Tataramu that crafting is its own reward, and urges the airship designer to funnel his passion into the completion of the \x02\x1a\x02\x02\x03Dezul Qualan\x02\x1a\x02\x01\x03."
7,"TEXT_BANIXA004_01489_SEQ_07","dummy"
8,"TEXT_BANIXA004_01489_SEQ_08","dummy"
9,"TEXT_BANIXA004_01489_SEQ_09","dummy"
10,"TEXT_BANIXA004_01489_SEQ_10","dummy"
11,"TEXT_BANIXA004_01489_SEQ_11","dummy"
12,"TEXT_BANIXA004_01489_SEQ_12","dummy"
13,"TEXT_BANIXA004_01489_SEQ_13","dummy"
14,"TEXT_BANIXA004_01489_SEQ_14","dummy"
15,"TEXT_BANIXA004_01489_SEQ_15","dummy"
16,"TEXT_BANIXA004_01489_SEQ_16","dummy"
17,"TEXT_BANIXA004_01489_SEQ_17","dummy"
18,"TEXT_BANIXA004_01489_SEQ_18","dummy"
19,"TEXT_BANIXA004_01489_SEQ_19","dummy"
20,"TEXT_BANIXA004_01489_SEQ_20","dummy"
21,"TEXT_BANIXA004_01489_SEQ_21","dummy"
22,"TEXT_BANIXA004_01489_SEQ_22","dummy"
23,"TEXT_BANIXA004_01489_SEQ_23","dummy"
24,"TEXT_BANIXA004_01489_TODO_00","Speak with Hida at the airship ticket counter in Gridania."
25,"TEXT_BANIXA004_01489_TODO_01","Speak with Chansteloup."
26,"TEXT_BANIXA004_01489_TODO_02","Deliver Tataramu's letter to Colson."
27,"TEXT_BANIXA004_01489_TODO_03","Present the promissory note to Hildeyerd in Fallgourd Float."
28,"TEXT_BANIXA004_01489_TODO_04","\x02\x08~\xe3\xe8\x02\xe8\x03\xff6Synthesize an engine jointing component \x02(\n\xff\x06Addon\n\x01\x03\xff@Deliver the engine jointing component \x02(\n\xff\x06Addon\n\x01\x03 to Tataramu\x03."
29,"TEXT_BANIXA004_01489_TODO_05","dummy"
30,"TEXT_BANIXA004_01489_TODO_06","dummy"
31,"TEXT_BANIXA004_01489_TODO_07","dummy"
32,"TEXT_BANIXA004_01489_TODO_08","dummy"
33,"TEXT_BANIXA004_01489_TODO_09","dummy"
34,"TEXT_BANIXA004_01489_TODO_10","dummy"
35,"TEXT_BANIXA004_01489_TODO_11","dummy"
36,"TEXT_BANIXA004_01489_TODO_12","dummy"
37,"TEXT_BANIXA004_01489_TODO_13","dummy"
38,"TEXT_BANIXA004_01489_TODO_14","dummy"
39,"TEXT_BANIXA004_01489_TODO_15","dummy"
40,"TEXT_BANIXA004_01489_TODO_16","dummy"
41,"TEXT_BANIXA004_01489_TODO_17","dummy"
42,"TEXT_BANIXA004_01489_TODO_18","dummy"
43,"TEXT_BANIXA004_01489_TODO_19","dummy"
44,"TEXT_BANIXA004_01489_TODO_20","dummy"
45,"TEXT_BANIXA004_01489_TODO_21","dummy"
46,"TEXT_BANIXA004_01489_TODO_22","dummy"
47,"TEXT_BANIXA004_01489_TODO_23","dummy"
48,"TEXT_BANIXA004_01489_TATARAMU_000_000","Ho there, \x02,\r\xff\x07\x02)\x03\xeb\x02\x03\xff\x02 \x02\x03! Construction of the airship proceeds apace! Our beastman colleagues have even agreed to implement several of my proposals!"
49,"TEXT_BANIXA004_01489_TATARAMU_000_001","However inadvertent it was, I must thank you for introducing me to this opportunity."
50,"TEXT_BANIXA004_01489_TATARAMU_000_002","That I should have the chance to contribute to such a revolutionary project... 'Tis \x02\x1a\x02\x02\x03exactly\x02\x1a\x02\x01\x03 the sort of thing I dreamed of as I pored over countless tomes on aeronautic principle and design!"
51,"TEXT_BANIXA004_01489_TATARAMU_000_003","There is, however, one small issue that has arisen to thwart us..."
52,"TEXT_BANIXA004_01489_TATARAMU_000_004","In order to properly integrate my innovations, we require certain materials to build a custom engine jointing component\xe2\x94\x80materials that are notoriously difficult to procure."
53,"TEXT_BANIXA004_01489_TATARAMU_000_005","I had hoped it would not come to this, but I must call upon the aid of an acquaintance of mine."
54,"TEXT_BANIXA004_01489_TATARAMU_000_006","\x02,\r\xff\x07\x02)\x03\xeb\x02\x03\xff\x02 \x02\x03, would you be so kind as to deliver this letter to a gentleman by the name of Colson? I am certain that he will agree to prepare the materials...and keep the entire matter discreet. "
55,"TEXT_BANIXA004_01489_TATARAMU_000_007","Now, Colson is often out and about on company business, but speak with Hida at the airship ticket counter in Gridania, and she will point you towards his latest appointment. My apologies, \x02,\r\xff\x07\x02)\x03\xeb\x02\x03\xff\x02 \x02\x03. I do not mean to treat you as a lackey, but I'd prefer to avoid the city for the time being..."
56,"TEXT_BANIXA004_01489_TATARAMU_000_008","I almost wish I could see Colson's face when he learns what I am building...not to mention with \x02\x1a\x02\x02\x03whom\x02\x1a\x02\x01\x03 I am building it!"
57,"TEXT_BANIXA004_01489_HIDA_000_010","Welcome to the airship landing. ...I'm sorry, was there aught else I might help you with, \x02\x08\x0e\xe9\x05\xff\x05miss\xff\x04sir\x03?"
58,"TEXT_BANIXA004_01489_HIDA_000_011","You wish to meet with Advisor Colson? Delivering a letter from \xe2\x80\x9cTataramu,\xe2\x80\x9d you say...? <gasp> Surely you don't mean \x02\x1a\x02\x02\x03Master\x02\x1a\x02\x01\x03 Tataramu!?"
59,"TEXT_BANIXA004_01489_HIDA_000_012","Y-You've seen him!? I-Is he hale and unharmed!?"
60,"TEXT_BANIXA004_01489_HIDA_000_013","You must take yourself directly to Quiver's Hold! Chansteloup will wish to speak with you in person!"
61,"TEXT_BANIXA004_01489_HIDA_000_014","You will find Advisor Colson there as well, assisting with the investigation. Swiftly now please, \x02\x08\x0e\xe9\x05\xff\x05miss\xff\x04sir\x03!"
62,"TEXT_BANIXA004_01489_HIDA_000_015","Pray head directly to Quiver's Hold and report to Chansteloup! He will surely drop everything to hear what you have to say!"
63,"TEXT_BANIXA004_01489_CHANSTELOUP_000_020","I'm sorry, \x02\x08\x0e\xe9\x05\xff\x05miss\xff\x04sir\x03, but I cannot assist you at this time\xe2\x94\x80the Gods' Quiver is fully engaged with investigating a most important case."
64,"TEXT_BANIXA004_01489_CHANSTELOUP_000_021","Every resource at our disposal has been allocated towards locating Chairman Tatabaru's missing son."
65,"TEXT_BANIXA004_01489_CHANSTELOUP_000_022","Even now, the chairman's chief aide, Advisor Colson, awaits within Quiver's Hold\xe2\x94\x80no doubt eager to berate the First Bow for our lack of progress."
66,"TEXT_BANIXA004_01489_CHANSTELOUP_000_023","Hm? Colson is the person you've come to see? Then I must ask you to mind your words. I can't have you antagonizing the esteemed representative of Highwind Skyways."
67,"TEXT_BANIXA004_01489_CHANSTELOUP_000_024","If you must speak with Advisor Colson, then pray do so with the utmost respect. Highwind Skyways is not a company to be trifled with..."
68,"TEXT_BANIXA004_01489_COLSON_000_030","Yes, yes, I am Colson, but this is hardly the time for\xe2\x94\x80 Hm? A letter for me? Let's have it, then, \x02\x08\x0e\xe9\x05\xff\x05miss\xff\x04son\x03! Time is of the essence, you know, especially at my age..."
69,"TEXT_BANIXA004_01489_COLSON_000_031","Great gods! This is signed by Master Tataramu! How came you by this document!? Is the young master well!?"
70,"TEXT_BANIXA004_01489_COLSON_000_032","What's that, you say!? Ensconced in the company of Ixal!? Then we've not a moment to lose! Should it cost me my very life, I shall see him freed from their ravenous clutches!"
71,"TEXT_BANIXA004_01489_COLSON_000_033","We'll need to form a rescue party... Yes, the finest Gods' Quiver marksmen, reinforced by a small army of Skyways retainers! Be brave, Master Tataramu! Those beastmen will soon rue the day they dared lay talons on my young charge!"
72,"TEXT_BANIXA004_01489_Q1_000_001","What will you say to soothe him?"
73,"TEXT_BANIXA004_01489_A1_000_001","Advisor, \x02\x1a\x02\x02\x03calm down\x02\x1a\x02\x01\x03!!!"
74,"TEXT_BANIXA004_01489_A1_000_002","But Tataramu is fine!"
75,"TEXT_BANIXA004_01489_COLSON_000_034","This no longer concerns you, \x02\x08\x1a\xe9\x05\xff\x0byoung miss\xff\nyoung man\x03! We must immediately\xe2\x94\x80\x02\x10\x01\x03...Wait, what? You mean to say that Tataramu is safe?"
76,"TEXT_BANIXA004_01489_COLSON_000_035","...He's there of his own free will? Building an airship \x02\x1a\x02\x02\x03with\x02\x1a\x02\x01\x03 the Ixal!? Wait, wait, wait! Perhaps we must needs begin afresh."
77,"TEXT_BANIXA004_01489_COLSON_000_036","As you are obviously aware, my name is Colson, and I am the chief technical advisor for Highwind Skyways and aide to Chairman Tatabaru. Pleased to make your acquaintance."
78,"TEXT_BANIXA004_01489_COLSON_000_037","What you may not have known is that the man who asked you to deliver this letter is the chairman's only son...and the sole successor to a veritable airship empire."
79,"TEXT_BANIXA004_01489_COLSON_000_038","Some few days ago, Master Tataramu accompanied me here to Gridania as part of his continuing education on company practices. Much to my surprise and alarum, however, the young master suddenly disappeared from under my very nose."
80,"TEXT_BANIXA004_01489_COLSON_000_039","Well, I was naturally beset by all manner of horrible imaginings! With no ransom demand or other clue to his whereabouts, I had no choice but to task the Gods' Quiver with turning the entire city upside down!"
81,"TEXT_BANIXA004_01489_COLSON_000_040","Suffice it to say, your news has lifted a terrible weight from my old shoulders. I know not how I would have faced the boy's father had events unfolded otherwise."
82,"TEXT_BANIXA004_01489_COLSON_000_041","...And yet, the contents of this letter still manage to vex me.\x02\x10\x01\x03\x02\x10\x01\x03\x02\x10\x01\x03\x02\x10\x01\x03\x02\x1a\x02\x02\x03Dear Colson,\x02\x10\x01\x03Enclosed is a list of materials I would have you prepare for my\x02\x10\x01\x03companion. I require them for a most exciting project!\x02\x10\x01\x03                                            Fond regards, Tataramu\x02\x1a\x02\x01\x03"
83,"TEXT_BANIXA004_01489_COLSON_000_042","Not one word of apology or even the slightest hint of contrition! My lectures on the privilege and responsibility of position appear to have fallen on deaf ears."
84,"TEXT_BANIXA004_01489_COLSON_000_043","And as for this list... I'm assuming these are materials for some manner of high-quality jointing component? A mounting frame for the ceruleum engine, yes?"
85,"TEXT_BANIXA004_01489_COLSON_001_043","And as for this list... I'm assuming these are materials for some manner of high-quality jointing component? Treated rubber gaskets to prevent ceruleum leakage, yes?"
86,"TEXT_BANIXA004_01489_COLSON_002_043","And as for this list... I'm assuming these are materials for some manner of high-quality jointing component? A leather-bound frame to absorb engine vibration, yes?"
87,"TEXT_BANIXA004_01489_COLSON_002_044","And as for this list... I'm assuming these are materials for some manner of high-quality engine jointing component?"
88,"TEXT_BANIXA004_01489_COLSON_000_045","Hmmm. I am sorely tempted to refuse this impertinent request, considering the trouble the young master has caused... But I am also intrigued."
89,"TEXT_BANIXA004_01489_COLSON_000_046","Here. Take this promissory note and hand it to the supervisor of the Fallgourd Float crafting facility. She will provide you with everything you require to craft Tataramu's component."
90,"TEXT_BANIXA004_01489_COLSON_000_047","Though I yet harbor some concerns, I will trust that Master Tataramu is content to work alongside these Ixal for now..."
91,"TEXT_BANIXA004_01489_COLSON_000_048","Master Tataramu is as a grandson to me\xe2\x94\x80I have watched that boy nurture a love for airships since the day he was born. Pray see to it that no harm befalls him..."
92,"TEXT_BANIXA004_01489_HILDEYERD_000_050","Hello again, adventurer! Come now, I can hardly hear you! I said, \xe2\x80\x9cHello again\xe2\x80\x9d!"
93,"TEXT_BANIXA004_01489_HILDEYERD_000_051","Oh my! This note has the seal of Highwind Skyways! ...Though I suppose it only stands to reason\xe2\x94\x80there are few other organizations that could afford the items you're requesting."
94,"TEXT_BANIXA004_01489_HILDEYERD_000_052","Here you are, then! Everything is in order for you to begin crafting!"
95,"TEXT_BANIXA004_01489_HILDEYERD_000_053","I'm sure you'll do just fine with those expensive materials! Remember: I'll be right here if you need anything!"
96,"TEXT_BANIXA004_01489_HILDEYERD_000_054","Finished crafting, have you? Well, don't keep the client waiting\xe2\x94\x80run along and deliver your handiwork! Now, I doubt that you'd be so clumsy as to misplace your precious creations, but on the off chance that you do, know that I still have the excess materials in my keeping."
97,"TEXT_BANIXA004_01489_TATARAMU_000_060","\x02,\r\xff\x07\x02)\x03\xeb\x02\x03\xff\x02 \x02\x03! You were gone so long I was beginning to worry! Were you able to deliver my letter to Colson?"
98,"TEXT_BANIXA004_01489_TATARAMU_000_061","Yes! This is exactly what I had in mind! Jointing components like this one are almost impossible to obtain without the clout of a company like Highwind Skyways behind you."
99,"TEXT_BANIXA004_01489_TATARAMU_000_062","But with your expertly crafted component now in hand, we should have no trouble integrating my improved engine housing into the \x02\x1a\x02\x02\x03Dezul Qualan\x02\x1a\x02\x01\x03. I can already feel the bracing chill of the wind on my face! Hear the cries of the birds! See the folk below, rushing about like tiny\xe2\x94\x80"
100,"TEXT_BANIXA004_01489_TATARAMU_000_063","Ahem. Pray excuse my little flights of fancy. Terrible habit of mine. So, \x02,\r\xff\x07\x02)\x03\xeb\x02\x03\xff\x02 \x02\x03... I suppose you heard from old Colson who I really am, then?"
101,"TEXT_BANIXA004_01489_TATARAMU_000_064","Yes, 'tis true: my father is the chairman of Highwind Skyways, the expansive airship service that links the great cities of Eorzea."
102,"TEXT_BANIXA004_01489_TATARAMU_000_065","Destined as I am to one day take the company's helm, people everywhere seek to curry my favor as they would some merchant prince."
103,"TEXT_BANIXA004_01489_TATARAMU_000_066","...A pity then that my \xe2\x80\x9croyal\xe2\x80\x9d status does not excuse me from an unrelenting procession of dreary lessons at home. I am forced to study mercantile practices, business strategies...all that I might maximize the profits of airship travel."
104,"TEXT_BANIXA004_01489_TATARAMU_000_067","But I have not the slightest interest in making coin. I've had enough of ledgers and lectures! Thus was I so reluctant to leave this little sanctuary."
105,"TEXT_BANIXA004_01489_TATARAMU_000_068","I want to \x02\x1a\x02\x02\x03design\x02\x1a\x02\x01\x03 airships, not manage a fleet of them! I want to be valued not for my station or my purse, but for the skills I have labored to acquire!"
106,"TEXT_BANIXA004_01489_TATARAMU_000_069","Mayhaps you hear naught but the whining of a spoiled child... Yet I swear to you, I would renounce my inheritance in a twinkling if I could!"
107,"TEXT_BANIXA004_01489_TATARAMU_000_070","Oh for the wings of a wondrous airship to carry me further, faster, and higher than ever before! \x02\x1a\x02\x02\x03That\x02\x1a\x02\x01\x03 is my dream! That, and naught else!"
108,"TEXT_BANIXA004_01489_SEZULTOTOLOC_000_071","Squawk! Well said, that was!"
109,"TEXT_BANIXA004_01489_SEZULTOTOLOC_000_072","And mean nothing to us, Tataramu's wealth does. Better off smelting down coins and making nails, Sezul thinks!"
110,"TEXT_BANIXA004_01489_TATARAMU_000_073","Thank you, Sezul..."
111,"TEXT_BANIXA004_01489_SEZULTOTOLOC_000_074","Squawk, squawk! Seize this passion, and let it sustain you, you must! Construction of \x02\x1a\x02\x02\x03Dezul Qualan\x02\x1a\x02\x01\x03 will take all that Tataramu has, and more!"
112,"TEXT_BANIXA004_01489_SEZULTOTOLOC_000_075","Chosen an easy path, Tataramu has not. No, not easy. But always fair master, crafting is! Great reward for great effort!"
113,"TEXT_BANIXA004_01489_SEZULTOTOLOC_000_076","Launch our vessel upon ocean of clouds, we shall! Launch it towards gates of Ayatlan! Ready to fly is Tataramu, yes?"
114,"TEXT_BANIXA004_01489_TATARAMU_000_077","Yes! Yes, sir!"
115,"TEXT_BANIXA004_01489_SYSTEM_000_500","Thanks to your diligent efforts, the engine housing has now been integrated into the \x02\x1a\x02\x02\x03Dezul Qualan\x02\x1a\x02\x01\x03's tail assembly! Continue assisting the Ehcatl Nine to see the airship hybrid reach completion."
116,"TEXT_BANIXA004_01489_SYSTEM_000_100","You have achieved \x02\x13\x06\xfe\xff\xff{\x1a\x03Friendly\x02\x13\x02\xec\x03 reputation with the Ehcatl Nine."
117,"TEXT_BANIXA004_01489_SYSTEM_000_101","New Ixal beast tribe daily quests are now available from Rozol Cattlan the Prudent at Ehcatl."
118,"TEXT_BANIXA004_01489_SYSTEM_000_102","Furthermore, you now have access to a wider selection of wares from the Ehcatl Nine vendor."
119,"TEXT_BANIXA004_01489_POPMESSAGE_000_200","You now have access to the crafting facility."
120,"TEXT_BANIXA004_01489_SYSTEM_000_201","Normal-quality items crafted in the course of this quest serve no purpose and cannot be sold. It is recommended that you discard them."
121,"TEXT_BANIXA004_01489_SEZULTOTOLOC_000_009","\xef\xbc\x88\xe2\x98\x85\xe6\x9c\xaa\xe4\xbd\xbf\xe7\x94\xa8\xef\xbc\x8f\xe5\x89\x8a\xe9\x99\xa4\xe4\xba\x88\xe5\xae\x9a\xe2\x98\x85\xef\xbc\x89"