177,TEXT_CHRHDB812_04543_RADZATHANMERCHANT03168_100_114,S-So wartet doch! Meister Lugae! Was ist mit meiner Bezahlung?!
178,TEXT_CHRHDB812_04543_NASHUMHAKARACCA_000_115,Macht des Hildikristalls! Mach auuuf!
179,TEXT_CHRHDB812_04543_HILDIBRAND_000_116,Hmpf ...? Was ist denn nun schon wieder?!
180,TEXT_CHRHDB812_04543_JUBRACA_000_117,（★未使用／削除予定★）
181,TEXT_CHRHDB812_04543_LUGAE_100_117,He! Wieso bewegt der sich plötzlich?! So war das aber nicht abgesprochen!
182,TEXT_CHRHDB812_04543_HILDIBRAND_000_118,Uaaaaaaaaaaaah!!!
183,TEXT_CHRHDB812_04543_HILDIBRAND_000_119,Huuuuuuuuuuurgh!!!
184,TEXT_CHRHDB812_04543_JUBRACA_000_120,（★未使用／削除予定★）
185,TEXT_CHRHDB812_04543_LUGAE_100_120,Hyaaaaaaaaaaaaah!!!
186,TEXT_CHRHDB812_04543_HILDIBRAND_000_121,"Uff! Ich weiß zwar nicht, was hier vor sich geht, aber immerhin sehe ich nicht mehr alles in Lila. Dann bin ich wohl wieder zu Hause."
187,TEXT_CHRHDB812_04543_HILDIBRAND_000_122,"Das Gestirn hat mich wieder! Die reinste Seele der Welt, gefiltert von einem Meisterbarista! Hahahaha! "
188,TEXT_CHRHDB812_04543_NASHUMHAKARACCA_000_123,A-Aber Herr Hildibrand! Wo wollt Ihr denn hin ...?! 
189,TEXT_CHRHDB812_04543_NASHUMHAKARACCA_000_124,（★未使用／削除予定★）
190,TEXT_CHRHDB812_04543_DELION_000_125,"Sie sind hier, wie ich es prophezeite! Die Außerætherischen sind gekommen!"
191,TEXT_CHRHDB812_04543_DELION_000_126,"Ich werde dafür sorgen, dass die ganze Welt die Wahrheit erfährt! Das wird die Schlagzeile meines Lebens!"
192,TEXT_CHRHDB812_04543_NASHUMHAKARACCA_000_127,"Wie gemein! Wir haben uns so viel Mühe gegeben, Herrn Hildibrands Seele nach Hause zu holen, da schnappen sie ihn uns gleich wieder weg."
193,TEXT_CHRHDB812_04543_NASHUMHAKARACCA_000_330,"Ich hatte mich sooo darauf gefreut, ihn endlich wiederzusehen! Das ist einfach nicht fair."
194,TEXT_CHRHDB812_04543_NASHUMHAKARACCA_000_331,"Aber futsch ist futsch. Gehen wir lieber zurück nach Radz-at-Han und sehen nach, was wir dagegen unternehmen können!"
195,TEXT_CHRHDB812_04543_NASHUMHAKARACCA_100_340,"Kaum war er da, ist er auch schon wieder weg. Wenn wir nur wüssten, wo dieses Flugding mit ihm hinwollte ..."
196,TEXT_CHRHDB812_04543_NASHUMHAKARACCA_000_340,"Aber na ja, schmollen kommt gar nicht infrage. Immerhin bin ich die Assistentin des besten Kriminologen überhaupt! Da ist es meine Aufgabe, ihm dabei zu assistieren, nicht dauernd entführt zu werden!"
197,TEXT_CHRHDB812_04543_NASHUMHAKARACCA_000_341,"Ich mache genau da weiter, wo wir aufgehört haben, und gehe wieder auf Spurensuche!"
198,TEXT_CHRHDB812_04543_NASHUMHAKARACCA_000_342,"Wenn ich Genaueres weiß, sag ich dir Bescheid. Halt dich bereit, ja? Ich zähle auf dich!"
199,TEXT_CHRHDB812_04543_SYSTEM_000_200,Zur gleichen Zeit in Mare Lamentorum ...
200,TEXT_CHRHDB812_04543_SYSTEM_000_300,"Die Nacht bricht herein, das Böse erwacht ♪"
201,TEXT_CHRHDB812_04543_SYSTEM_000_301,"Doch einen gibt es, der darüber lacht ♪"
202,TEXT_CHRHDB812_04543_SYSTEM_000_302,"Hildibrand ♪
Außer Rand und Band ♪
Ein Kriminologe, der das Übel verbannt ♪ 
"
203,TEXT_CHRHDB812_04543_SYSTEM_000_303,"Und wenn's mal kracht, dann elegant ..."
