#,Text,SelfKind,TargetKind,NumParam,FCActivityCategory,IconType
0,,0,0,0,0,-1
1,Free company established!,0,0,0,1,0
2,Company rank UNKNOWN attained!,0,0,1,1,0
3,Standing with the  now ****!,1,0,1,1,5
4,Standing with the  now ****!,1,0,1,1,6
5,Standing with the  now ****!,1,0,1,1,7
6,“” entitlement awarded!,0,0,1,1,0
7,You joined the company.,4,0,0,2,1
8,You joined the company.,4,0,0,2,1
9,You left the company.,4,0,0,2,2
10,You were dismissed from the company.,4,0,0,2,2
11,You were made .,4,5,0,2,3
12,You were elected .,4,5,0,2,3
13,You were made .,4,5,0,2,3
14,Company allegiance pledged to the .,0,1,0,1,5
15,Company allegiance pledged to the .,0,1,0,1,6
16,Company allegiance pledged to the .,0,1,0,1,7
17,You changed the settings for the member rank “.”,4,5,0,3,3
18,You added the member rank “.”,4,5,0,3,3
19,You deleted the member rank “.”,4,5,0,3,3
20,You changed member rank hierarchy.,4,0,0,3,3
21,You changed company chest settings for  UNKNOWN.,4,6,1,0,-1
22,You changed company chest settings for gil.,4,0,0,0,-1
23,You changed company chest settings for crystals.,4,0,0,0,-1
24,You updated the company board.,4,0,0,3,4
25,You updated the company profile.,4,0,0,3,4
26,You changed the company crest.,4,0,0,3,8
27,You purchased the company action “.”,4,0,1,4,9
28,You activated the company action “.”,4,0,1,4,9
29,Activity deleted.,0,0,0,0,4
30,You changed the name of a member rank to “.”,4,5,0,3,3
31,You disabled the company action “.”,4,0,1,4,9
32,You discarded the company action “.”,4,0,1,4,9
33,The company name abbreviation has been changed to “.”,0,3,0,3,4
34,The company name has been changed to “.”,0,2,0,3,4
35,"You changed the name of the estate hall at plot UNKNOWN, ward UNKNOWN,  to .",4,9,0,5,11
36,You updated the greeting for .,4,8,0,5,11
37,"You purchased the deed to plot UNKNOWN, ward UNKNOWN,  for the company.",4,7,0,5,11
38,"You relinquished the deed to plot UNKNOWN, ward UNKNOWN,  for the company.",4,7,0,5,11
39,"Your company's deed to plot UNKNOWN, ward UNKNOWN,  was revoked.",0,7,0,5,11
40,"You built an  at plot UNKNOWN, ward UNKNOWN, .",4,7,1,5,11
41,You removed .,4,8,0,5,11
42,You remodeled the exterior of .,4,8,0,5,11
43,You remodeled the interior of .,4,8,0,5,11
44,You rearranged the furniture of .,4,8,0,5,11
45,You rearranged the furnishings of .,4,8,0,5,11
46,You deleted a message from the  message book.,4,8,0,5,11
47,Application received from you.,4,0,0,2,12
48,Application from you withdrawn.,4,0,0,2,12
49,The character “you” no longer exists.,4,0,0,2,12
50,Application from you declined.,4,0,0,2,12
51,Unable to accept additional applications at this time.,0,0,0,2,12
52,You planted  in the .,4,10,1,6,13
53,You applied  to a plant in the .,4,10,1,6,13
54,You tended a plant in the .,4,10,0,6,13
55,You harvested  from the .,4,11,1,6,13
56, was obtained through successful intercrossing.,0,11,1,6,13
57,"Due to your absence, the rank of “” was transferred.",4,5,0,2,3
58,You removed a crop in the .,4,10,0,6,13
59,You added room #UNKNOWN to the estate.,4,0,1,5,11
60,You demolished room #UNKNOWN.,4,0,1,5,11
61,You cleaned the chocobo stables.,4,0,0,7,11
62,You trained .,4,12,0,7,11
63,You placed  in wheel slot one.,16,14,1,5,11
64,You removed the unprimed  from wheel slot one.,16,14,1,5,11
65,You removed  from wheel slot one.,16,14,1,5,11
66,"You converted the energy of  into the company action “,” readying it for activation.",16,14,1,4,9
67,You added a workshop beneath the estate.,16,0,0,8,15
68,You demolished the workshop beneath the estate.,16,0,0,8,15
69,You set  as the company workshop project.,16,14,0,8,15
70,All materials required in 's next stage of creation have been readied.,0,14,0,8,15
71,Progress was made on .,0,14,1,8,15
72,Progress was made in completing .,0,14,1,8,15
73,You removed  from the company workshop.,16,14,0,8,15
74,You discontinued the company workshop project.,16,0,0,8,15
75,You created a new .,16,0,1,8,15
76,You registered company airship **No. UNKNOWN** - **.,16,15,1,9,14
77,You changed the name of company airship **No. UNKNOWN** to **.,16,15,1,9,14
78,You dismantled company airship **No. UNKNOWN** - **.,16,15,1,9,14
79,You deployed ** on an exploratory voyage.,16,15,0,9,14
80,You recalled ** from the exploratory voyage.,16,15,0,9,14
81,You finalized the exploratory voyage report for **.,16,15,0,9,14
82,** is now rank UNKNOWN.,16,15,1,9,14
83,Company airship **No. UNKNOWN** may now be registered.,16,15,1,9,14
84,You exchanged 0 company credit for UNKNOWN .,16,22,1,1,0
85,"In one delivery, You contributed more than 60% of the  required for .",16,22,1,8,15
86,You charted a new course to the Diadem (Hard)!,16,0,0,9,14
87,"The company estate was deemed abandoned and the deed to plot UNKNOWN, ward UNKNOWN,  was revoked. Several salvageable possessions were placed in the care of the area's resident caretaker.",0,7,0,5,11
88,"You visited the estate, canceling the auto-demolition process.",16,0,0,5,11
89,"Possessions placed into the care of the resident caretaker after the demolition of the estate on plot UNKNOWN, ward UNKNOWN,  were not collected within the allotted time and have been discarded.",0,7,0,5,11
90,You planted  in a flowerpot.,16,14,0,6,13
91,You tended the items in a flowerpot.,16,0,0,6,13
92,You harvested  from a flowerpot.,16,14,1,6,13
93,You destroyed the items in a flowerpot.,16,0,0,6,13
94,"You relocated the estate to plot UNKNOWN, ward UNKNOWN, .",4,7,0,5,11
95,You registered company submersible **No. UNKNOWN** - **.,16,15,1,9,14
96,You changed the name of company submersible **No. UNKNOWN** to **.,16,15,1,9,14
97,You dismantled company submersible **No. UNKNOWN** - **.,16,15,1,9,14
98,You deployed ** on a subaquatic voyage.,16,15,0,9,14
99,You recalled ** from the subaquatic voyage.,16,15,0,9,14
100,You finalized the subaquatic voyage report for **.,16,15,0,9,14
101,** is now rank UNKNOWN.,16,15,1,9,14
102,Company submersible **No. UNKNOWN** may now be registered.,16,15,1,9,14
103,You deleted 's entry from the message book.,16,23,0,5,11
104,You updated the message book settings.,16,0,0,5,11
105,You assigned the residence a tag.,16,0,0,5,11
106,You changed 's interior design.,16,15,0,5,11
107,,0,0,0,0,0
