2162726,"The Bannock",""My subordinates have a knack for disappearing from time to time, but not to worry. Climb high and survey the stump below, and the shirkers in the shadows are soon revealed." Such were the guard captain\'s words, and I would see as he saw.","Built around the stump of a fallen heavenspillar, the Bannock serves as training grounds for Order of the Twin Adder initiates. There are several theories regarding the origin of the area's name, some claiming it is taken from the hard tack issued to Grand Company recruits, others that it is derived from the training stump's resemblance to those selfsame rations.",4877112,54,81556,81056,81452,500,759,22,False
2162727,"Haukke Manor",""I fled as fast as my legs could carry me, till I stood atop massive tree roots with nowhere to run. The glow from the windows, so beautiful, yet so terrible..." Such were the madman\'s words, and I would see as he saw.","Long frowned upon by the people of Gridania as a symbol of excess, the Seedseers would finally submit to pressure from the citizenry, selling the deed to the manor to Lady Amandine of House Dartancours. The word \xe2\x80\x9cHaukke\xe2\x80\x9d is of ancient Padjali origin and means, \xe2\x80\x9cto speak without words.\xe2\x80\x9d",4877113,54,81557,81057,81452,1800,459,22,False
2162728,"The Guardian Tree",""When I feel I have lost my way, I look down upon the ancient arbor under the shining sun. I look down, and I listen." Such were the conjurer\'s words, and I would see as she saw.","Having seen over a thousand summers, the Guardian Tree is purportedly the oldest arbor in all the Black Shroud, and home to the great one\xe2\x94\x80an elder elemental who watches and presides over the forest's denizens. The fruit borne by the tree resembles a plum and is sought after across the Three Continents for its curative properties.",4877163,54,81558,81058,81452,1200,1659,22,False
2162729,"Rainbow Bridge",""Shimmering in the sun and mist, the bridge is a sign that for all the pain we have inflicted on our forest home, the elementals still grace us with their favor." Such were the conjurer\'s words, and I would see as he saw.","When struck by the rare sunbeams which happen to penetrate the thick canopy of the Black Shroud, the veil of fine mist created by one of the East Vein's myriad cataracts projects a brilliant rainbow which appears to connect the river's east and west banks. The grotto hidden behind the veil houses one of the forest's most sacred locations\xe2\x94\x80the Lifemend Stump.",4877165,54,81559,81059,81452,1100,1359,22,False
2162730,"The Seedbed",""Flora or fauna, one cannot but marvel at the wonder of birth." Such were the scholar\'s words, and I would see as he saw.","Illuminated in the soft glow of countless moonspores, the Seedbed is an ancient arbor-turned-nursery used by the sylphs to grow and incubate their offspring, also known as podlings.",4878703,55,81562,81062,81452,1800,459,22,False
2162731,"Buscarron's Druthers",""What was I doin\' up there at dawn in the pourin\' rain? Hells if I can remember, but it wasn\'t a bad view." Such were the drunkard\'s words, and I would see as he saw.","The Druthers is run by a disenfranchised ex-sentry-turned-tavernkeep and welcomes all manner of folk, from upstanding to unsavory, so long as they follow Buscarron Strongarm's simple rules of etiquette: sit down, forget your worries, and savor your ale.",4878736,56,81563,81063,81452,800,1159,22,False
2162732,"South Shroud Landing","Overheard at a tavern: "Bet the people who built that place never thought it would end up used like that."","Constructed by Highwind Skyways to serve as a landing for cargo airships, this location was quickly abandoned when the imperial presence in the area became too large to ignore. Now the site is used as a makeshift market where bandits and poachers peddle their ill-gotten wares far from the eyes of the law.",4878759,56,81564,81064,81452,800,1159,22,False
2162733,"Urth's Gift",""Shrouded in mist, bathed in ephemeral light. I felt as if I\'d left the forest behind and come to another world..." Such were the conjurer\'s words, and I would see as he saw.","Ancient writings tell that in exchange for her lifeblood, Lady Urth was able to seal the Dark Divinity Odin in a crystalline prison beneath a bubbling wellspring. To honor her sacrifice, the land upon which she drew her last breath still bears her name.",4878763,56,81565,81065,81452,1200,1659,22,False
2162734,"Quarrymill",""As I was cleaning out the chimneys, I could not help but be struck by the view below. My village may be a humble one, but there\'s nowhere else I\'d call home." Such were the hunter\'s words, and I would see as he saw.","Once a deal had been struck between the Gelmorrans and the elementals allowing their return to the forest surface, the Elezen began unearthing large quantities of boulders to build the foundations of their new city, Gridania. The waterwheels of Quarrymill were raised to power the hammers which rendered the massive stones into workable blocks.",4878764,56,81566,81066,81452,500,759,22,False
2162735,"Ixali Logging Grounds",""I stood there atop the butchered arbor, my fist trembling in anger. Those who would harm our forest home must be shown no quarter." Such were the sentry\'s words, and I would see as he saw.","The Ixal have never taken well their banishment from the Black Shroud, and to this day continue to fell the hoary sentinels growing on the forest's outskirts. Too heavy to drag back to their settlements in Natalan or faraway Xelphatol, the ill-gotten lumber is tied to balloons buoyed with Ixali airstones and flown to the beast tribe's homeland under the cover of night.",4878773,57,81567,81067,81452,1200,1659,22,False
2162736,"Fallen Neurolink",""I don\'t like it, I can tell you that. That crescent...whatever-it-is...protruding into the sky. It doesn\'t belong there. It doesn\'t belong nowhere in this world." So were the guard\'s words, and I would see as he saw.","Coined by the learned men of Garlond Ironworks, these massive rings were used to dampen spiritual energies, preventing the focusing of power required to wield magicks. No less than five, each measuring hundreds of yalms across, were required to keep Bahamut silent for two full eras...but even then they proved insufficient.",4878784,57,81568,81068,81452,1800,459,22,False
2162737,"Alder Springs",""So there I was, starin\' out over those naked tree limbs. Was feelin\' brave, so I thought I\'d see just how far I could go. As it turns out? Pretty far." Such were the mountaineer\'s words, and I would see as he saw.","Once a vast grove of giant alders, the flames of the Calamity reduced the area to a charred graveyard, leaving nothing of the ancient holt but its name.",4878790,57,81569,81069,81452,800,1159,22,False
2162738,"Castrum Marinum",""Say what you will about our foe, you can\'t deny that the architecture of their outposts has a certain ghastly charm. I would have enjoyed the sunset a while longer, but the cohort doesn\'t take kindly to tourists." Such were the scout\'s words, and I would see as he saw.","Situated atop the roiling Rhotano Sea between Aldenard and the eastern coast of Vylbrand, Castrum Marinum serves as the southernmost outpost for the Garlean Empire's XIVth Legion. The cohort stationed on this man-made floating island is primarily tasked with the resupplying of imperial army cohorts deployed in the La Noscea and Thanalan theaters. ",4879319,42,81604,81104,81453,1700,1759,22,False
2162739,"Vesper Bay","Overheard in a tavern: "Go where the wealthy go and do what they do, and sooner or later their good fortune will rub off on you. That said, the merchant wasn\'t too happy when I climbed atop his estate for a better view..."","A bustling port city strategically situated on the western coast of Thanalan and maintained using funds generously provided by Syndicate chairman Lolorito, Vesper Bay serves as a gateway in and out of sultanate-controlled lands. The colossal bronze statue in the main plaza is said to be an exact likeness of said chairman (when viewed from afar).",4879321,42,81605,81105,81453,1200,1659,27,False
2162740,"Black Brush Station",""A modern marvel she may be, but a right bitch to keep runnin\'. I couldn\'t tell you how many hours I\'ve spent surveyin\' from all directions and altitudes. You can have the view, just give me a good night\'s sleep!" Such were the railroad man\'s words, and I would see as he saw.","A marvel of modern innovation, the steam engine has transformed the mining industry, increasing efficiency and profits thrice over. It has also led to the transformation of what was once a thinly manned aetheryte outpost into a thriving crossroads of labor and commerce\xe2\x94\x80a new pillar to support the thriving Ul'dahn economy.",4879611,43,81607,81107,81453,1800,459,22,False
2162741,"Gate of Nald","Overheard on the streets: "Lost me job, me family\xe2\x94\x80and any coin I could spend to drown me sorrows. And so I stood atop the canvas, looking out over the wasteland of me life."","One of three main portals accessible by the general populace, the Gate of Nald is wide enough for two fully burdened chocobo carriages to enter abreast and still leave room for the flanking gateguards. Her Royal Majesty Nanamo Ul Namo has commanded that the portcullis remain open night and day, so as to welcome all who would partake of Ul'dah's wonders.",4879612,43,81608,81108,81453,1200,1659,50,False
2162742,"The Burning Wall","Overheard in an alehouse: "Standing atop the crystal affords you the best view of the place, if you\'re brave enough to make the climb..."","Once an unscalable precipice severing eastern Thanalan from the Grand Wake, the Burning Wall earned its name for the deep-red glow it would emit each evening as the sun set. Toppled by the Calamity, that cliff no longer exists\xe2\x94\x80in its place a queer forest of crystalline sentinels and malformed creatures shunned by nature itself.",4879625,44,81612,81112,81453,1200,1659,22,False
2162743,"The Golden Bazaar",""A ghost town? Hah! Mark my words, I\'ll make my fortune there. When the sun is high, I climb atop the fencing and survey the land for untapped veins of ore." Such were the miner\'s words, and I would see as he saw.","Once a waypoint for traders making the journey between Gridania and Ul'dah, the rise of settlements such as Camp Drybone and Highbridge have all but rendered the once prospering hamlet a ghost town. Rumors of mythril deposits in the nearby mountains and treasure in the ruins of the Invisible City, however, may work to rekindle this dying ember.",4879626,44,81613,81113,81453,800,1159,22,False
2162744,"Thal's Respite",""Those who do not pay proper obeisance will find their fortunes all too fleeting. Those who do will feel the tears of mercy washing over them like the pouring rains." Such were the initiate\'s words, and I would see as he saw.","Overseer of wealth in the afterlife, proper obeisance to the Trader, Thal, is required for those who wish to take belongings accumulated in this world to the hereafter. Thal's Respite is oft used by stout devotees of the Order of Nald'thal as a place of fasting and prayer, but its distance from Ul'dah prevents all but the most affluent from making the journey.",4879627,44,81614,81114,81453,1800,459,58,False
2162745,"Nald's Reflection",""Those who do not pay proper obeisance will find fortune ever elusive. Those who do will see the fog lifted, and know the joys of abundance." Such were the initiate\'s words, and I would see as he saw.","Overseer of wealth and commerce upon the corporeal plane, it is believed that through fervent worship of the Trader Nald, one will reap immeasurable fortune in one's living years. Prince and pauper alike once made pilgrimages to this remote place of prayer in search of prosperity...until, that is, Milvaneth Sacrarium opened a new (toll-based) temple within Ul'dah.",4879628,45,81615,81115,81453,500,759,58,False
2162746,"Zahar'ak",""Some call the sight bleak, but to me it\'s a thing of beauty. The winds pound away at the hills, but strong we stand\xe2\x94\x80our gaze locked on our foe." Such were the sentry\'s words, and I would see what he saw.","Loosely translated as \xe2\x80\x9cland of perseverance,\xe2\x80\x9d Zahar'ak is a forward stronghold for the Amalj'aa host based in Zanr'ak. The beast tribe believes the scorched plains of Thanalan to be hallowed ground blessed by the cleansing flames of their primal deity, Ifrit, and as such are intent on driving from the land all whom they deem invaders.",4879629,45,81616,81116,81453,500,759,22,False
2162747,"The Sagolii Desert",""After a fortnight of wandering, I found myself under the searing sun, looking out upon the ruins of Allag. It was then I swore to myself: I will not succumb\xe2\x94\x80not this day." Such were the wayfarer\'s words, and I would see what he saw.","According to the Sons of Saint Coinach, the Sagolii Desert was once a verdant sea of lush plains capable of sustaining great civilizations, as is evidenced by the ruins recently discovered in the area. How such a place devolved into a lifeless desert remains a mystery, but recent disaster tells us an ancient calamity is the likely culprit.",4879630,45,81617,81117,81453,1200,1659,22,False
2162748,"The Sunken Temple of Qarn","Overheard in a tavern: "...Ah, a fellow antiquarian! There\'s a slanted stone slab that affords you the best vantage point of the ruins."","Most scholars of ancient Belah'dian civilization claim this twisting labyrinth of complex chambers to be a place of worship dedicated to the sun goddess, Azeyma. Recent diggings, however, have uncovered older chambers buried beneath the new containing relics not of the Sixth Astral Era, suggesting that the temple may have been built by a different people.",4879631,45,81618,81118,81453,1200,1659,22,False
2162749,"Minotaur Malm",""Beads of sweat flying from their broad shoulders, massive muscles tightening and loosening\xe2\x94\x80no, I\'ve not seen a finer sight in all the realm." Such were the warrioress\'s words, and I would see what she saw.","Local legend has that long ago, a young goatherd leading his pack to water at Forgotten Springs was set upon and chased a full malm through these caves by a minotaur. There has yet to be a second sighting of the creature, but the stories are enough to frighten away most who would consider passage through this trading post used by the Seventy-Seven Caravans.",4879632,45,81619,81119,81453,500,759,30,False
2162750,"East Watchtower",""On the watch, slumber\'s siren call is your greatest foe. When I feel myself drifting off at my post, I envision my commander standing before me, and put the fear of the gods in myself." Such were the sentry\'s words, and I would see what he saw.","To power their legions of warmachina, the Garleans require a steady supply of the aether-based fuel known as ceruleum. Bluefog housing the largest deposit in Eorzea, the Empire has begun their own mining operation but a stone's throw from the allied refineries, heightening tensions in the area and prompting the construction of two watchtowers.",4879633,46,81620,81120,81453,500,759,31,False
2162751,"Ceruleum Pipeline",""My duties include keeping the portcullis well oiled. A right fine view on a clear day, but don\'t lose your balance\xe2\x94\x80it\'s a long way down." Such were the soldier\'s words, and I would see what he saw.","Even before airships and engines were commonplace in Eorzea, Amajina & Sons Mineral Concern recognized the potential value of ceruleum and laid claim to nearly all of the untapped deposits in northern Thanalan. In an ironic twist, for many years before the Garlean invasion, the Concern's biggest customer was, in fact, the imperial army.",4879634,46,81621,81121,81453,1800,459,22,False
2162752,"Bluefog",""Fog ain\'t supposed to be blue, least not where I come from\xe2\x94\x80gives me the creeps. On such rare occasions as it clears up, I look upon the valley from on high. Simple pleasure, but it keeps me from losin\' my bloody mind." Such were the laborer\'s words, and I would see what he saw.","Though abundant on the northern continent of Ilsabard, only a handful of ceruleum deposits have ever been discovered on Aldenard, the largest being buried under the Sea of Spires in northern Thanalan. Ceruleum is a highly unstable substance and will begin to evaporate when in contact with air, resulting in the bluish haze from which this area earns its name.",4879635,46,81622,81122,81453,1200,1659,22,False
2162753,"Raubahn's Push",""Even in the wind and swirling snow, the talons are unmistakable, clutching toward the skies. Don\'t ask what compelled me to climb to the very tip of one, but I can tell you the sight was something to behold." Such were the sentry\'s words, and I would see what he saw.","In the final days of the Sixth Astral Era, the ceruleum fields of northern Thanalan proved to be one of the most hotly contested areas in all Eorzea, with the Empire amassing a giant host outside of Bluefog to seize control of the local fuel refineries. Though outnumbered three to one, Raubahn and his army succeeded in \xe2\x80\x9cpushing\xe2\x80\x9d back the enemy.",4879636,46,81623,81123,81453,800,1159,22,False
2162754,"Abandoned Amajina Mythril Mine",""I didn\'t know what those madmen were going to do with me, and I wasn\'t about to find out. When the fog descended, I snuck out across a collapsed pillar. Lucky to be alive, though I do wish I\'d had the luxury to enjoy the view." Such were the adventurer\'s words, and I would see what he saw.","The discovery of mythril in a small copper mine in Bluefog triggered the Great Rush which saw would-be prospectors flock to the Sea of Spires in search of quick and easy fortune. The veins that ran through the mountains, however, were not deep, and it was but ten summers before the mines ceased to yield the precious metal, forcing many to abandon their claims. ",4879637,46,81624,81124,81453,1800,459,22,False
2162755,"The Nail",""I suppose the view is impressive, yes, but it\'s rare that I have a moment to appreciate it. Too much work to be done before the sun goes down." Such were the draughtsman\'s words, and I would see what he saw.","As is described in the \x02\x1a\x02\x02\x03Enchiridion\x02\x1a\x02\x01\x03, to ensure the realm of man did not drift apart from the firmament, Halone struck the Nail through both, ever binding the two. And though assailed on all sides by great metal shards fallen from the lesser moon Dalamud's crust, the ancient peak remained standing, a testament to the land's life force.",4879638,63,81651,81151,81454,1700,1759,22,False
2162756,"The Observatorium","Overheard at a tavern: "It wasn\'t what you could call me finest hour. I slipped and fell, and snagged me garments on something-or-another. I was enjoying the sight\xe2\x94\x80till I realized how damned ridiculous I\'d look if anyone came upon me. Dusted meself off and went on me way."","Three hundred years ago, Ishgardian astrologian Adaunel the Younger convinced the Holy See that he could predict the comings and goings of the Dravanian Horde by studying the movements of the heavens, and thus secured funding for the construction of the First Dicasterial Observatorium of Aetherial and Astrological Phenomena and its grand astroscope.",4879639,63,81652,81152,81454,1800,459,22,False
2162757,"The Frozen Fang",""From on high, I looked down upon the dread carcass. Ah, to have been the hero who pierced the wyrm\'s heart with a ballista that day! The mere thought stirred my blood on the coldest of days." Such were the knight\'s words, and I would see what he saw.","In years past, the hot alpine summers would have seen this fallen Dravanian outflyer blown with maggots and reduced to bones in a matter of days. Now, in the endless winter wrought by the Calamity, the carcass rests in the permafrost under a thick blanket of snow, perfectly preserved since the day he was pierced through the heart by a ballista.",4879640,63,81653,81153,81454,800,1159,22,False
2162758,"The Holy See of Ishgard",""I look upon my homeland, its proud spires soaring in the azure, and swear a silent oath. My spear shall not leave my hand until the last dread wyrm has fallen." Such were the knight\'s words, and I would see what he saw.","For the past thousand years, Ishgard has waged a bloody war with the dragons of Dravania. To fend off the enemy horde, a complex web of defenses, magical and corporeal, has been added piecemeal to the city proper's outer walls, transforming her into an impenetrable bastion, while at the same time, isolating her and her people from the outside world.",4879641,63,81654,81154,81454,500,759,22,False
2162759,"Boulder Downs",""In the shadow of those unholy rocks, the mightiest giant will look as a dwarf. Yet from the right vantage point, even one of humble stature can look upon them all." Such were the knight\'s words, and I would see as he saw.","Before the Calamity, Boulder Downs was a vast sloped lea littered with moraine deposited by realm-swallowing glaciers long receded. The rain of debris that accompanied the fall of Dalamud, however, transformed the landscape into a frozen wasteland pocked with gaping impact craters and peculiar dark matter formations.",4879642,63,81655,81155,81454,1700,1759,22,False
2162760,"The Fury's Gaze",""Dragons, heretics\xe2\x94\x80I\'ve stared into the eye of many a foe. Stone has no eyes, yet no other gaze can pierce me to the very depths of my soul." Such were the knight\'s words, and I would see as he saw.","A place holy to all Ishgardians, it is believed that when a man stands within this hidden grotto, the Fury Herself will reach deep into the darkest recesses of his soul and lay out his sins before him, allowing the man to repent those failings. The Monument Tower nearby was built to protect this hallowed ground from the taint of dragons and heretics.",4879643,63,81656,81156,81454,1800,459,22,False
2162761,"Snowcloak",""As I stood there, my thoughts turned to those left behind in the west. The sun shone strong, yet it could not keep my tears from turning to ice on my cheeks." Such were the researcher\'s words, and I would see as she saw.","The bitter cold which swept over the Coerthas highlands following the Calamity did not only blanket the region in snow and ice, but transformed the water of Twinpools and the Swiftrun into a mountainous flow of ice\xe2\x94\x80a flow which has slowly crept through the western Coerthas highlands and now has completely engulfed Gargoyle Crossing, preventing passage.",4879644,63,81657,81157,81454,800,1159,22,False
2162762,"Camp Dragonhead",""Clearing the parapets after a snowfall is arduous work, but gazing out over the hoar-kissed peaks, a man might forget his aches and pains for a while." So were the knight\'s words, and I would see as he saw.","Its name taken from a rocky outcropping said to be the head of a Dravanian king turned to stone by the almighty hand of Halone, this outpost acts as the Coerthas central highlands' southernmost line of defense for the Holy See, tasked with fending off Ixali raids from Natalan, skirmishes by heretic factions, and the occasional yeti scare.",4879645,63,81658,81158,81454,1200,1659,22,False
2162763,"The Steel Vigil","Overheard in a tavern: "...Bollocks, I say! Ye haven\'t truly seen the Vigil until ye\'ve seen it from that very spot. Ye\'ll be wantin\' to tread carefully, mind ye."","One of four citadel watchtowers built along the Sea of Clouds, the Steel Vigil warned the Holy See of aerial attacks for centuries before being razed and gutted by the Dravanian Horde and their vile commander, Svara. Now, only the outer walls remain, leaving a bitter reminder of the dragons' destructive power.",4879646,63,81659,81159,81454,500,759,22,False
2162764,"Castrum Centri",""It\'s unnatural, is what it is\xe2\x94\x80roads and towers made of metal\xe2\x94\x80and yet I couldn\'t avert my eyes. Then I heard the great steel beast rousing in the distance, and thought I\'d best be on my way." Such were the scout\'s words, and I would see as he saw.","Castrum Centri was erected with material salvaged from the ruins of Castrum Novum\xe2\x94\x80the Garlean Empire's first major outpost in Eorzea, constructed in the final year of the Sixth Astral Era by VIIth Legion legatus Nael van Darnus. It houses several ceruleum mining pits, a magitek manufactory, and the Phantom Train, used to transport ordnance to outlying castra.",4879647,67,81701,81201,81455,1200,1659,22,False
2162765,"The Crystal Tower",""It was a scene not of this world: a forest of crystal, and in the distance a spire that stretched so high it could have touched the heavens..." Such were the adventurer\'s words, and I would see as she saw.","As if somehow beckoned forth from its hypogeal prison by the events of the Calamity, this sky-scraping spire now commands the Mor Dhonan horizon. Through their research, the Sons of Saint Coinach have determined that the monolith, also known as Syrcus Tower, was constructed to collect and store the endless energies of the sun.",4879648,67,81702,81202,81455,1800,459,22,False
2162766,"Rathefrost",""In fields of crystal, I stood tall atop one of the stones and took in the view in all its shimmering desolation." Such were the adventurer\'s words, and I would see what he saw.","The fall of the \x02\x1a\x02\x02\x03Agrius\x02\x1a\x02\x01\x03 into Silvertear Falls not only drained the magnificent multi-tiered lake, but instantly crystallized the majority of the region's flora\xe2\x94\x80a result of mass quantities of ceruleum fuel reacting with aether released upon Midgardsormr's death. What remains is a brilliant, yet dead landscape akin to a twisted garden pocked with blooming geodes.",4879649,67,81703,81203,81455,1200,1659,22,False
