2162688,"Barracuda Piers",""Under the azure, I gazed down upon warships three, their billowing sails of crimson leaving no doubt as to who truly rules the seas." Such were the merchant\'s words, and I would see as he saw.","These docks provide safe mooring for the Thalassocratic Navy's principal squadrons, also known as the Crimson Fleet. To prevent sabotage, admittance to the area is forbidden to the general citizenry; however, on clear days, one may catch a glimpse of the armada flagship, the \x02\x1a\x02\x02\x03Triumph\x02\x1a\x02\x01\x03, from atop one of Limsa Lominsa's myriad spans.",4876856,27,81501,81001,81451,800,1159,22,True
2162689,"The \x02\x1a\x02\x02\x03Astalicia\x02\x1a\x02\x01\x03",""A flagon or two o\' grog havin\' filled me \'ead with big ideas, I eyed that \'ive o\' villainy from the pier, feelin\' as if I could cut down One-eyed Hyllfyr \'imself. Woke the next mornin\' strung up by me ankles. Aye, was lucky to escape with me life." Such were the buccaneer\'s words, and I would see as he saw.","Registered as a trade vessel hailing from foreign waters, this battle-scarred warship captained by the lord of the region's underworld, One-eyed Hyllfyr, serves as a gathering place for brigands, cutthroats, and the purveyors of sundry other breeds of villainy. It is here that the city-state's many pirate crews find new recruits to join their ranks.",4876859,27,81502,81002,81451,1800,459,22,True
2162690,"Seasong Grotto",""In a dank cavern that\'s never known the sun, the patter of the rain me only companion, I dropped to one knee and said me farewells to me ill-fated mates. They sing no songs for fishermen, but the sea swallows us all the same." Such were the old mariner\'s words, and I would see as he saw.",bxe2\x80\x9cI am the waves that bear, I am the winds that guide.\x02\x10\x01\x03I am the evening stars, I am the morning sky.\x02\x10\x01\x03I am born of the sea, and there shall I die.\xe2\x80\x9d\x02\x10\x01\x03\x02\x10\x01\x03Nestled within a shallow cavern situated to the south of Summerford Farms sits an ancient monolith upon which is carved this, the Sailors' Requiem.",4876905,30,81503,81003,81451,500,759,58,True
2162691,"The Skylift",""Backbreakin\', arse-bustin\' work, it is. But seein\' me vessels ridin\' the winds, soarin\' off to far lands where me legs will never carry me\xe2\x94\x80well, at least me sweat and blood ain\'t been for naught, eh?" Such were the laborer\'s words, and I would see as he saw.","Once an endless expanse of flat, rocky meadows, lower La Noscea is now severed atwain by a sheer cliff known as the Descent. To maintain overland trade routes from the easterly outposts of Aleport and Bronze Lake, Lominsan engineers created the Skylift\xe2\x94\x80a tower of wooden scaffolding outfitted with pulleys, winches, and lighter-than-air balloons.",4876907,30,81504,81004,81451,1200,1659,22,True
2162692,"La Thagran Eastroad",""When the skies turn grey and spirits sag, I climb high and look upon roads blazed long ago. I turn my thoughts to the hardships of my forebears till mine own worries drift away, and I find strength to carry on." Such were the sentry\'s words, and I would see as she saw.","When the \x02\x1a\x02\x02\x03Galadion\x02\x1a\x02\x01\x03 fell victim to the Navigator's fury and ran aground on the southern shores of Vylbrand seven hundred years ago, it was her two helmsmen, Jean De Nevelle and Guy La Thagran, who were tasked with exploring the newfound island\xe2\x94\x80the former heading east, the latter, west. To this day, their routes still serve as La Noscea's two main thoroughfares.",4876912,30,81505,81005,81451,800,1159,22,True
2162693,"The Salt Strand",""Under the watchful gaze of the Wanderer, I cast a line to waters far below. Looking upon those pillars, grotesque and beautiful, my thoughts drift to that fateful day five years ago." Such were the fisher\'s words, and I would see as she saw.","When struck by a fallen shard from Dalamud's outer shell, a massive amount of concentrated aether was released from just below the surface of the Rhotano Sea, immediately fusing with and crystallizing the towering fount of salt water which was expelled during the impact. City-state-funded exploratory forays into the inner crater have all yet to return...",4876920,31,81508,81008,81451,1800,459,22,True
2162694,"Red Rooster Stead",""No romance in the farmin\' life? Balderdash, I say! Rise at dawn, climb atop the gate, and look upon the dew-kissed fields below\xe2\x94\x80then tell me there\'s any place in the realm ye\'d rather be." Such were the farmer\'s words, and I would see as he saw.","The farmers on the Red Rooster Stead will rarely shy from testing their agricultural acumen on exotic crops or untested growing methods, and take pride in their willingness to sacrifice a harvest if it means a better yield an autumn hence. The plantation's name is said to be taken from the bloody cockfights held after nightfall by the gamekeeps.",4876921,31,81509,81009,81451,500,759,22,True
2162695,"Brewer's Beacon",""When dawn breaks, I quench the flame and pour meself an ale. I step outside, and lose meself in the blue expanse above and below\xe2\x94\x80me hard-earned reward for the ships I\'ve seen to safety, I reckon." Such were the candlekeep\'s words, and I would see as he saw.","This relatively new lighthouse was built soon after the Calamity claimed Swiftperch Tower to ensure safe passage for trade vessels carrying shipments of dark stouts and blonde barleywines out of Aleport. In addition, the candlekeeps also keep watch for increasingly frequent rogue tidal waves caused by the stirrings of the Lord of the Whorl.",4876926,33,81513,81013,81451,500,759,22,True
2162696,"The Leatherworkers' Guild",""Knew it was my calling ever since I was knee-high to a goobbue. When cloudy days sunk my spirits, I\'d sneak into the guild, climb as high as my legs could carry me, and watch the tanners and tawers at work below." Such were the craftsman\'s words, and I would see as he saw.","Crafters for the realm-famous Atelier Fen-Yll, the Leatherworkers' Guild boasts the finest tawers and tanners in all Eorzea. In recent years, the workshop has come to be known for its Geva patterns, which outline methods of working and cutting hides, pelts, skins, and furs in a way that honors the elementals within by minimizing waste.",4868036,51,81552,81052,81452,1200,1659,22,True
2162697,"Apkallu Falls",""My favoritest place is where I can see the falling water. There\'s a secret path that only I know. I snuck out of bed to go there last night. Mum and Dad made me promise I wouldn\'t climb up there anymore\xe2\x94\x80you won\'t tell them, will you?" Such were the little boy\'s words, and I would see as he saw.","Named after a failed attempt by an ambitious Gridanian merchant to hatch and breed apkallus in the linn, Apkallu Falls is most remembered for serving as a place of meditation for the late Louisoix Leveilleur, Circle of Knowing Archon and hero of Eorzea.",4876928,51,81553,81053,81452,1800,459,22,True
2162698,"Bentbranch Meadows",""Cute little bugger, isn\'t he? The moogle, that is. Seein\' him up there on a clear day, swayin\' gently in the wind, it\'s enough to lull a man to slumber. Me, I settle for a stump and a moment\'s repose." Such were the stablehand\'s words, and I would see as he saw.","Once Moogle's Gift Mounts was established and its rookery stocked with Ishgard's finest birds, it was not long before an entire settlement had grown up around the stables. The trademark balloon tethered to the main building is actually an Ixali war vessel claimed by chocobokeeps after it became tangled in a nearby tree and was abandoned by its riders.",4877070,54,81555,81055,81452,1200,1659,52,True
2162699,"The Sanctum of the Twelve",""I\'ve never been the pious type, but when the sun strikes those windows and the trees in the gardens glisten, even I find myself mouthing a prayer from time to time." Such were the botanist\'s words, and I would see as he saw.","This sky-scraping ivory cathedral was built following the Age of Endless Frost\xe2\x94\x80a dark period in which the realm was overrun with famine and disease\xe2\x94\x80to serve as a place of refuge and respite for all who sought succor. Soon after, however, it fell into ruin and was all but forgotten...until the advent of the Seventh Umbral Era saw need for its rise once again.",4877071,55,81560,81060,81452,800,1159,58,True
2162700,"Little Solace",""To know the sylph, you must be the sylph. I may lack for wings, but a short climb will put me in a similar position. Lights dancing in the dark before me, I ponder what mischief I might make\xe2\x94\x80er, were I a sylph, that is." Such were the scholar\'s words, and I would see as he saw.","Little is the solace granted to those sylphs who would voice their opposition to the summoning of the Lord of Levin. Little is the solace bequeathed upon those who would abandon their homes in the Sylphlands and shun their frenzied brethren. Thus, it is only through fraternity that those sylphs may ultimately find solace, however little it may be.",4877072,55,81561,81061,81452,1800,459,22,True
2162701,"Royal Promenade",""Come morning, when my watch is over, I stand upon the three plates of silver depicting the first three of our kind. Paying reverence to those who came before us, I salute my sworn brothers who stand before me." Such were the Sultansworn\'s words, and I would see as he saw.","In times when the sultan had sole rule over the city-state, the Promenade would serve as an ersatz waiting chamber for those petitioners who sought audience with His Resplendence in the Fragrant Chamber. Now, with power in the hands of the Syndicate, the round is empty, save for the occasional tryst betwixt young nobles.",4877073,39,81601,81101,81453,500,759,31,True
2162702,"The Gold Court",""Even the strings of the tightest purse loosen upon seeing my famed balancing act. From vaulted gardens I leap onto the eastmost streetlamp, then bask as dour, cloudy expressions break into smiles and a shower of gil." Such were the acrobat\'s words, and I would see as he saw.","A large atrium in the heart of Ul'dah, the Gold Court's opulence and scale make it a popular meeting place for the city's elite. The plaza was once reserved for the sultan's private balls, but has since been opened to the public due to a lack of funds to maintain the majestic hanging fountain at her center.",4877074,39,81602,81102,81453,1200,1659,22,True
2162703,"The Jewel of the Desert",""From a vantage point high above Nophica\'s Wells, I looked out upon Ul\'dah in all its glory\xe2\x94\x80truly a jewel in the desert, shining brighter than a sea of stars." Such were the adventurer\'s words, and I would see as she saw.","The commercial hub of Ul'dah is organized strategically around the dome-shaped citadel at its center. Its towering fortifications and protective outer walls bedighted with myriad glass panes and colorful mosaics are visible for malms in all directions, and serve as a stark yet dazzling deterrent to would-be besiegers.",4877077,42,81603,81103,81453,1800,459,22,True
2162704,"The Ruins of Sil'dih",""The fog was so thick you could cut it with a blade. My foot slipped, and in an eyeblink I was sprawled out on a cliff, the ruins of a buried city before me. Sadly, the stinging pain in my arse detracted somewhat from my enjoyment of the scenery." Such were the adventurer\'s words, and I would see as he saw.","The city-states of Ul'dah and Sil'dih coexisted for generations until four hundred years ago when bad blood festering betwixt the two sultanates culminated in the War of the Sisters\xe2\x94\x80leaving Sil'dih a smoldering pile of rubble to be claimed by the shifting desert sands. The subsequent relocation of Ul'dah placed the city-state nearly directly above her fallen sibling.",4877078,43,81606,81106,81453,800,1159,22,True
2162705,"The Lonely Giant",""Merciful are the rains that fall, for they give succor to the thirsting land, and comfort the old wounds of one who journeyed too far from home." Such were the botanist\'s words, and I would see as she saw.","Local legend claims the Lonely Giant is everything from the ghost of a Sil'dihn sultan, to the prototype for a new model of Garlean machina. Ul'dahn scholars, however, simply believe him a Coerthan goobbue who lost his bearings during the chaos of the Calamity, and after a long journey through the Black Shroud, died of exhaustion upon reaching Thanalan.",4877079,44,81609,81109,81453,1700,1759,9,True
2162706,"The Invisible City",""As I felled my quarry atop a great stone slab, my eyes drifted up to a city swallowed by the clouds and the mountain itself. I know not who once called it home, nor why it fell, but it was a sight to behold." Such were the adventurer\'s words, and I would see as he saw.","Buried under nearly a malm of solid rock, if not for a gaping rent torn open by the Calamity, these ancient ruins may have gone undiscovered for another thousand summers. Scholars sent to Highbridge to study the site are currently of a mind that the structures are not a city, but in fact the tomb of one Lalafuto IV, famed sultan of Belah'dia.",4877081,44,81610,81110,81453,800,1159,22,True
2162707,"Highbridge",""En route from Ul\'dah to Gridania, I sought lodgings at Highbridge. Setting out at first light, I looked out upon the wise men of old\xe2\x94\x80at least they looked wiser than me\xe2\x94\x80and asked for guidance in my travels." Such were the merchant\'s words, and I would see as he saw.","After the Calamity rent eastern Thanalan asunder, one of the first projects commissioned by the Syndicate was the construction of a bridge to span the newly formed chasm and restore the trade route with lands transpontine. The city which has sprung up along its edges is populated almost solely by scholars investigating the nearby ruins of the Invisible City.",4877082,44,81611,81111,81453,500,759,58,True
2162708,"Woad Whisper Canyon",""Don\'t tell Baderon, but if ye ask me, ye\'ll find no better place to down a flagon of ale than where the water dances, keepin\' ye cool on even the \'ottest summer\'s day." Such were the laborer\'s words, and I would see as he saw.","Little more than a shallow valley but five years past, Woad Whisper Canyon was carved into a gaping gorge in a matter of moons after the Calamity drained Bronze Lake and dramatically altered the course of the Nym River. On hot days, laborers from both Summerford Farms and the Skylift will oft take respite in the cool mists of the falls...if not met by bandits.",4877083,30,81506,81006,81451,1200,1659,22,False
2162709,"Summerford Farms","Overheard at a tavern: "Erstwhile pirates taken to land, drunk on ale and tales of wenches and plunder, climb atop lamps as if they were manning the crow\'s nest of a great vessel..."","When Merlwyb Bloefhiswyn rose to Admiral, one of her first decrees included the clearing of large swathes of land for new Lominsan settlements. Summerford Farms and its expansive orange groves is one of those locations\xe2\x94\x80its name is derived from the man-made crossings required when late spring runoff from Mt. O'Ghomoro causes the Rogue River to swell.",4877084,30,81507,81007,81451,500,759,22,False
2162710,"The Grey Fleet",""I took refuge inside to get away from the rain. To my ill fortune, the beastmen had the same idea. Quickly, I climbed to the roof and plotted a course of escape. Quite a view, though staying alive was a far more pressing concern at the time." Such were the merchant\'s words, and I would see as he saw.","Sitting high atop Widow Cliffs on the southeastern coast of Vylbrand, the Grey Fleet was built to harness the constant southerly winds funneled down through the Strait of Merlthor, and use them to power the many mills which grind the region's wheat and full its wool.",4877085,31,81510,81010,81451,1200,1659,22,False
2162711,"Hidden Falls",""The ogling from the men as they recline burns brighter than the summer sun. I don\'t mind much, provided they\'re handsome...and wealthy doesn\'t hurt either." Such were the young lady\'s words, and I would see as she saw.","Sheltered on three sides by towering cliffs, Hidden Falls can be found several score yalms upstream from where the Agelyss River empties into the Strait of Merlthor. Taken by its beauty, Ul'dahn plutocrat Gegeruju was quick to purchase the land and construct a stage upon which private performances for the magnate's favored clients are held.",4877087,32,81511,81011,81451,800,1159,50,False
2162712,"Gullperch Tower",""The rains may cloud our view, but they won\'t stop those who would invade our shores. And so we climb high, scouring the horizon for any sign of danger." Such were the lookout\'s words, and I would see as he saw.","One of three beacons built along the La Noscean coast in the Sixth Astral Era, Gullperch Tower is the easternmost\xe2\x94\x80warning ships navigating the Strait of Merlthor of its deadly shallows, while also serving as a watchtower for pirate and Sahagin raids on Bloodshore.",4877088,32,81512,81012,81451,1800,459,22,False
2162713,"The Navigator",""I\'ve no wife, an\' no mind to take one\xe2\x94\x80the only child I\'ll ever know is the ale I brew. And so, as the cargo ships pull out of the harbor, I say a prayer to the watcher of seas, that She\'ll see me sons safe to someone\'s belly somewhere." Such were the brewer\'s words, and I would see as he saw.","Carved centuries past by a famous Roegadyn sculptor, this massive stone effigy located in the center of Aleport's lower plaza serves as hallowed ground upon which sailors might offer solemn prayers to the watcher of the seas before embarking on their journeys across the untamed deep. ",4877089,33,81514,81014,81451,1700,1759,58,False
2162714,"The Ship Graveyard",""If yer wise, ye won\'t look too closely. It\'s not just flotsam the dark tides drag in, and there are sights what could haunt the bravest of men for life. Aye, ye\'ll not catch me dead going there\xe2\x94\x80least of all at night." Such were the lighthouse keeper\'s words, and I would see as he saw.","For centuries, ships wrecked off the shores of southern Vylbrand have been carried upon currents to this quiet inlet\xe2\x94\x80a timeless reminder of the Deep's boundless wrath. So many are the wooden corpses which populate this watery lichyard, it is said that for every hull visible above the waves, a score more slumber beneath.",4877090,33,81515,81015,81451,1800,459,22,False
2162715,"Camp Skull Valley","Overheard at an inn: "There\'s an outpost with quite a view of the land, but you\'ll want to steel yourself well if you mean to go there..."","Now a strategic outpost for the Maelstrom, Camp Skull Valley was once but a circle of tents occupied by a meager Yellowjacket unit charged with surveilling the area for kobold incursions. Those beastmen foolish enough to venture down from O'Ghomoro were slaughtered and beheaded\xe2\x94\x80their skulls put on display as a warning to others.",4877091,33,81516,81016,81451,800,1159,22,False
2162716,"Tidegate","Overheard at an alehouse: "When I\'ve misplaced my goods, I climb atop the tents and scour the ground below. Offers a clear view, and you\'d be surprised at how sturdy they are..."","Taking advantage of the chaos left in the Calamity's wake, a large force of Sahagin rose from the seas and laid claim to Halfstone, a distant Lominsan settlement on the far-western edge of La Noscea. To prevent any further swells of the beastman forces, a massive wall was erected between the enemy-occupied lowlands and the allied Skull Valley.",4877092,33,81517,81017,81451,1200,1659,22,False
2162717,"Camp Bronze Lake","Overheard at a tavern: "Nothing like feeling the cool breeze on your skin after a hot bath. The view\'s nothin\' to sneeze at, either..."","The formation of great underwater fissures during the Calamity saw nearly half of the water comprising Bronze Lake vanish in the span of a single night. The result was the uncovering of ancient Nymian ruins submerged for thousands of years\xe2\x94\x80most notably, the Wanderer's Palace, a temple dedicated to the god Oschon.",4877099,34,81518,81018,81451,1700,1759,22,False
2162718,"Thalaos",""Under the burning sun, I climbed to the tip of the ancient one and turned my thoughts to the days when it roamed the deep. This was when inspiration struck..." Such were the scholar\'s words, and I would see as she saw.","Though there is no proof to support the claim, rumor has these sun-bleached remains of a long-dead denizen of the deep are those of one of the legendary twin sea serpents believed to have been unleashed by the Navigator, Llymlaen, at the dawn of eras to fill the empty seas (the other being Perykos).",4877101,34,81519,81019,81451,1200,1659,22,False
2162719,"Jijiroon's Trading Post","Overheard at a tavern: "Spent the night on that ledge, I did\xe2\x94\x80anything to escape those shelled monstrosities. Wasn\'t a bad sight, though I can\'t say I enjoyed the trip down..."","Located on the western banks of Bronze Lake, Jijiroon's Trading Post is one of two makeshift markets peddling baubles and trinkets to those brave enough to venture that deep into kobold lands. The other is Memeroon's trading post, run by Jijiroon's estranged sibling, to whom the stubborn Qiqirn merchant hasn't spoken in twenty summers.",4877103,34,81520,81020,81451,1800,459,22,False
2162720,"The Floating City of Nym",""There were islands floating in the sky, and crystals that shone like terrestrial stars. Even now, I wonder if it was but a dream..." Such were the fledgling adventurer\'s words, and I would see as she saw.","Suspended high above the foothills of Mt. O'Ghomoro is the Floating City of Nym\xe2\x94\x80central hub of a lost civilization which prospered on Vylbrand during the Fifth Astral Era. The accepted theory as to how the city was torn from the realm involves the over-aspecting of corrupted wind crystals\xe2\x94\x80a phenomenon witnessed late in the Sixth Astral Era.",4877105,350,81521,81021,81451,1800,459,22,False
2162721,"Camp Overlook","Overheard at an inn: "You\'ll want to keep a wide berth of brigands and beastmen both. There\'s a crumbling gate, overrun by shrubbery. Makes for good cover, and offers an unobstructed view of the road below\xe2\x94\x80two birds with one stone."","Manned by the \xe2\x80\x9cmeanest shite-kickin' unit in the whole damn Maelstrom,\xe2\x80\x9d Camp Overlook serves as the base of operations for the Red Swallows\xe2\x94\x80a privateer levy tasked with the surveillance of kobold activity in outer La Noscea and along the slopes of Mt. O'Ghomoro. ",4877106,350,81522,81022,81451,500,759,22,False
2162722,"U'Ghamaro Mines",""Reeks of sulfur and slumgullion, for sure, but lookin\' down from that furnace, I could swear there was somethin\' almost beautiful about the place. Either that or the fumes have gotten to me head..." Such were the soldier\'s words, and I would see as he saw.","The brilliant rainbow-colored hues that permeate the otherwise bistre slopes of O'Ghomoro are a result of the endless flow of toxic slumgullion streaming forth from the labyrinthine warrens that make up U'Ghamaro Mines. As more kobolds arrive on the surface each day, there is a scramble to construct new forges to accommodate them.",4877107,350,81523,81023,81451,1200,1659,22,False
2162723,"The Hermit's Hovel",""Someone actually lives there? I\'ll believe it when I meet the man. Still, you\'ll not find me complaining\xe2\x94\x80it\'s a fine place to sit down and rest your weary legs for a spell." Such were the adventurer\'s words, and I would see as he saw.","While few have ever seen the lord of this humble hideaway which rests precariously on the edge of an unscalable precipice\xe2\x94\x80let alone obtained his permission for entering the premises\xe2\x94\x80that has not stopped travelers from taking full advantage of the respite the location offers, whether it be a dip in the steaming pools, or a few bells' slumber on the soft goosefeather bed.",4877108,350,81524,81024,81451,1800,459,52,False
2162724,"The Carline Canopy","Overheard about town: "There\'s nothing quite like standing beside the mighty waterwheel, watching brave men and women as they come and go."","Nestled cozily within the inn known as the Roost lies the relaxing Carline Canopy, a haven for those seeking a respite from travel's travails or questing's quandaries. Figaga's Gift, the towering waterwheel found outside the caf\xc3\xa9, powers the saws and lathes of the Carpenters' Guild, and is widely considered Gridania's grandest architectural achievement.",4877111,51,81551,81051,81452,800,1159,22,False
2162725,"The Lancers' Guild",""In my early days of training, I was told to study the movements of my seniors. Climbing to what I thought the perfect vantage point, I earned no praise, only thorough scolding from my instructor." Such were the guardsman\'s words, and I would see as he saw.","Founded by legendary Wood Wailer captain Mistalle, the Lancers' Guild doubles as a headquarters for those who keep the peace within Gridania, and the greater peace without. It is to these \xe2\x80\x9cWailing Barracks\xe2\x80\x9d that people come with matters whose resolution requires a polearm's edge, and justice meted out to those who have wronged the forest or forestborn.",4868037,51,81554,81054,81452,500,759,22,False
