0,"TEXT_CMNDEFRETAINERCALL_00010_RETAINER_ENTER_1","Stets zu Diensten, \x02\x08xe9\x05\xff\x0egn\xc3\xa4dige Frau\xff\x0fgn\xc3\xa4diger Herr\x03!"
200,"TEXT_CMNDEFRETAINERCALL_00010_ACCEPT_HYURAN_FEMALE_TYPE3","Verstehe. Bin schon dabei!"
201,"TEXT_CMNDEFRETAINERCALL_00010_ACCEPT_HYURAN_FEMALE_TYPE4","Na gut. Dann will ich mal ..."
202,"TEXT_CMNDEFRETAINERCALL_00010_ACCEPT_HYURAN_FEMALE_TYPE5","Von mir aus ..."
203,"TEXT_CMNDEFRETAINERCALL_00010_ACCEPT_HYURAN_FEMALE_TYPE6","Ja, gerne. Ich geb mein Bestes!"
204,"TEXT_CMNDEFRETAINERCALL_00010_ACCEPT_ELEZEN_MALE_TYPE1","Euer Wunsch ist mir Befehl."
205,"TEXT_CMNDEFRETAINERCALL_00010_ACCEPT_ELEZEN_MALE_TYPE2","Schon verstanden, bin ja nicht bl\xc3\xb6d."
206,"TEXT_CMNDEFRETAINERCALL_00010_ACCEPT_ELEZEN_MALE_TYPE3","Ich werde mich sofort an die Arbeit machen."
207,"TEXT_CMNDEFRETAINERCALL_00010_ACCEPT_ELEZEN_MALE_TYPE4","Prima, ich flitz dann mal los!"
208,"TEXT_CMNDEFRETAINERCALL_00010_ACCEPT_ELEZEN_MALE_TYPE5","Ich guck mal, was sich da machen l\xc3\xa4sst."
209,"TEXT_CMNDEFRETAINERCALL_00010_ACCEPT_ELEZEN_MALE_TYPE6","Na, klar doch! Bin schon unterwegs."
210,"TEXT_CMNDEFRETAINERCALL_00010_ACCEPT_ELEZEN_FEMALE_TYPE1","Ich werde Euch nicht entt\xc3\xa4uschen."
211,"TEXT_CMNDEFRETAINERCALL_00010_ACCEPT_ELEZEN_FEMALE_TYPE2","Verstanden. Dann lass uns keine Zeit mit Schw\xc3\xa4tzchen verlieren."
212,"TEXT_CMNDEFRETAINERCALL_00010_ACCEPT_ELEZEN_FEMALE_TYPE3","Ich verstehe."
213,"TEXT_CMNDEFRETAINERCALL_00010_ACCEPT_ELEZEN_FEMALE_TYPE4","Mal sehen, ob ich's hinkriege!"
214,"TEXT_CMNDEFRETAINERCALL_00010_ACCEPT_ELEZEN_FEMALE_TYPE5","Ich meld mich, wenn ich fertig bin."
215,"TEXT_CMNDEFRETAINERCALL_00010_ACCEPT_ELEZEN_FEMALE_TYPE6","Dann will ich mal los!"
216,"TEXT_CMNDEFRETAINERCALL_00010_ACCEPT_LALAFELL_MALE_TYPE1","Wie Ihr w\xc3\xbcnscht."
217,"TEXT_CMNDEFRETAINERCALL_00010_ACCEPT_LALAFELL_MALE_TYPE2","Aber gerne doch."
218,"TEXT_CMNDEFRETAINERCALL_00010_ACCEPT_LALAFELL_MALE_TYPE3","Ich geb mein Bestes."
219,"TEXT_CMNDEFRETAINERCALL_00010_ACCEPT_LALAFELL_MALE_TYPE4","Ich guck mal, was ich machen kann."
220,"TEXT_CMNDEFRETAINERCALL_00010_ACCEPT_LALAFELL_MALE_TYPE5","Na gut, dann will ich mich mal aufraffen."
221,"TEXT_CMNDEFRETAINERCALL_00010_ACCEPT_LALAFELL_MALE_TYPE6","Bin schon so gut wie weg!"
222,"TEXT_CMNDEFRETAINERCALL_00010_ACCEPT_LALAFELL_FEMALE_TYPE1","Sehr wohl."
223,"TEXT_CMNDEFRETAINERCALL_00010_ACCEPT_LALAFELL_FEMALE_TYPE2","Wenn's weiter nichts ist ..."
224,"TEXT_CMNDEFRETAINERCALL_00010_ACCEPT_LALAFELL_FEMALE_TYPE3","Ich werde dich nicht entt\xc3\xa4uschen."
225,"TEXT_CMNDEFRETAINERCALL_00010_ACCEPT_LALAFELL_FEMALE_TYPE4","Dann mach ich mich mal auf die Socken!"
226,"TEXT_CMNDEFRETAINERCALL_00010_ACCEPT_LALAFELL_FEMALE_TYPE5","Ich ess kurz noch etwas, dann eile ich sofort los."
227,"TEXT_CMNDEFRETAINERCALL_00010_ACCEPT_LALAFELL_FEMALE_TYPE6","Aber sicher doch!"
228,"TEXT_CMNDEFRETAINERCALL_00010_ACCEPT_MIQOTE_MALE_TYPE1","Ich werde mich ohne Umschweife auf den Weg machen."
229,"TEXT_CMNDEFRETAINERCALL_00010_ACCEPT_MIQOTE_MALE_TYPE2","Wenn's weiter nichts ist ... Das mach ich doch mit links."
230,"TEXT_CMNDEFRETAINERCALL_00010_ACCEPT_MIQOTE_MALE_TYPE3","Ich bin schon auf dem Weg!"
231,"TEXT_CMNDEFRETAINERCALL_00010_ACCEPT_MIQOTE_MALE_TYPE4","Dann will ich mal losschlendern."
232,"TEXT_CMNDEFRETAINERCALL_00010_ACCEPT_MIQOTE_MALE_TYPE5","Aber nur, weil du es bist."
233,"TEXT_CMNDEFRETAINERCALL_00010_ACCEPT_MIQOTE_MALE_TYPE6","Danke! Endlich wieder etwas zu tun!"
234,"TEXT_CMNDEFRETAINERCALL_00010_ACCEPT_MIQOTE_FEMALE_TYPE1","\xc3\x9cberlasst das getrost mir!"
235,"TEXT_CMNDEFRETAINERCALL_00010_ACCEPT_MIQOTE_FEMALE_TYPE2","Als h\xc3\xa4tte ich nichts Besseres zu tun ... Aber gut."
236,"TEXT_CMNDEFRETAINERCALL_00010_ACCEPT_MIQOTE_FEMALE_TYPE3","Verstehe. Ich werde mich beeilen."
237,"TEXT_CMNDEFRETAINERCALL_00010_ACCEPT_MIQOTE_FEMALE_TYPE4","Mal sehen, ob ich das auch so hinbekomme."
238,"TEXT_CMNDEFRETAINERCALL_00010_ACCEPT_MIQOTE_FEMALE_TYPE5","Na, dann will ich mal. Weil du es bist."
239,"TEXT_CMNDEFRETAINERCALL_00010_ACCEPT_MIQOTE_FEMALE_TYPE6","Auf, auf! Die Pflicht ruft!"
240,"TEXT_CMNDEFRETAINERCALL_00010_ACCEPT_ROEGADYN_MALE_TYPE1","Ich werde Euch nicht entt\xc3\xa4uschen."
241,"TEXT_CMNDEFRETAINERCALL_00010_ACCEPT_ROEGADYN_MALE_TYPE2","Ausgerechnet jetzt? Dabei wollte ich gerade klar Schiff machen ... Nun gut."
242,"TEXT_CMNDEFRETAINERCALL_00010_ACCEPT_ROEGADYN_MALE_TYPE3","Ich werde mich reinh\xc3\xa4ngen."
243,"TEXT_CMNDEFRETAINERCALL_00010_ACCEPT_ROEGADYN_MALE_TYPE4","Wenn's weiter nichts ist ... Das mach ich doch mit links."
244,"TEXT_CMNDEFRETAINERCALL_00010_ACCEPT_ROEGADYN_MALE_TYPE5","Ich hatte sowieso gerade nichts Besseres vor."
245,"TEXT_CMNDEFRETAINERCALL_00010_ACCEPT_ROEGADYN_MALE_TYPE6","Dann will ich mal den Anker lichten und loslegen!"
246,"TEXT_CMNDEFRETAINERCALL_00010_ACCEPT_ROEGADYN_FEMALE_TYPE1","Ich werde tun, wie mir aufgetragen."
247,"TEXT_CMNDEFRETAINERCALL_00010_ACCEPT_ROEGADYN_FEMALE_TYPE2","Bevor ich mich an die Arbeit mache, werde ich mir noch einen kr\xc3\xa4ftigen Schluck Rum genehmigen."
248,"TEXT_CMNDEFRETAINERCALL_00010_ACCEPT_ROEGADYN_FEMALE_TYPE3","Also dann, die Arbeit ruft!"
249,"TEXT_CMNDEFRETAINERCALL_00010_ACCEPT_ROEGADYN_FEMALE_TYPE4","Das habe ich im Handumdrehen erledigt."
250,"TEXT_CMNDEFRETAINERCALL_00010_ACCEPT_ROEGADYN_FEMALE_TYPE5","Hast du niemand anderen, den du damit behelligen kannst? Na, gut ..."
251,"TEXT_CMNDEFRETAINERCALL_00010_ACCEPT_ROEGADYN_FEMALE_TYPE6","Leinen los! Die Arbeit ruft!"
252,"TEXT_CMNDEFRETAINERCALL_00010_ACCEPT_AURA_MALE_TYPE1","F\xc3\xbcr Euch gehe ich durch Feuer und Eis, \x02\x08\x17\xe9\x05\xff\nMeisterin\xff\x08Meister\x03."
253,"TEXT_CMNDEFRETAINERCALL_00010_ACCEPT_AURA_MALE_TYPE2","Na gut, das kann ich gerade noch erledigen."
254,"TEXT_CMNDEFRETAINERCALL_00010_ACCEPT_AURA_MALE_TYPE3","Betrachtet die Sache als erledigt."
255,"TEXT_CMNDEFRETAINERCALL_00010_ACCEPT_AURA_MALE_TYPE4","Wenn's weiter nichts ist. Das werd ich schon irgendwo auftreiben."
256,"TEXT_CMNDEFRETAINERCALL_00010_ACCEPT_AURA_MALE_TYPE5","Ich will's versuchen, aber versprechen tu ich nichts."
257,"TEXT_CMNDEFRETAINERCALL_00010_ACCEPT_AURA_MALE_TYPE6","Aber gerne doch! Ich werde jeden Stein umdrehen, bis ich's habe."
258,"TEXT_CMNDEFRETAINERCALL_00010_ACCEPT_AURA_FEMALE_TYPE1","F\xc3\xbcr Euch gehe ich durch Feuer und Eis, \x02\x08\x17\xe9\x05\xff\nMeisterin\xff\x08Meister\x03."
259,"TEXT_CMNDEFRETAINERCALL_00010_ACCEPT_AURA_FEMALE_TYPE2","Aber sicher doch."
260,"TEXT_CMNDEFRETAINERCALL_00010_ACCEPT_AURA_FEMALE_TYPE3","Sehr wohl, ich werde nichts unversucht lassen."
261,"TEXT_CMNDEFRETAINERCALL_00010_ACCEPT_AURA_FEMALE_TYPE4","Dann mal los, ich kann's kaum erwarten."
262,"TEXT_CMNDEFRETAINERCALL_00010_ACCEPT_AURA_FEMALE_TYPE5","Versprechen kann ich nichts, aber ich werd's versuchen."
263,"TEXT_CMNDEFRETAINERCALL_00010_ACCEPT_AURA_FEMALE_TYPE6","Kein Thema! Ich wei\xc3\x9f auch schon, wo ich anfange zu suchen."
264,"TEXT_CMNDEFRETAINERCALL_00010_COMPLETE_HYURAN_MALE_TYPE1","Ich habe alles erledigt. Ein Kinderspiel, wenn mir die Bemerkung gestattet ist."
265,"TEXT_CMNDEFRETAINERCALL_00010_COMPLETE_HYURAN_MALE_TYPE2","Na, was sagst du jetzt, \x02\x08\x11\xe9\x05\xff\x07Chefin\xff\x05Chef\x03? Bin ich gut?"
266,"TEXT_CMNDEFRETAINERCALL_00010_COMPLETE_HYURAN_MALE_TYPE3","Hier, bitte sehr."
267,"TEXT_CMNDEFRETAINERCALL_00010_COMPLETE_HYURAN_MALE_TYPE4","So, da h\xc3\xa4tten wir die fette Beute."
268,"TEXT_CMNDEFRETAINERCALL_00010_COMPLETE_HYURAN_MALE_TYPE5","Das sollte gen\xc3\xbcgen, oder?"
269,"TEXT_CMNDEFRETAINERCALL_00010_COMPLETE_HYURAN_MALE_TYPE6","Alles paletti?"
270,"TEXT_CMNDEFRETAINERCALL_00010_COMPLETE_HYURAN_FEMALE_TYPE1","Ich hoffe, Euch wohl gedient zu haben."
271,"TEXT_CMNDEFRETAINERCALL_00010_COMPLETE_HYURAN_FEMALE_TYPE2","Mach's nicht sofort kaputt, h\xc3\xb6rst du?"
272,"TEXT_CMNDEFRETAINERCALL_00010_COMPLETE_HYURAN_FEMALE_TYPE3","Es war mir ein Vergn\xc3\xbcgen."
273,"TEXT_CMNDEFRETAINERCALL_00010_COMPLETE_HYURAN_FEMALE_TYPE4","Wenn etwas nicht stimmt, kannst du mir es ja n\xc3\xa4chstes Mal sagen."
274,"TEXT_CMNDEFRETAINERCALL_00010_COMPLETE_HYURAN_FEMALE_TYPE5","Das w\xc3\xa4r's dann."
275,"TEXT_CMNDEFRETAINERCALL_00010_COMPLETE_HYURAN_FEMALE_TYPE6","Hab ich das nicht toll gemacht?"
276,"TEXT_CMNDEFRETAINERCALL_00010_COMPLETE_ELEZEN_MALE_TYPE1","Ich hoffe, alles zu Eurer Zufriedenheit erledigt zu haben."
277,"TEXT_CMNDEFRETAINERCALL_00010_COMPLETE_ELEZEN_MALE_TYPE2","Danken kannst du mir sp\xc3\xa4ter."
278,"TEXT_CMNDEFRETAINERCALL_00010_COMPLETE_ELEZEN_MALE_TYPE3","Ich habe alles erledigt."
279,"TEXT_CMNDEFRETAINERCALL_00010_COMPLETE_ELEZEN_MALE_TYPE4","Hoffentlich ist alles so, wie Ihr es wolltet."
280,"TEXT_CMNDEFRETAINERCALL_00010_COMPLETE_ELEZEN_MALE_TYPE5","Ich habe alles erledigt, im Schwei\xc3\x9fe meines Angesichts."
281,"TEXT_CMNDEFRETAINERCALL_00010_COMPLETE_ELEZEN_MALE_TYPE6","So, das w\xc3\xa4r geschafft! Gehen wir jetzt einen Tee trinken?"
282,"TEXT_CMNDEFRETAINERCALL_00010_COMPLETE_ELEZEN_FEMALE_TYPE1","Ist alles zu Eurer Zufriedenheit?"
283,"TEXT_CMNDEFRETAINERCALL_00010_COMPLETE_ELEZEN_FEMALE_TYPE2","Und, passt das?"
284,"TEXT_CMNDEFRETAINERCALL_00010_COMPLETE_ELEZEN_FEMALE_TYPE3","Ich habe alles erledigt wie aufgetragen."
285,"TEXT_CMNDEFRETAINERCALL_00010_COMPLETE_ELEZEN_FEMALE_TYPE4","Wie ist das? Passt das?"
286,"TEXT_CMNDEFRETAINERCALL_00010_COMPLETE_ELEZEN_FEMALE_TYPE5","Und? Wie gef\xc3\xa4llt Euch das?"
287,"TEXT_CMNDEFRETAINERCALL_00010_COMPLETE_ELEZEN_FEMALE_TYPE6","Ist alles im gr\xc3\xbcnen Bereich?"
288,"TEXT_CMNDEFRETAINERCALL_00010_COMPLETE_LALAFELL_MALE_TYPE1","Es war mir eine Freude."
289,"TEXT_CMNDEFRETAINERCALL_00010_COMPLETE_LALAFELL_MALE_TYPE2","Eine ganz sch\xc3\xb6ne Plackerei hast du mir da aufgehalst."
290,"TEXT_CMNDEFRETAINERCALL_00010_COMPLETE_LALAFELL_MALE_TYPE3","Ich hoffe, es wird dir von Nutzen sein."
291,"TEXT_CMNDEFRETAINERCALL_00010_COMPLETE_LALAFELL_MALE_TYPE4","Wie ist das? Alles gut so?"
292,"TEXT_CMNDEFRETAINERCALL_00010_COMPLETE_LALAFELL_MALE_TYPE5","Ist es das, was du wolltest?"
293,"TEXT_CMNDEFRETAINERCALL_00010_COMPLETE_LALAFELL_MALE_TYPE6","Guck mal, was ich f\xc3\xbcr dich habe!"
294,"TEXT_CMNDEFRETAINERCALL_00010_COMPLETE_LALAFELL_FEMALE_TYPE1","Es war mir eine Freude, von Diensten zu sein."
295,"TEXT_CMNDEFRETAINERCALL_00010_COMPLETE_LALAFELL_FEMALE_TYPE2","Das hatte ich mir aber leichter vorgestellt ..."
296,"TEXT_CMNDEFRETAINERCALL_00010_COMPLETE_LALAFELL_FEMALE_TYPE3","Bitte sehr. Hier ist, was du wolltest."
297,"TEXT_CMNDEFRETAINERCALL_00010_COMPLETE_LALAFELL_FEMALE_TYPE4","Ich glaube, ich hab, was du wolltest."
298,"TEXT_CMNDEFRETAINERCALL_00010_COMPLETE_LALAFELL_FEMALE_TYPE5","Schau mal, ob das das Richtige ist."
299,"TEXT_CMNDEFRETAINERCALL_00010_COMPLETE_LALAFELL_FEMALE_TYPE6","Hoffentlich kannst du damit gro\xc3\x9fe Taten vollbringen!"
300,"TEXT_CMNDEFRETAINERCALL_00010_COMPLETE_MIQOTE_MALE_TYPE1","Ist alles zu Eurer Zufriedenheit?"
301,"TEXT_CMNDEFRETAINERCALL_00010_COMPLETE_MIQOTE_MALE_TYPE2","Nimm's oder lass es bleiben, aber hier ist, was du wolltest."
302,"TEXT_CMNDEFRETAINERCALL_00010_COMPLETE_MIQOTE_MALE_TYPE3","Es ist erledigt."
303,"TEXT_CMNDEFRETAINERCALL_00010_COMPLETE_MIQOTE_MALE_TYPE4","Das war es doch, was du wolltest, oderrr?"
304,"TEXT_CMNDEFRETAINERCALL_00010_COMPLETE_MIQOTE_MALE_TYPE5","Hier. War gar nicht so einfach."
305,"TEXT_CMNDEFRETAINERCALL_00010_COMPLETE_MIQOTE_MALE_TYPE6","Ich habe dir was mitgebracht!"
306,"TEXT_CMNDEFRETAINERCALL_00010_COMPLETE_MIQOTE_FEMALE_TYPE1","Ich hoffe, das ist, was Ihr erwartet habt."
307,"TEXT_CMNDEFRETAINERCALL_00010_COMPLETE_MIQOTE_FEMALE_TYPE2","Sag nicht, du wolltest etwas anderes."
308,"TEXT_CMNDEFRETAINERCALL_00010_COMPLETE_MIQOTE_FEMALE_TYPE3","Ich habe alles besorgen k\xc3\xb6nnen."
309,"TEXT_CMNDEFRETAINERCALL_00010_COMPLETE_MIQOTE_FEMALE_TYPE4","Guck mal, ist das das Richtige?"
310,"TEXT_CMNDEFRETAINERCALL_00010_COMPLETE_MIQOTE_FEMALE_TYPE5","Das war alles andere als ein Katzensprung, aber hier ist es!"
311,"TEXT_CMNDEFRETAINERCALL_00010_COMPLETE_MIQOTE_FEMALE_TYPE6","Hui, jetzt bin ich aber au\xc3\x9fer Puste!"
312,"TEXT_CMNDEFRETAINERCALL_00010_COMPLETE_ROEGADYN_MALE_TYPE1","Es ist vollbracht."
313,"TEXT_CMNDEFRETAINERCALL_00010_COMPLETE_ROEGADYN_MALE_TYPE2","Hier. Kann ich mich jetzt wieder in meine Kaj\xc3\xbcte verziehen?"
314,"TEXT_CMNDEFRETAINERCALL_00010_COMPLETE_ROEGADYN_MALE_TYPE3","So was sollte ich doch besorgen, oder?"
315,"TEXT_CMNDEFRETAINERCALL_00010_COMPLETE_ROEGADYN_MALE_TYPE4","Wenn etwas nicht stimmt, lass es mich wissen."
316,"TEXT_CMNDEFRETAINERCALL_00010_COMPLETE_ROEGADYN_MALE_TYPE5","Hiermit sollte alles erledigt sein."
317,"TEXT_CMNDEFRETAINERCALL_00010_COMPLETE_ROEGADYN_MALE_TYPE6","Das war doch das Richtige?"
318,"TEXT_CMNDEFRETAINERCALL_00010_COMPLETE_ROEGADYN_FEMALE_TYPE1","Ich habe Euren Auftrag wunschgem\xc3\xa4\xc3\x9f erledigt."
319,"TEXT_CMNDEFRETAINERCALL_00010_COMPLETE_ROEGADYN_FEMALE_TYPE2","Zufrieden? Wenn nicht, behalt's f\xc3\xbcr dich."
320,"TEXT_CMNDEFRETAINERCALL_00010_COMPLETE_ROEGADYN_FEMALE_TYPE3","Sieh, was ich mitgebracht habe."
321,"TEXT_CMNDEFRETAINERCALL_00010_COMPLETE_ROEGADYN_FEMALE_TYPE4","Hier, das m\xc3\xbcsste sein, was du wolltest."
322,"TEXT_CMNDEFRETAINERCALL_00010_COMPLETE_ROEGADYN_FEMALE_TYPE5","Ich habe mir redlich M\xc3\xbche gegeben."
323,"TEXT_CMNDEFRETAINERCALL_00010_COMPLETE_ROEGADYN_FEMALE_TYPE6","Ahoi! Eine lustige Kreuzfahrt war das."
324,"TEXT_CMNDEFRETAINERCALL_00010_COMPLETE_AURA_MALE_TYPE1","Es ist vollbracht."
325,"TEXT_CMNDEFRETAINERCALL_00010_COMPLETE_AURA_MALE_TYPE2","Ich hab, was du wolltest."
326,"TEXT_CMNDEFRETAINERCALL_00010_COMPLETE_AURA_MALE_TYPE3","Es verlief alles nach Plan."
327,"TEXT_CMNDEFRETAINERCALL_00010_COMPLETE_AURA_MALE_TYPE4","Ich ha's. Oder zumindest so was \xc3\x84hnliches."
328,"TEXT_CMNDEFRETAINERCALL_00010_COMPLETE_AURA_MALE_TYPE5","Einfach war's nicht, aber bitte sehr."
329,"TEXT_CMNDEFRETAINERCALL_00010_COMPLETE_AURA_MALE_TYPE6","Rate mal, was ich mitgebracht habe ..."
330,"TEXT_CMNDEFRETAINERCALL_00010_COMPLETE_AURA_FEMALE_TYPE1","Es ist vollbracht, \x02\x08\x17\xe9\x05\xff\nMeisterin\xff\x08Meister\x03."
331,"TEXT_CMNDEFRETAINERCALL_00010_COMPLETE_AURA_FEMALE_TYPE2","Wehe, das ist nicht das Richtige ... Noch mal lauf ich nich' los."
332,"TEXT_CMNDEFRETAINERCALL_00010_COMPLETE_AURA_FEMALE_TYPE3","Ich habe gefunden, was Ihr braucht."
333,"TEXT_CMNDEFRETAINERCALL_00010_COMPLETE_AURA_FEMALE_TYPE4","Ist das das Richtige?"
334,"TEXT_CMNDEFRETAINERCALL_00010_COMPLETE_AURA_FEMALE_TYPE5","Ich glaub, ich hab mir Plattf\xc3\xbc\xc3\x9fe gelaufen."
335,"TEXT_CMNDEFRETAINERCALL_00010_COMPLETE_AURA_FEMALE_TYPE6","Guck mal, was ich habe! Da bist du aber froh, dass du mich losgeschickt hast, und nicht diesen grummeligen Roegadyn, was?"
336,"TEXT_CMNDEFRETAINERCALL_00010_TUTORIAL_INTRO_1","Gehilfen-Unternehmungen sind freigeschaltet. Damit kannst du Gehilfen entsenden, um bestimmte Erledigungen f\xc3\xbcr dich zu t\xc3\xa4tigen, wie zum Beispiel einen Gegenstand besorgen."
337,"TEXT_CMNDEFRETAINERCALL_00010_TUTORIAL_INTRO_2","Bevor du einen Gehilfen auf eine Unternehmung schickst, musst du ihn auf das kommende Abenteuer vorbereiten."
338,"TEXT_CMNDEFRETAINERCALL_00010_TUTORIAL_INTRO_3","Daf\xc3\xbcr musst du eine Charakterklasse f\xc3\xbcr den Gehilfen w\xc3\xa4hlen."
339,"TEXT_CMNDEFRETAINERCALL_00010_TUTORIAL_CLASS_1","Grunds\xc3\xa4tzlich stehen dir Charakterklassen der Disziplinen Krieger, Magier und Sammler zur Verf\xc3\xbcgung."
340,"TEXT_CMNDEFRETAINERCALL_00010_TUTORIAL_CLASS_2","Die Disziplin ist nicht dauerhaft festgelegt und kann sp\xc3\xa4ter im Gehilfen-Dialog wieder ge\xc3\xa4ndert werden."
341,"TEXT_CMNDEFRETAINERCALL_00010_TUTORIAL_CLASS_3","Von der gew\xc3\xa4hlten Disziplin h\xc3\xa4ngt es ab, welche Gegenst\xc3\xa4nde der Gehilfe besorgen kann."
342,"TEXT_CMNDEFRETAINERCALL_00010_TUTORIAL_CLASS_4","Du kannst dem Gehilfen aber keine Charakterklasse geben, die du selbst noch nicht freigeschaltet hast."
343,"TEXT_CMNDEFRETAINERCALL_00010_TUTORIAL_FIRST_CLASS_1","\x02)\x03\xea\x02\x03 ist nun \x02\x08+\xe4\xe8\x04\x01\xff\x12\x02(\x0e\xff\tClassJob\xe8\x03\x01\x03\xff\x12\x02(\x0e\xff\tClassJob\xe8\x03\x03\x03\x03!"
344,"TEXT_CMNDEFRETAINERCALL_00010_TUTORIAL_FIRST_CLASS_2","Damit sich dein Gehilfe auf eine Unternehmung begeben kann, musst du ihn mit einer Waffe oder einem Werkzeug ausr\xc3\xbcsten."
345,"TEXT_CMNDEFRETAINERCALL_00010_TUTORIAL_FIRST_CLASS_3","W\xc3\xa4hle dazu im Gehilfen-Dialog die Option \xe2\x80\x9eAusr\xc3\xbcstung ansehen\xe2\x80\x9c."
346,"TEXT_CMNDEFRETAINERCALL_00010_TUTORIAL_SECOND_CLASS_1","\x02)\x03\xea\x02\x03 ist nun \x02\x08+\xe4\xe8\x04\x01\xff\x12\x02(\x0e\xff\tClassJob\xe8\x03\x01\x03\xff\x12\x02(\x0e\xff\tClassJob\xe8\x03\x03\x03\x03!"
347,"TEXT_CMNDEFRETAINERCALL_00010_TUTORIAL_SECOND_CLASS_2","Damit sich dein Gehilfe auf eine Unternehmung begeben kann, musst du ihm die richtige Ausr\xc3\xbcstung f\xc3\xbcr die Haupthand zuweisen. W\xc3\xa4hle dazu im Gehilfen-Dialog die Option \xe2\x80\x9eAusr\xc3\xbcstung ansehen\xe2\x80\x9c."
348,"TEXT_CMNDEFRETAINERCALL_00010_TUTORIAL_CLASS_RESET_1","Die Charakterklasse des Gehilfen kann auch wieder zur\xc3\xbcckgesetzt werden. W\xc3\xa4hle dazu im Gehilfen-Dialog noch einmal \xe2\x80\x9eCharakterklasse festlegen\xe2\x80\x9c."
349,"TEXT_CMNDEFRETAINERCALL_00010_TUTORIAL_CLASS_RESET_2","Wenn die Charakterklasse zur\xc3\xbcckgesetzt wird, legt der Gehilfe seine Ausr\xc3\xbcstung ab."
350,"TEXT_CMNDEFRETAINERCALL_00010_TUTORIAL_EQUIP_1","Um deinen Gehilfen mit einer Unternehmung zu beauftragen, musst du ihm die richtige Ausr\xc3\xbcstung f\xc3\xbcr die Haupthand zuweisen."
351,"TEXT_CMNDEFRETAINERCALL_00010_TUTORIAL_EQUIP_2","Die Waffe beziehungsweise das Werkzeug muss zu seiner Charakterklasse und Stufe passen."
352,"TEXT_CMNDEFRETAINERCALL_00010_TUTORIAL_FIRST_WEAPON_1","Du hast \x02)\x03\xea\x02\x03 mit Ausr\xc3\xbcstung f\xc3\xbcr \x02\x08\x12\xe4\xe8\x03\x01\xff\x06seine\xff\x05ihre\x03 Haupthand ausgestattet!"
353,"TEXT_CMNDEFRETAINERCALL_00010_TUTORIAL_FIRST_WEAPON_2","Der Gehilfe ist jetzt auf sein Abenteuer vorbereitet und kann auf eine Unternehmung geschickt werden."
354,"TEXT_CMNDEFRETAINERCALL_00010_TUTORIAL_FIRST_WEAPON_3","Dem Gehilfen-Dialog wurde die Option \xe2\x80\x9eMit Unternehmung beauftragen\xe2\x80\x9c hinzugef\xc3\xbcgt. W\xc3\xa4hle sie, um eine Unternehmung auszusuchen."
355,"TEXT_CMNDEFRETAINERCALL_00010_ABOUT_RETAINER_TIP_1","Um einen Gehilfen auf eine Unternehmung zu schicken, ben\xc3\xb6tigst du Wertmarken."
356,"TEXT_CMNDEFRETAINERCALL_00010_ABOUT_RETAINER_TIP_2","Wertmarken erh\xc3\xa4ltst du zum Beispiel im Tausch gegen Staatstaler oder als Belohnung f\xc3\xbcr Auftr\xc3\xa4ge der Wilden St\xc3\xa4mme und Freibriefe."
357,"TEXT_CMNDEFRETAINERCALL_00010_CLASS_EXPLAIN_START","\x02)\x03\xea\x02\x03 ist momentan \x02\x08+\xe4\xe8\x04\x01\xff\x12\x02(\x0e\xff\tClassJob\xe8\x03\x01\x03\xff\x12\x02(\x0e\xff\tClassJob\xe8\x03\x03\x03\x03."
358,"TEXT_CMNDEFRETAINERCALL_00010_ABOUT_VENTURES_1","Es gibt zwei Arten von Unternehmungen: Beschaffungen und Erkundungen."
359,"TEXT_CMNDEFRETAINERCALL_00010_ABOUT_VENTURES_2","Beschaffungen (Beutez\xc3\xbcge, Mineraliensuche, Ernteausfl\xc3\xbcge bzw. Fischz\xc3\xbcge) sind einfache Abenteuer, die eine Stunde dauern und eine Wertmarke kosten. Der Gehilfe beschafft dir einen bestimmten Gegenstand."
360,"TEXT_CMNDEFRETAINERCALL_00010_ABOUT_VENTURES_3","Erkundungen sind schwierige Abenteuer, die 18 Stunden dauern und zwei Wertmarken kosten. Der Gehilfe bringt mit, was er unterwegs finden konnte."
361,"TEXT_CMNDEFRETAINERCALL_00010_ABOUT_VENTURES_4","Bei beiden Arten von Unternehmungen h\xc3\xa4ngt der Gegenstand, der besorgt werden kann, oder die Region, die erkundet werden kann, von der gew\xc3\xa4hlten Charakterklasse ab."
362,"TEXT_CMNDEFRETAINERCALL_00010_ABOUT_VENTURES_5","Um einen Gehilfen auf eine Unternehmung zu schicken, ben\xc3\xb6tigst du Wertmarken."
363,"TEXT_CMNDEFRETAINERCALL_00010_ABOUT_VENTURES_6","Wertmarken erh\xc3\xa4ltst du zum Beispiel im Tausch gegen Staatstaler oder als Belohnung f\xc3\xbcr Auftr\xc3\xa4ge der Wilden St\xc3\xa4mme und Freibriefe."
364,"TEXT_CMNDEFRETAINERCALL_00010_FIRST_VENTURE_1","Du hast \x02)\x03\xea\x02\x03 auf eine Unternehmung geschickt!"
365,"TEXT_CMNDEFRETAINERCALL_00010_FIRST_VENTURE_2","Diese Unternehmung wird\x02\x08-\xe1\xe8\x02\x01\xff%\x02\x08!\xe4\xe8\x02\x02\xff\n 1 Stunde\xff\x10 \x02 \x03\xe8\x02\x03 Stunden\x03\xff\x01\x03\x02\x08-\xe1\xe8\x03\x01\xff%\x02\x08!\xe4\xe8\x03\x02\xff\n 1 Minute\xff\x10 \x02 \x03\xe8\x03\x03 Minuten\x03\xff\x01\x03 dauern. Erkundige dich nach Ablauf dieser Zeit hier nach dem Ergebnis."
366,"TEXT_CMNDEFRETAINERCALL_00010_FIRST_VENTURE_3","Dem Gehilfen-Dialog wurde die Option \xe2\x80\x9eUnternehmung einsehen\xe2\x80\x9c hinzugef\xc3\xbcgt. Hier kannst du dir den Inhalt und die verbleibende Dauer einer laufenden Unternehmung ansehen."
367,"TEXT_CMNDEFRETAINERCALL_00010_FIRST_VENTURE_4","Die verbleibende Dauer bis Abschluss der Unternehmung kann au\xc3\x9ferdem im Timer unter \xe2\x80\x9eSpielinhalte\xe2\x80\x9c im Hauptmen\xc3\xbc eingesehen werden."
368,"TEXT_CMNDEFRETAINERCALL_00010_FIRST_VENTURE_5","Der Gehilfe kann auch w\xc3\xa4hrend Unternehmungen wie gew\xc3\xb6hnlich mit der Kr\xc3\xa4merklingel f\xc3\xbcr andere Aufgaben herbeigerufen werden."
369,"TEXT_CMNDEFRETAINERCALL_00010_FIRST_VENTURE_6","Dadurch wird der Gehilfe nicht bei seiner Unternehmung behindert, also kann er ohne Bedenken gerufen werden."
370,"TEXT_CMNDEFRETAINERCALL_00010_FIRST_COMPLETED_1","\x02)\x03\xea\x02\x03 ist von der Unternehmung zur\xc3\xbcckgekehrt!"
371,"TEXT_CMNDEFRETAINERCALL_00010_FIRST_COMPLETED_2","W\xc3\xa4hle im Gehilfen-Dialog die Option \xe2\x80\x9eUnternehmung einsehen\xe2\x80\x9c, um dich nach dem Ergebnis zu erkundigen."
372,"TEXT_CMNDEFRETAINERCALL_00010_TUTORIAL_FINISHED_1","\x02)\x03\xea\x02\x03 ist von \x02\x08\x14\xe4\xe8\x03\x01\xff\x07seiner\xff\x06ihrer\x03 Unternehmung zur\xc3\xbcckgekehrt! \x02\x08\x0e\xe4\xe8\x03\x01\xff\x03Er\xff\x04Sie\x03 hat den gew\xc3\xbcnschten Gegenstand mitgebracht und Routine erworben."
373,"TEXT_CMNDEFRETAINERCALL_00010_TUTORIAL_FINISHED_2","Wenn ein Gehilfe eine Unternehmung zu Ende f\xc3\xbchrt, erh\xc3\xa4lt er Routine, mit der er in seiner Stufe aufsteigen kann."
374,"TEXT_CMNDEFRETAINERCALL_00010_TUTORIAL_FINISHED_3","Mit steigender Stufe kann der Gehilfe an neue Orte geschickt werden. Au\xc3\x9ferdem findet der Gehilfe mehr und bessere Gegenst\xc3\xa4nde, je besser er ausger\xc3\xbcstet ist."
375,"TEXT_CMNDEFRETAINERCALL_00010_TUTORIAL_FINISHED_4","Gehilfen-Unternehmungen k\xc3\xb6nnen dir also das Abenteurerleben erleichtern. Nutze sie h\xc3\xa4ufig!"
376,"TEXT_CMNDEFRETAINERCALL_00010_TASK_CATEGORY_FORTUNE","Schneller Streifzug (2 Wertmarken)"
377,"TEXT_CMNDEFRETAINERCALL_00010_FORTUNE_TASK_UNLOCK_1","\x02)\x03\xea\x02\x03 hat Stufe 10 erreicht und kann nun auf einen schnellen Streifzug geschickt werden."
378,"TEXT_CMNDEFRETAINERCALL_00010_FORTUNE_TASK_UNLOCK_2","Der schnelle Streifzug ist eine neue Art von Unternehmung, auf die der Gehilfe geschickt werden kann."
379,"TEXT_CMNDEFRETAINERCALL_00010_FORTUNE_TASK_UNLOCK_3","(dummy)"
380,"TEXT_CMNDEFRETAINERCALL_00010_ABOUT_FORTUNE_TASK_1","Der Gehilfe kann nun auf einen schnellen Streifzug geschickt werden."
381,"TEXT_CMNDEFRETAINERCALL_00010_ABOUT_FORTUNE_TASK_2","Auf diesem Streifzug sammelt der Gehilfe den erstbesten Gegenstand auf, den er findet, und kehrt zur\xc3\xbcck. Man wei\xc3\x9f also nicht, was f\xc3\xbcr einen Gegenstand er besorgt. Mit etwas Gl\xc3\xbcck kann der Gegenstand aber auch besonders wertvoll sein."
382,"TEXT_CMNDEFRETAINERCALL_00010_ABOUT_FORTUNE_TASK_3","Wie viel Routine der Gehilfe bei einer Unternehmung erwirbt, h\xc3\xa4ngt stark von der Gegenstandstufe des gefundenen Gegenstands ab. Mit etwas Gl\xc3\xbcck kann der Gehilfe viel mehr Routine als gew\xc3\xb6hnlich erwerben."
383,"TEXT_CMNDEFRETAINERCALL_00010_ABOUT_FORTUNE_TASK_4","Unternehmungen sind eine gute Methode, um an Gegenst\xc3\xa4nde zu kommen. Benutze dazu sowohl Besorgungen als auch Erkundungen!"
384,"TEXT_CMNDEFRETAINERCALL_00010_ENTER2_HYURAN_MALE_TYPE1","Habt Ihr noch einen Wunsch?"
385,"TEXT_CMNDEFRETAINERCALL_00010_ENTER2_HYURAN_MALE_TYPE2","Was rufst du mich von meiner Unternehmung zur\xc3\xbcck? Ich war fast am Ziel ..."
386,"TEXT_CMNDEFRETAINERCALL_00010_ENTER2_HYURAN_MALE_TYPE3","Was gibt es?"
387,"TEXT_CMNDEFRETAINERCALL_00010_ENTER2_HYURAN_MALE_TYPE4","Gibt's noch was? Hast du was vergessen? Macht nichts, passiert mir auch st\xc3\xa4ndig."
388,"TEXT_CMNDEFRETAINERCALL_00010_ENTER2_HYURAN_MALE_TYPE5","Was kann ich noch f\xc3\xbcr dich tun?"
389,"TEXT_CMNDEFRETAINERCALL_00010_ENTER2_HYURAN_MALE_TYPE6","Gibt's noch etwas? Nur raus mit der Sprache, ich erledige das in einem Aufwasch."
390,"TEXT_CMNDEFRETAINERCALL_00010_ENTER2_HYURAN_FEMALE_TYPE1","Was kann ich noch f\xc3\xbcr Euch tun?"
391,"TEXT_CMNDEFRETAINERCALL_00010_ENTER2_HYURAN_FEMALE_TYPE2","Geh, komm zur\xc3\xbcck, geh, komm zur\xc3\xbcck ... Entscheid dich doch mal, was du willst!"
392,"TEXT_CMNDEFRETAINERCALL_00010_ENTER2_HYURAN_FEMALE_TYPE3","Ich befinde mich mitten in einer Unternehmung f\xc3\xbcr dich. Also fass dich bitte m\xc3\xb6glichst kurz."
393,"TEXT_CMNDEFRETAINERCALL_00010_ENTER2_HYURAN_FEMALE_TYPE4","Ich war zwar gerade mit einer anderen Sache besch\xc3\xa4ftigt, aber f\xc3\xbcr dich habe ich doch immer Zeit."
394,"TEXT_CMNDEFRETAINERCALL_00010_ENTER2_HYURAN_FEMALE_TYPE5","Ja? Hast du noch einen Wunsch?"
395,"TEXT_CMNDEFRETAINERCALL_00010_ENTER2_HYURAN_FEMALE_TYPE6","Hast du geklingelt? Ich bin sofort losgewetzt."
396,"TEXT_CMNDEFRETAINERCALL_00010_ENTER2_ELEZEN_MALE_TYPE1","Ihr habt wieder gerufen?"
397,"TEXT_CMNDEFRETAINERCALL_00010_ENTER2_ELEZEN_MALE_TYPE2","Was soll denn das? Ich bin mitten in einer Unternehmung!"
398,"TEXT_CMNDEFRETAINERCALL_00010_ENTER2_ELEZEN_MALE_TYPE3","Habt Ihr noch einen Auftrag? Ich bin bereit."
