0,"TEXT_CMNDEFRETAINERCALL_00010_RETAINER_ENTER_1","Stets zu Diensten, \x02\x08xe9\x05\xff\x0egn\xc3\xa4dige Frau\xff\x0fgn\xc3\xa4diger Herr\x03!"
399,"TEXT_CMNDEFRETAINERCALL_00010_ENTER2_ELEZEN_MALE_TYPE4","Eigentlich wollte ich mich gerade von meiner anstrengenden Unternehmung ausruhen ..."
400,"TEXT_CMNDEFRETAINERCALL_00010_ENTER2_ELEZEN_MALE_TYPE5","Unternehmung oder nicht, ich komme, sobald Ihr ruft."
401,"TEXT_CMNDEFRETAINERCALL_00010_ENTER2_ELEZEN_MALE_TYPE6","Ihr glaubt nicht, wen ich gerade w\xc3\xa4hrend meiner Unternehmung getroffen habe! Aber sagt zuerst, was ich noch f\xc3\xbcr Euch tun kann."
402,"TEXT_CMNDEFRETAINERCALL_00010_ENTER2_ELEZEN_FEMALE_TYPE1","Ihr habt gerufen? Ich habe alles stehen und liegen gelassen und bin sofort zur\xc3\xbcckgeeilt."
403,"TEXT_CMNDEFRETAINERCALL_00010_ENTER2_ELEZEN_FEMALE_TYPE2","Was is' denn nu schon wieder?"
404,"TEXT_CMNDEFRETAINERCALL_00010_ENTER2_ELEZEN_FEMALE_TYPE3","Habt Ihr noch etwas zu erledigen?"
405,"TEXT_CMNDEFRETAINERCALL_00010_ENTER2_ELEZEN_FEMALE_TYPE4","Da bin ich wieder!"
406,"TEXT_CMNDEFRETAINERCALL_00010_ENTER2_ELEZEN_FEMALE_TYPE5","Ihr ahnt nicht, was ich auf meiner Unternehmung schon alles gefunden habe. Aber sagt zuerst, was ich noch f\xc3\xbcr Euch tun kann."
407,"TEXT_CMNDEFRETAINERCALL_00010_ENTER2_ELEZEN_FEMALE_TYPE6","Habt Ihr Euch verdr\xc3\xbcckt? Oder kann ich wieder etwas f\xc3\xbcr Euch erledigen? Na, Hauptsache ist, wir haben uns mal wieder getroffen."
408,"TEXT_CMNDEFRETAINERCALL_00010_ENTER2_LALAFELL_MALE_TYPE1","Ich bin sofort zur\xc3\xbcckgeeilt, als ich Euer vornehmes Klingeln vernahm. Was ist Euer Begehr?"
409,"TEXT_CMNDEFRETAINERCALL_00010_ENTER2_LALAFELL_MALE_TYPE2","Hast du Schussel wieder mal etwas vergessen?"
410,"TEXT_CMNDEFRETAINERCALL_00010_ENTER2_LALAFELL_MALE_TYPE3","Hach, es lief gerade so richtig gut bei meiner Unternehmung! Was gibt es denn Dringendes?"
411,"TEXT_CMNDEFRETAINERCALL_00010_ENTER2_LALAFELL_MALE_TYPE4","Ja? Wo brennt's denn?"
412,"TEXT_CMNDEFRETAINERCALL_00010_ENTER2_LALAFELL_MALE_TYPE5","Ich war gerade unterwegs, bin aber hoppeldimoppel zur\xc3\xbcckgeeilt. Also, was ist?"
413,"TEXT_CMNDEFRETAINERCALL_00010_ENTER2_LALAFELL_MALE_TYPE6","Hallihall\xc3\xb6chen! Was gibt's denn Pressierliches?"
414,"TEXT_CMNDEFRETAINERCALL_00010_ENTER2_LALAFELL_FEMALE_TYPE1","Welchen zus\xc3\xa4tzlichen Wunsch darf ich Euch erf\xc3\xbcllen?"
415,"TEXT_CMNDEFRETAINERCALL_00010_ENTER2_LALAFELL_FEMALE_TYPE2","Schon wieder etwas? Soll ich mich vielleicht in zwei teilen?"
416,"TEXT_CMNDEFRETAINERCALL_00010_ENTER2_LALAFELL_FEMALE_TYPE3","Was ist passiert? Ein Notfall?"
417,"TEXT_CMNDEFRETAINERCALL_00010_ENTER2_LALAFELL_FEMALE_TYPE4","So, jetzt geh ich mal gem\xc3\xbctlich eine Runde einkauf... Oh, du hier? Hast du etwa gerufen?"
418,"TEXT_CMNDEFRETAINERCALL_00010_ENTER2_LALAFELL_FEMALE_TYPE5","Hast du noch einen Wunsch? Spuck's nur aus!"
419,"TEXT_CMNDEFRETAINERCALL_00010_ENTER2_LALAFELL_FEMALE_TYPE6","Nur eins macht mehr Spa\xc3\x9f als eine Unternehmung. Ein Nebenauftrag w\xc3\xa4hrend einer Unternehmung! Was gibt's?"
420,"TEXT_CMNDEFRETAINERCALL_00010_ENTER2_MIQOTE_MALE_TYPE1","Ihr habt mich zur\xc3\xbcckgerufen?"
421,"TEXT_CMNDEFRETAINERCALL_00010_ENTER2_MIQOTE_MALE_TYPE2","Ich glau's nicht! Was ist denn jetzt schon wieder?"
422,"TEXT_CMNDEFRETAINERCALL_00010_ENTER2_MIQOTE_MALE_TYPE3","Hast du einen neuen Auftrag f\xc3\xbcr mich?"
423,"TEXT_CMNDEFRETAINERCALL_00010_ENTER2_MIQOTE_MALE_TYPE4","Bei der Unternehmung sieht es sowieso gerade nicht so gut aus, da kann ich auch gerne etwas anderes machen. Was liegt denn an?"
424,"TEXT_CMNDEFRETAINERCALL_00010_ENTER2_MIQOTE_MALE_TYPE5","Du rufst mich doch nicht zur\xc3\xbcck, um mir einen guten Tag zu w\xc3\xbcnschen, oder? Wie kann ich helfen?"
425,"TEXT_CMNDEFRETAINERCALL_00010_ENTER2_MIQOTE_MALE_TYPE6","Ich war gerade total weit weg, aber egal, du hast ja gerufen! Was gibt's?"
426,"TEXT_CMNDEFRETAINERCALL_00010_ENTER2_MIQOTE_FEMALE_TYPE1","Kann ich noch etwas f\xc3\xbcr Euch erledigen?"
427,"TEXT_CMNDEFRETAINERCALL_00010_ENTER2_MIQOTE_FEMALE_TYPE2","Mach schnell, ich ha's eilig."
428,"TEXT_CMNDEFRETAINERCALL_00010_ENTER2_MIQOTE_FEMALE_TYPE3","Ein neuer Auftrag? Aberrr sicher doch!"
429,"TEXT_CMNDEFRETAINERCALL_00010_ENTER2_MIQOTE_FEMALE_TYPE4","Ich erledige alles, was du mir auftr\xc3\xa4gst ... Aber nur, wenn du mir den R\xc3\xbccken kraulst."
430,"TEXT_CMNDEFRETAINERCALL_00010_ENTER2_MIQOTE_FEMALE_TYPE5","Ich habe ja eigentlich alle Tatzen voll zu tun ..."
431,"TEXT_CMNDEFRETAINERCALL_00010_ENTER2_MIQOTE_FEMALE_TYPE6","Noch ein Auftrag? Hurra! Was ist es diesmal? Hinter einem Wollkn\xc3\xa4uel herjagen?"
432,"TEXT_CMNDEFRETAINERCALL_00010_ENTER2_ROEGADYN_MALE_TYPE1","Habt Ihr noch eine Aufgabe f\xc3\xbcr mich?"
433,"TEXT_CMNDEFRETAINERCALL_00010_ENTER2_ROEGADYN_MALE_TYPE2","Gibt's noch was? Nur raus mit der Sprache."
434,"TEXT_CMNDEFRETAINERCALL_00010_ENTER2_ROEGADYN_MALE_TYPE3","Was hast du auf dem Herzen?"
435,"TEXT_CMNDEFRETAINERCALL_00010_ENTER2_ROEGADYN_MALE_TYPE4","Ist etwas passiert?"
436,"TEXT_CMNDEFRETAINERCALL_00010_ENTER2_ROEGADYN_MALE_TYPE5","Wozu rufst du mich zur\xc3\xbcck? Hab ich etwas verbrochen?"
437,"TEXT_CMNDEFRETAINERCALL_00010_ENTER2_ROEGADYN_MALE_TYPE6","Hier bin ich! Wo brennt's denn, Sportsfreund?"
438,"TEXT_CMNDEFRETAINERCALL_00010_ENTER2_ROEGADYN_FEMALE_TYPE1","Habt Ihr wieder etwas zu erledigen?"
439,"TEXT_CMNDEFRETAINERCALL_00010_ENTER2_ROEGADYN_FEMALE_TYPE2","Du l\xc3\xa4sst einem aber auch keine Ruhe ..."
440,"TEXT_CMNDEFRETAINERCALL_00010_ENTER2_ROEGADYN_FEMALE_TYPE3","Was hast du auf dem Herzen?"
441,"TEXT_CMNDEFRETAINERCALL_00010_ENTER2_ROEGADYN_FEMALE_TYPE4","Kann ich etwas f\xc3\xbcr dich erledigen?"
442,"TEXT_CMNDEFRETAINERCALL_00010_ENTER2_ROEGADYN_FEMALE_TYPE5","Fass dich kurz, ich hab zu tun."
443,"TEXT_CMNDEFRETAINERCALL_00010_ENTER2_ROEGADYN_FEMALE_TYPE6","Mehr Arbeit? Nur zu, ich mach's im Handumdrehen."
444,"TEXT_CMNDEFRETAINERCALL_00010_ENTER2_AURA_MALE_TYPE1","Was ist, \x02\x08\x17\xe9\x05\xff\nMeisterin\xff\x08Meister\x03? Ich bin sofort zur\xc3\xbcckgeeilt!"
445,"TEXT_CMNDEFRETAINERCALL_00010_ENTER2_AURA_MALE_TYPE2","Was ist denn jetzt schon wieder?"
446,"TEXT_CMNDEFRETAINERCALL_00010_ENTER2_AURA_MALE_TYPE3","Gibt es etwas Wichtiges zu erledigen?"
447,"TEXT_CMNDEFRETAINERCALL_00010_ENTER2_AURA_MALE_TYPE4","Was kann ich denn noch f\xc3\xbcr dich tun?"
448,"TEXT_CMNDEFRETAINERCALL_00010_ENTER2_AURA_MALE_TYPE5","Lauf hier hin, lauf da hin ... Niemand kann sich mehr zu etwas entscheiden heutzutage ..."
449,"TEXT_CMNDEFRETAINERCALL_00010_ENTER2_AURA_MALE_TYPE6","Ich war doch noch gar nicht fertig!"
450,"TEXT_CMNDEFRETAINERCALL_00010_ENTER2_AURA_FEMALE_TYPE1","Zu Euren Diensten!"
451,"TEXT_CMNDEFRETAINERCALL_00010_ENTER2_AURA_FEMALE_TYPE2","Was ist denn nun schon wieder?"
452,"TEXT_CMNDEFRETAINERCALL_00010_ENTER2_AURA_FEMALE_TYPE3","Habt Ihr eine dringende Aufgabe zu erledigen?"
453,"TEXT_CMNDEFRETAINERCALL_00010_ENTER2_AURA_FEMALE_TYPE4","Ist was passiert?"
454,"TEXT_CMNDEFRETAINERCALL_00010_ENTER2_AURA_FEMALE_TYPE5","Ich hatte schon fast alles erledigt, worum du mich gebeten hast ..."
455,"TEXT_CMNDEFRETAINERCALL_00010_ENTER2_AURA_FEMALE_TYPE6","Ich war doch noch gar nicht fertig, hihi!"
456,"TEXT_CMNDEFRETAINERCALL_00010_LEAVE2_HYURAN_MALE_TYPE1","Wie Ihr w\xc3\xbcnscht."
457,"TEXT_CMNDEFRETAINERCALL_00010_LEAVE2_HYURAN_MALE_TYPE2","Dann verkr\xc3\xbcmel ich mich mal wieder."
458,"TEXT_CMNDEFRETAINERCALL_00010_LEAVE2_HYURAN_MALE_TYPE3","Gut, dann kann ich ja wieder an meine eigentliche Arbeit."
459,"TEXT_CMNDEFRETAINERCALL_00010_LEAVE2_HYURAN_MALE_TYPE4","Dann will ich mal wieder an meine Unternehmung."
460,"TEXT_CMNDEFRETAINERCALL_00010_LEAVE2_HYURAN_MALE_TYPE5","Kann ich dann wieder meine Unternehmung fortsetzen? Sehr liebensw\xc3\xbcrdig."
461,"TEXT_CMNDEFRETAINERCALL_00010_LEAVE2_HYURAN_MALE_TYPE6","Auf auf, zur\xc3\xbcck an die Arbeit!"
462,"TEXT_CMNDEFRETAINERCALL_00010_LEAVE2_HYURAN_FEMALE_TYPE1","Ich werde mich sofort wieder Eurem urspr\xc3\xbcnglichen Gesuch widmen."
463,"TEXT_CMNDEFRETAINERCALL_00010_LEAVE2_HYURAN_FEMALE_TYPE2","Das war's? Super. Dann kann ich ja aufbrechen."
464,"TEXT_CMNDEFRETAINERCALL_00010_LEAVE2_HYURAN_FEMALE_TYPE3","Ich werde mich sofort wieder der Unternehmung widmen."
465,"TEXT_CMNDEFRETAINERCALL_00010_LEAVE2_HYURAN_FEMALE_TYPE4","Mal sehen, ob sich die Unternehmung inzwischen von selbst erledigt hat ..."
466,"TEXT_CMNDEFRETAINERCALL_00010_LEAVE2_HYURAN_FEMALE_TYPE5","Freust du dich schon auf die Fr\xc3\xbcchte meiner Arbeit? Gedulde dich noch etwas."
467,"TEXT_CMNDEFRETAINERCALL_00010_LEAVE2_HYURAN_FEMALE_TYPE6","Ich bin dann wieder weg! Tsch\xc3\xbc\xc3\xbc\xc3\xbcs! \xe2\x99\xaa"
468,"TEXT_CMNDEFRETAINERCALL_00010_LEAVE2_ELEZEN_MALE_TYPE1","Bitte ruft mich, wenn es ein neues Anliegen gibt."
469,"TEXT_CMNDEFRETAINERCALL_00010_LEAVE2_ELEZEN_MALE_TYPE2","Ich mach mich dann mal wieder auf die Socken."
470,"TEXT_CMNDEFRETAINERCALL_00010_LEAVE2_ELEZEN_MALE_TYPE3","Ich werde meine Unternehmung fortsetzen. Adieu!"
471,"TEXT_CMNDEFRETAINERCALL_00010_LEAVE2_ELEZEN_MALE_TYPE4","Sieht so aus, als m\xc3\xbcsste ich wieder auf meine Unternehmung gehen ..."
472,"TEXT_CMNDEFRETAINERCALL_00010_LEAVE2_ELEZEN_MALE_TYPE5","Meine Unternehmung ruft."
473,"TEXT_CMNDEFRETAINERCALL_00010_LEAVE2_ELEZEN_MALE_TYPE6","Ich flitz dann mal wieder los. Meldet Euch, wenn es etwas gibt!"
474,"TEXT_CMNDEFRETAINERCALL_00010_LEAVE2_ELEZEN_FEMALE_TYPE1","Ich bin froh, von Diensten gewesen zu sein."
475,"TEXT_CMNDEFRETAINERCALL_00010_LEAVE2_ELEZEN_FEMALE_TYPE2","Das war alles? Und daf\xc3\xbcr unterbreche ich meine Unternehmung?"
476,"TEXT_CMNDEFRETAINERCALL_00010_LEAVE2_ELEZEN_FEMALE_TYPE3","Wenn das alles war, breche ich wieder auf."
477,"TEXT_CMNDEFRETAINERCALL_00010_LEAVE2_ELEZEN_FEMALE_TYPE4","Ich hab da noch etwas zu erledigen ... Bis sp\xc3\xa4ter!"
478,"TEXT_CMNDEFRETAINERCALL_00010_LEAVE2_ELEZEN_FEMALE_TYPE5","Ich st\xc3\xbcrze mich dann wieder in meine Arbeit ... Etwas anderes habe ich ja doch nicht zu tun."
479,"TEXT_CMNDEFRETAINERCALL_00010_LEAVE2_ELEZEN_FEMALE_TYPE6","Also gut, bis sp\xc3\xa4ter! Ich freu mich schon!"
480,"TEXT_CMNDEFRETAINERCALL_00010_LEAVE2_LALAFELL_MALE_TYPE1","Entschuldigt mich. Ich habe da noch ein paar Besorgungen f\xc3\xbcr Euch zu machen."
481,"TEXT_CMNDEFRETAINERCALL_00010_LEAVE2_LALAFELL_MALE_TYPE2","Ich verdr\xc3\xbcck mich dann mal wieder."
482,"TEXT_CMNDEFRETAINERCALL_00010_LEAVE2_LALAFELL_MALE_TYPE3","Du hast deine Abenteuer, ich meine Unternehmungen. Ich meld mich, wenn ich fertig bin."
483,"TEXT_CMNDEFRETAINERCALL_00010_LEAVE2_LALAFELL_MALE_TYPE4","Ich dackel dann mal wieder los ... Tsch\xc3\xbcssi!"
484,"TEXT_CMNDEFRETAINERCALL_00010_LEAVE2_LALAFELL_MALE_TYPE5","Ich muss los. Ich bin da selber grad was am Planen dran ..."
485,"TEXT_CMNDEFRETAINERCALL_00010_LEAVE2_LALAFELL_MALE_TYPE6","War's das? Supi. Dann mach ich mich mal wieder vom Acker."
486,"TEXT_CMNDEFRETAINERCALL_00010_LEAVE2_LALAFELL_FEMALE_TYPE1","Ich leg mich dann mal wieder ins Zeug, damit Ihr gaaanz stolz auf mich sein k\xc3\xb6nnt!"
487,"TEXT_CMNDEFRETAINERCALL_00010_LEAVE2_LALAFELL_FEMALE_TYPE2","Ich bin weg. Hab da noch was L\xc3\xa4stiges zu erledigen ..."
488,"TEXT_CMNDEFRETAINERCALL_00010_LEAVE2_LALAFELL_FEMALE_TYPE3","Was die Unternehmung angeht, bitte gedulde dich noch ein bisschen."
489,"TEXT_CMNDEFRETAINERCALL_00010_LEAVE2_LALAFELL_FEMALE_TYPE4","Ich mach mich dann mal wieder an die Unternehmung. Ist ganz sch\xc3\xb6n happig, was du da verlangst ..."
490,"TEXT_CMNDEFRETAINERCALL_00010_LEAVE2_LALAFELL_FEMALE_TYPE5","So, zur\xc3\xbcck an die Arbeit. Ich meld mich sp\xc3\xa4ter wieder!"
491,"TEXT_CMNDEFRETAINERCALL_00010_LEAVE2_LALAFELL_FEMALE_TYPE6","Bin schon weg!"
492,"TEXT_CMNDEFRETAINERCALL_00010_LEAVE2_MIQOTE_MALE_TYPE1","Ich werde mich wieder Eurem Gesuch widmen. Auf Wiedersehen!"
493,"TEXT_CMNDEFRETAINERCALL_00010_LEAVE2_MIQOTE_MALE_TYPE2","Das war alles? Und daf\xc3\xbcr rufst du mich von einer Unternehmung zur\xc3\xbcck? Na, manchen muss man sogar ihren Allerwertesten hinterhertragen ..."
494,"TEXT_CMNDEFRETAINERCALL_00010_LEAVE2_MIQOTE_MALE_TYPE3","Die Unternehmung habe ich so gut wie abgeschlossen. Bitte gedulde dich noch ein wenig."
495,"TEXT_CMNDEFRETAINERCALL_00010_LEAVE2_MIQOTE_MALE_TYPE4","Ich schleich mich. Bis sp\xc3\xa4ter!"
496,"TEXT_CMNDEFRETAINERCALL_00010_LEAVE2_MIQOTE_MALE_TYPE5","Ich begebe mich dann wieder auf meine abenteuerliche Unternehmung. Bis sp\xc3\xa4ter."
497,"TEXT_CMNDEFRETAINERCALL_00010_LEAVE2_MIQOTE_MALE_TYPE6","Ich streuner noch ein bisschen drau\xc3\x9fen herum, dann meld ich mich wieder!"
498,"TEXT_CMNDEFRETAINERCALL_00010_LEAVE2_MIQOTE_FEMALE_TYPE1","Es war mir eine Freude, Euch zu helfen. Zur\xc3\xbcck zur Unternehmung ..."
499,"TEXT_CMNDEFRETAINERCALL_00010_LEAVE2_MIQOTE_FEMALE_TYPE2","Ich dachte schon, es w\xc3\xbcrde den ganzen Tag dauern ..."
500,"TEXT_CMNDEFRETAINERCALL_00010_LEAVE2_MIQOTE_FEMALE_TYPE3","Sehr gut. Ich hab gerade n\xc3\xa4mlich waaahnsinnig viel zu tun ... "
501,"TEXT_CMNDEFRETAINERCALL_00010_LEAVE2_MIQOTE_FEMALE_TYPE4","Dann will ich mal gucken, was meine Unternehmung so macht."
502,"TEXT_CMNDEFRETAINERCALL_00010_LEAVE2_MIQOTE_FEMALE_TYPE5","Bis sp\xc3\xa4ter also. Ich meld mich, wenn ich von meinem Abenteuer zur\xc3\xbcckgekehrt bin."
503,"TEXT_CMNDEFRETAINERCALL_00010_LEAVE2_MIQOTE_FEMALE_TYPE6","Dann will ich mal wieder raus an die frische Luft! Die vielen Leute hier machen mich immer ganz kirre."
504,"TEXT_CMNDEFRETAINERCALL_00010_LEAVE2_ROEGADYN_MALE_TYPE1","So leid es mir auch tut - die Unternehmung ist noch nicht beendet. Ich werde mich beeilen."
505,"TEXT_CMNDEFRETAINERCALL_00010_LEAVE2_ROEGADYN_MALE_TYPE2","Scheuch mich nicht so! Ein alter Roegadyn ist doch kein Express-Chocobo!"
506,"TEXT_CMNDEFRETAINERCALL_00010_LEAVE2_ROEGADYN_MALE_TYPE3","Auf bald, \x02\x08\x1d\xe9\x05\xff\rAbenteurerin\xff\x0bAbenteurer\x03."
507,"TEXT_CMNDEFRETAINERCALL_00010_LEAVE2_ROEGADYN_MALE_TYPE4","Auf ein andermal!"
508,"TEXT_CMNDEFRETAINERCALL_00010_LEAVE2_ROEGADYN_MALE_TYPE5","Ich leg mich auch weiterhin ins Zeug, darauf kannst du Ziz-Gift nehmen."
509,"TEXT_CMNDEFRETAINERCALL_00010_LEAVE2_ROEGADYN_MALE_TYPE6","Leinen los und volle Kraft voraus! Ich geh wieder an die Arbeit!"
510,"TEXT_CMNDEFRETAINERCALL_00010_LEAVE2_ROEGADYN_FEMALE_TYPE1","Wenn Ihr mich nun entschuldigen w\xc3\xbcrdet. Ich habe noch eine Unternehmung zu beenden."
511,"TEXT_CMNDEFRETAINERCALL_00010_LEAVE2_ROEGADYN_FEMALE_TYPE2","Ja ja, ich bin ja schon weg ..."
512,"TEXT_CMNDEFRETAINERCALL_00010_LEAVE2_ROEGADYN_FEMALE_TYPE3","Ich meld mich, sobald ich von meiner Unternehmung zur\xc3\xbcckgekehrt bin."
513,"TEXT_CMNDEFRETAINERCALL_00010_LEAVE2_ROEGADYN_FEMALE_TYPE4","Ich setz dann mal wieder die Segel. Auf Wiedersehen!"
514,"TEXT_CMNDEFRETAINERCALL_00010_LEAVE2_ROEGADYN_FEMALE_TYPE5","Ich habe noch etwas zu erledigen. Bis sp\xc3\xa4ter, \x02\x08\x1d\xe9\x05\xff\rAbenteurerin\xff\x0bAbenteurer\x03!"
515,"TEXT_CMNDEFRETAINERCALL_00010_LEAVE2_ROEGADYN_FEMALE_TYPE6","Anker lichten, Segel hissen, Bahn frei! Ich breche auf!"
516,"TEXT_CMNDEFRETAINERCALL_00010_LEAVE2_AURA_MALE_TYPE1","Sehr wohl, Dann kehre ich zur\xc3\xbcck zu meiner Arbeit."
517,"TEXT_CMNDEFRETAINERCALL_00010_LEAVE2_AURA_MALE_TYPE2","Entscheid dich mal, was du willst ..."
518,"TEXT_CMNDEFRETAINERCALL_00010_LEAVE2_AURA_MALE_TYPE3","Wie Ihr meint."
519,"TEXT_CMNDEFRETAINERCALL_00010_LEAVE2_AURA_MALE_TYPE4","Gut, dann mach ich mich mal wieder auf die Sandalen."
520,"TEXT_CMNDEFRETAINERCALL_00010_LEAVE2_AURA_MALE_TYPE5","Bis bald."
521,"TEXT_CMNDEFRETAINERCALL_00010_LEAVE2_AURA_MALE_TYPE6","Dann mache ich mich mal wieder an die Arbeit!"
522,"TEXT_CMNDEFRETAINERCALL_00010_LEAVE2_AURA_FEMALE_TYPE1","Mit Eurer Erlaubnis ..."
523,"TEXT_CMNDEFRETAINERCALL_00010_LEAVE2_AURA_FEMALE_TYPE2","Toll, jetzt darf ich noch mal von vorne anfangen ..."
524,"TEXT_CMNDEFRETAINERCALL_00010_LEAVE2_AURA_FEMALE_TYPE3","Dann setze ich meine Unternehmung fort."
525,"TEXT_CMNDEFRETAINERCALL_00010_LEAVE2_AURA_FEMALE_TYPE4","Dann flitz ich mal wieder los!"
526,"TEXT_CMNDEFRETAINERCALL_00010_LEAVE2_AURA_FEMALE_TYPE5","Gut, wenn du mich also nicht brauchst ..."
527,"TEXT_CMNDEFRETAINERCALL_00010_LEAVE2_AURA_FEMALE_TYPE6","Tsch\xc3\xbcssi!"
528,"TEXT_CMNDEFRETAINERCALL_00010_ENTER3_HYURAN_MALE_TYPE1","Ich habe alles erledigt, wie Ihr es befohlen habt."
529,"TEXT_CMNDEFRETAINERCALL_00010_ENTER3_HYURAN_MALE_TYPE2","Ich habe vielleicht eine Laune ... Hab die ganze Nacht nicht gepennt."
530,"TEXT_CMNDEFRETAINERCALL_00010_ENTER3_HYURAN_MALE_TYPE3","Ich bin zur\xc3\xbcck."
531,"TEXT_CMNDEFRETAINERCALL_00010_ENTER3_HYURAN_MALE_TYPE4","Guter Zeitpunkt. Ich bin gerade zur\xc3\xbcckgekommen."
532,"TEXT_CMNDEFRETAINERCALL_00010_ENTER3_HYURAN_MALE_TYPE5","Das war vielleicht ein Abenteuer! Jetzt hab ich aber m\xc3\xa4chtig Kohldampf."
533,"TEXT_CMNDEFRETAINERCALL_00010_ENTER3_HYURAN_MALE_TYPE6","Guck mal, wer wieder da ist!"
534,"TEXT_CMNDEFRETAINERCALL_00010_ENTER3_HYURAN_FEMALE_TYPE1","Ich hoffe, alles zu Eurer Zufriedenheit erledigt zu haben."
535,"TEXT_CMNDEFRETAINERCALL_00010_ENTER3_HYURAN_FEMALE_TYPE2","Ich bin zur\xc3\xbcck, aus der H\xc3\xb6lle der Gehilfensklaven ..."
536,"TEXT_CMNDEFRETAINERCALL_00010_ENTER3_HYURAN_FEMALE_TYPE3","Ich bin von meiner Unternehmung zur\xc3\xbcckgekehrt. P\xc3\xbcnktlich, wie angek\xc3\xbcndigt."
537,"TEXT_CMNDEFRETAINERCALL_00010_ENTER3_HYURAN_FEMALE_TYPE4","Puh, das war ein sch\xc3\xb6nes St\xc3\xbcck Arbeit."
538,"TEXT_CMNDEFRETAINERCALL_00010_ENTER3_HYURAN_FEMALE_TYPE5","Ich habe alles erledigt."
539,"TEXT_CMNDEFRETAINERCALL_00010_ENTER3_HYURAN_FEMALE_TYPE6","Ich bin zur\xc3\xbcck, deine Lieblingsgehilfin!"
540,"TEXT_CMNDEFRETAINERCALL_00010_ENTER3_ELEZEN_MALE_TYPE1","Ich bin froh, Euch wiederzusehen."
541,"TEXT_CMNDEFRETAINERCALL_00010_ENTER3_ELEZEN_MALE_TYPE2","Endlich wieder hier ... Wo bestimmt noch mehr Arbeit auf mich wartet."
542,"TEXT_CMNDEFRETAINERCALL_00010_ENTER3_ELEZEN_MALE_TYPE3","Ich bin zur\xc3\xbcckgekehrt."
543,"TEXT_CMNDEFRETAINERCALL_00010_ENTER3_ELEZEN_MALE_TYPE4","Einen anstrengenden Beruf habt Ihr da, \x02\x08\x1d\xe9\x05\xff\rAbenteurerin\xff\x0bAbenteurer\x03. St\xc3\xa4ndig unterwegs, das w\xc3\xa4r nichts f\xc3\xbcr mich."
544,"TEXT_CMNDEFRETAINERCALL_00010_ENTER3_ELEZEN_MALE_TYPE5","Es ist vollbracht."
545,"TEXT_CMNDEFRETAINERCALL_00010_ENTER3_ELEZEN_MALE_TYPE6","Schaut mal, wer wieder hier ist! Ich bin's!"
546,"TEXT_CMNDEFRETAINERCALL_00010_ENTER3_ELEZEN_FEMALE_TYPE1","Ich bin froh, Euch wiedersehen zu d\xc3\xbcrfen."
547,"TEXT_CMNDEFRETAINERCALL_00010_ENTER3_ELEZEN_FEMALE_TYPE2","Ich habe getan, was Ihr wolltet. Auch wenn es keinen Spa\xc3\x9f gemacht hat."
548,"TEXT_CMNDEFRETAINERCALL_00010_ENTER3_ELEZEN_FEMALE_TYPE3","Ich bin von meiner Unternehmung zur\xc3\xbcckgekehrt."
549,"TEXT_CMNDEFRETAINERCALL_00010_ENTER3_ELEZEN_FEMALE_TYPE4","Ich hab mich ganz sch\xc3\xb6n ins Zeug gelegt, aber jetzt bin ich wieder da."
550,"TEXT_CMNDEFRETAINERCALL_00010_ENTER3_ELEZEN_FEMALE_TYPE5","Das w\xc3\xa4re erledigt. Jetzt k\xc3\xb6nnte ich eine Erfrischung vertragen."
551,"TEXT_CMNDEFRETAINERCALL_00010_ENTER3_ELEZEN_FEMALE_TYPE6","Da bin ich wieder. Ich hab mir echt M\xc3\xbche gegeben."
552,"TEXT_CMNDEFRETAINERCALL_00010_ENTER3_LALAFELL_MALE_TYPE1","Da bin ich wieder!"
553,"TEXT_CMNDEFRETAINERCALL_00010_ENTER3_LALAFELL_MALE_TYPE2","Mannometer, war das eine Rennerei!"
554,"TEXT_CMNDEFRETAINERCALL_00010_ENTER3_LALAFELL_MALE_TYPE3","Erledigt. Jetzt k\xc3\xb6nnte ich einen Happen vertragen."
555,"TEXT_CMNDEFRETAINERCALL_00010_ENTER3_LALAFELL_MALE_TYPE4","So, das w\xc3\xa4re geschafft."
556,"TEXT_CMNDEFRETAINERCALL_00010_ENTER3_LALAFELL_MALE_TYPE5","Puh, diese Unternehmung war nicht so einfach."
557,"TEXT_CMNDEFRETAINERCALL_00010_ENTER3_LALAFELL_MALE_TYPE6","Da bin ich wieder!"
558,"TEXT_CMNDEFRETAINERCALL_00010_ENTER3_LALAFELL_FEMALE_TYPE1","Ich bin zur\xc3\xbcck, \x02\x08\x0f\xe9\x05\xff\x05Frau\xff\x05Herr\x03 \x02,\r\xff\x07\x02)\x03\xeb\x02\x03\xff\x02 \x03\x03!"
559,"TEXT_CMNDEFRETAINERCALL_00010_ENTER3_LALAFELL_FEMALE_TYPE2","So, das w\xc3\xa4r erledigt."
560,"TEXT_CMNDEFRETAINERCALL_00010_ENTER3_LALAFELL_FEMALE_TYPE3","Es ist ein gutes Gef\xc3\xbchl, nach getaner Arbeit heimzukehren."
561,"TEXT_CMNDEFRETAINERCALL_00010_ENTER3_LALAFELL_FEMALE_TYPE4","Na, das h\xc3\xa4tte ich hinter mich gebracht."
562,"TEXT_CMNDEFRETAINERCALL_00010_ENTER3_LALAFELL_FEMALE_TYPE5","Puh, zwischendurch bin ich ganz sch\xc3\xb6n ins Schwitzen geraten. Aber ich bin wieder da."
563,"TEXT_CMNDEFRETAINERCALL_00010_ENTER3_LALAFELL_FEMALE_TYPE6","Ich bin wieder hier!"
564,"TEXT_CMNDEFRETAINERCALL_00010_ENTER3_MIQOTE_MALE_TYPE1","Ich habe alles erledigt, wie Ihr es befohlen habt."
565,"TEXT_CMNDEFRETAINERCALL_00010_ENTER3_MIQOTE_MALE_TYPE2","Hallo. Was hast du eigentlich gemacht, w\xc3\xa4hrend ich f\xc3\xbcr dich unterwegs war?"
566,"TEXT_CMNDEFRETAINERCALL_00010_ENTER3_MIQOTE_MALE_TYPE3","Die Unternehmung ist erledigt."
567,"TEXT_CMNDEFRETAINERCALL_00010_ENTER3_MIQOTE_MALE_TYPE4","Bin ich zu sp\xc3\xa4t? Nein? Dann ist ja gut."
568,"TEXT_CMNDEFRETAINERCALL_00010_ENTER3_MIQOTE_MALE_TYPE5","Das w\xc3\xa4re erledigt. Und mitgebracht habe ich auch etwas."
569,"TEXT_CMNDEFRETAINERCALL_00010_ENTER3_MIQOTE_MALE_TYPE6","Ganz sch\xc3\xb6n aufregend, so eine Unternehmung. Ein toller Spa\xc3\x9f!"
570,"TEXT_CMNDEFRETAINERCALL_00010_ENTER3_MIQOTE_FEMALE_TYPE1","Ich habe erledigt, was Ihr mir befohlen hattet."
571,"TEXT_CMNDEFRETAINERCALL_00010_ENTER3_MIQOTE_FEMALE_TYPE2","Na? Wo warst du eigentlich, w\xc3\xa4hrend ich mir f\xc3\xbcr dich die Pfoten abgelaufen habe?"
572,"TEXT_CMNDEFRETAINERCALL_00010_ENTER3_MIQOTE_FEMALE_TYPE3","Ich habe deinen Auftrag erledigt."
573,"TEXT_CMNDEFRETAINERCALL_00010_ENTER3_MIQOTE_FEMALE_TYPE4","Die Unternehmung ist beendet. War gar nicht so schwer."
574,"TEXT_CMNDEFRETAINERCALL_00010_ENTER3_MIQOTE_FEMALE_TYPE5","Unternehmung abgeschlossen."
575,"TEXT_CMNDEFRETAINERCALL_00010_ENTER3_MIQOTE_FEMALE_TYPE6","Ich bin zur\xc3\xbcck! Wirklich spa\xc3\x9fig, so eine Unternehmung!"
576,"TEXT_CMNDEFRETAINERCALL_00010_ENTER3_ROEGADYN_MALE_TYPE1","Ich hoffe, Euren Wunsch erf\xc3\xbcllt zu haben."
577,"TEXT_CMNDEFRETAINERCALL_00010_ENTER3_ROEGADYN_MALE_TYPE2","War das eine Plackerei! Da zieh ich doch lieber einen Elefantenwal an Bord."
578,"TEXT_CMNDEFRETAINERCALL_00010_ENTER3_ROEGADYN_MALE_TYPE3","Ich bin von meinem Abenteuer zur\xc3\xbcckgekehrt."
579,"TEXT_CMNDEFRETAINERCALL_00010_ENTER3_ROEGADYN_MALE_TYPE4","Endlich wieder im heimatlichen Hafen!"
580,"TEXT_CMNDEFRETAINERCALL_00010_ENTER3_ROEGADYN_MALE_TYPE5","Ich bin zur\xc3\xbcck, aber denk nicht, dass das einfach war."
581,"TEXT_CMNDEFRETAINERCALL_00010_ENTER3_ROEGADYN_MALE_TYPE6","Ahoi! Ich bin zur\xc3\xbcck von meiner Kreuzfahrt."
582,"TEXT_CMNDEFRETAINERCALL_00010_ENTER3_ROEGADYN_FEMALE_TYPE1","Ich habe Euren Befehl ausgef\xc3\xbchrt."
583,"TEXT_CMNDEFRETAINERCALL_00010_ENTER3_ROEGADYN_FEMALE_TYPE2","Endlich wieder daheim! So schnell geh ich nicht wieder auf eine Unternehmung ..."
584,"TEXT_CMNDEFRETAINERCALL_00010_ENTER3_ROEGADYN_FEMALE_TYPE3","Ich bin zur\xc3\xbcck."
585,"TEXT_CMNDEFRETAINERCALL_00010_ENTER3_ROEGADYN_FEMALE_TYPE4","Endlich wieder im Heimathafen!"
586,"TEXT_CMNDEFRETAINERCALL_00010_ENTER3_ROEGADYN_FEMALE_TYPE5","Dein Unternehmungsgesuch war gar nicht so einfach ..."
587,"TEXT_CMNDEFRETAINERCALL_00010_ENTER3_ROEGADYN_FEMALE_TYPE6","Alle Mann an Deck! Ich bin zur\xc3\xbcck!"
588,"TEXT_CMNDEFRETAINERCALL_00010_ENTER3_AURA_MALE_TYPE1","Die Unternehmung ist abgeschlossen, \x02\x08\x17\xe9\x05\xff\nMeisterin\xff\x08Meister\x03."
589,"TEXT_CMNDEFRETAINERCALL_00010_ENTER3_AURA_MALE_TYPE2","Bin wieder da. <seufz>"
590,"TEXT_CMNDEFRETAINERCALL_00010_ENTER3_AURA_MALE_TYPE3","Es verlief alles ohne Zwischenf\xc3\xa4lle."
591,"TEXT_CMNDEFRETAINERCALL_00010_ENTER3_AURA_MALE_TYPE4","Hier, guck mal, ich hab dir was mitgebracht."
592,"TEXT_CMNDEFRETAINERCALL_00010_ENTER3_AURA_MALE_TYPE5","Ich bin zur\xc3\xbcck, aber viel Zeit hab ich nicht."
593,"TEXT_CMNDEFRETAINERCALL_00010_ENTER3_AURA_MALE_TYPE6","Ich hab mich extra beeilt, weil ich dich so vermisst habe."
594,"TEXT_CMNDEFRETAINERCALL_00010_ENTER3_AURA_FEMALE_TYPE1","Die Unternehmung ist abgeschlossen, \x02\x08\x17\xe9\x05\xff\nMeisterin\xff\x08Meister\x03."
595,"TEXT_CMNDEFRETAINERCALL_00010_ENTER3_AURA_FEMALE_TYPE2","Unternehmung fertig, Opo-opo tot."
596,"TEXT_CMNDEFRETAINERCALL_00010_ENTER3_AURA_FEMALE_TYPE3","Die Unternehmung ist beendet."
597,"TEXT_CMNDEFRETAINERCALL_00010_ENTER3_AURA_FEMALE_TYPE4","Die Unternehmung war ein Klacks!"
598,"TEXT_CMNDEFRETAINERCALL_00010_ENTER3_AURA_FEMALE_TYPE5","Ich glaube, die Unternehmung war erfolgreich ..."
599,"TEXT_CMNDEFRETAINERCALL_00010_ENTER3_AURA_FEMALE_TYPE6","Ich bin wieder da-haa! \xe2\x99\xaa"