0,"TEXT_REGFSTARCGUILD_00008_LUCIANE_000_1","Kann ich dir in irgendeiner Weise helfen, \x02\x08\x1d\xe9\x05\xff\rAbenteurerin\xff\x0bAbenteurer\x03?"
1,"TEXT_REGFSTARCGUILD_00008_Q1_000_1","Was m\xc3\xb6chtest du fragen?"
2,"TEXT_REGFSTARCGUILD_00008_A1_000_1","Was machst du hier?"
3,"TEXT_REGFSTARCGUILD_00008_A1_000_2","Was ist das Bogenschie\xc3\x9fen?"
4,"TEXT_REGFSTARCGUILD_00008_A1_000_3","Nichts."
5,"TEXT_REGFSTARCGUILD_00008_LUCIANE_000_2","Was ich hier mache? Ich bin die Gildenmeisterin der Waldl\xc3\xa4ufergilde hier. In dieses Amt wurde ich von Nophicas Schar eingesetzt."
6,"TEXT_REGFSTARCGUILD_00008_LUCIANE_000_3","Das bedeutet, dass ich nat\xc3\xbcrlich das Training derer \xc3\xbcberwache, die das Bogenschie\xc3\x9fen erlernen wollen, aber nicht nur das: Unsere Gilde hilft auch, wenn sich jemand nicht alleine gegen wilde Bestien zur Wehr setzen kann."
7,"TEXT_REGFSTARCGUILD_00008_LUCIANE_000_4","Bogenschie\xc3\x9fen erfordert eine tiefe Erkenntnis der Dinge, und nur wenn man die Situation vollkommen erfasst hat, vermag man den Pfeil auf die richtige Bahn zu lenken und das Ziel mit Kraft zu durchschlagen. Das ist es, was ich unseren Sch\xc3\xbclern beibringe."
8,"TEXT_REGFSTARCGUILD_00008_LUCIANE_000_5","Unsere Kunst wird sich demjenigen erschlie\xc3\x9fen, der mit ganzem Herzen das Wahre sucht. Wenn du dazu bereit bist, dann sei uns willkommen."
9,"TEXT_REGFSTARCGUILD_00008_LUCIANE_000_6","Was ist die entscheidende St\xc3\xa4rke des Bogens? Das d\xc3\xbcrfte auch dir als Laie klar sein: die Distanz. Schwerter und Lanzen k\xc3\xb6nnen noch so lang sein, sie werden dir nie so viel Spielraum f\xc3\xbcr einen gezielten, durchdachten Angriff bieten."
10,"TEXT_REGFSTARCGUILD_00008_LUCIANE_000_7","Wenn du zerschmetternde Hiebe austeilen willst, bist du hier falsch. Bogenschie\xc3\x9fen erfordert Effizienz in der Bewegung und strategisches Denken. Dann kannst du den Feind kontrollieren, ihn erwischen, wenn er gerade fliehen will und ihn mit Giftpfeilen zur Strecke bringen. Du wirst erstaunt sein, wie vielf\xc3\xa4ltig diese Waffe ist."
11,"TEXT_REGFSTARCGUILD_00008_LUCIANE_000_8","Beobachte einmal einen Meister des Bogens und sieh, welchen Pfeilhagel er ohne jede Anstrengung auf seine Feinde niedergehen lassen kann!"
12,"TEXT_REGFSTARCGUILD_00008_LUCIANE_000_9","Bedenke nur immer: Wenn dir die Distanz etwas n\xc3\xbctzen soll, dann musst du den \xc3\x9cberblick bewahren und den Feind richtig einsch\xc3\xa4tzen. Dann beherrschst du das Schlachtfeld!"
13,"TEXT_REGFSTARCGUILD_00008_LUCIANE_000_020","Hallo! Du hast ein scharfes Auge entwickelt, \x02,\r\xff\x07\x02)\x03\xeb\x02\x03\xff\x02 \x02\x03. Wenn du so weitermachst, wirst du Leih und Silvairre bald \xc3\xbcbertroffen haben."
14,"TEXT_REGFSTARCGUILD_00008_LUCIANE_000_030","Du bist jetzt also ein Barde? Man munkelt, dass Jehantel der G\xc3\xb6tterbogen dir eine seiner uralten Techniken beigebracht hat. Alle Achtung, \x02,\r\xff\x07\x02)\x03\xeb\x02\x03\xff\x02 \x02\x03, du hast es wirklich weit gebracht."
15,"TEXT_REGFSTARCGUILD_00008_LUCIANE_000_040","Du scheinst in Ul'dah ja in einen ziemlichen Schlamassel geraten zu sein. Aber lass den Kopf nicht h\xc3\xa4ngen. Du hast schon oft genug bewiesen, dass du zu Gro\xc3\x9fem f\xc3\xa4hig bist. Betrachten wir es als eine Gelegenheit, dein gutes Auge noch ein wenig zu schulen."
16,"TEXT_REGFSTARCGUILD_00008_LUCIANE_000_041","Der Verdacht, der auf dir und deinen Freunden lastete, hat sich gekl\xc3\xa4rt, nicht wahr? T\xc3\xa4uschung und Wahrheit sind nicht immer leicht zu erkennen, aber dein geschultes Auge sieht die wahre Gestalt der Dinge."
17,"TEXT_REGFSTARCGUILD_00008_Q2_000_1","Was m\xc3\xb6chtest du fragen?"
18,"TEXT_REGFSTARCGUILD_00008_A2_000_1","Was gibt es Neues?"
19,"TEXT_REGFSTARCGUILD_00008_A2_000_2","Was ist das Bogenschie\xc3\x9fen?"
20,"TEXT_REGFSTARCGUILD_00008_A2_000_3","Nichts."
21,"TEXT_REGFSTARCGUILD_00008_LUCIANE_000_100","Wir haben viel von deinen Taten geh\xc3\xb6rt. Allen in der Gilde bist du ein gro\xc3\x9fes Vorbild. Man spricht sogar schon davon, einen \xc3\x9cbungsplatz nach dir zu benennen. \x02,\r\xff\x07\x02)\x03\xeb\x02\x03\xff\x02 \x02\x03-Schie\xc3\x9fplatz ... klingt doch nicht schlecht, oder?"
22,"TEXT_REGFSTARCGUILD_00008_LUCIANE_000_101","Unsere Sch\xc3\xbctzen sind jedenfalls hochmotiviert. Sie haben nun ein klares Ziel vor Augen: Sie wollen so gut werden wie \x02\x08\r\xe9\x05\xff\x04die\xff\x04der\x03 ber\xc3\xbchmte \x02)\x03\xeb\x02\x03."
23,"TEXT_REGFSTARCGUILD_00008_LUCIANE_000_102","Ich brauche dir keinen Rat mehr zu erteilen, aber ich m\xc3\xb6chte dich daran erinnern, dass du dein gutes Auge st\xc3\xa4ndig schulen musst, wenn du deine m\xc3\xbchsam erarbeitete Zielsicherheit nicht verlieren m\xc3\xb6chtest."
24,"TEXT_REGFSTARCGUILD_00008_LUCIANE_000_110","Das Bogenschie\xc3\x9fen ist ... dein Spezialgebiet! Du selbst k\xc3\xb6nntest meinen Sch\xc3\xbclern und Sch\xc3\xbclerinnen viel dazu lehren, aber wenn du meine kleine Einf\xc3\xbchrung noch einmal h\xc3\xb6ren m\xc3\xb6chtest ... Bitte sch\xc3\xb6n!"
25,"TEXT_REGFSTARCGUILD_00008_LUCIANE_000_111","Was ist die entscheidende St\xc3\xa4rke des Bogens? Das d\xc3\xbcrfte auch einem Laien klar sein: die Distanz. Schwerter und Lanzen k\xc3\xb6nnen noch so lang sein, sie werden dir nie so viel Spielraum f\xc3\xbcr einen gezielten, durchdachten Angriff bieten."
26,"TEXT_REGFSTARCGUILD_00008_LUCIANE_000_113","Wer zerschmetternde Hiebe austeilen will, ist hier falsch. Bogenschie\xc3\x9fen erfordert Effizienz in der Bewegung und strategisches Denken. Dann kann man den Feind kontrollieren, ihn erwischen, wenn er gerade fliehen will, und ihn mit Giftpfeilen zur Strecke bringen. Es ist erstaunlich, wie vielf\xc3\xa4ltig diese Waffe ist."
27,"TEXT_REGFSTARCGUILD_00008_LUCIANE_000_114","Beobachtet man einmal einen Meister des Bogens, dann sieht man, welchen Pfeilhagel er ohne jede Anstrengung auf seine Feinde niedergehen lassen kann!"
28,"TEXT_REGFSTARCGUILD_00008_LUCIANE_000_115","Bedenke nur immer: Wenn einem die Distanz etwas n\xc3\xbctzen soll, dann muss man den \xc3\x9cberblick bewahren und den Feind richtig einsch\xc3\xa4tzen. Dann beherrscht man das Schlachtfeld!"